"No.","Time","Source","Destination","Protocol","Length","Info"
"1","0.000000","248.38.9.24","131.243.1.10","TCP","74","41553  >  21 [SYN] Seq=1314531094 Win=5840 Len=0 MSS=1460 SACK_PERM=1 TSval=3118435140 TSecr=0 WS=1"
"2","0.000682","131.243.1.10","248.38.9.24","TCP","58","21  >  41553 [SYN, ACK] Seq=3522283870 Ack=1314531095 Win=17520 Len=0 MSS=1460"
"4","0.180331","131.243.1.10","248.38.9.24","FTP","60","Response: 220-"
"34","0.372931","248.38.9.24","131.243.1.10","FTP","70","Request: USER anonymous"
"55","181.169693","217.148.52.180","131.243.2.12","TCP","62","2471  >  21 [SYN] Seq=3240012531 Win=16384 Len=0 MSS=1460 SACK_PERM=1"
"56","181.170054","131.243.2.12","217.148.52.180","TCP","62","21  >  2471 [SYN, ACK] Seq=4160427570 Ack=3240012532 Win=64240 Len=0 SACK_PERM=1 MSS=1460"
"58","181.410599","131.243.2.12","217.148.52.180","FTP","137","Response: 220 <domain> FTP server (Version wu-2.6.2(1) Fri Nov 30 16:58:35 PST 2001) ready."
"59","181.594332","217.148.52.180","131.243.2.12","FTP","70","Request: USER anonymous"
"115","214.658574","59.30.70.208","128.3.28.48","TCP","74","34500  >  21 [SYN] Seq=2376548815 Win=4452 Len=0 MSS=1484 SACK_PERM=1 TSval=409860 TSecr=0 WS=1"
"116","214.659322","128.3.28.48","59.30.70.208","TCP","74","21  >  34500 [SYN, ACK] Seq=3378153982 Ack=2376548816 Win=5792 Len=0 MSS=1460 SACK_PERM=1 TSval=2268157553 TSecr=409860 WS=1"
"121","215.266410","128.3.28.48","59.30.70.208","FTP","120","Response: 220 <domain> FTP server (Version wu-2.6.1-20) ready."
"123","215.586663","59.30.70.208","128.3.28.48","FTP","82","Request: USER anonymous"
"278","299.953907","229.246.115.157","131.243.1.10","TCP","58","56646  >  21 [SYN] Seq=3601681547 Win=61320 Len=0 MSS=1460"
"279","299.954409","131.243.1.10","229.246.115.157","TCP","58","21  >  56646 [SYN, ACK] Seq=482135012 Ack=3601681548 Win=17520 Len=0 MSS=1460"
"281","300.393364","131.243.1.10","229.246.115.157","FTP","60","Response: 220-"
"313","300.844028","229.246.115.157","131.243.1.10","FTP","70","Request: USER anonymous"
"373","320.670464","189.30.8.121","131.243.1.10","TCP","62","40570  >  21 [SYN] Seq=3857849774 Win=16384 Len=0 MSS=1460 SACK_PERM=1"
"374","320.670868","131.243.1.10","189.30.8.121","TCP","58","21  >  40570 [SYN, ACK] Seq=3874753629 Ack=3857849775 Win=17520 Len=0 MSS=1460"
"377","320.773890","131.243.1.10","189.30.8.121","FTP","60","Response: 220-"
"407","320.897867","189.30.8.121","131.243.1.10","FTP","70","Request: USER anonymous"
"451","333.532263","189.30.8.121","131.243.1.10","TCP","62","40595  >  21 [SYN] Seq=3861801731 Win=16384 Len=0 MSS=1460 SACK_PERM=1"
"714","469.183003","7.82.237.222","131.243.1.10","TCP","62","5973  >  21 [SYN] Seq=2836082884 Win=64240 Len=0 MSS=1460 SACK_PERM=1"
"715","469.183483","131.243.1.10","7.82.237.222","TCP","58","21  >  5973 [SYN, ACK] Seq=4117658485 Ack=2836082885 Win=17520 Len=0 MSS=1460"
"717","469.344960","131.243.1.10","7.82.237.222","FTP","60","Response: 220-"
"747","469.517170","7.82.237.222","131.243.1.10","FTP","70","Request: USER anonymous"
"803","489.912305","7.82.237.222","131.243.1.10","TCP","62","7485  >  21 [SYN] Seq=2842551017 Win=64240 Len=0 MSS=1460 SACK_PERM=1"
"804","489.912775","131.243.1.10","7.82.237.222","TCP","58","21  >  7485 [SYN, ACK] Seq=1007098652 Ack=2842551018 Win=17520 Len=0 MSS=1460"
"982","559.299725","152.191.35.146","128.3.28.48","TCP","74","34528  >  21 [SYN] Seq=2757745484 Win=4452 Len=0 MSS=1484 SACK_PERM=1 TSval=444325 TSecr=0 WS=1"
"983","559.299954","128.3.28.48","152.191.35.146","TCP","74","21  >  34528 [SYN, ACK] Seq=3739857697 Ack=2757745485 Win=5792 Len=0 MSS=1460 SACK_PERM=1 TSval=2268192013 TSecr=444325 WS=1"
"989","562.418579","128.3.28.48","152.191.35.146","FTP","120","Response: 220 <domain> FTP server (Version wu-2.6.1-20) ready."
"993","562.728994","152.191.35.146","128.3.28.48","FTP","82","Request: USER anonymous"
"1028","570.447473","152.191.35.146","128.3.28.48","TCP","74","34530  >  21 [SYN] Seq=2780329856 Win=4452 Len=0 MSS=1484 SACK_PERM=1 TSval=445440 TSecr=0 WS=1"
"1076","585.219385","152.191.35.146","128.3.28.48","TCP","74","34532  >  21 [SYN] Seq=2799027952 Win=4452 Len=0 MSS=1484 SACK_PERM=1 TSval=446917 TSecr=0 WS=1"
"1232","672.104564","45.7.36.127","131.243.2.12","TCP","62","2945  >  21 [SYN] Seq=1291332707 Win=8192 Len=0 MSS=1460 SACK_PERM=1"
"1233","672.104926","131.243.2.12","45.7.36.127","TCP","62","21  >  2945 [SYN, ACK] Seq=4224685611 Ack=1291332708 Win=64240 Len=0 SACK_PERM=1 MSS=1460"
"1235","672.310384","131.243.2.12","45.7.36.127","FTP","137","Response: 220 <domain> FTP server (Version wu-2.6.2(1) Fri Nov 30 16:58:35 PST 2001) ready."
"1236","672.483689","45.7.36.127","131.243.2.12","FTP","70","Request: USER anonymous"
"1628","822.100125","161.126.87.140","131.243.1.10","TCP","62","1819  >  21 [SYN] Seq=2931886122 Win=64240 Len=0 MSS=1452 SACK_PERM=1"
"1629","822.100687","131.243.1.10","161.126.87.140","TCP","58","21  >  1819 [SYN, ACK] Seq=3250326095 Ack=2931886123 Win=17424 Len=0 MSS=1460"
"1631","822.184713","131.243.1.10","161.126.87.140","FTP","60","Response: 220-"
"1661","822.287007","161.126.87.140","131.243.1.10","FTP","70","Request: USER anonymous"
"1720","848.339938","91.198.76.64","131.243.1.10","TCP","74","61149  >  21 [SYN] Seq=2133859527 Win=5840 Len=0 MSS=1414 SACK_PERM=1 TSval=16744644 TSecr=0 WS=1"
"1721","848.340543","131.243.1.10","91.198.76.64","TCP","58","21  >  61149 [SYN, ACK] Seq=1099545148 Ack=2133859528 Win=16968 Len=0 MSS=1460"
"1723","848.479401","131.243.1.10","91.198.76.64","FTP","60","Response: 220-"
"1755","848.632771","91.198.76.64","131.243.1.10","FTP","70","Request: USER anonymous"
"1893","907.085868","161.126.87.140","131.243.1.10","TCP","62","1824  >  21 [SYN] Seq=2951351270 Win=64240 Len=0 MSS=1452 SACK_PERM=1"
"1978","917.242797","161.126.87.140","131.243.1.10","TCP","62","1826  >  21 [SYN] Seq=2953685133 Win=64240 Len=0 MSS=1452 SACK_PERM=1"
"2260","1005.801986","189.214.156.168","131.243.1.10","TCP","62","3017  >  21 [SYN] Seq=1637976573 Win=8760 Len=0 MSS=536 SACK_PERM=1"
"2261","1005.802550","131.243.1.10","189.214.156.168","TCP","58","21  >  3017 [SYN, ACK] Seq=3816381822 Ack=1637976574 Win=16616 Len=0 MSS=1460"
"2263","1006.493435","131.243.1.10","189.214.156.168","FTP","60","Response: 220-"
"2287","1008.383030","189.214.156.168","131.243.1.10","FTP","70","Request: USER anonymous"
"2293","1009.621110","173.112.82.221","131.243.1.10","TCP","78","3887  >  21 [SYN] Seq=4090061794 Win=44620 Len=0 MSS=1460 WS=8 TSval=0 TSecr=0 SACK_PERM=1"
"2294","1009.621960","131.243.1.10","173.112.82.221","TCP","58","21  >  3887 [SYN, ACK] Seq=4144702575 Ack=4090061795 Win=17520 Len=0 MSS=1460"
"2296","1009.801197","131.243.1.10","173.112.82.221","FTP","60","Response: 220-"
"2329","1010.025599","173.112.82.221","131.243.1.10","FTP","70","Request: USER anonymous"
"2458","1058.658334","168.254.152.132","131.243.2.12","TCP","62","2523  >  21 [SYN] Seq=1546644010 Win=16384 Len=0 MSS=1460 SACK_PERM=1"
"2459","1058.658563","131.243.2.12","168.254.152.132","TCP","62","21  >  2523 [SYN, ACK] Seq=4275810114 Ack=1546644011 Win=64240 Len=0 SACK_PERM=1 MSS=1460"
"2461","1058.888768","131.243.2.12","168.254.152.132","FTP","137","Response: 220 <domain> FTP server (Version wu-2.6.2(1) Fri Nov 30 16:58:35 PST 2001) ready."
"2465","1059.083599","168.254.152.132","131.243.2.12","FTP","70","Request: USER anonymous"
"2604","1110.250958","4.251.189.14","131.243.1.10","TCP","74","37465  >  21 [SYN] Seq=2480776528 Win=5840 Len=0 MSS=1460 SACK_PERM=1 TSval=85092584 TSecr=0 WS=1"
"2605","1110.251485","131.243.1.10","4.251.189.14","TCP","58","21  >  37465 [SYN, ACK] Seq=299187676 Ack=2480776529 Win=17520 Len=0 MSS=1460"
"2607","1110.346829","131.243.1.10","4.251.189.14","FTP","60","Response: 220-"
"2637","1110.454190","4.251.189.14","131.243.1.10","FTP","70","Request: USER anonymous"
"2727","1130.548455","148.111.20.136","131.243.1.10","TCP","74","51858  >  21 [SYN] Seq=2511075633 Win=5840 Len=0 MSS=1460 SACK_PERM=1 TSval=24353085 TSecr=0 WS=1"
"2728","1130.549012","131.243.1.10","148.111.20.136","TCP","58","21  >  51858 [SYN, ACK] Seq=3387262940 Ack=2511075634 Win=17520 Len=0 MSS=1460"
"2730","1130.646036","131.243.1.10","148.111.20.136","FTP","60","Response: 220-"
"2760","1130.754412","148.111.20.136","131.243.1.10","FTP","70","Request: USER anonymous"
"2946","1187.419124","168.254.152.132","131.243.2.12","TCP","62","1466  >  21 [SYN] Seq=1576231986 Win=16384 Len=0 MSS=1460 SACK_PERM=1"
"2947","1187.419406","131.243.2.12","168.254.152.132","TCP","62","21  >  1466 [SYN, ACK] Seq=4292362850 Ack=1576231987 Win=64240 Len=0 SACK_PERM=1 MSS=1460"
"3035","1210.970672","249.44.109.25","128.3.28.48","TCP","74","1286  >  21 [SYN] Seq=2594401953 Win=5840 Len=0 MSS=1460 SACK_PERM=1 TSval=195399166 TSecr=0 WS=1"
"3036","1210.971413","128.3.28.48","249.44.109.25","TCP","74","21  >  1286 [SYN, ACK] Seq=134197193 Ack=2594401954 Win=5792 Len=0 MSS=1460 SACK_PERM=1 TSval=2268257174 TSecr=195399166 WS=1"
"3039","1211.280232","128.3.28.48","249.44.109.25","FTP","120","Response: 220 <domain> FTP server (Version wu-2.6.1-20) ready."
"3041","1211.383184","249.44.109.25","128.3.28.48","FTP","82","Request: USER anonymous"
"3070","1212.344161","249.44.109.25","128.3.28.48","TCP","74","1288  >  21 [SYN] Seq=2585326590 Win=5840 Len=0 MSS=1460 SACK_PERM=1 TSval=195399304 TSecr=0 WS=1"
"3103","1214.338147","249.44.109.25","128.3.28.48","TCP","74","1290  >  21 [SYN] Seq=2593112408 Win=5840 Len=0 MSS=1460 SACK_PERM=1 TSval=195399503 TSecr=0 WS=1"
"3479","1319.138518","55.84.210.42","131.243.1.10","TCP","62","3552  >  21 [SYN] Seq=3664903931 Win=32767 Len=0 MSS=1324 SACK_PERM=1"
"3480","1319.139029","131.243.1.10","55.84.210.42","TCP","58","21  >  3552 [SYN, ACK] Seq=3783934135 Ack=3664903932 Win=17212 Len=0 MSS=1460"
"3482","1319.353546","131.243.1.10","55.84.210.42","FTP","60","Response: 220-"
"3512","1319.827810","55.84.210.42","131.243.1.10","FTP","70","Request: USER anonymous"
"3570","1349.116272","82.143.24.12","131.243.2.12","TCP","62","3868  >  21 [SYN] Seq=1278870484 Win=16384 Len=0 MSS=1460 SACK_PERM=1"
"3571","1349.116552","131.243.2.12","82.143.24.12","TCP","62","21  >  3868 [SYN, ACK] Seq=18157420 Ack=1278870485 Win=64240 Len=0 SACK_PERM=1 MSS=1460"
"3573","1349.395655","131.243.2.12","82.143.24.12","FTP","137","Response: 220 <domain> FTP server (Version wu-2.6.2(1) Fri Nov 30 16:58:35 PST 2001) ready."
"3574","1349.593305","82.143.24.12","131.243.2.12","FTP","70","Request: USER anonymous"
"3621","1368.002076","232.8.175.74","131.243.1.10","TCP","58","63068  >  21 [SYN] Seq=3108712002 Win=8760 Len=0 MSS=1460"
"3622","1368.002631","131.243.1.10","232.8.175.74","TCP","58","21  >  63068 [SYN, ACK] Seq=3387660695 Ack=3108712003 Win=17520 Len=0 MSS=1460"
"3624","1368.316500","131.243.1.10","232.8.175.74","FTP","60","Response: 220-"
"3654","1368.646572","232.8.175.74","131.243.1.10","FTP","70","Request: USER anonymous"
"3770","1397.507006","178.214.186.1","131.243.1.10","TCP","74","60407  >  21 [SYN] Seq=3726390522 Win=5840 Len=0 MSS=1380 SACK_PERM=1 TSval=119568921 TSecr=0 WS=1"
"3771","1397.507598","131.243.1.10","178.214.186.1","TCP","58","21  >  60407 [SYN, ACK] Seq=3033698578 Ack=3726390523 Win=16560 Len=0 MSS=1460"
"3773","1398.286787","131.243.1.10","178.214.186.1","FTP","60","Response: 220-"
"3815","1401.921394","178.214.186.1","131.243.1.10","FTP","70","Request: USER anonymous"
"3846","1407.795061","178.214.186.1","131.243.1.10","TCP","74","60415  >  21 [SYN] Seq=3962290439 Win=5840 Len=0 MSS=1380 SACK_PERM=1 TSval=119569951 TSecr=0 WS=1"
"4225","1555.077767","232.8.175.74","131.243.1.10","TCP","58","63072  >  21 [SYN] Seq=3132369786 Win=8760 Len=0 MSS=1460"
"4304","1562.660435","232.8.175.74","131.243.1.10","TCP","58","63074  >  21 [SYN] Seq=3133455060 Win=8760 Len=0 MSS=1460"
"4586","1652.098510","152.191.35.146","128.3.28.48","TCP","74","34722  >  21 [SYN] Seq=3924136716 Win=4452 Len=0 MSS=1484 SACK_PERM=1 TSval=553606 TSecr=0 WS=1"
"4890","1844.469748","216.43.247.103","131.243.1.10","TCP","74","58752  >  21 [SYN] Seq=3247196764 Win=5840 Len=0 MSS=1460 SACK_PERM=1 TSval=1909298758 TSecr=0 WS=1"
"4891","1844.470400","131.243.1.10","216.43.247.103","TCP","58","21  >  58752 [SYN, ACK] Seq=3225932124 Ack=3247196765 Win=17520 Len=0 MSS=1460"
"4893","1845.196837","131.243.1.10","216.43.247.103","FTP","60","Response: 220-"
"4923","1845.946238","216.43.247.103","131.243.1.10","FTP","70","Request: USER anonymous"
"4950","1850.699881","16.69.134.221","131.243.2.12","TCP","62","4517  >  21 [SYN] Seq=3465098127 Win=16384 Len=0 MSS=1460 SACK_PERM=1"
"4951","1850.700183","131.243.2.12","16.69.134.221","TCP","62","21  >  4517 [SYN, ACK] Seq=83179557 Ack=3465098128 Win=64240 Len=0 SACK_PERM=1 MSS=1460"
"4955","1851.287624","131.243.2.12","16.69.134.221","FTP","137","Response: 220 <domain> FTP server (Version wu-2.6.2(1) Fri Nov 30 16:58:35 PST 2001) ready."
"4956","1851.466020","16.69.134.221","131.243.2.12","FTP","70","Request: USER anonymous"
"5230","1905.844067","150.70.97.75","131.243.1.10","TCP","74","2130  >  21 [SYN] Seq=3301524672 Win=32120 Len=0 MSS=1460 SACK_PERM=1 TSval=342513391 TSecr=0 WS=1"
"5231","1905.844691","131.243.1.10","150.70.97.75","TCP","58","21  >  2130 [SYN, ACK] Seq=2892670080 Ack=3301524673 Win=17520 Len=0 MSS=1460"
"5234","1906.024084","131.243.1.10","150.70.97.75","FTP","60","Response: 220-"
"5264","1906.215761","150.70.97.75","131.243.1.10","FTP","70","Request: USER anonymous"
"5461","2256.864522","250.225.145.152","131.243.1.10","TCP","62","1267  >  21 [SYN] Seq=2007889 Win=8192 Len=0 MSS=536 SACK_PERM=1"
"5462","2256.865079","131.243.1.10","250.225.145.152","TCP","58","21  >  1267 [SYN, ACK] Seq=3464407724 Ack=2007890 Win=16616 Len=0 MSS=1460"
"5466","2262.571839","131.243.1.10","250.225.145.152","FTP","60","Response: 220-"
"5490","2265.818491","250.225.145.152","131.243.1.10","FTP","70","Request: USER anonymous"
"5537","2333.119291","18.197.41.194","131.243.1.10","TCP","58","25202  >  21 [SYN] Seq=3498156635 Win=32768 Len=0 MSS=1460"
"5538","2333.119799","131.243.1.10","18.197.41.194","TCP","58","21  >  25202 [SYN, ACK] Seq=2192896636 Ack=3498156636 Win=17520 Len=0 MSS=1460"
"5540","2333.277847","131.243.1.10","18.197.41.194","FTP","60","Response: 220-"
"5570","2333.447475","18.197.41.194","131.243.1.10","FTP","70","Request: USER anonymous"
"5598","2345.851666","237.180.56.133","131.243.1.10","TCP","62","3276  >  21 [SYN] Seq=1323715783 Win=16384 Len=0 MSS=1360 SACK_PERM=1"
"5599","2345.852128","131.243.1.10","237.180.56.133","TCP","58","21  >  3276 [SYN, ACK] Seq=16825282 Ack=1323715784 Win=17680 Len=0 MSS=1460"
"5601","2346.723601","131.243.1.10","237.180.56.133","FTP","60","Response: 220-"
"5631","2347.643369","237.180.56.133","131.243.1.10","FTP","70","Request: USER anonymous"
"5651","2353.779108","18.197.41.194","131.243.1.10","TCP","58","25574  >  21 [SYN] Seq=3570394930 Win=32768 Len=0 MSS=1460"
"5732","2404.733566","82.143.24.12","131.243.2.12","TCP","62","3262  >  21 [SYN] Seq=3123447665 Win=16384 Len=0 MSS=1460 SACK_PERM=1"
"5733","2404.733883","131.243.2.12","82.143.24.12","TCP","62","21  >  3262 [SYN, ACK] Seq=155435433 Ack=3123447666 Win=64240 Len=0 SACK_PERM=1 MSS=1460"
"5773","2475.883014","44.120.49.173","109.103.64.27","TCP","58","4936  >  21 [SYN] Seq=24263792 Win=8192 Len=0 MSS=1460"
"5774","2475.884892","109.103.64.27","44.120.49.173","TCP","58","21  >  4936 [SYN, ACK] Seq=2687898557 Ack=24263793 Win=1460 Len=0 MSS=1460"
"5776","2475.963426","109.103.64.27","44.120.49.173","FTP","86","Response: 220 <domain> FTP Server Ready "
"5777","2476.038895","44.120.49.173","109.103.64.27","FTP","70","Request: USER anonymous"
"5800","2481.569778","82.143.24.12","131.243.2.12","TCP","62","1089  >  21 [SYN] Seq=3148109521 Win=16384 Len=0 MSS=1460 SACK_PERM=1"
"5801","2481.570053","131.243.2.12","82.143.24.12","TCP","62","21  >  1089 [SYN, ACK] Seq=165493444 Ack=3148109522 Win=64240 Len=0 SACK_PERM=1 MSS=1460"
"5816","2489.559743","44.120.49.173","62.159.77.154","TCP","58","2007  >  21 [SYN] Seq=24271237 Win=8192 Len=0 MSS=1460"
"5817","2489.561462","62.159.77.154","44.120.49.173","TCP","58","21  >  2007 [SYN, ACK] Seq=323899999 Ack=24271238 Win=2920 Len=0 MSS=1460"
"5819","2489.639775","62.159.77.154","44.120.49.173","FTP","77","Response: 220 FTP server ready."
"5820","2489.716219","44.120.49.173","62.159.77.154","FTP","70","Request: USER anonymous"
"5840","2492.080593","44.120.49.173","44.76.136.98","TCP","58","2207  >  21 [SYN] Seq=24272692 Win=8192 Len=0 MSS=1460"
"5841","2492.081230","44.76.136.98","44.120.49.173","TCP","62","21  >  2207 [SYN, ACK] Seq=2072705664 Ack=24272693 Win=49152 Len=0 MSS=1460 SACK_PERM=1"
"5843","2492.360598","44.76.136.98","44.120.49.173","FTP","86","Response: 220 <domain> FTP server ready."
"5844","2492.437366","44.120.49.173","44.76.136.98","FTP","70","Request: USER anonymous"
"5878","2517.622359","44.120.49.173","189.246.241.212","TCP","58","4143  >  21 [SYN] Seq=24286673 Win=8192 Len=0 MSS=1460"
"5879","2517.623564","189.246.241.212","44.120.49.173","TCP","58","21  >  4143 [SYN, ACK] Seq=433599999 Ack=24286674 Win=2920 Len=0 MSS=1460"
"5880","2517.628304","44.120.49.173","123.47.104.102","TCP","58","4144  >  21 [SYN] Seq=24286687 Win=8192 Len=0 MSS=1460"
"5881","2517.630106","123.47.104.102","44.120.49.173","TCP","58","21  >  4144 [SYN, ACK] Seq=2037642685 Ack=24286688 Win=1460 Len=0 MSS=1460"
"5883","2517.702385","189.246.241.212","44.120.49.173","FTP","77","Response: 220 FTP server ready."
"5885","2517.710097","123.47.104.102","44.120.49.173","FTP","86","Response: 220 <domain> FTP Server Ready "
"5886","2517.725048","44.120.49.173","4.18.95.135","TCP","58","4151  >  21 [SYN] Seq=24286770 Win=8192 Len=0 MSS=1460"
"5887","2517.726621","4.18.95.135","44.120.49.173","TCP","58","21  >  4151 [SYN, ACK] Seq=238665728 Ack=24286771 Win=23360 Len=0 MSS=536"
"5890","2517.779322","44.120.49.173","189.246.241.212","FTP","70","Request: USER anonymous"
"5892","2517.784574","44.120.49.173","123.47.104.102","FTP","70","Request: USER anonymous"
"5895","2517.804955","4.18.95.135","44.120.49.173","FTP","98","Response: 220 FTP Server, type 'quote help' for help"
"5926","2519.130780","44.120.49.173","48.248.244.161","TCP","58","4266  >  21 [SYN] Seq=24287624 Win=8192 Len=0 MSS=1460"
"5927","2519.132533","48.248.244.161","44.120.49.173","TCP","58","21  >  4266 [SYN, ACK] Seq=3781889981 Ack=24287625 Win=1460 Len=0 MSS=1460"
"5929","2519.213457","48.248.244.161","44.120.49.173","FTP","87","Response: 220 <domain> FTP Server Ready. "
"5930","2519.289226","44.120.49.173","48.248.244.161","FTP","70","Request: USER anonymous"
"5975","2541.372768","82.143.24.12","131.243.2.12","TCP","62","3147  >  21 [SYN] Seq=3168390350 Win=16384 Len=0 MSS=1460 SACK_PERM=1"
"5976","2541.372973","131.243.2.12","82.143.24.12","TCP","62","21  >  3147 [SYN, ACK] Seq=173414354 Ack=3168390351 Win=64240 Len=0 SACK_PERM=1 MSS=1460"
"6063","2606.054495","250.225.145.152","131.243.1.10","TCP","62","1290  >  21 [SYN] Seq=2356647 Win=8192 Len=0 MSS=536 SACK_PERM=1"
"6116","2677.584041","82.143.24.12","131.243.2.12","TCP","62","3610  >  21 [SYN] Seq=3216165529 Win=16384 Len=0 MSS=1460 SACK_PERM=1"
"6117","2677.584440","131.243.2.12","82.143.24.12","TCP","62","21  >  3610 [SYN, ACK] Seq=192217504 Ack=3216165530 Win=64240 Len=0 SACK_PERM=1 MSS=1460"
"6186","2769.867612","69.157.45.176","131.243.2.12","TCP","62","2479  >  21 [SYN] Seq=2787842498 Win=64240 Len=0 MSS=1460 SACK_PERM=1"
"6187","2769.867867","131.243.2.12","69.157.45.176","TCP","62","21  >  2479 [SYN, ACK] Seq=204329644 Ack=2787842499 Win=64240 Len=0 SACK_PERM=1 MSS=1460"
"6189","2770.117376","131.243.2.12","69.157.45.176","FTP","137","Response: 220 <domain> FTP server (Version wu-2.6.2(1) Fri Nov 30 16:58:35 PST 2001) ready."
"6190","2770.335283","69.157.45.176","131.243.2.12","FTP","70","Request: USER anonymous"
"6236","2819.158148","143.156.1.2","131.243.2.12","TCP","62","3167  >  21 [SYN] Seq=598276253 Win=16384 Len=0 MSS=1460 SACK_PERM=1"
"6237","2819.158405","131.243.2.12","143.156.1.2","TCP","62","21  >  3167 [SYN, ACK] Seq=212715356 Ack=598276254 Win=64240 Len=0 SACK_PERM=1 MSS=1460"
"6239","2819.363407","131.243.2.12","143.156.1.2","FTP","137","Response: 220 <domain> FTP server (Version wu-2.6.2(1) Fri Nov 30 16:58:35 PST 2001) ready."
"6240","2819.540377","143.156.1.2","131.243.2.12","FTP","70","Request: USER anonymous"
"6310","2868.194999","47.125.91.135","131.243.2.12","TCP","62","1300  >  21 [SYN] Seq=238381077 Win=16384 Len=0 MSS=1460 SACK_PERM=1"
"6311","2868.195313","131.243.2.12","47.125.91.135","TCP","62","21  >  1300 [SYN, ACK] Seq=220102631 Ack=238381078 Win=64240 Len=0 SACK_PERM=1 MSS=1460"
"6313","2868.401256","131.243.2.12","47.125.91.135","FTP","137","Response: 220 <domain> FTP server (Version wu-2.6.2(1) Fri Nov 30 16:58:35 PST 2001) ready."
"6315","2868.576089","47.125.91.135","131.243.2.12","FTP","70","Request: USER anonymous"
"6390","2914.830573","24.190.46.234","131.243.1.10","TCP","58","48576  >  21 [SYN] Seq=2413775609 Win=8760 Len=0 MSS=1460"
"6391","2914.831238","131.243.1.10","24.190.46.234","TCP","58","21  >  48576 [SYN, ACK] Seq=159066750 Ack=2413775610 Win=17520 Len=0 MSS=1460"
"6393","2914.861045","131.243.1.10","24.190.46.234","FTP","60","Response: 220-"
"6423","2914.904041","24.190.46.234","131.243.1.10","FTP","70","Request: USER anonymous"
"6490","3023.725069","75.16.160.171","131.243.2.12","TCP","74","55508  >  21 [SYN] Seq=217413204 Win=65535 Len=0 MSS=1460 WS=1 TSval=1929749 TSecr=0"
"6491","3023.725277","131.243.2.12","75.16.160.171","TCP","74","21  >  55508 [SYN, ACK] Seq=242020474 Ack=217413205 Win=65535 Len=0 TSval=314246494 TSecr=1929749 WS=2 MSS=1460"
"6493","3024.020699","131.243.2.12","75.16.160.171","FTP","149","Response: 220 <domain> FTP server (Version wu-2.6.2(1) Fri Nov 30 16:58:35 PST 2001) ready."
"6494","3024.284467","75.16.160.171","131.243.2.12","FTP","82","Request: USER anonymous"
"6518","3044.037779","244.173.253.244","131.243.2.12","TCP","74","51770  >  21 [SYN] Seq=99526660 Win=65535 Len=0 MSS=1460 WS=1 TSval=1780416 TSecr=0"
"6519","3044.038082","131.243.2.12","244.173.253.244","TCP","74","21  >  51770 [SYN, ACK] Seq=244740850 Ack=99526661 Win=65535 Len=0 TSval=314248525 TSecr=1780416 WS=2 MSS=1460"
"6520","3044.263430","90.227.190.180","131.243.2.12","TCP","62","3904  >  21 [SYN] Seq=1987179967 Win=16384 Len=0 MSS=1460 SACK_PERM=1"
"6521","3044.263663","131.243.2.12","90.227.190.180","TCP","62","21  >  3904 [SYN, ACK] Seq=244866349 Ack=1987179968 Win=64240 Len=0 SACK_PERM=1 MSS=1460"
"6524","3044.475979","131.243.2.12","90.227.190.180","FTP","137","Response: 220 <domain> FTP server (Version wu-2.6.2(1) Fri Nov 30 16:58:35 PST 2001) ready."
"6525","3044.656070","90.227.190.180","131.243.2.12","FTP","70","Request: USER anonymous"
"6529","3044.839871","131.243.2.12","244.173.253.244","FTP","149","Response: 220 <domain> FTP server (Version wu-2.6.2(1) Fri Nov 30 16:58:35 PST 2001) ready."
"6531","3045.103918","244.173.253.244","131.243.2.12","FTP","82","Request: USER anonymous"
"6564","3049.266388","244.173.253.244","131.243.2.12","TCP","74","53665  >  21 [SYN] Seq=370338452 Win=65535 Len=0 MSS=1460 WS=1 TSval=1780427 TSecr=0"
"6565","3049.266616","131.243.2.12","244.173.253.244","TCP","74","21  >  53665 [SYN, ACK] Seq=245543545 Ack=370338453 Win=65535 Len=0 TSval=314249048 TSecr=1780427 WS=2 MSS=1460"
"6598","3053.392552","244.173.253.244","131.243.2.12","TCP","74","55120  >  21 [SYN] Seq=582556104 Win=65535 Len=0 MSS=1460 WS=1 TSval=1780435 TSecr=0"
"6599","3053.392768","131.243.2.12","244.173.253.244","TCP","74","21  >  55120 [SYN, ACK] Seq=246161602 Ack=582556105 Win=65535 Len=0 TSval=314249461 TSecr=1780435 WS=2 MSS=1460"
"6723","3119.361988","171.142.200.244","131.243.1.10","TCP","74","33011  >  21 [SYN] Seq=301681035 Win=5808 Len=0 MSS=1412 SACK_PERM=1 TSval=1202176 TSecr=0 WS=1"
"6724","3119.362511","131.243.1.10","171.142.200.244","TCP","58","21  >  33011 [SYN, ACK] Seq=3969871644 Ack=301681036 Win=16944 Len=0 MSS=1460"
"6726","3119.550830","131.243.1.10","171.142.200.244","FTP","60","Response: 220-"
"6756","3119.795245","171.142.200.244","131.243.1.10","FTP","70","Request: USER anonymous"
"6765","3120.128461","217.148.52.180","203.174.5.11","TCP","62","3241  >  21 [SYN] Seq=31237828 Win=16384 Len=0 MSS=1460 SACK_PERM=1"
"6766","3120.129719","203.174.5.11","217.148.52.180","TCP","58","21  >  3241 [SYN, ACK] Seq=605120000 Ack=31237829 Win=32768 Len=0 MSS=1460"
"6772","3120.368451","203.174.5.11","217.148.52.180","FTP","135","Response: 220 <domain> FTP server (Version 1.7.212.5 Wed May 30 12:19:42 GMT 2001) ready."
"6778","3120.558400","217.148.52.180","203.174.5.11","FTP","70","Request: USER anonymous"
"6798","3121.524539","171.142.200.244","131.243.1.10","TCP","74","33013  >  21 [SYN] Seq=317341198 Win=5808 Len=0 MSS=1412 SACK_PERM=1 TSval=1202392 TSecr=0 WS=1"
"6936","3145.391734","43.27.105.111","128.3.28.48","TCP","62","17134  >  21 [SYN] Seq=3233997189 Win=16384 Len=0 MSS=1460 SACK_PERM=1"
"6937","3145.392070","128.3.28.48","43.27.105.111","TCP","62","21  >  17134 [SYN, ACK] Seq=2161586593 Ack=3233997190 Win=5840 Len=0 MSS=1460 SACK_PERM=1"
"7031","3176.103590","128.3.28.48","43.27.105.111","FTP","108","Response: 220 <domain> FTP server (Version wu-2.6.1-20) ready."
"7036","3176.808319","43.27.105.111","128.3.28.48","FTP","70","Request: USER anonymous"
"7121","3196.028452","43.27.105.111","128.3.28.48","TCP","62","18263  >  21 [SYN] Seq=3252580769 Win=16384 Len=0 MSS=1460 SACK_PERM=1"
"7122","3196.028644","128.3.28.48","43.27.105.111","TCP","62","21  >  18263 [SYN, ACK] Seq=2221108319 Ack=3252580770 Win=5840 Len=0 MSS=1460 SACK_PERM=1"
"7365","3267.260079","43.27.105.111","128.3.28.48","TCP","62","19695  >  21 [SYN] Seq=3298967184 Win=16384 Len=0 MSS=1460 SACK_PERM=1"
"7366","3267.260269","128.3.28.48","43.27.105.111","TCP","62","21  >  19695 [SYN, ACK] Seq=2298563529 Ack=3298967185 Win=5840 Len=0 MSS=1460 SACK_PERM=1"
"7479","3306.364903","192.232.226.84","131.243.1.10","TCP","74","33728  >  21 [SYN] Seq=499649924 Win=5840 Len=0 MSS=1460 SACK_PERM=1 TSval=10497202 TSecr=0 WS=1"
"7480","3306.365402","131.243.1.10","192.232.226.84","TCP","58","21  >  33728 [SYN, ACK] Seq=3845919655 Ack=499649925 Win=17520 Len=0 MSS=1460"
"7482","3306.495352","131.243.1.10","192.232.226.84","FTP","60","Response: 220-"
"7512","3306.672925","192.232.226.84","131.243.1.10","FTP","70","Request: USER anonymous"
"7628","3351.966009","120.151.219.31","131.243.1.10","TCP","62","50236  >  21 [SYN] Seq=3093969718 Win=64240 Len=0 MSS=1380 SACK_PERM=1"
"7629","3351.966759","131.243.1.10","120.151.219.31","TCP","58","21  >  50236 [SYN, ACK] Seq=286736227 Ack=3093969719 Win=16560 Len=0 MSS=1460"
"7631","3352.209112","131.243.1.10","120.151.219.31","FTP","60","Response: 220-"
"7661","3352.456393","120.151.219.31","131.243.1.10","FTP","70","Request: USER anonymous"
"7921","3457.816513","69.157.45.176","203.174.5.11","TCP","62","1044  >  21 [SYN] Seq=3005183275 Win=64240 Len=0 MSS=1460 SACK_PERM=1"
"7922","3457.817365","203.174.5.11","69.157.45.176","TCP","58","21  >  1044 [SYN, ACK] Seq=616512000 Ack=3005183276 Win=32768 Len=0 MSS=1460"
"7924","3458.123427","203.174.5.11","69.157.45.176","FTP","135","Response: 220 <domain> FTP server (Version 1.7.212.5 Wed May 30 12:19:42 GMT 2001) ready."
"7925","3458.305122","69.157.45.176","203.174.5.11","FTP","70","Request: USER anonymous"
"8020","3512.481932","84.68.192.198","131.243.1.10","TCP","74","1594  >  21 [SYN] Seq=3117017266 Win=57344 Len=0 MSS=1380 WS=1 TSval=1219411870 TSecr=0"
"8021","3512.482576","131.243.1.10","84.68.192.198","TCP","58","21  >  1594 [SYN, ACK] Seq=2371308538 Ack=3117017267 Win=16560 Len=0 MSS=1460"
"8024","3512.661897","131.243.1.10","84.68.192.198","FTP","60","Response: 220-"
"8054","3512.852521","84.68.192.198","131.243.1.10","FTP","70","Request: USER anonymous"
"8199","3555.603779","18.23.245.184","131.243.1.10","TCP","62","1915  >  21 [SYN] Seq=1898881 Win=8192 Len=0 MSS=536 SACK_PERM=1"
"8200","3555.604401","131.243.1.10","18.23.245.184","TCP","58","21  >  1915 [SYN, ACK] Seq=1163261937 Ack=1898882 Win=16616 Len=0 MSS=1460"
"8210","3558.973812","131.243.1.10","18.23.245.184","FTP","60","Response: 220-"
"8243","3565.644954","18.23.245.184","131.243.1.10","FTP","70","Request: USER anonymous"
"8261","3574.253778","129.80.74.185","131.243.1.10","TCP","62","19542  >  21 [SYN] Seq=19508663 Win=8192 Len=0 MSS=1460 SACK_PERM=1"
"8262","3574.254441","131.243.1.10","129.80.74.185","TCP","58","21  >  19542 [SYN, ACK] Seq=3410837018 Ack=19508664 Win=17520 Len=0 MSS=1460"
"8269","3575.220283","192.232.226.84","131.243.1.10","TCP","74","33739  >  21 [SYN] Seq=770075469 Win=5840 Len=0 MSS=1460 SACK_PERM=1 TSval=10524088 TSecr=0 WS=1"
"8321","3576.334000","131.243.1.10","129.80.74.185","FTP","60","Response: 220-"
"8384","3584.744111","129.80.74.185","131.243.1.10","FTP","70","Request: USER anonymous"
"8387","3585.675122","129.80.74.185","131.243.1.10","TCP","62","19546  >  21 [SYN] Seq=19520079 Win=8192 Len=0 MSS=1460 SACK_PERM=1"
"8598","3664.623256","18.23.245.184","131.243.1.10","TCP","62","2004  >  21 [SYN] Seq=2010473 Win=8192 Len=0 MSS=536 SACK_PERM=1"
"8599","3664.623719","131.243.1.10","18.23.245.184","TCP","58","21  >  2004 [SYN, ACK] Seq=582140518 Ack=2010474 Win=16616 Len=0 MSS=1460"
"8788","3736.490808","132.239.174.251","131.243.1.10","TCP","62","35056  >  21 [SYN] Seq=2671301654 Win=16384 Len=0 MSS=1436 SACK_PERM=1"
"8789","3736.491333","131.243.1.10","132.239.174.251","TCP","58","21  >  35056 [SYN, ACK] Seq=1088897551 Ack=2671301655 Win=17232 Len=0 MSS=1460"
"8791","3737.684176","131.243.1.10","132.239.174.251","FTP","60","Response: 220-"
"8821","3740.230585","132.239.174.251","131.243.1.10","FTP","70","Request: USER anonymous"
"8847","3910.686665","239.248.79.130","131.243.1.10","TCP","74","2794  >  21 [SYN] Seq=959109208 Win=32120 Len=0 MSS=1460 SACK_PERM=1 TSval=167544579 TSecr=0 WS=1"
"8848","3910.687161","131.243.1.10","239.248.79.130","TCP","58","21  >  2794 [SYN, ACK] Seq=145574164 Ack=959109209 Win=17520 Len=0 MSS=1460"
"8850","3910.987645","131.243.1.10","239.248.79.130","FTP","60","Response: 220-"
"8880","3911.406738","239.248.79.130","131.243.1.10","FTP","70","Request: USER anonymous"
"8924","3915.623815","37.113.117.74","131.243.1.10","TCP","74","53763  >  21 [SYN] Seq=1364227951 Win=5840 Len=0 MSS=1460 SACK_PERM=1 TSval=329631335 TSecr=0 WS=1"
"8925","3915.624415","131.243.1.10","37.113.117.74","TCP","58","21  >  53763 [SYN, ACK] Seq=2034695565 Ack=1364227952 Win=17520 Len=0 MSS=1460"
"8928","3915.828231","37.113.117.74","131.243.1.10","FTP","142","Request: USER anonymous"
"8930","3915.835542","131.243.1.10","37.113.117.74","FTP","60","Response: 220-"
"8976","3920.707365","37.113.117.74","131.243.1.10","TCP","74","53773  >  21 [SYN] Seq=1369968116 Win=5840 Len=0 MSS=1460 SACK_PERM=1 TSval=329631843 TSecr=0 WS=1"
"9008","3921.120841","91.198.76.64","131.243.1.10","TCP","74","61446  >  21 [SYN] Seq=1093397123 Win=5840 Len=0 MSS=1414 SACK_PERM=1 TSval=17051919 TSecr=0 WS=1"
"9127","4045.565058","143.248.150.114","131.243.1.10","TCP","62","1201  >  21 [SYN] Seq=1532177 Win=8192 Len=0 MSS=536 SACK_PERM=1"
"9128","4045.565691","131.243.1.10","143.248.150.114","TCP","58","21  >  1201 [SYN, ACK] Seq=4046295192 Ack=1532178 Win=16616 Len=0 MSS=1460"
"9130","4045.924754","131.243.1.10","143.248.150.114","FTP","60","Response: 220-"
"9154","4046.684877","143.248.150.114","131.243.1.10","FTP","70","Request: USER anonymous"
"9188","4071.885221","143.248.150.114","131.243.1.10","TCP","62","1203  >  21 [SYN] Seq=1558509 Win=8192 Len=0 MSS=536 SACK_PERM=1"
"9241","4196.699256","184.177.31.177","131.243.1.10","TCP","66","1084  >  21 [SYN] Seq=1162727178 Win=10728 Len=0 MSS=1418 WS=4 SACK_PERM=1"
"9242","4196.699824","131.243.1.10","184.177.31.177","TCP","58","21  >  1084 [SYN, ACK] Seq=1697468048 Ack=1162727179 Win=17016 Len=0 MSS=1460"
"9244","4196.890055","131.243.1.10","184.177.31.177","FTP","60","Response: 220-"
"9274","4197.289252","184.177.31.177","131.243.1.10","FTP","70","Request: USER anonymous"
"9309","4292.193466","18.23.245.184","131.243.1.10","TCP","62","2474  >  21 [SYN] Seq=2623850 Win=8192 Len=0 MSS=536 SACK_PERM=1"
"9310","4292.194227","131.243.1.10","18.23.245.184","TCP","58","21  >  2474 [SYN, ACK] Seq=3874567521 Ack=2623851 Win=16616 Len=0 MSS=1460"
"9342","4300.404438","18.23.245.184","131.243.1.10","TCP","62","2489  >  21 [SYN] Seq=2642478 Win=8192 Len=0 MSS=536 SACK_PERM=1"
"9417","4335.547285","192.232.226.84","131.243.1.10","TCP","74","33751  >  21 [SYN] Seq=1588560555 Win=5840 Len=0 MSS=1460 SACK_PERM=1 TSval=10600121 TSecr=0 WS=1"
"9552","4482.215731","193.248.9.31","131.243.1.10","TCP","74","33094  >  21 [SYN] Seq=1738534005 Win=5840 Len=0 MSS=1452 SACK_PERM=1 TSval=198976 TSecr=0 WS=1"
"9553","4482.216225","131.243.1.10","193.248.9.31","TCP","58","21  >  33094 [SYN, ACK] Seq=907419649 Ack=1738534006 Win=17424 Len=0 MSS=1460"
"9555","4482.448322","131.243.1.10","193.248.9.31","FTP","60","Response: 220-"
"9585","4482.834310","193.248.9.31","131.243.1.10","FTP","70","Request: USER anonymous"
"9631","4692.911158","116.177.87.124","131.243.1.10","TCP","74","2785  >  21 [SYN] Seq=1963533716 Win=32120 Len=0 MSS=1460 SACK_PERM=1 TSval=185039815 TSecr=0 WS=1"
"9632","4692.911935","131.243.1.10","116.177.87.124","TCP","58","21  >  2785 [SYN, ACK] Seq=900011732 Ack=1963533717 Win=17520 Len=0 MSS=1460"
"9634","4693.080418","131.243.1.10","116.177.87.124","FTP","60","Response: 220-"
"9664","4693.263231","116.177.87.124","131.243.1.10","FTP","70","Request: USER anonymous"
"9700","4803.332740","213.17.189.200","131.243.1.10","TCP","74","46205  >  21 [SYN] Seq=2063954069 Win=5840 Len=0 MSS=1460 TSval=24083687 TSecr=0 WS=1"
"9701","4803.333439","131.243.1.10","213.17.189.200","TCP","58","21  >  46205 [SYN, ACK] Seq=363818444 Ack=2063954070 Win=17520 Len=0 MSS=1460"
"9703","4803.567990","131.243.1.10","213.17.189.200","FTP","60","Response: 220-"
"9733","4803.810178","213.17.189.200","131.243.1.10","FTP","70","Request: USER anonymous"
"9760","4850.998704","76.62.141.80","131.243.1.10","TCP","74","37885  >  21 [SYN] Seq=2267672001 Win=5840 Len=0 MSS=1460 SACK_PERM=1 TSval=323151191 TSecr=0 WS=1"
"9761","4850.999372","131.243.1.10","76.62.141.80","TCP","58","21  >  37885 [SYN, ACK] Seq=193793049 Ack=2267672002 Win=17520 Len=0 MSS=1460"
"9763","4851.544922","131.243.1.10","76.62.141.80","FTP","60","Response: 220-"
"9793","4855.112593","76.62.141.80","131.243.1.10","FTP","70","Request: USER anonymous"
"9796","4855.499439","157.215.230.139","131.243.1.10","TCP","58","21986  >  21 [SYN] Seq=1927027190 Win=6144 Len=0 MSS=1368"
"9797","4855.499920","131.243.1.10","157.215.230.139","TCP","58","21  >  21986 [SYN, ACK] Seq=1181394413 Ack=1927027191 Win=16416 Len=0 MSS=1460"
"9803","4855.958332","131.243.1.10","157.215.230.139","FTP","60","Response: 220-"
"9845","4858.379430","157.215.230.139","131.243.1.10","FTP","70","Request: USER anonymous"
"9880","4941.297082","76.62.141.80","131.243.1.10","TCP","74","38041  >  21 [SYN] Seq=2359617895 Win=5840 Len=0 MSS=1460 SACK_PERM=1 TSval=323160221 TSecr=0 WS=1"
"9881","4941.297920","131.243.1.10","76.62.141.80","TCP","58","21  >  38041 [SYN, ACK] Seq=1941765362 Ack=2359617896 Win=17520 Len=0 MSS=1460"
"9941","5000.296549","76.62.141.80","131.243.1.10","TCP","74","38141  >  21 [SYN] Seq=2428491720 Win=5840 Len=0 MSS=1460 SACK_PERM=1 TSval=323166122 TSecr=0 WS=1"
"9997","5006.103863","203.139.202.26","131.243.2.12","TCP","58","55549  >  21 [SYN] Seq=1423724933 Win=16384 Len=0 MSS=1460"
"9998","5006.104142","131.243.2.12","203.139.202.26","TCP","58","21  >  55549 [SYN, ACK] Seq=503301304 Ack=1423724934 Win=64240 Len=0 MSS=1460"
"10001","5012.025467","131.243.2.12","203.139.202.26","FTP","137","Response: 220 <domain> FTP server (Version wu-2.6.2(1) Fri Nov 30 16:58:35 PST 2001) ready."
"10002","5012.683104","203.139.202.26","131.243.2.12","FTP","70","Request: USER anonymous"
"10028","5021.967173","254.213.124.61","131.243.2.12","TCP","62","1200  >  21 [SYN] Seq=4805563 Win=8192 Len=0 MSS=1460 SACK_PERM=1"
"10029","5021.967427","131.243.2.12","254.213.124.61","TCP","62","21  >  1200 [SYN, ACK] Seq=505633082 Ack=4805564 Win=64240 Len=0 SACK_PERM=1 MSS=1460"
"10038","5026.936799","131.213.89.179","131.243.1.10","TCP","58","3866  >  21 [SYN] Seq=443754931 Win=8192 Len=0 MSS=1460"
"10039","5026.937309","131.243.1.10","131.213.89.179","TCP","58","21  >  3866 [SYN, ACK] Seq=526115875 Ack=443754932 Win=17520 Len=0 MSS=1460"
"10041","5027.115258","131.243.1.10","131.213.89.179","FTP","60","Response: 220-"
"10071","5027.307538","131.213.89.179","131.243.1.10","FTP","70","Request: USER anonymous"
"10086","5028.181551","76.62.141.80","131.243.1.10","TCP","74","38191  >  21 [SYN] Seq=2461311091 Win=5840 Len=0 MSS=1460 SACK_PERM=1 TSval=323168910 TSecr=0 WS=1"
"10088","5028.205486","131.243.2.12","254.213.124.61","FTP","137","Response: 220 <domain> FTP server (Version wu-2.6.2(1) Fri Nov 30 16:58:35 PST 2001) ready."
"10132","5029.131730","254.213.124.61","131.243.2.12","FTP","70","Request: USER anonymous"
"10185","5154.301811","152.172.117.61","131.243.1.10","TCP","62","1926  >  21 [SYN] Seq=3292358249 Win=16384 Len=0 MSS=1460 SACK_PERM=1"
"10186","5154.302235","131.243.1.10","152.172.117.61","TCP","58","21  >  1926 [SYN, ACK] Seq=4228911422 Ack=3292358250 Win=17520 Len=0 MSS=1460"
"10187","5154.344280","152.172.117.61","131.243.1.10","TCP","62","1923  >  21 [SYN] Seq=3292148777 Win=16384 Len=0 MSS=1460 SACK_PERM=1"
"10190","5155.212759","131.243.1.10","152.172.117.61","FTP","60","Response: 220-"
"10271","5169.632792","152.172.117.61","131.243.1.10","FTP","70","Request: USER anonymous"
"10304","5205.136336","173.218.67.133","131.243.1.10","TCP","74","33311  >  21 [SYN] Seq=2498043033 Win=5840 Len=0 MSS=1460 SACK_PERM=1 TSval=42472 TSecr=0 WS=1"
"10305","5205.136842","131.243.1.10","173.218.67.133","TCP","58","21  >  33311 [SYN, ACK] Seq=1024496820 Ack=2498043034 Win=17520 Len=0 MSS=1460"
"10307","5205.254314","131.243.1.10","173.218.67.133","FTP","60","Response: 220-"
"10337","5205.534408","173.218.67.133","131.243.1.10","FTP","70","Request: USER anonymous"
"10367","5410.902990","97.0.158.29","131.243.1.10","TCP","74","46189  >  21 [SYN] Seq=2703202794 Win=5840 Len=0 MSS=1460 SACK_PERM=1 TSval=494332448 TSecr=0 WS=1"
"10368","5410.903555","131.243.1.10","97.0.158.29","TCP","58","21  >  46189 [SYN, ACK] Seq=4236532844 Ack=2703202795 Win=17520 Len=0 MSS=1460"
"10370","5410.994076","131.243.1.10","97.0.158.29","FTP","60","Response: 220-"
"10400","5411.098813","97.0.158.29","131.243.1.10","FTP","70","Request: USER anonymous"
"10437","5612.490809","161.206.176.161","131.243.1.10","TCP","62","2726  >  21 [SYN] Seq=3530878059 Win=16384 Len=0 MSS=1460 SACK_PERM=1"
"10438","5612.491253","131.243.1.10","161.206.176.161","TCP","58","21  >  2726 [SYN, ACK] Seq=1634527201 Ack=3530878060 Win=17520 Len=0 MSS=1460"
"10440","5612.720764","131.243.1.10","161.206.176.161","FTP","60","Response: 220-"
"10470","5613.023230","161.206.176.161","131.243.1.10","FTP","70","Request: USER anonymous"
"10502","5683.632795","21.97.107.165","131.243.1.10","TCP","62","60804  >  21 [SYN] Seq=2816766624 Win=64240 Len=0 MSS=1380 SACK_PERM=1"
"10503","5683.633373","131.243.1.10","21.97.107.165","TCP","58","21  >  60804 [SYN, ACK] Seq=3500936126 Ack=2816766625 Win=16560 Len=0 MSS=1460"
"10505","5683.876127","131.243.1.10","21.97.107.165","FTP","60","Response: 220-"
"10535","5684.129355","21.97.107.165","131.243.1.10","FTP","70","Request: USER anonymous"
"10562","5701.622984","21.97.107.165","131.243.1.10","TCP","62","60835  >  21 [SYN] Seq=3760902752 Win=64240 Len=0 MSS=1380 SACK_PERM=1"
"10624","5872.816503","212.7.211.138","131.243.1.10","TCP","62","2110  >  21 [SYN] Seq=4096161 Win=8192 Len=0 MSS=1460 SACK_PERM=1"
"10625","5872.817193","131.243.1.10","212.7.211.138","TCP","58","21  >  2110 [SYN, ACK] Seq=557305894 Ack=4096162 Win=17520 Len=0 MSS=1460"
