"No.","Time","Source","Destination","Protocol","Length","Info"
"1","0.000000","113.165.230.66","131.243.1.10","TCP","62","63267  >  21 [SYN] Seq=1678493483 Win=64240 Len=0 MSS=1460 SACK_PERM=1"
"2","0.000507","131.243.1.10","113.165.230.66","TCP","58","21  >  63267 [SYN, ACK] Seq=2848448489 Ack=1678493484 Win=17520 Len=0 MSS=1460"
"4","0.674262","131.243.1.10","113.165.230.66","FTP","60","Response: 220-"
"34","1.905509","113.165.230.66","131.243.1.10","FTP","70","Request: USER anonymous"
"56","91.565033","181.223.231.99","131.243.2.12","TCP","62","3362  >  21 [SYN] Seq=2469850254 Win=16384 Len=0 MSS=1460 SACK_PERM=1"
"57","91.565344","131.243.2.12","181.223.231.99","TCP","62","21  >  3362 [SYN, ACK] Seq=2835865449 Ack=2469850255 Win=64240 Len=0 SACK_PERM=1 MSS=1460"
"59","91.788076","131.243.2.12","181.223.231.99","FTP","137","Response: 220 <domain> FTP server (Version wu-2.6.2(1) Fri Nov 30 16:58:35 PST 2001) ready."
"60","91.982555","181.223.231.99","131.243.2.12","FTP","70","Request: USER anonymous"
"119","126.553363","123.125.239.10","128.3.28.48","TCP","74","63004  >  21 [SYN] Seq=1171148531 Win=5840 Len=0 MSS=1460 SACK_PERM=1 TSval=314098082 TSecr=0 WS=1"
"120","126.553615","128.3.28.48","123.125.239.10","TCP","74","21  >  63004 [SYN, ACK] Seq=2887783774 Ack=1171148532 Win=5792 Len=0 MSS=1460 SACK_PERM=1 TSval=2233538616 TSecr=314098082 WS=1"
"122","127.102778","128.3.28.48","123.125.239.10","FTP","120","Response: 220 <domain> FTP server (Version wu-2.6.1-20) ready."
"126","127.383993","123.125.239.10","128.3.28.48","FTP","82","Request: USER anonymous"
"153","130.091331","123.125.239.10","128.3.28.48","TCP","74","63011  >  21 [SYN] Seq=1179361229 Win=5840 Len=0 MSS=1460 SACK_PERM=1 TSval=314099854 TSecr=0 WS=1"
"189","135.002801","123.125.239.10","128.3.28.48","TCP","74","63016  >  21 [SYN] Seq=1184413743 Win=5840 Len=0 MSS=1460 SACK_PERM=1 TSval=314102420 TSecr=0 WS=1"
"311","194.648779","79.37.53.67","131.243.2.12","TCP","62","38255  >  21 [SYN] Seq=934586305 Win=16384 Len=0 MSS=1460 SACK_PERM=1"
"312","194.649134","131.243.2.12","79.37.53.67","TCP","62","21  >  38255 [SYN, ACK] Seq=2850451775 Ack=934586306 Win=64240 Len=0 SACK_PERM=1 MSS=1460"
"314","194.861841","131.243.2.12","79.37.53.67","FTP","137","Response: 220 <domain> FTP server (Version wu-2.6.2(1) Fri Nov 30 16:58:35 PST 2001) ready."
"315","195.041158","79.37.53.67","131.243.2.12","FTP","70","Request: USER anonymous"
"401","216.393164","79.37.53.67","203.174.5.11","TCP","62","39897  >  21 [SYN] Seq=950349522 Win=16384 Len=0 MSS=1460 SACK_PERM=1"
"402","216.393983","203.174.5.11","79.37.53.67","TCP","58","21  >  39897 [SYN, ACK] Seq=863808000 Ack=950349523 Win=32768 Len=0 MSS=1460"
"404","216.650268","203.174.5.11","79.37.53.67","FTP","135","Response: 220 <domain> FTP server (Version 1.7.212.5 Wed May 30 12:19:42 GMT 2001) ready."
"405","216.829165","79.37.53.67","203.174.5.11","FTP","70","Request: USER anonymous"
"659","317.903117","182.125.36.184","131.243.1.10","TCP","58","46477  >  21 [SYN] Seq=2629967346 Win=8760 Len=0 MSS=1460"
"660","317.903918","131.243.1.10","182.125.36.184","TCP","58","21  >  46477 [SYN, ACK] Seq=304250576 Ack=2629967347 Win=17520 Len=0 MSS=1460"
"664","318.993490","131.243.1.10","182.125.36.184","FTP","60","Response: 220-"
"695","320.393043","182.125.36.184","131.243.1.10","FTP","70","Request: USER anonymous"
"720","333.014547","240.86.67.4","131.243.1.10","TCP","62","4036  >  21 [SYN] Seq=1950806314 Win=16384 Len=0 MSS=1460 SACK_PERM=1"
"721","333.015361","131.243.1.10","240.86.67.4","TCP","58","21  >  4036 [SYN, ACK] Seq=2446010622 Ack=1950806315 Win=17520 Len=0 MSS=1460"
"725","333.558053","131.243.1.10","240.86.67.4","FTP","60","Response: 220-"
"755","334.112098","240.86.67.4","131.243.1.10","FTP","70","Request: USER anonymous"
"932","427.781391","116.106.109.148","131.243.1.10","TCP","62","4931  >  21 [SYN] Seq=1274017979 Win=64240 Len=0 MSS=1460 SACK_PERM=1"
"933","427.782075","131.243.1.10","116.106.109.148","TCP","58","21  >  4931 [SYN, ACK] Seq=4289573324 Ack=1274017980 Win=17520 Len=0 MSS=1460"
"935","427.976812","131.243.1.10","116.106.109.148","FTP","60","Response: 220-"
"965","428.181695","116.106.109.148","131.243.1.10","FTP","70","Request: USER anonymous"
"1302","583.488722","72.192.229.59","128.3.12.44","TCP","74","2997  >  21 [SYN] Seq=1503100016 Win=32120 Len=0 MSS=1460 SACK_PERM=1 TSval=60821156 TSecr=0 WS=1"
"1303","583.489543","128.3.12.44","72.192.229.59","TCP","54","21  >  2997 [SYN, ACK] Seq=129664000 Ack=1503100017 Win=4096 Len=0"
"1305","583.755261","128.3.12.44","72.192.229.59","FTP","136","Response: 220 <domain> FTP server (Version wu-2.6.2(1) Mon Dec 3 12:18:44 PST 2001) ready."
"1307","583.928787","72.192.229.59","128.3.12.44","FTP","70","Request: USER anonymous"
"1347","588.042784","79.37.53.67","131.243.2.12","TCP","62","37361  >  21 [SYN] Seq=1170577317 Win=16384 Len=0 MSS=1460 SACK_PERM=1"
"1348","588.043104","131.243.2.12","79.37.53.67","TCP","62","21  >  37361 [SYN, ACK] Seq=2908900215 Ack=1170577318 Win=64240 Len=0 SACK_PERM=1 MSS=1460"
"1393","596.195524","224.220.166.101","131.243.1.10","TCP","62","56537  >  21 [SYN] Seq=1130017749 Win=32768 Len=0 MSS=1460 WS=1"
"1394","596.196232","131.243.1.10","224.220.166.101","TCP","58","21  >  56537 [SYN, ACK] Seq=4013430997 Ack=1130017750 Win=17520 Len=0 MSS=1460"
"1396","596.226845","131.243.1.10","224.220.166.101","FTP","60","Response: 220-"
"1436","596.902413","224.220.166.101","131.243.1.10","FTP","70","Request: USER anonymous"
"1445","597.305338","246.94.203.142","203.174.5.11","TCP","62","2658  >  21 [SYN] Seq=4068834244 Win=16384 Len=0 MSS=1460 SACK_PERM=1"
"1446","597.306117","203.174.5.11","246.94.203.142","TCP","58","21  >  2658 [SYN, ACK] Seq=867392000 Ack=4068834245 Win=32768 Len=0 MSS=1460"
"1453","597.535712","203.174.5.11","246.94.203.142","FTP","135","Response: 220 <domain> FTP server (Version 1.7.212.5 Wed May 30 12:19:42 GMT 2001) ready."
"1455","597.711653","246.94.203.142","203.174.5.11","FTP","70","Request: USER anonymous"
"1541","609.971716","72.192.229.59","128.3.12.44","TCP","74","3001  >  21 [SYN] Seq=1529309888 Win=32120 Len=0 MSS=1460 SACK_PERM=1 TSval=60823805 TSecr=0 WS=1"
"1543","609.972625","128.3.12.44","72.192.229.59","TCP","54","21  >  3001 [SYN, ACK] Seq=134528000 Ack=1529309889 Win=4096 Len=0"
"1556","611.076824","79.37.53.67","203.174.5.11","TCP","62","40225  >  21 [SYN] Seq=1186864425 Win=16384 Len=0 MSS=1460 SACK_PERM=1"
"1557","611.077581","203.174.5.11","79.37.53.67","TCP","58","21  >  40225 [SYN, ACK] Seq=867904000 Ack=1186864426 Win=32768 Len=0 MSS=1460"
"1628","616.920177","72.192.229.59","128.3.12.44","TCP","74","3003  >  21 [SYN] Seq=1548218916 Win=32120 Len=0 MSS=1460 SACK_PERM=1 TSval=60824499 TSecr=0 WS=1"
"1690","622.060256","72.192.229.59","128.3.12.44","TCP","74","3005  >  21 [SYN] Seq=1543681211 Win=32120 Len=0 MSS=1460 SACK_PERM=1 TSval=60825013 TSecr=0 WS=1"
"1848","658.590381","27.172.198.213","131.243.1.10","TCP","74","1025  >  21 [SYN] Seq=1586062586 Win=5840 Len=0 MSS=1460 SACK_PERM=1 TSval=10610719 TSecr=0 WS=1"
"1849","658.591092","131.243.1.10","27.172.198.213","TCP","58","21  >  1025 [SYN, ACK] Seq=1469381378 Ack=1586062587 Win=17520 Len=0 MSS=1460"
"1853","658.979579","131.243.1.10","27.172.198.213","FTP","60","Response: 220-"
"1886","659.583244","27.172.198.213","131.243.1.10","FTP","70","Request: USER anonymous"
"1983","684.440312","177.87.134.55","131.243.1.10","TCP","62","14462  >  21 [SYN] Seq=4203434425 Win=16384 Len=0 MSS=1460 SACK_PERM=1"
"1984","684.440825","131.243.1.10","177.87.134.55","TCP","58","21  >  14462 [SYN, ACK] Seq=2437754288 Ack=4203434426 Win=17520 Len=0 MSS=1460"
"1987","684.652490","131.243.1.10","177.87.134.55","FTP","60","Response: 220-"
"2017","684.875705","177.87.134.55","131.243.1.10","FTP","70","Request: USER anonymous"
"2153","736.109534","72.192.229.59","128.3.12.44","TCP","74","3014  >  21 [SYN] Seq=1686578557 Win=32120 Len=0 MSS=1460 SACK_PERM=1 TSval=60836418 TSecr=0 WS=1"
"2211","755.310998","195.55.62.39","131.243.1.10","TCP","78","52511  >  21 [SYN] Seq=3684174973 Win=16384 Len=0 MSS=1460 SACK_PERM=1 WS=1 TSval=148884112 TSecr=0"
"2212","755.311686","131.243.1.10","195.55.62.39","TCP","58","21  >  52511 [SYN, ACK] Seq=2516191693 Ack=3684174974 Win=17520 Len=0 MSS=1460"
"2214","755.471440","131.243.1.10","195.55.62.39","FTP","60","Response: 220-"
"2244","755.641016","195.55.62.39","131.243.1.10","FTP","70","Request: USER anonymous"
"2323","784.629027","158.218.249.29","131.243.1.10","TCP","74","40517  >  21 [SYN] Seq=1919850843 Win=5608 Len=0 MSS=1402 TSval=309536559 TSecr=0 WS=1"
"2324","784.629730","131.243.1.10","158.218.249.29","TCP","58","21  >  40517 [SYN, ACK] Seq=485991313 Ack=1919850844 Win=16824 Len=0 MSS=1460"
"2326","784.812677","131.243.1.10","158.218.249.29","FTP","60","Response: 220-"
"2356","785.142766","158.218.249.29","131.243.1.10","FTP","70","Request: USER anonymous"
"2388","786.830732","158.218.249.29","131.243.1.10","TCP","74","48676  >  21 [SYN] Seq=1925727702 Win=5608 Len=0 MSS=1402 TSval=309536779 TSecr=0 WS=1"
"2389","786.831167","131.243.1.10","158.218.249.29","TCP","58","21  >  48676 [SYN, ACK] Seq=4199815486 Ack=1925727703 Win=16824 Len=0 MSS=1460"
"2538","840.910511","65.240.185.205","131.243.2.12","TCP","62","1841  >  21 [SYN] Seq=3124187105 Win=16384 Len=0 MSS=1460 SACK_PERM=1"
"2539","840.910745","131.243.2.12","65.240.185.205","TCP","62","21  >  1841 [SYN, ACK] Seq=2950256608 Ack=3124187106 Win=64240 Len=0 SACK_PERM=1 MSS=1460"
"2543","841.336045","131.243.2.12","65.240.185.205","FTP","137","Response: 220 <domain> FTP server (Version wu-2.6.2(1) Fri Nov 30 16:58:35 PST 2001) ready."
"2544","841.645651","65.240.185.205","131.243.2.12","FTP","70","Request: USER anonymous"
"2577","849.900141","16.18.143.122","131.243.1.10","TCP","74","3601  >  21 [SYN] Seq=2699103329 Win=16384 Len=0 MSS=1460 WS=1 TSval=1680806044 TSecr=0"
"2578","849.900657","131.243.1.10","16.18.143.122","TCP","58","21  >  3601 [SYN, ACK] Seq=3585163381 Ack=2699103330 Win=17520 Len=0 MSS=1460"
"2582","850.226476","131.243.1.10","16.18.143.122","FTP","60","Response: 220-"
"2613","850.560340","16.18.143.122","131.243.1.10","FTP","70","Request: USER anonymous"
"2943","965.795819","230.101.18.175","128.3.12.44","TCP","74","1914  >  21 [SYN] Seq=2631955524 Win=57344 Len=0 MSS=1460 WS=1 TSval=279964170 TSecr=0"
"2944","965.796706","128.3.12.44","230.101.18.175","TCP","54","21  >  1914 [SYN, ACK] Seq=200320000 Ack=2631955525 Win=4096 Len=0"
"2946","966.222204","128.3.12.44","230.101.18.175","FTP","136","Response: 220 <domain> FTP server (Version wu-2.6.2(1) Mon Dec 3 12:18:44 PST 2001) ready."
"2950","966.550812","230.101.18.175","128.3.12.44","FTP","70","Request: USER anonymous"
"3007","982.204114","79.37.53.67","131.243.2.12","TCP","62","37332  >  21 [SYN] Seq=1407814872 Win=16384 Len=0 MSS=1460 SACK_PERM=1"
"3100","1004.193116","79.37.53.67","203.174.5.11","TCP","62","38798  >  21 [SYN] Seq=1423931211 Win=16384 Len=0 MSS=1460 SACK_PERM=1"
"3101","1004.193880","203.174.5.11","79.37.53.67","TCP","58","21  >  38798 [SYN, ACK] Seq=883072000 Ack=1423931212 Win=32768 Len=0 MSS=1460"
"3465","1193.751233","41.54.26.143","131.243.1.10","TCP","62","18676  >  21 [SYN] Seq=1109730945 Win=16384 Len=0 MSS=1400 SACK_PERM=1"
"3466","1193.751874","131.243.1.10","41.54.26.143","TCP","58","21  >  18676 [SYN, ACK] Seq=688266487 Ack=1109730946 Win=16800 Len=0 MSS=1460"
"3470","1193.976327","131.243.1.10","41.54.26.143","FTP","60","Response: 220-"
"3501","1194.268035","41.54.26.143","131.243.1.10","FTP","70","Request: USER anonymous"
"3569","1359.106848","181.223.231.99","131.243.2.12","TCP","62","2921  >  21 [SYN] Seq=212682238 Win=16384 Len=0 MSS=1460 SACK_PERM=1"
"3570","1359.107127","131.243.2.12","181.223.231.99","TCP","62","21  >  2921 [SYN, ACK] Seq=3034323179 Ack=212682239 Win=64240 Len=0 SACK_PERM=1 MSS=1460"
"3587","1361.844170","79.37.53.67","131.243.2.12","TCP","62","40373  >  21 [SYN] Seq=1641289142 Win=16384 Len=0 MSS=1460 SACK_PERM=1"
"3588","1361.844496","131.243.2.12","79.37.53.67","TCP","62","21  >  40373 [SYN, ACK] Seq=3034693120 Ack=1641289143 Win=64240 Len=0 SACK_PERM=1 MSS=1460"
"3683","1385.388847","79.37.53.67","203.174.5.11","TCP","62","39096  >  21 [SYN] Seq=1657917497 Win=16384 Len=0 MSS=1460 SACK_PERM=1"
"3793","1420.360243","89.124.219.32","131.243.2.12","TCP","62","1886  >  21 [SYN] Seq=1567835972 Win=16384 Len=0 MSS=1460 SACK_PERM=1"
"3794","1420.360498","131.243.2.12","89.124.219.32","TCP","62","21  >  1886 [SYN, ACK] Seq=3042852714 Ack=1567835973 Win=64240 Len=0 SACK_PERM=1 MSS=1460"
"3796","1420.603924","131.243.2.12","89.124.219.32","FTP","137","Response: 220 <domain> FTP server (Version wu-2.6.2(1) Fri Nov 30 16:58:35 PST 2001) ready."
"3797","1420.790639","89.124.219.32","131.243.2.12","FTP","70","Request: USER anonymous"
"3841","1432.019538","123.125.239.10","128.3.28.48","TCP","74","63662  >  21 [SYN] Seq=2541902128 Win=5840 Len=0 MSS=1460 SACK_PERM=1 TSval=314766563 TSecr=0 WS=1"
"3887","1437.712185","123.125.239.10","128.3.28.48","TCP","74","63666  >  21 [SYN] Seq=2540436333 Win=5840 Len=0 MSS=1460 SACK_PERM=1 TSval=314769479 TSecr=0 WS=1"
"3933","1443.649735","1.126.179.169","131.243.1.10","TCP","58","12340  >  21 [SYN] Seq=725323911 Win=512 Len=0 MSS=1460"
"3934","1443.650437","131.243.1.10","1.126.179.169","TCP","58","21  >  12340 [SYN, ACK] Seq=997332839 Ack=725323912 Win=17520 Len=0 MSS=1460"
"3946","1444.522067","131.243.1.10","1.126.179.169","FTP","60","Response: 220-"
"3979","1445.603785","1.126.179.169","131.243.1.10","FTP","70","Request: USER anonymous"
"4067","1459.978740","69.88.8.56","131.243.1.10","TCP","62","2569  >  21 [SYN] Seq=3829444673 Win=64240 Len=0 MSS=1460 SACK_PERM=1"
"4068","1459.979211","131.243.1.10","69.88.8.56","TCP","58","21  >  2569 [SYN, ACK] Seq=2352168365 Ack=3829444674 Win=17520 Len=0 MSS=1460"
"4072","1460.127326","131.243.1.10","69.88.8.56","FTP","60","Response: 220-"
"4102","1460.286148","69.88.8.56","131.243.1.10","FTP","70","Request: USER anonymous"
"4276","1495.115862","104.205.27.72","128.3.28.48","TCP","74","42694  >  21 [SYN] Seq=2708560480 Win=5840 Len=0 MSS=1460 SACK_PERM=1 TSval=335107530 TSecr=0 WS=1"
"4277","1495.116162","128.3.28.48","104.205.27.72","TCP","74","21  >  42694 [SYN, ACK] Seq=50011526 Ack=2708560481 Win=5792 Len=0 MSS=1460 SACK_PERM=1 TSval=2233675459 TSecr=335107530 WS=1"
"4279","1495.581955","128.3.28.48","104.205.27.72","FTP","120","Response: 220 <domain> FTP server (Version wu-2.6.1-20) ready."
"4283","1495.678325","104.205.27.72","128.3.28.48","FTP","82","Request: USER anonymous"
"4309","1496.657565","104.205.27.72","128.3.28.48","TCP","74","42696  >  21 [SYN] Seq=2721548107 Win=5840 Len=0 MSS=1460 SACK_PERM=1 TSval=335108318 TSecr=0 WS=1"
"4344","1498.139052","104.205.27.72","128.3.28.48","TCP","74","42698  >  21 [SYN] Seq=2712879308 Win=5840 Len=0 MSS=1460 SACK_PERM=1 TSval=335109079 TSecr=0 WS=1"
"4402","1505.838991","104.205.27.72","128.3.28.48","TCP","74","42700  >  21 [SYN] Seq=2727342159 Win=5840 Len=0 MSS=1460 SACK_PERM=1 TSval=335113022 TSecr=0 WS=1"
"4466","1519.171471","30.146.52.247","131.243.1.10","TCP","62","2412  >  21 [SYN] Seq=775738884 Win=8192 Len=0 MSS=1380 SACK_PERM=1"
"4467","1519.172052","131.243.1.10","30.146.52.247","TCP","58","21  >  2412 [SYN, ACK] Seq=2874677368 Ack=775738885 Win=16560 Len=0 MSS=1460"
"4473","1519.696770","131.243.1.10","30.146.52.247","FTP","60","Response: 220-"
"4505","1520.294553","30.146.52.247","131.243.1.10","FTP","70","Request: USER anonymous"
"4537","1523.469217","104.205.27.72","128.3.28.48","TCP","74","42702  >  21 [SYN] Seq=2754166692 Win=5840 Len=0 MSS=1460 SACK_PERM=1 TSval=335122051 TSecr=0 WS=1"
"4581","1525.509820","104.205.27.72","128.3.28.48","TCP","74","42704  >  21 [SYN] Seq=2767961232 Win=5840 Len=0 MSS=1460 SACK_PERM=1 TSval=335123096 TSecr=0 WS=1"
"4625","1527.876331","104.205.27.72","128.3.28.48","TCP","74","42706  >  21 [SYN] Seq=2758752492 Win=5840 Len=0 MSS=1460 SACK_PERM=1 TSval=335124308 TSecr=0 WS=1"
"4700","1532.761359","136.108.93.122","203.174.5.11","TCP","62","29456  >  21 [SYN] Seq=2973765677 Win=32768 Len=0 MSS=1460 WS=1"
"4701","1532.762264","203.174.5.11","136.108.93.122","TCP","58","21  >  29456 [SYN, ACK] Seq=897216000 Ack=2973765678 Win=32768 Len=0 MSS=1460"
"4730","1535.635365","203.174.5.11","136.108.93.122","FTP","135","Response: 220 <domain> FTP server (Version 1.7.212.5 Wed May 30 12:19:42 GMT 2001) ready."
"4734","1535.948884","136.108.93.122","203.174.5.11","FTP","70","Request: USER anonymous"
"4748","1536.815260","20.191.125.223","242.70.74.100","TCP","58","52099  >  21 [SYN] Seq=1131396769 Win=8760 Len=0 MSS=1460"
"4749","1536.816475","242.70.74.100","20.191.125.223","TCP","58","21  >  52099 [SYN, ACK] Seq=26259049 Ack=1131396770 Win=8760 Len=0 MSS=1460"
"4753","1536.997430","30.146.52.247","131.243.1.10","TCP","62","2414  >  21 [SYN] Seq=1189977737 Win=8192 Len=0 MSS=1380 SACK_PERM=1"
"4755","1537.135304","242.70.74.100","20.191.125.223","FTP","98","Response: 220 <domain> FTP server (SunOS 5.6) ready."
"4762","1537.346757","20.191.125.223","242.70.74.100","FTP","70","Request: USER anonymous"
"4919","1542.215310","30.146.52.247","131.243.1.10","TCP","62","2416  >  21 [SYN] Seq=129593226 Win=8192 Len=0 MSS=1380 SACK_PERM=1"
"5384","1648.182423","120.186.15.61","131.243.1.10","TCP","74","3333  >  21 [SYN] Seq=2580967875 Win=16060 Len=0 MSS=1460 SACK_PERM=1 TSval=26161526 TSecr=0 WS=1"
"5385","1648.183075","131.243.1.10","120.186.15.61","TCP","58","21  >  3333 [SYN, ACK] Seq=1880614981 Ack=2580967876 Win=17520 Len=0 MSS=1460"
"5387","1648.412214","131.243.1.10","120.186.15.61","FTP","60","Response: 220-"
"5418","1648.915418","120.186.15.61","131.243.1.10","FTP","70","Request: USER anonymous"
"5449","1651.385144","4.251.189.14","131.243.1.10","TCP","74","60211  >  21 [SYN] Seq=2626169397 Win=5840 Len=0 MSS=1460 SACK_PERM=1 TSval=50541110 TSecr=0 WS=1"
"5450","1651.385673","131.243.1.10","4.251.189.14","TCP","58","21  >  60211 [SYN, ACK] Seq=2750398034 Ack=2626169398 Win=17520 Len=0 MSS=1460"
"5452","1651.480803","131.243.1.10","4.251.189.14","FTP","60","Response: 220-"
"5484","1651.586841","4.251.189.14","131.243.1.10","FTP","70","Request: USER anonymous"
"5559","1662.452948","168.254.152.132","131.243.2.12","TCP","62","2135  >  21 [SYN] Seq=2745912265 Win=16384 Len=0 MSS=1460 SACK_PERM=1"
"5560","1662.453223","131.243.2.12","168.254.152.132","TCP","62","21  >  2135 [SYN, ACK] Seq=3081988221 Ack=2745912266 Win=64240 Len=0 SACK_PERM=1 MSS=1460"
"5562","1663.082917","131.243.2.12","168.254.152.132","FTP","137","Response: 220 <domain> FTP server (Version wu-2.6.2(1) Fri Nov 30 16:58:35 PST 2001) ready."
"5565","1663.265414","168.254.152.132","131.243.2.12","FTP","70","Request: USER anonymous"
"5616","1672.220350","191.27.3.166","131.243.1.10","TCP","62","37624  >  21 [SYN] Seq=2232748994 Win=64240 Len=0 MSS=1460 SACK_PERM=1"
"5617","1672.221118","131.243.1.10","191.27.3.166","TCP","58","21  >  37624 [SYN, ACK] Seq=1063806196 Ack=2232748995 Win=17520 Len=0 MSS=1460"
"5620","1672.435065","131.243.1.10","191.27.3.166","FTP","60","Response: 220-"
"5650","1672.661733","191.27.3.166","131.243.1.10","FTP","70","Request: USER anonymous"
"5806","1704.245888","8.113.23.107","128.3.12.44","TCP","74","10514  >  21 [SYN] Seq=3051394548 Win=57344 Len=0 MSS=1460 WS=1 TSval=1914132 TSecr=0"
"5807","1704.246735","128.3.12.44","8.113.23.107","TCP","54","21  >  10514 [SYN, ACK] Seq=315136000 Ack=3051394549 Win=4096 Len=0"
"5812","1704.570530","128.3.12.44","8.113.23.107","FTP","136","Response: 220 <domain> FTP server (Version wu-2.6.2(1) Mon Dec 3 12:18:44 PST 2001) ready."
"5814","1704.755858","8.113.23.107","128.3.12.44","FTP","70","Request: USER anonymous"
"6013","1748.319671","249.44.109.25","128.3.28.48","TCP","74","4136  >  21 [SYN] Seq=2714954371 Win=5840 Len=0 MSS=1460 SACK_PERM=1 TSval=160843415 TSecr=0 WS=1"
"6014","1748.319863","128.3.28.48","249.44.109.25","TCP","74","21  >  4136 [SYN, ACK] Seq=316150400 Ack=2714954372 Win=5792 Len=0 MSS=1460 SACK_PERM=1 TSval=2233700777 TSecr=160843415 WS=1"
"6018","1748.635078","128.3.28.48","249.44.109.25","FTP","120","Response: 220 <domain> FTP server (Version wu-2.6.1-20) ready."
"6020","1748.738171","249.44.109.25","128.3.28.48","FTP","82","Request: USER anonymous"
"6044","1749.645162","249.44.109.25","128.3.28.48","TCP","74","4140  >  21 [SYN] Seq=2725840120 Win=5840 Len=0 MSS=1460 SACK_PERM=1 TSval=160843548 TSecr=0 WS=1"
"6082","1751.604047","249.44.109.25","128.3.28.48","TCP","74","4200  >  21 [SYN] Seq=2720602644 Win=5840 Len=0 MSS=1460 SACK_PERM=1 TSval=160843744 TSecr=0 WS=1"
"6083","1751.604234","128.3.28.48","249.44.109.25","TCP","74","21  >  4200 [SYN, ACK] Seq=318982615 Ack=2720602645 Win=5792 Len=0 MSS=1460 SACK_PERM=1 TSval=2233701105 TSecr=160843744 WS=1"
"6108","1753.308423","79.37.53.67","131.243.2.12","TCP","62","39753  >  21 [SYN] Seq=1877665772 Win=16384 Len=0 MSS=1460 SACK_PERM=1"
"6109","1753.308666","131.243.2.12","79.37.53.67","TCP","62","21  >  39753 [SYN, ACK] Seq=3098118334 Ack=1877665773 Win=64240 Len=0 SACK_PERM=1 MSS=1460"
"6234","1769.241618","30.146.52.247","131.243.1.10","TCP","62","2439  >  21 [SYN] Seq=816570905 Win=8192 Len=0 MSS=1380 SACK_PERM=1"
"6298","1773.335523","30.146.52.247","131.243.1.10","TCP","62","2440  >  21 [SYN] Seq=590354120 Win=8192 Len=0 MSS=1380 SACK_PERM=1"
"6347","1775.555577","79.37.53.67","203.174.5.11","TCP","62","38586  >  21 [SYN] Seq=1893612447 Win=16384 Len=0 MSS=1460 SACK_PERM=1"
"6548","1801.718783","66.165.111.206","131.243.1.10","TCP","62","4559  >  21 [SYN] Seq=1923057539 Win=64800 Len=0 MSS=1440 SACK_PERM=1"
"6549","1801.719557","131.243.1.10","66.165.111.206","TCP","58","21  >  4559 [SYN, ACK] Seq=912690079 Ack=1923057540 Win=17280 Len=0 MSS=1460"
"6552","1802.008506","131.243.1.10","66.165.111.206","FTP","60","Response: 220-"
"6582","1802.310563","66.165.111.206","131.243.1.10","FTP","70","Request: USER anonymous"
"6793","1823.936074","6.57.196.120","131.243.1.10","TCP","74","2302  >  21 [SYN] Seq=2322712151 Win=32120 Len=0 MSS=1460 SACK_PERM=1 TSval=262567166 TSecr=0 WS=1"
"6794","1823.936515","131.243.1.10","6.57.196.120","TCP","58","21  >  2302 [SYN, ACK] Seq=1655586281 Ack=2322712152 Win=17520 Len=0 MSS=1460"
"6796","1824.113399","131.243.1.10","6.57.196.120","FTP","60","Response: 220-"
"6826","1824.326961","6.57.196.120","131.243.1.10","FTP","70","Request: USER anonymous"
"6891","1832.866284","6.57.196.120","131.243.1.10","TCP","74","2304  >  21 [SYN] Seq=2346003212 Win=32120 Len=0 MSS=1460 SACK_PERM=1 TSval=262568058 TSecr=0 WS=1"
"7162","1884.543232","30.146.52.247","131.243.1.10","TCP","62","2450  >  21 [SYN] Seq=1083272609 Win=8192 Len=0 MSS=1380 SACK_PERM=1"
"7253","1891.443693","30.146.52.247","131.243.1.10","TCP","62","2455  >  21 [SYN] Seq=765647945 Win=8192 Len=0 MSS=1380 SACK_PERM=1"
"7254","1891.443693","30.146.52.247","131.243.1.10","TCP","62","2454  >  21 [SYN] Seq=1293574387 Win=8192 Len=0 MSS=1380 SACK_PERM=1"
"7255","1891.443963","30.146.52.247","131.243.1.10","TCP","62","2456  >  21 [SYN] Seq=1443972475 Win=8192 Len=0 MSS=1380 SACK_PERM=1"
"7448","1899.357119","30.146.52.247","131.243.1.10","TCP","62","2461  >  21 [SYN] Seq=1643152422 Win=8192 Len=0 MSS=1380 SACK_PERM=1"
"7667","1938.564968","179.192.184.110","131.243.1.10","TCP","62","34259  >  21 [SYN] Seq=2240561738 Win=16384 Len=0 MSS=1402 SACK_PERM=1"
"7668","1938.565540","131.243.1.10","179.192.184.110","TCP","58","21  >  34259 [SYN, ACK] Seq=646769491 Ack=2240561739 Win=16824 Len=0 MSS=1460"
"7671","1938.758223","131.243.1.10","179.192.184.110","FTP","60","Response: 220-"
"7701","1939.076475","179.192.184.110","131.243.1.10","FTP","70","Request: USER anonymous"
"7952","2009.692460","40.159.39.117","131.243.2.12","TCP","62","1350  >  21 [SYN] Seq=3819789687 Win=16384 Len=0 MSS=1460 SACK_PERM=1"
"7953","2009.692686","131.243.2.12","40.159.39.117","TCP","62","21  >  1350 [SYN, ACK] Seq=3146029596 Ack=3819789688 Win=64240 Len=0 SACK_PERM=1 MSS=1460"
"7956","2010.280261","131.243.2.12","40.159.39.117","FTP","137","Response: 220 <domain> FTP server (Version wu-2.6.2(1) Fri Nov 30 16:58:35 PST 2001) ready."
"7957","2010.459962","40.159.39.117","131.243.2.12","FTP","70","Request: USER anonymous"
"8238","2168.910161","79.37.53.67","203.174.5.11","TCP","62","38046  >  21 [SYN] Seq=2129590580 Win=16384 Len=0 MSS=1460 SACK_PERM=1"
"8353","2207.684514","0.52.194.105","131.243.1.10","TCP","62","3131  >  21 [SYN] Seq=2086921672 Win=64240 Len=0 MSS=1460 SACK_PERM=1"
"8354","2207.685281","131.243.1.10","0.52.194.105","TCP","58","21  >  3131 [SYN, ACK] Seq=105077798 Ack=2086921673 Win=17520 Len=0 MSS=1460"
"8356","2207.865160","131.243.1.10","0.52.194.105","FTP","60","Response: 220-"
"8386","2208.054095","0.52.194.105","131.243.1.10","FTP","70","Request: USER anonymous"
"8609","2364.750689","86.220.148.131","131.243.2.12","TCP","62","1126  >  21 [SYN] Seq=1090312 Win=8192 Len=0 MSS=536 SACK_PERM=1"
"8610","2364.750919","131.243.2.12","86.220.148.131","TCP","62","21  >  1126 [SYN, ACK] Seq=3215425898 Ack=1090313 Win=65392 Len=0 SACK_PERM=1 MSS=536"
"8614","2367.859796","131.243.2.12","86.220.148.131","FTP","137","Response: 220 <domain> FTP server (Version wu-2.6.2(1) Fri Nov 30 16:58:35 PST 2001) ready."
"8616","2368.380317","86.220.148.131","131.243.2.12","FTP","70","Request: USER anonymous"
"8674","2385.075381","42.46.167.1","131.243.1.10","TCP","58","55522  >  21 [SYN] Seq=3419305693 Win=16384 Len=0 MSS=512"
"8675","2385.075961","131.243.1.10","42.46.167.1","TCP","58","21  >  55522 [SYN, ACK] Seq=2611021729 Ack=3419305694 Win=16384 Len=0 MSS=1460"
"8677","2385.103451","131.243.1.10","42.46.167.1","FTP","60","Response: 220-"
"8699","2385.263284","42.46.167.1","131.243.1.10","FTP","70","Request: USER anonymous"
"8736","2389.717968","86.220.148.131","131.243.2.12","TCP","62","1131  >  21 [SYN] Seq=1115288 Win=8192 Len=0 MSS=536 SACK_PERM=1"
"8779","2403.439595","86.220.148.131","131.243.2.12","TCP","62","1133  >  21 [SYN] Seq=1129014 Win=8192 Len=0 MSS=536 SACK_PERM=1"
"8781","2404.384459","3.16.238.33","131.243.1.10","TCP","62","1999  >  21 [SYN] Seq=2862671309 Win=64240 Len=0 MSS=1452 SACK_PERM=1"
"8782","2404.385056","131.243.1.10","3.16.238.33","TCP","58","21  >  1999 [SYN, ACK] Seq=2190431019 Ack=2862671310 Win=17424 Len=0 MSS=1460"
"8786","2404.607915","131.243.1.10","3.16.238.33","FTP","60","Response: 220-"
"8816","2404.856801","3.16.238.33","131.243.1.10","FTP","70","Request: USER anonymous"
"8905","2413.350077","86.220.148.131","131.243.2.12","TCP","62","1135  >  21 [SYN] Seq=1138897 Win=8192 Len=0 MSS=536 SACK_PERM=1"
"8956","2434.948997","86.220.148.131","131.243.2.12","TCP","62","1138  >  21 [SYN] Seq=1160518 Win=8192 Len=0 MSS=536 SACK_PERM=1"
"8988","2440.821246","86.220.148.131","131.243.2.12","TCP","62","1142  >  21 [SYN] Seq=1166376 Win=8192 Len=0 MSS=536 SACK_PERM=1"
"9025","2448.593094","86.220.148.131","131.243.2.12","TCP","62","1144  >  21 [SYN] Seq=1174149 Win=8192 Len=0 MSS=536 SACK_PERM=1"
"9032","2449.805546","86.220.148.131","131.243.2.12","TCP","62","1145  >  21 [SYN] Seq=1175346 Win=8192 Len=0 MSS=536 SACK_PERM=1"
"9035","2450.195412","86.220.148.131","131.243.2.12","TCP","62","1146  >  21 [SYN] Seq=1175765 Win=8192 Len=0 MSS=536 SACK_PERM=1"
"9038","2450.435449","86.220.148.131","131.243.2.12","TCP","62","1147  >  21 [SYN] Seq=1175971 Win=8192 Len=0 MSS=536 SACK_PERM=1"
"9165","2479.935886","189.30.8.121","131.243.1.10","TCP","62","42968  >  21 [SYN] Seq=4093048810 Win=16384 Len=0 MSS=1460 SACK_PERM=1"
"9166","2479.936327","131.243.1.10","189.30.8.121","TCP","58","21  >  42968 [SYN, ACK] Seq=1337753613 Ack=4093048811 Win=17520 Len=0 MSS=1460"
"9168","2480.038746","131.243.1.10","189.30.8.121","FTP","60","Response: 220-"
"9198","2480.153312","189.30.8.121","131.243.1.10","FTP","70","Request: USER anonymous"
"9212","2480.524676","216.17.33.81","131.243.1.10","TCP","62","3277  >  21 [SYN] Seq=3448048119 Win=16384 Len=0 MSS=1460 SACK_PERM=1"
"9213","2480.525188","131.243.1.10","216.17.33.81","TCP","58","21  >  3277 [SYN, ACK] Seq=3065141178 Ack=3448048120 Win=17520 Len=0 MSS=1460"
"9220","2480.728559","131.243.1.10","216.17.33.81","FTP","60","Response: 220-"
"9252","2480.933090","216.17.33.81","131.243.1.10","FTP","70","Request: USER anonymous"
"9277","2482.433240","216.17.33.81","131.243.1.10","TCP","62","3279  >  21 [SYN] Seq=3448566602 Win=16384 Len=0 MSS=1460 SACK_PERM=1"
"9343","2484.459549","216.17.33.81","131.243.1.10","TCP","62","3281  >  21 [SYN] Seq=3449134337 Win=16384 Len=0 MSS=1460 SACK_PERM=1"
"9401","2486.380572","216.17.33.81","131.243.1.10","TCP","62","3283  >  21 [SYN] Seq=3449663539 Win=16384 Len=0 MSS=1460 SACK_PERM=1"
"9461","2490.339525","132.67.54.229","131.243.1.10","TCP","62","3856  >  21 [SYN] Seq=11120417 Win=8192 Len=0 MSS=1460 SACK_PERM=1"
"9462","2490.340204","131.243.1.10","132.67.54.229","TCP","58","21  >  3856 [SYN, ACK] Seq=3705950050 Ack=11120418 Win=17520 Len=0 MSS=1460"
"9467","2491.172802","131.243.1.10","132.67.54.229","FTP","60","Response: 220-"
"9497","2491.988324","132.67.54.229","131.243.1.10","FTP","70","Request: USER anonymous"
"9566","2510.018582","3.16.238.33","131.243.1.10","TCP","62","2146  >  21 [SYN] Seq=1852895550 Win=16384 Len=0 MSS=1452 SACK_PERM=1"
"9567","2510.019010","131.243.1.10","3.16.238.33","TCP","58","21  >  2146 [SYN, ACK] Seq=389900713 Ack=1852895551 Win=17424 Len=0 MSS=1460"
"9647","2512.911187","3.16.238.33","131.243.1.10","TCP","62","2148  >  21 [SYN] Seq=1853717327 Win=16384 Len=0 MSS=1452 SACK_PERM=1"
"9856","2549.061135","79.37.53.67","131.243.2.12","TCP","62","40638  >  21 [SYN] Seq=2351849352 Win=16384 Len=0 MSS=1460 SACK_PERM=1"
"9946","2579.320754","79.37.53.67","203.174.5.11","TCP","62","39776  >  21 [SYN] Seq=2369581459 Win=16384 Len=0 MSS=1460 SACK_PERM=1"
"9968","2596.960082","160.231.206.89","131.243.1.10","TCP","62","1586  >  21 [SYN] Seq=9411981 Win=8192 Len=0 MSS=1460 SACK_PERM=1"
"9969","2596.960604","131.243.1.10","160.231.206.89","TCP","58","21  >  1586 [SYN, ACK] Seq=22899296 Ack=9411982 Win=17520 Len=0 MSS=1460"
"9971","2597.195548","131.243.1.10","160.231.206.89","FTP","60","Response: 220-"
"10001","2597.634697","160.231.206.89","131.243.1.10","FTP","70","Request: USER anonymous"
"10024","2603.912450","159.216.169.116","128.3.12.44","TCP","74","32777  >  21 [SYN] Seq=3547649380 Win=5840 Len=0 MSS=1460 SACK_PERM=1 TSval=692870 TSecr=0 WS=1"
"10025","2603.913295","128.3.12.44","159.216.169.116","TCP","54","21  >  32777 [SYN, ACK] Seq=454016000 Ack=3547649381 Win=4096 Len=0"
"10027","2604.278656","128.3.12.44","159.216.169.116","FTP","136","Response: 220 <domain> FTP server (Version wu-2.6.2(1) Mon Dec 3 12:18:44 PST 2001) ready."
"10029","2604.551647","159.216.169.116","128.3.12.44","FTP","70","Request: USER anonymous"
"10080","2669.626899","132.67.54.229","131.243.1.10","TCP","62","3877  >  21 [SYN] Seq=11299839 Win=8192 Len=0 MSS=1460 SACK_PERM=1"
"10129","2678.698906","132.67.54.229","131.243.1.10","TCP","62","4053  >  21 [SYN] Seq=11308790 Win=8192 Len=0 MSS=1460 SACK_PERM=1"
"10130","2678.699382","131.243.1.10","132.67.54.229","TCP","58","21  >  4053 [SYN, ACK] Seq=146854299 Ack=11308791 Win=17520 Len=0 MSS=1460"
"10176","2685.405445","132.67.54.229","131.243.1.10","TCP","62","4115  >  21 [SYN] Seq=11315486 Win=8192 Len=0 MSS=1460 SACK_PERM=1"
"10177","2685.405900","131.243.1.10","132.67.54.229","TCP","58","21  >  4115 [SYN, ACK] Seq=4256104882 Ack=11315487 Win=17520 Len=0 MSS=1460"
"10246","2706.306839","154.153.143.71","131.243.1.10","TCP","74","56303  >  21 [SYN] Seq=3424969350 Win=5840 Len=0 MSS=1412 SACK_PERM=1 TSval=97575 TSecr=0 WS=1"
"10247","2706.307402","131.243.1.10","154.153.143.71","TCP","58","21  >  56303 [SYN, ACK] Seq=3023218313 Ack=3424969351 Win=16944 Len=0 MSS=1460"
"10249","2706.518066","131.243.1.10","154.153.143.71","FTP","60","Response: 220-"
"10279","2706.909748","154.153.143.71","131.243.1.10","FTP","70","Request: USER anonymous"
"10317","2737.042823","101.114.196.190","131.243.1.10","TCP","58","10063  >  21 [SYN] Seq=1119764053 Win=8192 Len=0 MSS=1460"
"10318","2737.043251","131.243.1.10","101.114.196.190","TCP","58","21  >  10063 [SYN, ACK] Seq=1500521062 Ack=1119764054 Win=17520 Len=0 MSS=1460"
"10320","2737.205762","131.243.1.10","101.114.196.190","FTP","60","Response: 220-"
"10350","2738.832216","101.114.196.190","131.243.1.10","FTP","70","Request: USER anonymous"
"10379","2782.154469","132.67.54.229","131.243.1.10","TCP","62","4139  >  21 [SYN] Seq=11412095 Win=8192 Len=0 MSS=1460 SACK_PERM=1"
"10444","2873.694787","42.46.167.1","128.3.12.44","TCP","58","55803  >  21 [SYN] Seq=3126035446 Win=16384 Len=0 MSS=512"
"10445","2873.695617","128.3.12.44","42.46.167.1","TCP","54","21  >  55803 [SYN, ACK] Seq=496512000 Ack=3126035447 Win=4096 Len=0"
"10447","2873.807269","128.3.12.44","42.46.167.1","FTP","136","Response: 220 <domain> FTP server (Version wu-2.6.2(1) Mon Dec 3 12:18:44 PST 2001) ready."
"10448","2873.826491","42.46.167.1","128.3.12.44","FTP","70","Request: USER anonymous"
"10474","2962.693499","79.37.53.67","131.243.2.12","TCP","62","37691  >  21 [SYN] Seq=2593182138 Win=16384 Len=0 MSS=1460 SACK_PERM=1"
"10531","2989.506449","79.37.53.67","203.174.5.11","TCP","62","40283  >  21 [SYN] Seq=2610320181 Win=16384 Len=0 MSS=1460 SACK_PERM=1"
"10651","3119.805860","101.114.196.190","131.243.1.10","TCP","58","10066  >  21 [SYN] Seq=1207434129 Win=8192 Len=0 MSS=1460"
"10703","3125.188159","182.6.9.175","128.3.32.63","TCP","74","33006  >  21 [SYN] Seq=4176052118 Win=5840 Len=0 MSS=1460 SACK_PERM=1 TSval=3662874 TSecr=0 WS=1"
"10704","3125.189262","128.3.32.63","182.6.9.175","TCP","74","21  >  33006 [SYN, ACK] Seq=4205066325 Ack=4176052119 Win=5792 Len=0 MSS=1460 SACK_PERM=1 TSval=1299998860 TSecr=3662874 WS=1"
"10709","3125.363955","128.3.32.63","182.6.9.175","FTP","120","Response: 220 <domain> FTP server (Version wu-2.6.1-20) ready."
"10711","3125.415129","182.6.9.175","128.3.32.63","FTP","82","Request: USER anonymous"
"10748","3163.985824","101.114.196.190","131.243.1.10","TCP","58","10068  >  21 [SYN] Seq=1217625083 Win=8192 Len=0 MSS=1460"
"10801","3178.971274","107.34.21.92","131.243.2.12","TCP","66","1099  >  21 [SYN] Seq=2345298682 Win=60352 Len=0 MSS=1460 WS=4 SACK_PERM=1"
"10802","3178.971577","131.243.2.12","107.34.21.92","TCP","66","21  >  1099 [SYN, ACK] Seq=3351252040 Ack=2345298683 Win=65535 Len=0 WS=2 SACK_PERM=1 MSS=1460"
"10804","3179.574460","131.243.2.12","107.34.21.92","FTP","137","Response: 220 <domain> FTP server (Version wu-2.6.2(1) Fri Nov 30 16:58:35 PST 2001) ready."
"10805","3179.761156","107.34.21.92","131.243.2.12","FTP","70","Request: USER anonymous"
"10864","3209.882810","84.68.192.198","131.243.1.10","TCP","74","1658  >  21 [SYN] Seq=159375807 Win=57344 Len=0 MSS=1380 WS=1 TSval=1184769085 TSecr=0"
"10865","3209.883391","131.243.1.10","84.68.192.198","TCP","58","21  >  1658 [SYN, ACK] Seq=3521078661 Ack=159375808 Win=16560 Len=0 MSS=1460"
"10867","3210.064265","131.243.1.10","84.68.192.198","FTP","60","Response: 220-"
"10897","3210.255797","84.68.192.198","131.243.1.10","FTP","70","Request: USER anonymous"
"10955","3213.727324","101.114.196.190","131.243.1.10","TCP","58","10070  >  21 [SYN] Seq=1229070799 Win=8192 Len=0 MSS=1460"
"11078","3248.856047","101.114.196.190","131.243.1.10","TCP","58","10072  >  21 [SYN] Seq=1237221347 Win=8192 Len=0 MSS=1460"
"11145","3254.844545","101.114.196.190","131.243.1.10","TCP","58","10074  >  21 [SYN] Seq=1238698633 Win=8192 Len=0 MSS=1460"
"11340","3334.276650","121.195.250.138","128.3.12.44","TCP","62","1368  >  21 [SYN] Seq=2973117409 Win=44032 Len=0 MSS=1452 SACK_PERM=1"
"11341","3334.277505","128.3.12.44","121.195.250.138","TCP","54","21  >  1368 [SYN, ACK] Seq=586688000 Ack=2973117410 Win=4096 Len=0"
"11343","3334.614949","128.3.12.44","121.195.250.138","FTP","136","Response: 220 <domain> FTP server (Version wu-2.6.2(1) Mon Dec 3 12:18:44 PST 2001) ready."
"11346","3334.853829","121.195.250.138","128.3.12.44","FTP","70","Request: USER anonymous"
"11365","3337.254876","121.195.250.138","128.3.12.44","TCP","62","1370  >  21 [SYN] Seq=2973971327 Win=44032 Len=0 MSS=1452 SACK_PERM=1"
"11421","3352.689597","79.37.53.67","131.243.2.12","TCP","62","38908  >  21 [SYN] Seq=2829157153 Win=16384 Len=0 MSS=1460 SACK_PERM=1"
"11458","3357.419410","121.195.250.138","128.3.12.44","TCP","62","1372  >  21 [SYN] Seq=2979071713 Win=44032 Len=0 MSS=1452 SACK_PERM=1"
"11559","3386.099052","35.73.33.202","131.243.1.10","TCP","74","1052  >  21 [SYN] Seq=304584139 Win=5840 Len=0 MSS=1460 SACK_PERM=1 TSval=978476 TSecr=0 WS=1"
"11560","3386.099669","131.243.1.10","35.73.33.202","TCP","58","21  >  1052 [SYN, ACK] Seq=3430874290 Ack=304584140 Win=17520 Len=0 MSS=1460"
"11562","3386.274388","131.243.1.10","35.73.33.202","FTP","60","Response: 220-"
"11592","3386.459368","35.73.33.202","131.243.1.10","FTP","70","Request: USER anonymous"
"11660","3406.222159","148.253.227.51","131.243.1.10","TCP","62","1059  >  21 [SYN] Seq=1472894 Win=8192 Len=0 MSS=536 SACK_PERM=1"
"11661","3406.222730","131.243.1.10","148.253.227.51","TCP","58","21  >  1059 [SYN, ACK] Seq=44675302 Ack=1472895 Win=16616 Len=0 MSS=1460"
"11668","3406.749135","131.243.1.10","148.253.227.51","FTP","60","Response: 220-"
"11708","3409.409557","148.253.227.51","131.243.1.10","FTP","70","Request: USER anonymous"
"11812","3432.822884","148.253.227.51","131.243.1.10","TCP","62","1061  >  21 [SYN] Seq=1499502 Win=8192 Len=0 MSS=536 SACK_PERM=1"
"11903","3449.126954","47.125.91.135","131.243.2.12","TCP","62","2255  >  21 [SYN] Seq=4066784043 Win=16384 Len=0 MSS=1460 SACK_PERM=1"
"11904","3449.127219","131.243.2.12","47.125.91.135","TCP","62","21  >  2255 [SYN, ACK] Seq=3404352924 Ack=4066784044 Win=64240 Len=0 SACK_PERM=1 MSS=1460"
"11906","3449.348821","131.243.2.12","47.125.91.135","FTP","137","Response: 220 <domain> FTP server (Version wu-2.6.2(1) Fri Nov 30 16:58:35 PST 2001) ready."
"11907","3449.531247","47.125.91.135","131.243.2.12","FTP","70","Request: USER anonymous"
"11914","3450.209775","24.190.46.234","131.243.1.10","TCP","58","64846  >  21 [SYN] Seq=3584156901 Win=8760 Len=0 MSS=1460"
"11915","3450.210221","131.243.1.10","24.190.46.234","TCP","58","21  >  64846 [SYN, ACK] Seq=3767176380 Ack=3584156902 Win=17520 Len=0 MSS=1460"
"11917","3450.240466","131.243.1.10","24.190.46.234","FTP","60","Response: 220-"
"11947","3450.287012","24.190.46.234","131.243.1.10","FTP","70","Request: USER anonymous"
"11984","3454.599180","35.73.33.202","131.243.1.10","TCP","74","1054  >  21 [SYN] Seq=373294933 Win=5840 Len=0 MSS=1460 SACK_PERM=1 TSval=985326 TSecr=0 WS=1"
"12068","3461.248612","216.43.247.103","131.243.1.10","TCP","74","53830  >  21 [SYN] Seq=232787550 Win=5840 Len=0 MSS=1460 SACK_PERM=1 TSval=1874847580 TSecr=0 WS=1"
"12069","3461.249132","131.243.1.10","216.43.247.103","TCP","58","21  >  53830 [SYN, ACK] Seq=1990657183 Ack=232787551 Win=17520 Len=0 MSS=1460"
"12073","3461.970674","131.243.1.10","216.43.247.103","FTP","60","Response: 220-"
"12103","3462.708170","216.43.247.103","131.243.1.10","FTP","70","Request: USER anonymous"
"12109","3463.417656","26.250.204.76","131.243.1.10","TCP","62","3205  >  21 [SYN] Seq=2771092683 Win=65535 Len=0 MSS=1360 SACK_PERM=1"
"12110","3463.418121","131.243.1.10","26.250.204.76","TCP","58","21  >  3205 [SYN, ACK] Seq=1185175049 Ack=2771092684 Win=17680 Len=0 MSS=1460"
"12115","3463.591958","131.243.1.10","26.250.204.76","FTP","60","Response: 220-"
"12145","3463.826888","26.250.204.76","131.243.1.10","FTP","70","Request: USER anonymous"
"12179","3465.266935","26.250.204.76","131.243.1.10","TCP","62","3207  >  21 [SYN] Seq=2771615365 Win=65535 Len=0 MSS=1360 SACK_PERM=1"
"12346","3514.697528","98.192.203.106","131.243.1.10","TCP","62","29027  >  21 [SYN] Seq=2827168482 Win=64240 Len=0 MSS=1400 SACK_PERM=1"
