"1","0.000000","142.164.6.70","131.243.1.10","TCP","62","1313  >  21 [SYN] Seq=1734984547 Win=8760 Len=0 MSS=1460 SACK_PERM=1"
"91","105.078090","73.6.91.115","131.243.2.12","TCP","62","2027  >  21 [SYN] Seq=4190971401 Win=16384 Len=0 MSS=1460 SACK_PERM=1"
"372","206.339715","131.243.1.10","142.164.6.70","TCP","54","21  >  1313 [FIN, ACK] Seq=1166105771 Ack=1734985256 Win=17520 Len=0"
"400","222.785014","82.143.24.12","131.243.2.12","TCP","62","3537  >  21 [SYN] Seq=2986625670 Win=16384 Len=0 MSS=1460 SACK_PERM=1"
"485","251.651531","79.37.53.67","131.243.2.12","TCP","62","35280  >  21 [SYN] Seq=4133316359 Win=16384 Len=0 MSS=1460 SACK_PERM=1"
"730","372.521806","67.243.63.146","131.243.1.10","TCP","62","1380  >  21 [SYN] Seq=3849101 Win=8192 Len=0 MSS=1460 SACK_PERM=1"
"801","380.893000","67.243.63.146","131.243.1.10","TCP","62","1383  >  21 [SYN] Seq=3857473 Win=8192 Len=0 MSS=1460 SACK_PERM=1"
"894","387.261854","131.243.1.10","67.243.63.146","TCP","54","21  >  1383 [FIN, ACK] Seq=2199040887 Ack=3857593 Win=17520 Len=0"
"895","387.263386","67.243.63.146","131.243.1.10","TCP","62","1385  >  21 [SYN] Seq=3863843 Win=8192 Len=0 MSS=1460 SACK_PERM=1"
"1060","403.788599","67.243.63.146","131.243.1.10","TCP","62","1388  >  21 [SYN] Seq=3880239 Win=8192 Len=0 MSS=1460 SACK_PERM=1"
"1152","414.570994","67.243.63.146","131.243.1.10","TCP","62","1390  >  21 [SYN] Seq=3891097 Win=8192 Len=0 MSS=1460 SACK_PERM=1"
"1343","499.134708","40.175.116.120","128.3.12.44","TCP","78","45958  >  21 [SYN] Seq=897728278 Win=16384 Len=0 MSS=1460 SACK_PERM=1 WS=1 TSval=959726359 TSecr=0"
"1377","500.813220","40.175.116.120","128.3.12.44","TCP","78","9337  >  21 [SYN] Seq=765006584 Win=16384 Len=0 MSS=1460 SACK_PERM=1 WS=1 TSval=959726362 TSecr=0"
"1629","646.122682","79.37.53.67","131.243.2.12","TCP","62","35478  >  21 [SYN] Seq=76300470 Win=16384 Len=0 MSS=1460 SACK_PERM=1"
"1762","690.823856","172.211.70.122","131.243.1.10","TCP","74","40037  >  21 [SYN] Seq=2645955037 Win=5840 Len=0 MSS=1460 TSval=317460990 TSecr=0 WS=2"
"1831","697.902054","245.22.38.204","203.174.5.11","TCP","62","3157  >  21 [SYN] Seq=1981005324 Win=64240 Len=0 MSS=1460 SACK_PERM=1"
"1913","709.050040","245.22.38.204","203.174.5.11","TCP","62","3160  >  21 [SYN] Seq=1983910078 Win=64240 Len=0 MSS=1460 SACK_PERM=1"
"1927","710.015808","203.174.5.11","245.22.38.204","TCP","54","21  >  3160 [FIN, ACK] Seq=1886016248 Ack=1983910129 Win=32768 Len=0"
"1928","710.017486","245.22.38.204","203.174.5.11","TCP","62","3161  >  21 [SYN] Seq=1984215697 Win=64240 Len=0 MSS=1460 SACK_PERM=1"
"1962","726.581151","131.243.1.10","172.211.70.122","TCP","54","21  >  40037 [FIN, ACK] Seq=3678261592 Ack=2645955292 Win=17520 Len=0"
"1966","778.278657","180.69.204.185","131.243.1.10","TCP","74","1494  >  21 [SYN] Seq=2848098330 Win=5840 Len=0 MSS=1460 SACK_PERM=1 TSval=1981421 TSecr=0 WS=1"
"2043","836.432440","89.42.124.234","203.174.5.11","TCP","62","1158  >  21 [SYN] Seq=3481078044 Win=64240 Len=0 MSS=1460 SACK_PERM=1"
"2118","903.173643","203.174.5.11","89.42.124.234","TCP","54","21  >  1158 [FIN, ACK] Seq=1887744759 Ack=3481078585 Win=32768 Len=0"
"2122","1086.228837","131.243.1.10","180.69.204.185","TCP","54","21  >  1494 [FIN, ACK] Seq=121949123 Ack=2848098432 Win=17520 Len=0"
"2125","1199.329314","230.23.2.245","131.243.1.10","TCP","74","35879  >  21 [SYN] Seq=3166086907 Win=5808 Len=0 MSS=1412 SACK_PERM=1 TSval=9278925 TSecr=0 WS=1"
"2161","1201.271073","207.82.132.32","131.243.193.93","TCP","74","65056  >  21 [SYN] Seq=3425332968 Win=5840 Len=0 MSS=1460 SACK_PERM=1 TSval=2653119 TSecr=0 WS=1"
"2228","1277.818288","131.243.1.10","230.23.2.245","TCP","54","21  >  35879 [FIN, ACK] Seq=4220401714 Ack=3166087011 Win=16944 Len=0"
"2230","1278.826262","230.23.2.245","131.243.1.10","TCP","74","35882  >  21 [SYN] Seq=3265665855 Win=5808 Len=0 MSS=1412 SACK_PERM=1 TSval=9286875 TSecr=0 WS=1"
"2291","1460.425664","79.37.53.67","131.243.2.12","TCP","62","33678  >  21 [SYN] Seq=554447160 Win=16384 Len=0 MSS=1460 SACK_PERM=1"
"2343","1483.409496","79.37.53.67","203.174.5.11","TCP","62","35384  >  21 [SYN] Seq=570789127 Win=16384 Len=0 MSS=1460 SACK_PERM=1"
"2386","1515.988167","203.174.5.11","79.37.53.67","TCP","54","21  >  35384 [FIN, ACK] Seq=1890560706 Ack=570789372 Win=32768 Len=0"
"2390","1575.626263","122.28.199.241","131.243.1.10","TCP","62","3136  >  21 [SYN] Seq=2969649892 Win=8760 Len=0 MSS=1460 SACK_PERM=1"
"2450","1618.779005","131.243.1.10","122.28.199.241","TCP","54","21  >  3136 [FIN, ACK] Seq=2267539833 Ack=2969649983 Win=17520 Len=0"
"2454","1636.270161","131.243.193.93","207.82.132.32","TCP","66","21  >  65056 [FIN, ACK] Seq=3180837652 Ack=3425333222 Win=5792 Len=0 TSval=885068944 TSecr=2696626"
"2458","1640.060675","122.28.199.241","131.243.1.10","TCP","62","3141  >  21 [SYN] Seq=2984625720 Win=8760 Len=0 MSS=1460 SACK_PERM=1"
"2517","1702.802170","104.205.27.72","128.3.28.48","TCP","74","42009  >  21 [SYN] Seq=3905625284 Win=5840 Len=0 MSS=1460 SACK_PERM=1 TSval=202397446 TSecr=0 WS=1"
"2544","1704.373912","128.3.28.48","104.205.27.72","TCP","66","21  >  42009 [FIN, ACK] Seq=1311479077 Ack=3905625385 Win=5792 Len=0 TSval=2207763812 TSecr=202398249"
"2545","1704.377159","104.205.27.72","128.3.28.48","TCP","74","42011  >  21 [SYN] Seq=3895910579 Win=5840 Len=0 MSS=1460 SACK_PERM=1 TSval=202398252 TSecr=0 WS=1"
"2575","1705.894065","104.205.27.72","128.3.28.48","TCP","74","42013  >  21 [SYN] Seq=3898211108 Win=5840 Len=0 MSS=1460 SACK_PERM=1 TSval=202399030 TSecr=0 WS=1"
"2607","1792.402291","4.251.189.14","131.243.1.10","TCP","74","46315  >  21 [SYN] Seq=3795674049 Win=5840 Len=0 MSS=1460 SACK_PERM=1 TSval=24626074 TSecr=0 WS=1"
"2674","1794.867902","131.243.1.10","4.251.189.14","TCP","54","21  >  46315 [FIN, ACK] Seq=3739856455 Ack=3795674167 Win=17520 Len=0"
"2678","1814.810246","148.111.20.136","131.243.1.10","TCP","74","43567  >  21 [SYN] Seq=3822039560 Win=5840 Len=0 MSS=1460 SACK_PERM=1 TSval=74020629 TSecr=0 WS=1"
"2745","1818.894256","131.243.1.10","148.111.20.136","TCP","54","21  >  43567 [FIN, ACK] Seq=2404755189 Ack=3822039679 Win=17520 Len=0"
"2749","1836.494959","79.37.53.67","131.243.2.12","TCP","62","34370  >  21 [SYN] Seq=786768831 Win=16384 Len=0 MSS=1460 SACK_PERM=1"
"2803","1874.840447","24.239.126.222","131.243.1.10","TCP","74","57740  >  21 [SYN] Seq=1079805767 Win=32768 Len=0 MSS=1460 WS=1 TSval=3497007375 TSecr=0"
"2867","1898.205790","249.44.109.25","128.3.28.48","TCP","74","2932  >  21 [SYN] Seq=3899323806 Win=5840 Len=0 MSS=1460 SACK_PERM=1 TSval=134926338 TSecr=0 WS=1"
"2891","1899.600578","128.3.28.48","249.44.109.25","TCP","66","21  >  2932 [FIN, ACK] Seq=1520225624 Ack=3899323907 Win=5792 Len=0 TSval=2207783333 TSecr=134926477"
"2892","1899.629686","249.44.109.25","128.3.28.48","TCP","74","2998  >  21 [SYN] Seq=3894539380 Win=5840 Len=0 MSS=1460 SACK_PERM=1 TSval=134926478 TSecr=0 WS=1"
"2921","1902.923761","249.44.109.25","128.3.28.48","TCP","74","3071  >  21 [SYN] Seq=3906347298 Win=5840 Len=0 MSS=1460 SACK_PERM=1 TSval=134926808 TSecr=0 WS=1"
"2945","1907.858567","128.3.28.48","249.44.109.25","TCP","66","21  >  3071 [FIN, ACK] Seq=1529416767 Ack=3906347398 Win=5792 Len=0 TSval=2207784159 TSecr=134927303"
"2948","2182.202389","62.87.148.206","131.243.1.10","TCP","62","20553  >  21 [SYN] Seq=1533753869 Win=16384 Len=0 MSS=1460 SACK_PERM=1"
"3005","2185.036457","131.243.1.10","24.239.126.222","TCP","54","21  >  57740 [FIN, ACK] Seq=775093863 Ack=1079805946 Win=17520 Len=0"
"3100","2230.018341","79.37.53.67","131.243.2.12","TCP","62","34855  >  21 [SYN] Seq=1024150713 Win=16384 Len=0 MSS=1460 SACK_PERM=1"
"3147","2342.012401","168.29.177.209","131.243.1.10","TCP","58","4616  >  21 [SYN] Seq=425406182 Win=4096 Len=0 MSS=1460"
"3187","2398.835045","127.115.69.174","131.243.1.10","TCP","74","54196  >  21 [SYN] Seq=134031576 Win=5840 Len=0 MSS=1460 TSval=306876388 TSecr=0 WS=1"
"3245","2399.652081","131.243.1.10","127.115.69.174","TCP","54","21  >  54196 [FIN, ACK] Seq=2251082560 Ack=134031665 Win=17520 Len=0"
"3247","2414.426999","82.143.24.12","131.243.2.12","TCP","62","2433  >  21 [SYN] Seq=3813955091 Win=16384 Len=0 MSS=1460 SACK_PERM=1"
"3274","2427.837515","209.75.218.182","131.243.1.10","TCP","74","33006  >  21 [SYN] Seq=566720768 Win=5840 Len=0 MSS=1460 SACK_PERM=1 TSval=229667 TSecr=0 WS=1"
"3332","2430.784121","131.243.1.10","209.75.218.182","TCP","54","21  >  33006 [FIN, ACK] Seq=853243475 Ack=566720828 Win=17520 Len=0"
"3375","2456.757825","84.68.192.198","131.243.1.10","TCP","74","1184  >  21 [SYN] Seq=2442447545 Win=57344 Len=0 MSS=1380 WS=1 TSval=1158759429 TSecr=0"
"3444","2459.785742","131.243.1.10","84.68.192.198","TCP","54","21  >  1184 [FIN, ACK] Seq=3034705117 Ack=2442447633 Win=16560 Len=0"
"3482","2484.721536","131.243.1.10","62.87.148.206","TCP","54","21  >  20553 [FIN, ACK] Seq=757797815 Ack=1533754544 Win=17520 Len=0"
"3484","2610.326519","53.55.176.50","131.243.1.10","TCP","62","10011  >  21 [SYN] Seq=17309033 Win=65535 Len=0 MSS=1460 SACK_PERM=1"
"3666","2639.201808","79.37.53.67","131.243.2.12","TCP","62","35391  >  21 [SYN] Seq=1264725096 Win=16384 Len=0 MSS=1460 SACK_PERM=1"
"3670","2639.302679","131.243.1.10","53.55.176.50","TCP","54","21  >  10011 [FIN, ACK] Seq=205596764 Ack=17309395 Win=17520 Len=0"
"3693","2642.774192","131.243.1.10","168.29.177.209","TCP","54","21  >  4616 [FIN, ACK] Seq=1579772673 Ack=425406216 Win=17520 Len=0"
"3713","2648.311975","246.94.203.142","203.174.5.11","TCP","62","1070  >  21 [SYN] Seq=3346926217 Win=16384 Len=0 MSS=1460 SACK_PERM=1"
"3770","2660.701403","79.37.53.67","203.174.5.11","TCP","62","34674  >  21 [SYN] Seq=1280435387 Win=16384 Len=0 MSS=1460 SACK_PERM=1"
"3853","2673.711966","203.174.5.11","79.37.53.67","TCP","54","21  >  34674 [FIN, ACK] Seq=1903872898 Ack=1280435789 Win=32768 Len=0"
"3913","2708.446505","216.43.247.103","131.243.1.10","TCP","74","42534  >  21 [SYN] Seq=469423174 Win=5840 Len=0 MSS=1460 SACK_PERM=1 TSval=1848837730 TSecr=0 WS=1"
"3986","2716.650369","53.55.176.50","131.243.1.10","TCP","62","10137  >  21 [SYN] Seq=17415392 Win=65535 Len=0 MSS=1460 SACK_PERM=1"
"4037","2718.373443","53.55.176.50","131.243.1.10","TCP","62","10138  >  21 [SYN] Seq=17417107 Win=65535 Len=0 MSS=1460 SACK_PERM=1"
"4108","2723.001503","131.243.1.10","216.43.247.103","TCP","54","21  >  42534 [FIN, ACK] Seq=766400988 Ack=469423293 Win=17520 Len=0"
"4208","2787.989658","53.55.176.50","131.243.1.10","TCP","62","10252  >  21 [SYN] Seq=17486728 Win=65535 Len=0 MSS=1460 SACK_PERM=1"
"4309","2819.521994","53.55.176.50","131.243.1.10","TCP","62","10059  >  21 [SYN] Seq=17518269 Win=65535 Len=0 MSS=1460 SACK_PERM=1"
"4518","2842.735522","53.55.176.50","131.243.1.10","TCP","62","10088  >  21 [SYN] Seq=17541490 Win=65535 Len=0 MSS=1460 SACK_PERM=1"
"4604","2847.820810","53.55.176.50","131.243.1.10","TCP","62","10122  >  21 [SYN] Seq=17546574 Win=65535 Len=0 MSS=1460 SACK_PERM=1"
"5146","3028.111005","79.37.53.67","131.243.2.12","TCP","62","35347  >  21 [SYN] Seq=1499928225 Win=16384 Len=0 MSS=1460 SACK_PERM=1"
"5249","3057.855305","79.37.53.67","203.174.5.11","TCP","62","34884  >  21 [SYN] Seq=1517170633 Win=16384 Len=0 MSS=1460 SACK_PERM=1"
"5256","3059.310300","24.83.76.105","131.243.1.10","TCP","62","1978  >  21 [SYN] Seq=2120492376 Win=16384 Len=0 MSS=1460"
"5342","3066.257146","24.83.76.105","131.243.1.10","TCP","62","2002  >  21 [SYN] Seq=2122428187 Win=16384 Len=0 MSS=1460"
"5344","3066.268346","24.83.76.105","131.243.1.10","TCP","62","2003  >  21 [SYN] Seq=2122461556 Win=16384 Len=0 MSS=1460"
"5346","3066.273200","24.83.76.105","131.243.1.10","TCP","62","2004  >  21 [SYN] Seq=2122526404 Win=16384 Len=0 MSS=1460"
"5557","3079.193495","131.243.1.10","24.83.76.105","TCP","54","21  >  1978 [FIN, ACK] Seq=2478889592 Ack=2120492507 Win=17520 Len=0"
"5567","3082.070664","131.243.1.10","24.83.76.105","TCP","54","21  >  2004 [FIN, ACK] Seq=3699204811 Ack=2122526491 Win=17520 Len=0"
"5596","3096.403234","49.143.255.248","131.243.1.10","TCP","62","17772  >  21 [SYN] Seq=409164775 Win=64240 Len=0 MSS=1460 SACK_PERM=1"
"5669","3102.584417","53.55.176.50","131.243.1.10","TCP","62","10224  >  21 [SYN] Seq=17801402 Win=65535 Len=0 MSS=1460 SACK_PERM=1"
"5741","3109.608563","53.55.176.50","131.243.1.10","TCP","62","10227  >  21 [SYN] Seq=17808433 Win=65535 Len=0 MSS=1460 SACK_PERM=1"
"5863","3149.661430","82.143.24.12","131.243.2.12","TCP","62","1628  >  21 [SYN] Seq=4097445591 Win=16384 Len=0 MSS=1460 SACK_PERM=1"
"5998","3192.129150","157.198.151.233","131.243.1.10","TCP","74","3519  >  21 [SYN] Seq=1131138061 Win=32120 Len=0 MSS=1460 SACK_PERM=1 TSval=41054097 TSecr=0 WS=1"
"6097","3213.362019","213.30.184.86","131.243.1.10","TCP","62","53045  >  21 [SYN] Seq=1117365431 Win=64240 Len=0 MSS=1460 SACK_PERM=1"
"6168","3219.598654","131.243.1.10","213.30.184.86","TCP","54","21  >  53045 [FIN, ACK] Seq=3002530312 Ack=1117365547 Win=17520 Len=0"
"6227","3252.754527","203.174.5.11","246.94.203.142","TCP","54","21  >  1070 [FIN, ACK] Seq=1903432848 Ack=3346934002 Win=32768 Len=0"
"6232","3277.576065","24.83.76.105","131.243.1.10","TCP","62","2076  >  21 [SYN] Seq=2178416908 Win=16384 Len=0 MSS=1460"
"6294","3309.310991","114.201.61.120","131.243.1.10","TCP","62","1236  >  21 [SYN] Seq=3504166 Win=8192 Len=0 MSS=536 SACK_PERM=1"
"6350","3329.816154","114.201.61.120","131.243.1.10","TCP","62","1237  >  21 [SYN] Seq=3524690 Win=8192 Len=0 MSS=536 SACK_PERM=1"
"6382","3335.006148","131.243.1.10","114.201.61.120","TCP","54","21  >  1237 [FIN, ACK] Seq=463896992 Ack=3524692 Win=16616 Len=0"
"6383","3335.017620","114.201.61.120","131.243.1.10","TCP","62","1241  >  21 [SYN] Seq=3529639 Win=8192 Len=0 MSS=536 SACK_PERM=1"
"6445","3377.894548","131.243.1.10","157.198.151.233","TCP","54","21  >  3519 [FIN, ACK] Seq=159112962 Ack=1131138150 Win=17520 Len=0"
"6448","3400.026456","131.243.1.10","49.143.255.248","TCP","54","21  >  17772 [FIN, ACK] Seq=834895921 Ack=409164909 Win=17520 Len=0"
"6451","3401.537652","114.201.61.120","131.243.1.10","TCP","62","1244  >  21 [SYN] Seq=3596389 Win=8192 Len=0 MSS=536 SACK_PERM=1"
"6475","3404.287337","114.201.61.120","131.243.1.10","TCP","62","1246  >  21 [SYN] Seq=3599161 Win=8192 Len=0 MSS=536 SACK_PERM=1"
"6559","3442.425598","79.37.53.67","131.243.2.12","TCP","62","34161  >  21 [SYN] Seq=1740753286 Win=16384 Len=0 MSS=1460 SACK_PERM=1"
"6616","3471.185977","79.37.53.67","203.174.5.11","TCP","62","34881  >  21 [SYN] Seq=1758244589 Win=16384 Len=0 MSS=1460 SACK_PERM=1"
"6671","3504.393643","66.224.210.96","131.243.1.10","TCP","74","64460  >  21 [SYN] Seq=1319903559 Win=5840 Len=0 MSS=1460 SACK_PERM=1 TSval=1744052 TSecr=0 WS=1"
"6729","3505.186370","131.243.1.10","66.224.210.96","TCP","54","21  >  64460 [FIN, ACK] Seq=3825329876 Ack=1319903651 Win=17520 Len=0"
"6730","3505.221394","66.224.210.96","131.243.1.10","TCP","74","65272  >  21 [SYN] Seq=1311106256 Win=5840 Len=0 MSS=1460 SACK_PERM=1 TSval=1744135 TSecr=0 WS=1"
"6792","3508.904623","131.243.1.10","66.224.210.96","TCP","54","21  >  65272 [FIN, ACK] Seq=1282878180 Ack=1311106347 Win=17520 Len=0"
"6794","3616.817813","24.190.46.234","131.243.1.10","TCP","58","36078  >  21 [SYN] Seq=2853901118 Win=8760 Len=0 MSS=1460"
"6847","3617.276533","131.243.1.10","24.190.46.234","TCP","54","21  >  36078 [FIN, ACK] Seq=4234012795 Ack=2853901194 Win=17520 Len=0"
"6849","3828.700636","79.37.53.67","131.243.2.12","TCP","62","36242  >  21 [SYN] Seq=1975234601 Win=16384 Len=0 MSS=1460 SACK_PERM=1"
"6925","3844.943127","198.132.228.204","128.3.28.48","TCP","62","4218  >  21 [SYN] Seq=3898299642 Win=16384 Len=0 MSS=1460 SACK_PERM=1"
"6947","3889.352766","128.3.28.48","198.132.228.204","TCP","54","21  >  4218 [FIN, ACK] Seq=3565635723 Ack=3898299835 Win=5840 Len=0"
"6950","3890.405639","198.132.228.204","128.3.28.48","TCP","62","4232  >  21 [SYN] Seq=3910284559 Win=16384 Len=0 MSS=1460 SACK_PERM=1"
"6975","3951.118288","198.132.228.204","128.3.28.48","TCP","62","4253  >  21 [SYN] Seq=3926065250 Win=16384 Len=0 MSS=1460 SACK_PERM=1"
"6994","4116.951094","169.92.87.70","203.174.5.11","TCP","62","2722  >  21 [SYN] Seq=899654746 Win=16384 Len=0 MSS=1460 SACK_PERM=1"
"7156","4204.351248","79.37.53.67","131.243.2.12","TCP","62","32918  >  21 [SYN] Seq=2207732126 Win=16384 Len=0 MSS=1460 SACK_PERM=1"
"7247","4224.687674","79.37.53.67","203.174.5.11","TCP","62","32149  >  21 [SYN] Seq=2223540247 Win=16384 Len=0 MSS=1460 SACK_PERM=1"
"7322","4237.742821","203.174.5.11","79.37.53.67","TCP","54","21  >  32149 [FIN, ACK] Seq=1931136760 Ack=2223540536 Win=32768 Len=0"
"7409","4284.382111","198.132.228.204","128.3.28.48","TCP","62","4348  >  21 [SYN] Seq=4012548799 Win=16384 Len=0 MSS=1460 SACK_PERM=1"
"7530","4349.026321","128.3.28.48","198.132.228.204","TCP","54","21  >  4348 [FIN, ACK] Seq=4028598314 Ack=4012548986 Win=5840 Len=0"
"7533","4350.421172","198.132.228.204","128.3.28.48","TCP","62","4369  >  21 [SYN] Seq=4029663237 Win=16384 Len=0 MSS=1460 SACK_PERM=1"
"7636","4401.873731","157.231.148.18","131.243.2.12","TCP","62","1678  >  21 [SYN] Seq=2738632225 Win=16384 Len=0 MSS=1460 SACK_PERM=1"
"8702","4530.132954","198.132.228.204","128.3.28.48","TCP","62","4422  >  21 [SYN] Seq=4076406588 Win=16384 Len=0 MSS=1460 SACK_PERM=1"
"8779","4538.515883","107.34.21.92","131.243.2.12","TCP","62","4303  >  21 [SYN] Seq=2507109066 Win=16384 Len=0 MSS=1460 SACK_PERM=1"
"8876","4549.617306","62.87.148.206","131.243.1.10","TCP","62","54275  >  21 [SYN] Seq=2128362562 Win=16384 Len=0 MSS=1460 SACK_PERM=1"
"9376","4580.829519","128.3.28.48","198.132.228.204","TCP","54","21  >  4422 [FIN, ACK] Seq=4291928277 Ack=4076406777 Win=5840 Len=0"
"9392","4582.124138","198.132.228.204","128.3.28.48","TCP","62","4437  >  21 [SYN] Seq=4089852842 Win=16384 Len=0 MSS=1460 SACK_PERM=1"
"9549","4598.656783","79.37.53.67","131.243.2.12","TCP","62","36123  >  21 [SYN] Seq=2445074661 Win=16384 Len=0 MSS=1460 SACK_PERM=1"
"9832","4619.391378","79.37.53.67","203.174.5.11","TCP","62","35622  >  21 [SYN] Seq=2460906480 Win=16384 Len=0 MSS=1460 SACK_PERM=1"
"9983","4628.569005","198.132.228.204","128.3.28.48","TCP","62","4454  >  21 [SYN] Seq=4101987745 Win=16384 Len=0 MSS=1460 SACK_PERM=1"
"10663","4693.727289","198.132.228.204","128.3.28.48","TCP","62","4472  >  21 [SYN] Seq=4118878897 Win=16384 Len=0 MSS=1460 SACK_PERM=1"
"10953","4721.363286","203.174.5.11","169.92.87.70","TCP","54","21  >  2722 [FIN, ACK] Seq=1927241914 Ack=899663298 Win=32768 Len=0"
"11176","4745.233298","198.132.228.204","128.3.28.48","TCP","62","4489  >  21 [SYN] Seq=4132269490 Win=16384 Len=0 MSS=1460 SACK_PERM=1"
"11626","4791.808463","198.132.228.204","128.3.28.48","TCP","62","4507  >  21 [SYN] Seq=4144480647 Win=16384 Len=0 MSS=1460 SACK_PERM=1"
"12118","4848.968773","128.3.28.48","198.132.228.204","TCP","54","21  >  4507 [FIN, ACK] Seq=278575369 Ack=4144480836 Win=5840 Len=0"
"12126","4849.778471","198.132.228.204","128.3.28.48","TCP","62","4525  >  21 [SYN] Seq=4159809962 Win=16384 Len=0 MSS=1460 SACK_PERM=1"
"12144","4851.342717","83.27.116.42","131.243.1.10","TCP","62","34142  >  21 [SYN] Seq=3065272175 Win=64240 Len=0 MSS=1460 SACK_PERM=1"
"12150","4851.450415","131.243.1.10","62.87.148.206","TCP","54","21  >  54275 [FIN, ACK] Seq=268651705 Ack=2128363237 Win=17520 Len=0"
"12285","4861.311072","131.243.1.10","83.27.116.42","TCP","54","21  >  34142 [FIN, ACK] Seq=682239904 Ack=3065272290 Win=17520 Len=0"
"12613","4897.092574","198.132.228.204","128.3.28.48","TCP","62","4542  >  21 [SYN] Seq=4172129352 Win=16384 Len=0 MSS=1460 SACK_PERM=1"
"13023","4944.342566","198.132.228.204","128.3.28.48","TCP","62","4556  >  21 [SYN] Seq=4184427903 Win=16384 Len=0 MSS=1460 SACK_PERM=1"
"13353","4984.733266","79.37.53.67","131.243.2.12","TCP","62","34734  >  21 [SYN] Seq=2679727952 Win=16384 Len=0 MSS=1460 SACK_PERM=1"
"13549","5002.359996","198.132.228.204","128.3.28.48","TCP","62","4576  >  21 [SYN] Seq=4199567222 Win=16384 Len=0 MSS=1460 SACK_PERM=1"
"13582","5007.168338","79.37.53.67","203.174.5.11","TCP","62","34960  >  21 [SYN] Seq=2695510318 Win=16384 Len=0 MSS=1460 SACK_PERM=1"
"13747","5063.649256","198.132.228.204","128.3.28.48","TCP","62","4594  >  21 [SYN] Seq=4215520590 Win=16384 Len=0 MSS=1460 SACK_PERM=1"
"13844","5112.296410","198.132.228.204","128.3.28.48","TCP","62","4612  >  21 [SYN] Seq=4228120297 Win=16384 Len=0 MSS=1460 SACK_PERM=1"
"13934","5156.226057","128.3.28.48","198.132.228.204","TCP","54","21  >  4612 [FIN, ACK] Seq=615344418 Ack=4228120512 Win=5840 Len=0"
"13940","5156.993451","198.132.228.204","128.3.28.48","TCP","62","4626  >  21 [SYN] Seq=4239995086 Win=16384 Len=0 MSS=1460 SACK_PERM=1"
"14095","5247.501404","255.143.100.71","131.243.1.10","TCP","62","2517  >  21 [SYN] Seq=3794639057 Win=64240 Len=0 MSS=1460 SACK_PERM=1"
"14178","5262.699430","198.132.228.204","128.3.28.48","TCP","62","4658  >  21 [SYN] Seq=4267322113 Win=16384 Len=0 MSS=1460 SACK_PERM=1"
"14183","5263.958543","255.143.100.71","131.243.1.10","TCP","62","2519  >  21 [SYN] Seq=3798838073 Win=64240 Len=0 MSS=1460 SACK_PERM=1"
"14316","5301.532354","131.243.1.10","255.143.100.71","TCP","54","21  >  2517 [FIN, ACK] Seq=1595105079 Ack=3794639162 Win=17520 Len=0"
"14336","5307.396264","198.132.228.204","128.3.28.48","TCP","62","4675  >  21 [SYN] Seq=4278983262 Win=16384 Len=0 MSS=1460 SACK_PERM=1"
"14433","5355.091307","198.132.228.204","128.3.28.48","TCP","62","4690  >  21 [SYN] Seq=4291365193 Win=16384 Len=0 MSS=1460 SACK_PERM=1"
"14453","5366.019371","177.81.214.10","203.174.5.11","TCP","74","1249  >  21 [SYN] Seq=3263617581 Win=32568 Len=0 MSS=472 SACK_PERM=1 TSval=111777887 TSecr=0 WS=1"
"14483","5371.661381","203.174.5.11","177.81.214.10","TCP","54","21  >  1249 [FIN, ACK] Seq=1950656339 Ack=3263617641 Win=32768 Len=0"
"14495","5378.008254","116.177.87.124","131.243.1.10","TCP","74","3150  >  21 [SYN] Seq=3279849938 Win=32120 Len=0 MSS=1460 SACK_PERM=1 TSval=124561754 TSecr=0 WS=1"
"14567","5380.630411","131.243.1.10","116.177.87.124","TCP","54","21  >  3150 [FIN, ACK] Seq=730003459 Ack=3279850068 Win=17520 Len=0"
"14571","5381.020838","79.37.53.67","131.243.2.12","TCP","62","34788  >  21 [SYN] Seq=2917251873 Win=16384 Len=0 MSS=1460 SACK_PERM=1"
"14627","5390.585196","177.81.214.10","203.174.5.11","TCP","74","1252  >  21 [SYN] Seq=3299391499 Win=32568 Len=0 MSS=472 SACK_PERM=1 TSval=111780346 TSecr=0 WS=1"
"14687","5400.306989","198.132.228.204","128.3.28.48","TCP","62","4709  >  21 [SYN] Seq=8301707 Win=16384 Len=0 MSS=1460 SACK_PERM=1"
"14700","5406.880544","79.37.53.67","203.174.5.11","TCP","62","33817  >  21 [SYN] Seq=2934395293 Win=16384 Len=0 MSS=1460 SACK_PERM=1"
"14772","5414.554240","177.81.214.10","203.174.5.11","TCP","74","1261  >  21 [SYN] Seq=3322661635 Win=32568 Len=0 MSS=472 SACK_PERM=1 TSval=111782743 TSecr=0 WS=1"
"14830","5419.540110","203.174.5.11","79.37.53.67","TCP","54","21  >  33817 [FIN, ACK] Seq=1951041138 Ack=2934395890 Win=32768 Len=0"
"14839","5422.987213","38.5.158.54","131.243.2.12","TCP","62","2520  >  21 [SYN] Seq=2167604509 Win=16384 Len=0 MSS=1460 SACK_PERM=1"
"14899","5439.179780","177.81.214.10","203.174.5.11","TCP","74","1265  >  21 [SYN] Seq=3349038134 Win=32568 Len=0 MSS=472 SACK_PERM=1 TSval=111785206 TSecr=0 WS=1"
"14958","5448.553168","128.3.28.48","198.132.228.204","TCP","54","21  >  4709 [FIN, ACK] Seq=920195330 Ack=8301890 Win=5840 Len=0"
"14959","5449.595052","198.132.228.204","128.3.28.48","TCP","62","4724  >  21 [SYN] Seq=21209077 Win=16384 Len=0 MSS=1460 SACK_PERM=1"
"15015","5472.961162","177.81.214.10","203.174.5.11","TCP","74","1267  >  21 [SYN] Seq=3376511373 Win=32568 Len=0 MSS=472 SACK_PERM=1 TSval=111788587 TSecr=0 WS=1"
"15157","5517.072413","83.27.116.42","131.243.1.10","TCP","62","34474  >  21 [SYN] Seq=3229779826 Win=64240 Len=0 MSS=1460 SACK_PERM=1"
"15258","5537.420617","12.47.80.49","131.243.1.10","TCP","74","2074  >  21 [SYN] Seq=1799203319 Win=5840 Len=0 MSS=1460 SACK_PERM=1 TSval=986718068 TSecr=0 WS=1"
"15357","5550.200424","131.243.1.10","12.47.80.49","TCP","54","21  >  2074 [FIN, ACK] Seq=569546550 Ack=1799203436 Win=17520 Len=0"
"15450","5592.762716","83.27.116.42","131.243.1.10","TCP","62","34505  >  21 [SYN] Seq=3248263161 Win=64240 Len=0 MSS=1460 SACK_PERM=1"
"15525","5600.264742","198.132.228.204","128.3.28.48","TCP","62","4769  >  21 [SYN] Seq=60210681 Win=16384 Len=0 MSS=1460 SACK_PERM=1"
"15536","5602.819449","177.81.214.10","203.174.5.11","TCP","74","1317  >  21 [SYN] Seq=3500589179 Win=32568 Len=0 MSS=472 SACK_PERM=1 TSval=111801578 TSecr=0 WS=1"
"15561","5604.996400","203.174.5.11","177.81.214.10","TCP","54","21  >  1317 [FIN, ACK] Seq=1952512368 Ack=3500589255 Win=32768 Len=0"
"15573","5607.814488","177.81.214.10","203.174.5.11","TCP","74","1319  >  21 [SYN] Seq=3516679302 Win=32568 Len=0 MSS=472 SACK_PERM=1 TSval=111802078 TSecr=0 WS=1"
"15763","5678.323529","82.143.24.12","131.243.2.12","TCP","62","5202  >  21 [SYN] Seq=765372577 Win=16384 Len=0 MSS=1460 SACK_PERM=1"
"16032","5769.897202","79.37.53.67","131.243.2.12","TCP","62","34972  >  21 [SYN] Seq=3153131773 Win=16384 Len=0 MSS=1460 SACK_PERM=1"
"16098","5791.688982","79.37.53.67","203.174.5.11","TCP","62","35950  >  21 [SYN] Seq=3169296996 Win=16384 Len=0 MSS=1460 SACK_PERM=1"
"16323","6070.284673","97.0.158.29","131.243.1.10","TCP","74","47802  >  21 [SYN] Seq=4013815541 Win=5840 Len=0 MSS=1460 SACK_PERM=1 TSval=433865417 TSecr=0 WS=1"
"16383","6071.429353","131.243.1.10","97.0.158.29","TCP","54","21  >  47802 [FIN, ACK] Seq=1996979348 Ack=4013815607 Win=17520 Len=0"
"16390","6072.728764","198.132.228.204","128.3.28.48","TCP","62","4924  >  21 [SYN] Seq=182922300 Win=16384 Len=0 MSS=1460 SACK_PERM=1"
"16412","6124.382271","128.3.28.48","198.132.228.204","TCP","54","21  >  4924 [FIN, ACK] Seq=1623919388 Ack=182922483 Win=5840 Len=0"
"16413","6125.365854","198.132.228.204","128.3.28.48","TCP","62","4945  >  21 [SYN] Seq=196549314 Win=16384 Len=0 MSS=1460 SACK_PERM=1"
"16418","6147.605217","79.37.53.67","131.243.2.12","TCP","62","33038  >  21 [SYN] Seq=3386397756 Win=16384 Len=0 MSS=1460 SACK_PERM=1"
"16493","6176.378088","79.37.53.67","203.174.5.11","TCP","62","35659  >  21 [SYN] Seq=3403515769 Win=16384 Len=0 MSS=1460 SACK_PERM=1"
"16600","6195.137610","198.132.228.204","128.3.28.48","TCP","62","4970  >  21 [SYN] Seq=214794575 Win=16384 Len=0 MSS=1460 SACK_PERM=1"
"16622","6253.894571","107.34.21.92","131.243.2.12","TCP","62","2931  >  21 [SYN] Seq=2938834729 Win=16384 Len=0 MSS=1460 SACK_PERM=1"
"16639","6255.715354","198.132.228.204","128.3.28.48","TCP","62","4993  >  21 [SYN] Seq=230459368 Win=16384 Len=0 MSS=1460 SACK_PERM=1"
"16787","6335.748792","198.132.228.204","128.3.28.48","TCP","62","3021  >  21 [SYN] Seq=251472240 Win=16384 Len=0 MSS=1460 SACK_PERM=1"
"16890","6385.508173","128.3.28.48","198.132.228.204","TCP","54","21  >  3021 [FIN, ACK] Seq=1897476031 Ack=251472421 Win=5840 Len=0"
"16896","6386.681823","198.132.228.204","128.3.28.48","TCP","62","3041  >  21 [SYN] Seq=264931460 Win=16384 Len=0 MSS=1460 SACK_PERM=1"
"17023","6449.344560","198.132.228.204","128.3.28.48","TCP","62","3064  >  21 [SYN] Seq=281347103 Win=16384 Len=0 MSS=1460 SACK_PERM=1"
"17118","6499.390207","198.132.228.204","128.3.28.48","TCP","62","3084  >  21 [SYN] Seq=294448635 Win=16384 Len=0 MSS=1460 SACK_PERM=1"
"17183","6535.769873","79.37.53.67","131.243.2.12","TCP","62","35579  >  21 [SYN] Seq=3621623854 Win=16384 Len=0 MSS=1460 SACK_PERM=1"
"17277","6561.738226","79.37.53.67","203.174.5.11","TCP","62","31225  >  21 [SYN] Seq=3638470461 Win=16384 Len=0 MSS=1460 SACK_PERM=1"
"17364","6574.288508","203.174.5.11","79.37.53.67","TCP","54","21  >  31225 [FIN, ACK] Seq=1954560895 Ack=3638470860 Win=32768 Len=0"
"17371","6575.592343","198.132.228.204","128.3.28.48","TCP","62","3111  >  21 [SYN] Seq=314337280 Win=16384 Len=0 MSS=1460 SACK_PERM=1"
"17476","6629.037677","128.3.28.48","198.132.228.204","TCP","54","21  >  3111 [FIN, ACK] Seq=2160427510 Ack=314337483 Win=5840 Len=0"
"17477","6629.875005","198.132.228.204","128.3.28.48","TCP","62","3131  >  21 [SYN] Seq=328760313 Win=16384 Len=0 MSS=1460 SACK_PERM=1"
"17582","6681.033275","198.132.228.204","128.3.28.48","TCP","62","3149  >  21 [SYN] Seq=342137945 Win=16384 Len=0 MSS=1460 SACK_PERM=1"
"17677","6729.492390","198.132.228.204","128.3.28.48","TCP","62","3166  >  21 [SYN] Seq=354871435 Win=16384 Len=0 MSS=1460 SACK_PERM=1"
"17747","6767.292469","9.134.163.63","131.243.1.10","TCP","62","2295  >  21 [SYN] Seq=967493357 Win=16384 Len=0 MSS=1460 SACK_PERM=1"
"17832","6778.793654","198.132.228.204","128.3.28.48","TCP","62","3184  >  21 [SYN] Seq=367667892 Win=16384 Len=0 MSS=1460 SACK_PERM=1"
"17927","6827.473387","198.132.228.204","128.3.28.48","TCP","62","3200  >  21 [SYN] Seq=380318089 Win=16384 Len=0 MSS=1460 SACK_PERM=1"
"18026","6876.512357","128.3.28.48","198.132.228.204","TCP","54","21  >  3200 [FIN, ACK] Seq=2422626022 Ack=380318292 Win=5840 Len=0"
"18028","6877.400946","198.132.228.204","128.3.28.48","TCP","62","3219  >  21 [SYN] Seq=393540417 Win=16384 Len=0 MSS=1460 SACK_PERM=1"
"18138","6932.021800","198.132.228.204","128.3.28.48","TCP","62","3240  >  21 [SYN] Seq=407930940 Win=16384 Len=0 MSS=1460 SACK_PERM=1"
"18170","6951.420481","165.196.252.224","131.243.1.10","TCP","62","1096  >  21 [SYN] Seq=18435518 Win=8192 Len=0 MSS=536 SACK_PERM=1"
"18171","6951.420482","165.196.252.224","131.243.1.10","TCP","62","1097  >  21 [SYN] Seq=18435519 Win=8192 Len=0 MSS=536 SACK_PERM=1"
"18221","6951.931751","79.37.53.67","131.243.2.12","TCP","62","35045  >  21 [SYN] Seq=3862700981 Win=16384 Len=0 MSS=1460 SACK_PERM=1"
"18373","6965.494707","131.243.1.10","165.196.252.224","TCP","54","21  >  1097 [FIN, ACK] Seq=2150999204 Ack=18435571 Win=16616 Len=0"
"18483","6973.999973","79.37.53.67","203.174.5.11","TCP","62","35130  >  21 [SYN] Seq=3878513558 Win=16384 Len=0 MSS=1460 SACK_PERM=1"
"18610","6986.458752","198.132.228.204","128.3.28.48","TCP","62","3263  >  21 [SYN] Seq=422088534 Win=16384 Len=0 MSS=1460 SACK_PERM=1"
"18692","7027.890407","165.196.252.224","131.243.1.10","TCP","62","1104  >  21 [SYN] Seq=18512014 Win=8192 Len=0 MSS=536 SACK_PERM=1"
"18763","7042.717065","131.243.1.10","165.196.252.224","TCP","54","21  >  1104 [FIN, ACK] Seq=802581104 Ack=18512066 Win=16616 Len=0"
"18777","7046.716710","198.132.228.204","128.3.28.48","TCP","62","3281  >  21 [SYN] Seq=437847319 Win=16384 Len=0 MSS=1460 SACK_PERM=1"
"18883","7101.658326","198.132.228.204","128.3.28.48","TCP","62","3305  >  21 [SYN] Seq=452421282 Win=16384 Len=0 MSS=1460 SACK_PERM=1"
"18995","7159.930873","128.3.28.48","198.132.228.204","TCP","54","21  >  3305 [FIN, ACK] Seq=2722543637 Ack=452421497 Win=5840 Len=0"
"18996","7160.695170","198.132.228.204","128.3.28.48","TCP","62","3323  >  21 [SYN] Seq=467778979 Win=16384 Len=0 MSS=1460 SACK_PERM=1"
"19096","7209.998085","198.132.228.204","128.3.28.48","TCP","62","3342  >  21 [SYN] Seq=480716501 Win=16384 Len=0 MSS=1460 SACK_PERM=1"
"19146","7241.942385","165.196.252.224","131.243.1.10","TCP","62","1124  >  21 [SYN] Seq=18726074 Win=8192 Len=0 MSS=536 SACK_PERM=1"
"19252","7263.046711","198.132.228.204","128.3.28.48","TCP","62","3358  >  21 [SYN] Seq=494626268 Win=16384 Len=0 MSS=1460 SACK_PERM=1"
"19428","7318.379739","198.132.228.204","128.3.28.48","TCP","62","3381  >  21 [SYN] Seq=509104129 Win=16384 Len=0 MSS=1460 SACK_PERM=1"
"19529","7345.381980","79.37.53.67","131.243.2.12","TCP","62","36061  >  21 [SYN] Seq=4099139647 Win=16384 Len=0 MSS=1460 SACK_PERM=1"
"19644","7367.150694","79.37.53.67","203.174.5.11","TCP","62","35372  >  21 [SYN] Seq=4115290049 Win=16384 Len=0 MSS=1460 SACK_PERM=1"
"19657","7368.523223","165.196.252.224","131.243.1.10","TCP","62","1128  >  21 [SYN] Seq=18852667 Win=8192 Len=0 MSS=536 SACK_PERM=1"
"19709","7372.770901","198.132.228.204","128.3.28.48","TCP","62","3400  >  21 [SYN] Seq=523419513 Win=16384 Len=0 MSS=1460 SACK_PERM=1"
"19733","7376.653200","131.201.66.31","131.243.2.12","TCP","62","4702  >  21 [SYN] Seq=894671545 Win=35100 Len=0 MSS=1460 SACK_PERM=1"
"20073","7447.231928","128.3.28.48","198.132.228.204","TCP","54","21  >  3400 [FIN, ACK] Seq=3026755450 Ack=523419710 Win=5840 Len=0"
"20080","7448.345817","198.132.228.204","128.3.28.48","TCP","62","3427  >  21 [SYN] Seq=543181125 Win=16384 Len=0 MSS=1460 SACK_PERM=1"
"20094","7450.876743","84.68.192.198","131.243.1.10","TCP","74","1261  >  21 [SYN] Seq=593195696 Win=57344 Len=0 MSS=1380 WS=1 TSval=1159258827 TSecr=0"
"20169","7453.909714","131.243.1.10","84.68.192.198","TCP","54","21  >  1261 [FIN, ACK] Seq=3703201031 Ack=593195784 Win=16560 Len=0"
"20210","7464.388946","94.115.110.217","128.3.12.44","TCP","74","53384  >  21 [SYN] Seq=217468467 Win=5840 Len=0 MSS=1460 SACK_PERM=1 TSval=3447403055 TSecr=0 WS=1"
"20245","7467.363562","128.3.12.44","94.115.110.217","TCP","54","21  >  53384 [FIN, ACK] Seq=1791680418 Ack=217468553 Win=4096 Len=0"
"20301","7486.494085","42.47.103.207","131.243.1.10","TCP","62","61645  >  21 [SYN] Seq=34055153 Win=8192 Len=0 MSS=1460 SACK_PERM=1"
"20365","7494.078564","123.229.236.233","131.243.1.10","TCP","66","1086  >  21 [SYN] Seq=3716810910 Win=16384 Len=0 MSS=1452 WS=1 SACK_PERM=1"
"20459","7500.419606","198.132.228.204","128.3.28.48","TCP","62","3444  >  21 [SYN] Seq=556808115 Win=16384 Len=0 MSS=1460 SACK_PERM=1"
"20500","7509.473676","42.47.103.207","131.243.1.10","TCP","62","61646  >  21 [SYN] Seq=34078066 Win=8192 Len=0 MSS=1460 SACK_PERM=1"
"20506","7510.254677","131.243.1.10","42.47.103.207","TCP","54","21  >  61645 [RST] Seq=3178560209 Win=0 Len=0"
"20676","7542.363912","131.243.1.10","123.229.236.233","TCP","54","21  >  1086 [FIN, ACK] Seq=3361113281 Ack=3716811094 Win=17424 Len=0"
"20678","7542.379516","123.229.236.233","131.243.1.10","TCP","66","1090  >  21 [SYN] Seq=3729036199 Win=16384 Len=0 MSS=1452 WS=1 SACK_PERM=1"
"20757","7546.745919","198.132.228.204","128.3.28.48","TCP","62","3461  >  21 [SYN] Seq=568887112 Win=16384 Len=0 MSS=1460 SACK_PERM=1"
"20898","7600.343144","6.80.138.33","131.243.1.10","TCP","74","36252  >  21 [SYN] Seq=1583076829 Win=5840 Len=0 MSS=1460 SACK_PERM=1 TSval=13677845 TSecr=0 WS=1"
"20984","7608.769467","131.243.1.10","6.80.138.33","TCP","54","21  >  36252 [FIN, ACK] Seq=2667454615 Ack=1583077009 Win=17520 Len=0"
"21041","7629.754742","198.132.228.204","128.3.28.48","TCP","62","3488  >  21 [SYN] Seq=590577653 Win=16384 Len=0 MSS=1460 SACK_PERM=1"
"21175","7680.238737","198.132.228.204","128.3.28.48","TCP","62","3505  >  21 [SYN] Seq=603714664 Win=16384 Len=0 MSS=1460 SACK_PERM=1"
"21310","7726.892824","128.3.28.48","198.132.228.204","TCP","54","21  >  3505 [FIN, ACK] Seq=3339892191 Ack=603714873 Win=5840 Len=0"
"21313","7727.784738","198.132.228.204","128.3.28.48","TCP","62","3518  >  21 [SYN] Seq=616057415 Win=16384 Len=0 MSS=1460 SACK_PERM=1"
"21357","7744.801673","79.37.53.67","131.243.2.12","TCP","62","34971  >  21 [SYN] Seq=42265808 Win=16384 Len=0 MSS=1460 SACK_PERM=1"
"21479","7771.410075","79.37.53.67","203.174.5.11","TCP","62","34196  >  21 [SYN] Seq=59326430 Win=16384 Len=0 MSS=1460 SACK_PERM=1"
"21533","7776.948480","198.132.228.204","128.3.28.48","TCP","62","3534  >  21 [SYN] Seq=628800191 Win=16384 Len=0 MSS=1460 SACK_PERM=1"
"21750","7827.799130","198.132.228.204","128.3.28.48","TCP","62","3550  >  21 [SYN] Seq=642053537 Win=16384 Len=0 MSS=1460 SACK_PERM=1"
"21906","7881.205717","198.132.228.204","128.3.28.48","TCP","62","3566  >  21 [SYN] Seq=656019536 Win=16384 Len=0 MSS=1460 SACK_PERM=1"
"21954","7900.319481","106.20.55.102","131.243.1.10","TCP","62","1454  >  21 [SYN] Seq=511417104 Win=16384 Len=0 MSS=1460 SACK_PERM=1"
"22210","7930.323282","198.132.228.204","128.3.28.48","TCP","62","3582  >  21 [SYN] Seq=668611603 Win=16384 Len=0 MSS=1460 SACK_PERM=1"
"22227","7936.659467","106.20.55.102","131.243.1.10","TCP","62","1461  >  21 [SYN] Seq=520797729 Win=16384 Len=0 MSS=1460 SACK_PERM=1"
"22300","7944.029179","102.182.6.132","131.243.1.10","TCP","74","52287  >  21 [SYN] Seq=1698719749 Win=5840 Len=0 MSS=1460 TSval=338729781 TSecr=0 WS=1"
"22421","7959.257942","131.243.1.10","106.20.55.102","TCP","54","21  >  1461 [FIN, ACK] Seq=1884790961 Ack=520797862 Win=17520 Len=0"
"22422","7959.263394","106.20.55.102","131.243.1.10","TCP","62","1464  >  21 [SYN] Seq=526563637 Win=16384 Len=0 MSS=1460 SACK_PERM=1"
"22525","7972.529744","106.20.55.102","131.243.1.10","TCP","62","1466  >  21 [SYN] Seq=529965593 Win=16384 Len=0 MSS=1460 SACK_PERM=1"
"22593","7977.151618","127.1.58.114","131.243.1.10","TCP","62","1151  >  21 [SYN] Seq=2282535 Win=8192 Len=0 MSS=1460"
"22713","7983.349332","127.1.58.114","131.243.1.10","TCP","62","1153  >  21 [SYN] Seq=2288739 Win=8192 Len=0 MSS=1460"
"22925","7988.645705","131.243.1.10","127.1.58.114","TCP","54","21  >  1151 [FIN, ACK] Seq=1181547924 Ack=2282897 Win=17520 Len=0"
"22938","7999.927383","127.1.58.114","131.243.1.10","TCP","62","1156  >  21 [SYN] Seq=2305322 Win=8192 Len=0 MSS=1460"
"23002","8025.255716","198.132.228.204","128.3.28.48","TCP","62","3608  >  21 [SYN] Seq=693147424 Win=16384 Len=0 MSS=1460 SACK_PERM=1"
"23018","8064.738690","82.143.24.12","131.243.2.12","TCP","62","3513  >  21 [SYN] Seq=1656222783 Win=16384 Len=0 MSS=1460 SACK_PERM=1"
"23050","8075.079603","128.3.28.48","198.132.228.204","TCP","54","21  >  3608 [FIN, ACK] Seq=3710777515 Ack=693147613 Win=5840 Len=0"
"23052","8076.290543","198.132.228.204","128.3.28.48","TCP","62","3623  >  21 [SYN] Seq=706386769 Win=16384 Len=0 MSS=1460 SACK_PERM=1"
"23058","8077.170278","141.25.137.236","131.243.1.10","TCP","62","1123  >  21 [SYN] Seq=6392914 Win=5840 Len=0 MSS=1460 SACK_PERM=1"
"23187","8136.504957","198.132.228.204","128.3.28.48","TCP","62","3641  >  21 [SYN] Seq=722311839 Win=16384 Len=0 MSS=1460 SACK_PERM=1"
"23198","8155.735923","79.37.53.67","203.174.5.11","TCP","62","34862  >  21 [SYN] Seq=293298539 Win=16384 Len=0 MSS=1460 SACK_PERM=1"
"23277","8187.876228","198.132.228.204","128.3.28.48","TCP","62","3656  >  21 [SYN] Seq=735635843 Win=16384 Len=0 MSS=1460 SACK_PERM=1"
"23304","8236.827185","198.132.228.204","128.3.28.48","TCP","62","3674  >  21 [SYN] Seq=748446945 Win=16384 Len=0 MSS=1460 SACK_PERM=1"
"23308","8247.556142","131.243.1.10","102.182.6.132","TCP","54","21  >  52287 [FIN, ACK] Seq=38599799 Ack=1698719873 Win=17520 Len=0"
"23311","8253.105037","211.57.73.255","131.243.2.12","TCP","62","1262  >  21 [SYN] Seq=2167627862 Win=16384 Len=0 MSS=1460 SACK_PERM=1"
"23409","8285.887782","198.132.228.204","128.3.28.48","TCP","62","3690  >  21 [SYN] Seq=761349178 Win=16384 Len=0 MSS=1460 SACK_PERM=1"
"23470","8322.709061","106.20.55.102","131.243.1.10","TCP","62","1512  >  21 [SYN] Seq=619369506 Win=16384 Len=0 MSS=1460 SACK_PERM=1"
"23528","8324.225601","106.20.55.102","131.243.1.10","TCP","62","1514  >  21 [SYN] Seq=619823667 Win=16384 Len=0 MSS=1460 SACK_PERM=1"
"23610","8329.826442","198.132.228.204","128.3.28.48","TCP","62","3703  >  21 [SYN] Seq=772835902 Win=16384 Len=0 MSS=1460 SACK_PERM=1"
"23630","8339.090855","131.243.1.10","106.20.55.102","TCP","54","21  >  1514 [FIN, ACK] Seq=327509267 Ack=619823771 Win=17520 Len=0"
"23660","8355.001549","106.20.55.102","131.243.1.10","TCP","62","1516  >  21 [SYN] Seq=627573626 Win=16384 Len=0 MSS=1460 SACK_PERM=1"
"23769","8369.234098","106.20.55.102","131.243.1.10","TCP","62","1519  >  21 [SYN] Seq=631297584 Win=16384 Len=0 MSS=1460 SACK_PERM=1"
"23849","8372.855411","106.20.55.102","131.243.1.10","TCP","62","1522  >  21 [SYN] Seq=632300998 Win=16384 Len=0 MSS=1460 SACK_PERM=1"
"23918","8375.924820","128.3.28.48","198.132.228.204","TCP","54","21  >  3703 [FIN, ACK] Seq=4028311300 Ack=772836119 Win=5840 Len=0"
"23919","8377.190832","198.132.228.204","128.3.28.48","TCP","62","3719  >  21 [SYN] Seq=785064933 Win=16384 Len=0 MSS=1460 SACK_PERM=1"
"23941","8377.942148","106.20.55.102","131.243.1.10","TCP","62","1525  >  21 [SYN] Seq=633677668 Win=16384 Len=0 MSS=1460 SACK_PERM=1"
"23977","8378.106651","225.76.177.112","131.243.1.10","TCP","62","3480  >  21 [SYN] Seq=10752287 Win=8192 Len=0 MSS=1460 SACK_PERM=1"
