"1","0.000000","248.38.9.24","131.243.1.10","TCP","74","41553  >  21 [SYN] Seq=1314531094 Win=5840 Len=0 MSS=1460 SACK_PERM=1 TSval=3118435140 TSecr=0 WS=1"
"52","1.256596","131.243.1.10","248.38.9.24","TCP","54","21  >  41553 [FIN, ACK] Seq=3522285406 Ack=1314531176 Win=17520 Len=0"
"55","181.169693","217.148.52.180","131.243.2.12","TCP","62","2471  >  21 [SYN] Seq=3240012531 Win=16384 Len=0 MSS=1460 SACK_PERM=1"
"115","214.658574","59.30.70.208","128.3.28.48","TCP","74","34500  >  21 [SYN] Seq=2376548815 Win=4452 Len=0 MSS=1484 SACK_PERM=1 TSval=409860 TSecr=0 WS=1"
"217","261.077621","128.3.28.48","59.30.70.208","TCP","66","21  >  34500 [FIN, ACK] Seq=3378154477 Ack=2376549028 Win=5792 Len=0 TSval=2268162194 TSecr=414500"
"278","299.953907","229.246.115.157","131.243.1.10","TCP","58","56646  >  21 [SYN] Seq=3601681547 Win=61320 Len=0 MSS=1460"
"353","309.284590","131.243.1.10","229.246.115.157","TCP","54","21  >  56646 [FIN, ACK] Seq=482136669 Ack=3601681644 Win=17520 Len=0"
"373","320.670464","189.30.8.121","131.243.1.10","TCP","62","40570  >  21 [SYN] Seq=3857849774 Win=16384 Len=0 MSS=1460 SACK_PERM=1"
"435","324.623291","131.243.1.10","189.30.8.121","TCP","54","21  >  40570 [FIN, ACK] Seq=3874755272 Ack=3857849890 Win=17520 Len=0"
"451","333.532263","189.30.8.121","131.243.1.10","TCP","62","40595  >  21 [SYN] Seq=3861801731 Win=16384 Len=0 MSS=1460 SACK_PERM=1"
"714","469.183003","7.82.237.222","131.243.1.10","TCP","62","5973  >  21 [SYN] Seq=2836082884 Win=64240 Len=0 MSS=1460 SACK_PERM=1"
"779","474.910791","131.243.1.10","7.82.237.222","TCP","54","21  >  5973 [FIN, ACK] Seq=4117660128 Ack=2836082997 Win=17520 Len=0"
"803","489.912305","7.82.237.222","131.243.1.10","TCP","62","7485  >  21 [SYN] Seq=2842551017 Win=64240 Len=0 MSS=1460 SACK_PERM=1"
"865","493.245702","131.243.1.10","7.82.237.222","TCP","54","21  >  7485 [FIN, ACK] Seq=1007100335 Ack=2842551172 Win=17520 Len=0"
"982","559.299725","152.191.35.146","128.3.28.48","TCP","74","34528  >  21 [SYN] Seq=2757745484 Win=4452 Len=0 MSS=1484 SACK_PERM=1 TSval=444325 TSecr=0 WS=1"
"1016","565.290459","128.3.28.48","152.191.35.146","TCP","66","21  >  34528 [FIN, ACK] Seq=3739858090 Ack=2757745585 Win=5792 Len=0 TSval=2268192612 TSecr=444922"
"1028","570.447473","152.191.35.146","128.3.28.48","TCP","74","34530  >  21 [SYN] Seq=2780329856 Win=4452 Len=0 MSS=1484 SACK_PERM=1 TSval=445440 TSecr=0 WS=1"
"1076","585.219385","152.191.35.146","128.3.28.48","TCP","74","34532  >  21 [SYN] Seq=2799027952 Win=4452 Len=0 MSS=1484 SACK_PERM=1 TSval=446917 TSecr=0 WS=1"
"1232","672.104564","45.7.36.127","131.243.2.12","TCP","62","2945  >  21 [SYN] Seq=1291332707 Win=8192 Len=0 MSS=1460 SACK_PERM=1"
"1628","822.100125","161.126.87.140","131.243.1.10","TCP","62","1819  >  21 [SYN] Seq=2931886122 Win=64240 Len=0 MSS=1452 SACK_PERM=1"
"1720","848.339938","91.198.76.64","131.243.1.10","TCP","74","61149  >  21 [SYN] Seq=2133859527 Win=5840 Len=0 MSS=1414 SACK_PERM=1 TSval=16744644 TSecr=0 WS=1"
"1789","849.864453","131.243.1.10","91.198.76.64","TCP","54","21  >  61149 [FIN, ACK] Seq=1099546901 Ack=2133859690 Win=16968 Len=0"
"1893","907.085868","161.126.87.140","131.243.1.10","TCP","62","1824  >  21 [SYN] Seq=2951351270 Win=64240 Len=0 MSS=1452 SACK_PERM=1"
"1978","917.242797","161.126.87.140","131.243.1.10","TCP","62","1826  >  21 [SYN] Seq=2953685133 Win=64240 Len=0 MSS=1452 SACK_PERM=1"
"2188","951.602976","131.243.1.10","161.126.87.140","TCP","54","21  >  1824 [FIN, ACK] Seq=1653998554 Ack=2951351421 Win=17424 Len=0"
"2260","1005.801986","189.214.156.168","131.243.1.10","TCP","62","3017  >  21 [SYN] Seq=1637976573 Win=8760 Len=0 MSS=536 SACK_PERM=1"
"2293","1009.621110","173.112.82.221","131.243.1.10","TCP","78","3887  >  21 [SYN] Seq=4090061794 Win=44620 Len=0 MSS=1460 WS=8 TSval=0 TSecr=0 SACK_PERM=1"
"2378","1016.545295","131.243.1.10","189.214.156.168","TCP","54","21  >  3017 [FIN, ACK] Seq=3816383557 Ack=1637976722 Win=16616 Len=0"
"2458","1058.658334","168.254.152.132","131.243.2.12","TCP","62","2523  >  21 [SYN] Seq=1546644010 Win=16384 Len=0 MSS=1460 SACK_PERM=1"
"2604","1110.250958","4.251.189.14","131.243.1.10","TCP","74","37465  >  21 [SYN] Seq=2480776528 Win=5840 Len=0 MSS=1460 SACK_PERM=1 TSval=85092584 TSecr=0 WS=1"
"2682","1113.294613","131.243.1.10","4.251.189.14","TCP","54","21  >  37465 [FIN, ACK] Seq=299189397 Ack=2480776645 Win=17520 Len=0"
"2727","1130.548455","148.111.20.136","131.243.1.10","TCP","74","51858  >  21 [SYN] Seq=2511075633 Win=5840 Len=0 MSS=1460 SACK_PERM=1 TSval=24353085 TSecr=0 WS=1"
"2804","1133.627955","131.243.1.10","148.111.20.136","TCP","54","21  >  51858 [FIN, ACK] Seq=3387264663 Ack=2511075753 Win=17520 Len=0"
"2946","1187.419124","168.254.152.132","131.243.2.12","TCP","62","1466  >  21 [SYN] Seq=1576231986 Win=16384 Len=0 MSS=1460 SACK_PERM=1"
"3035","1210.970672","249.44.109.25","128.3.28.48","TCP","74","1286  >  21 [SYN] Seq=2594401953 Win=5840 Len=0 MSS=1460 SACK_PERM=1 TSval=195399166 TSecr=0 WS=1"
"3069","1212.332731","128.3.28.48","249.44.109.25","TCP","66","21  >  1286 [FIN, ACK] Seq=134197585 Ack=2594402054 Win=5792 Len=0 TSval=2268257310 TSecr=195399303"
"3070","1212.344161","249.44.109.25","128.3.28.48","TCP","74","1288  >  21 [SYN] Seq=2585326590 Win=5840 Len=0 MSS=1460 SACK_PERM=1 TSval=195399304 TSecr=0 WS=1"
"3103","1214.338147","249.44.109.25","128.3.28.48","TCP","74","1290  >  21 [SYN] Seq=2593112408 Win=5840 Len=0 MSS=1460 SACK_PERM=1 TSval=195399503 TSecr=0 WS=1"
"3461","1309.650935","131.243.1.10","173.112.82.221","TCP","54","21  >  3887 [FIN, ACK] Seq=4144708565 Ack=4090066046 Win=17520 Len=0"
"3479","1319.138518","55.84.210.42","131.243.1.10","TCP","62","3552  >  21 [SYN] Seq=3664903931 Win=32767 Len=0 MSS=1324 SACK_PERM=1"
"3570","1349.116272","82.143.24.12","131.243.2.12","TCP","62","3868  >  21 [SYN] Seq=1278870484 Win=16384 Len=0 MSS=1460 SACK_PERM=1"
"3621","1368.002076","232.8.175.74","131.243.1.10","TCP","58","63068  >  21 [SYN] Seq=3108712002 Win=8760 Len=0 MSS=1460"
"3758","1394.136062","131.243.1.10","232.8.175.74","TCP","54","21  >  63068 [FIN, ACK] Seq=3387662646 Ack=3108712169 Win=17520 Len=0"
"3770","1397.507006","178.214.186.1","131.243.1.10","TCP","74","60407  >  21 [SYN] Seq=3726390522 Win=5840 Len=0 MSS=1380 SACK_PERM=1 TSval=119568921 TSecr=0 WS=1"
"3846","1407.795061","178.214.186.1","131.243.1.10","TCP","74","60415  >  21 [SYN] Seq=3962290439 Win=5840 Len=0 MSS=1380 SACK_PERM=1 TSval=119569951 TSecr=0 WS=1"
"3847","1407.795300","131.243.1.10","178.214.186.1","TCP","54","21  >  60407 [FIN, ACK] Seq=3033700168 Ack=3726390577 Win=16560 Len=0"
"4225","1555.077767","232.8.175.74","131.243.1.10","TCP","58","63072  >  21 [SYN] Seq=3132369786 Win=8760 Len=0 MSS=1460"
"4304","1562.660435","232.8.175.74","131.243.1.10","TCP","58","63074  >  21 [SYN] Seq=3133455060 Win=8760 Len=0 MSS=1460"
"4492","1618.906107","131.243.1.10","55.84.210.42","TCP","54","21  >  3552 [FIN, ACK] Seq=3783935841 Ack=3664904007 Win=17212 Len=0"
"4586","1652.098510","152.191.35.146","128.3.28.48","TCP","74","34722  >  21 [SYN] Seq=3924136716 Win=4452 Len=0 MSS=1484 SACK_PERM=1 TSval=553606 TSecr=0 WS=1"
"4890","1844.469748","216.43.247.103","131.243.1.10","TCP","74","58752  >  21 [SYN] Seq=3247196764 Win=5840 Len=0 MSS=1460 SACK_PERM=1 TSval=1909298758 TSecr=0 WS=1"
"4950","1850.699881","16.69.134.221","131.243.2.12","TCP","62","4517  >  21 [SYN] Seq=3465098127 Win=16384 Len=0 MSS=1460 SACK_PERM=1"
"5010","1859.044640","131.243.1.10","216.43.247.103","TCP","54","21  >  58752 [FIN, ACK] Seq=3225933847 Ack=3247196884 Win=17520 Len=0"
"5230","1905.844067","150.70.97.75","131.243.1.10","TCP","74","2130  >  21 [SYN] Seq=3301524672 Win=32120 Len=0 MSS=1460 SACK_PERM=1 TSval=342513391 TSecr=0 WS=1"
"5328","1912.013135","131.243.1.10","150.70.97.75","TCP","54","21  >  2130 [FIN, ACK] Seq=2892671819 Ack=3301524769 Win=17520 Len=0"
"5461","2256.864522","250.225.145.152","131.243.1.10","TCP","62","1267  >  21 [SYN] Seq=2007889 Win=8192 Len=0 MSS=536 SACK_PERM=1"
"5463","2259.763775","250.225.145.152","131.243.1.10","TCP","62"," 1267  >  21 [SYN] Seq=2007889 Win=8192 Len=0 MSS=536 SACK_PERM=1"
"5535","2285.162390","131.243.1.10","250.225.145.152","TCP","54","21  >  1267 [FIN, ACK] Seq=3464409561 Ack=2008068 Win=16616 Len=0"
"5537","2333.119291","18.197.41.194","131.243.1.10","TCP","58","25202  >  21 [SYN] Seq=3498156635 Win=32768 Len=0 MSS=1460"
"5594","2334.979591","131.243.1.10","18.197.41.194","TCP","54","21  >  25202 [FIN, ACK] Seq=2192898222 Ack=3498156716 Win=17520 Len=0"
"5598","2345.851666","237.180.56.133","131.243.1.10","TCP","62","3276  >  21 [SYN] Seq=1323715783 Win=16384 Len=0 MSS=1360 SACK_PERM=1"
"5651","2353.779108","18.197.41.194","131.243.1.10","TCP","58","25574  >  21 [SYN] Seq=3570394930 Win=32768 Len=0 MSS=1460"
"5732","2404.733566","82.143.24.12","131.243.2.12","TCP","62","3262  >  21 [SYN] Seq=3123447665 Win=16384 Len=0 MSS=1460 SACK_PERM=1"
"5773","2475.883014","44.120.49.173","109.103.64.27","TCP","58","4936  >  21 [SYN] Seq=24263792 Win=8192 Len=0 MSS=1460"
"5796","2478.208655","109.103.64.27","44.120.49.173","TCP","54","21  >  4936 [RST] Seq=2687899207 Win=1460 Len=0"
"5799","2480.988994","131.243.1.10","237.180.56.133","TCP","54","21  >  3276 [FIN, ACK] Seq=16827101 Ack=1323715960 Win=17680 Len=0"
"5800","2481.569778","82.143.24.12","131.243.2.12","TCP","62","1089  >  21 [SYN] Seq=3148109521 Win=16384 Len=0 MSS=1460 SACK_PERM=1"
"5816","2489.559743","44.120.49.173","62.159.77.154","TCP","58","2007  >  21 [SYN] Seq=24271237 Win=8192 Len=0 MSS=1460"
"5839","2491.792549","62.159.77.154","44.120.49.173","TCP","54","21  >  2007 [RST] Seq=323900204 Win=0 Len=0"
"5840","2492.080593","44.120.49.173","44.76.136.98","TCP","58","2207  >  21 [SYN] Seq=24272692 Win=8192 Len=0 MSS=1460"
"5878","2517.622359","44.120.49.173","189.246.241.212","TCP","58","4143  >  21 [SYN] Seq=24286673 Win=8192 Len=0 MSS=1460"
"5880","2517.628304","44.120.49.173","123.47.104.102","TCP","58","4144  >  21 [SYN] Seq=24286687 Win=8192 Len=0 MSS=1460"
"5886","2517.725048","44.120.49.173","4.18.95.135","TCP","58","4151  >  21 [SYN] Seq=24286770 Win=8192 Len=0 MSS=1460"
"5926","2519.130780","44.120.49.173","48.248.244.161","TCP","58","4266  >  21 [SYN] Seq=24287624 Win=8192 Len=0 MSS=1460"
"5975","2541.372768","82.143.24.12","131.243.2.12","TCP","62","3147  >  21 [SYN] Seq=3168390350 Win=16384 Len=0 MSS=1460 SACK_PERM=1"
"6063","2606.054495","250.225.145.152","131.243.1.10","TCP","62","1290  >  21 [SYN] Seq=2356647 Win=8192 Len=0 MSS=536 SACK_PERM=1"
"6116","2677.584041","82.143.24.12","131.243.2.12","TCP","62","3610  >  21 [SYN] Seq=3216165529 Win=16384 Len=0 MSS=1460 SACK_PERM=1"
"6186","2769.867612","69.157.45.176","131.243.2.12","TCP","62","2479  >  21 [SYN] Seq=2787842498 Win=64240 Len=0 MSS=1460 SACK_PERM=1"
"6236","2819.158148","143.156.1.2","131.243.2.12","TCP","62","3167  >  21 [SYN] Seq=598276253 Win=16384 Len=0 MSS=1460 SACK_PERM=1"
"6275","2835.471054","131.243.2.12","16.69.134.221","TCP","54","21  >  4517 [RST] Seq=83184375 Win=64240 Len=0"
"6310","2868.194999","47.125.91.135","131.243.2.12","TCP","62","1300  >  21 [SYN] Seq=238381077 Win=16384 Len=0 MSS=1460 SACK_PERM=1"
"6390","2914.830573","24.190.46.234","131.243.1.10","TCP","58","48576  >  21 [SYN] Seq=2413775609 Win=8760 Len=0 MSS=1460"
"6444","2915.277818","131.243.1.10","24.190.46.234","TCP","54","21  >  48576 [FIN, ACK] Seq=159068331 Ack=2413775685 Win=17520 Len=0"
"6490","3023.725069","75.16.160.171","131.243.2.12","TCP","74","55508  >  21 [SYN] Seq=217413204 Win=65535 Len=0 MSS=1460 WS=1 TSval=1929749 TSecr=0"
"6518","3044.037779","244.173.253.244","131.243.2.12","TCP","74","51770  >  21 [SYN] Seq=99526660 Win=65535 Len=0 MSS=1460 WS=1 TSval=1780416 TSecr=0"
"6520","3044.263430","90.227.190.180","131.243.2.12","TCP","62","3904  >  21 [SYN] Seq=1987179967 Win=16384 Len=0 MSS=1460 SACK_PERM=1"
"6564","3049.266388","244.173.253.244","131.243.2.12","TCP","74","53665  >  21 [SYN] Seq=370338452 Win=65535 Len=0 MSS=1460 WS=1 TSval=1780427 TSecr=0"
"6598","3053.392552","244.173.253.244","131.243.2.12","TCP","74","55120  >  21 [SYN] Seq=582556104 Win=65535 Len=0 MSS=1460 WS=1 TSval=1780435 TSecr=0"
"6723","3119.361988","171.142.200.244","131.243.1.10","TCP","74","33011  >  21 [SYN] Seq=301681035 Win=5808 Len=0 MSS=1412 SACK_PERM=1 TSval=1202176 TSecr=0 WS=1"
"6765","3120.128461","217.148.52.180","203.174.5.11","TCP","62","3241  >  21 [SYN] Seq=31237828 Win=16384 Len=0 MSS=1460 SACK_PERM=1"
"6796","3121.494180","131.243.1.10","171.142.200.244","TCP","54","21  >  33011 [FIN, ACK] Seq=3969873266 Ack=301681127 Win=16944 Len=0"
"6798","3121.524539","171.142.200.244","131.243.1.10","TCP","74","33013  >  21 [SYN] Seq=317341198 Win=5808 Len=0 MSS=1412 SACK_PERM=1 TSval=1202392 TSecr=0 WS=1"
"6936","3145.391734","43.27.105.111","128.3.28.48","TCP","62","17134  >  21 [SYN] Seq=3233997189 Win=16384 Len=0 MSS=1460 SACK_PERM=1"
"7085","3184.636858","128.3.28.48","43.27.105.111","TCP","54","21  >  17134 [FIN, ACK] Seq=2161587194 Ack=3233997391 Win=5840 Len=0"
"7121","3196.028452","43.27.105.111","128.3.28.48","TCP","62","18263  >  21 [SYN] Seq=3252580769 Win=16384 Len=0 MSS=1460 SACK_PERM=1"
"7365","3267.260079","43.27.105.111","128.3.28.48","TCP","62","19695  >  21 [SYN] Seq=3298967184 Win=16384 Len=0 MSS=1460 SACK_PERM=1"
"7479","3306.364903","192.232.226.84","131.243.1.10","TCP","74","33728  >  21 [SYN] Seq=499649924 Win=5840 Len=0 MSS=1460 SACK_PERM=1 TSval=10497202 TSecr=0 WS=1"
"7628","3351.966009","120.151.219.31","131.243.1.10","TCP","62","50236  >  21 [SYN] Seq=3093969718 Win=64240 Len=0 MSS=1380 SACK_PERM=1"
"7687","3354.148322","131.243.1.10","120.151.219.31","TCP","54","21  >  50236 [FIN, ACK] Seq=286737843 Ack=3093969816 Win=16560 Len=0"
"7819","3392.443759","44.76.136.98","44.120.49.173","TCP","54","21  >  2207 [FIN, ACK] Seq=2072705782 Ack=24272710 Win=49152 Len=0"
"7921","3457.816513","69.157.45.176","203.174.5.11","TCP","62","1044  >  21 [SYN] Seq=3005183275 Win=64240 Len=0 MSS=1460 SACK_PERM=1"
"8020","3512.481932","84.68.192.198","131.243.1.10","TCP","74","1594  >  21 [SYN] Seq=3117017266 Win=57344 Len=0 MSS=1380 WS=1 TSval=1219411870 TSecr=0"
"8088","3515.505685","131.243.1.10","84.68.192.198","TCP","54","21  >  1594 [FIN, ACK] Seq=2371310284 Ack=3117017354 Win=16560 Len=0"
"8190","3551.910567","131.243.1.10","192.232.226.84","TCP","54","21  >  33728 [FIN, ACK] Seq=3845922895 Ack=499650651 Win=17520 Len=0"
"8199","3555.603779","18.23.245.184","131.243.1.10","TCP","62","1915  >  21 [SYN] Seq=1898881 Win=8192 Len=0 MSS=536 SACK_PERM=1"
"8204","3557.059567","18.23.245.184","131.243.1.10","TCP","62"," 1915  >  21 [SYN] Seq=1898881 Win=8192 Len=0 MSS=536 SACK_PERM=1"
"8261","3574.253778","129.80.74.185","131.243.1.10","TCP","62","19542  >  21 [SYN] Seq=19508663 Win=8192 Len=0 MSS=1460 SACK_PERM=1"
"8269","3575.220283","192.232.226.84","131.243.1.10","TCP","74","33739  >  21 [SYN] Seq=770075469 Win=5840 Len=0 MSS=1460 SACK_PERM=1 TSval=10524088 TSecr=0 WS=1"
"8387","3585.675122","129.80.74.185","131.243.1.10","TCP","62","19546  >  21 [SYN] Seq=19520079 Win=8192 Len=0 MSS=1460 SACK_PERM=1"
"8534","3632.562789","131.243.1.10","129.80.74.185","TCP","54","21  >  19542 [FIN, ACK] Seq=3410838537 Ack=19508715 Win=17520 Len=0"
"8598","3664.623256","18.23.245.184","131.243.1.10","TCP","62","2004  >  21 [SYN] Seq=2010473 Win=8192 Len=0 MSS=536 SACK_PERM=1"
"8783","3723.903569","203.174.5.11","217.148.52.180","TCP","54"," 21  >  3241 [FIN, ACK] Seq=605129399 Ack=31246772 Win=32768 Len=0"
"8788","3736.490808","132.239.174.251","131.243.1.10","TCP","62","35056  >  21 [SYN] Seq=2671301654 Win=16384 Len=0 MSS=1436 SACK_PERM=1"
"8843","3783.870779","131.243.1.10","132.239.174.251","TCP","54","21  >  35056 [FIN, ACK] Seq=1088899125 Ack=2671301733 Win=17232 Len=0"
"8847","3910.686665","239.248.79.130","131.243.1.10","TCP","74","2794  >  21 [SYN] Seq=959109208 Win=32120 Len=0 MSS=1460 SACK_PERM=1 TSval=167544579 TSecr=0 WS=1"
"8924","3915.623815","37.113.117.74","131.243.1.10","TCP","74","53763  >  21 [SYN] Seq=1364227951 Win=5840 Len=0 MSS=1460 SACK_PERM=1 TSval=329631335 TSecr=0 WS=1"
"8969","3918.353629","131.243.1.10","37.113.117.74","TCP","54","21  >  53763 [FIN, ACK] Seq=2034697122 Ack=1364228041 Win=17520 Len=0"
"8974","3919.800595","131.243.1.10","239.248.79.130","TCP","54","21  >  2794 [FIN, ACK] Seq=145576040 Ack=959109343 Win=17520 Len=0"
"8976","3920.707365","37.113.117.74","131.243.1.10","TCP","74","53773  >  21 [SYN] Seq=1369968116 Win=5840 Len=0 MSS=1460 SACK_PERM=1 TSval=329631843 TSecr=0 WS=1"
"9008","3921.120841","91.198.76.64","131.243.1.10","TCP","74","61446  >  21 [SYN] Seq=1093397123 Win=5840 Len=0 MSS=1414 SACK_PERM=1 TSval=17051919 TSecr=0 WS=1"
"9127","4045.565058","143.248.150.114","131.243.1.10","TCP","62","1201  >  21 [SYN] Seq=1532177 Win=8192 Len=0 MSS=536 SACK_PERM=1"
"9186","4058.901762","131.243.1.10","143.248.150.114","TCP","54","21  >  1201 [FIN, ACK] Seq=4046296871 Ack=1532285 Win=16616 Len=0"
"9188","4071.885221","143.248.150.114","131.243.1.10","TCP","62","1203  >  21 [SYN] Seq=1558509 Win=8192 Len=0 MSS=536 SACK_PERM=1"
"9241","4196.699256","184.177.31.177","131.243.1.10","TCP","66","1084  >  21 [SYN] Seq=1162727178 Win=10728 Len=0 MSS=1418 WS=4 SACK_PERM=1"
"9298","4207.943376","131.243.1.10","184.177.31.177","TCP","54","21  >  1084 [FIN, ACK] Seq=1697469694 Ack=1162727285 Win=17016 Len=0"
"9304","4270.820455","131.243.1.10","18.23.245.184","TCP","54","21  >  1915 [FIN, ACK] Seq=1163264138 Ack=1899075 Win=16616 Len=0"
"9308","4285.920863","131.243.1.10","18.23.245.184","TCP","54","21  >  2004 [FIN, ACK] Seq=582142501 Ack=2010640 Win=16616 Len=0"
"9309","4292.193466","18.23.245.184","131.243.1.10","TCP","62","2474  >  21 [SYN] Seq=2623850 Win=8192 Len=0 MSS=536 SACK_PERM=1"
"9311","4292.229001","18.23.245.184","131.243.1.10","TCP","62"," 2474  >  21 [SYN] Seq=2623850 Win=8192 Len=0 MSS=536 SACK_PERM=1"
"9342","4300.404438","18.23.245.184","131.243.1.10","TCP","62","2489  >  21 [SYN] Seq=2642478 Win=8192 Len=0 MSS=536 SACK_PERM=1"
"9345","4302.389083","18.23.245.184","131.243.1.10","TCP","62"," 2489  >  21 [SYN] Seq=2642478 Win=8192 Len=0 MSS=536 SACK_PERM=1"
"9417","4335.547285","192.232.226.84","131.243.1.10","TCP","74","33751  >  21 [SYN] Seq=1588560555 Win=5840 Len=0 MSS=1460 SACK_PERM=1 TSval=10600121 TSecr=0 WS=1"
"9552","4482.215731","193.248.9.31","131.243.1.10","TCP","74","33094  >  21 [SYN] Seq=1738534005 Win=5840 Len=0 MSS=1452 SACK_PERM=1 TSval=198976 TSecr=0 WS=1"
"9618","4487.518962","131.243.1.10","193.248.9.31","TCP","54","21  >  33094 [FIN, ACK] Seq=907421359 Ack=1738534140 Win=17424 Len=0"
"9631","4692.911158","116.177.87.124","131.243.1.10","TCP","74","2785  >  21 [SYN] Seq=1963533716 Win=32120 Len=0 MSS=1460 SACK_PERM=1 TSval=185039815 TSecr=0 WS=1"
"9697","4695.546965","131.243.1.10","116.177.87.124","TCP","54","21  >  2785 [FIN, ACK] Seq=900013431 Ack=1963533847 Win=17520 Len=0"
"9700","4803.332740","213.17.189.200","131.243.1.10","TCP","74","46205  >  21 [SYN] Seq=2063954069 Win=5840 Len=0 MSS=1460 TSval=24083687 TSecr=0 WS=1"
"9754","4807.530782","131.243.1.10","213.17.189.200","TCP","54","21  >  46205 [FIN, ACK] Seq=363820050 Ack=2063954129 Win=17520 Len=0"
"9760","4850.998704","76.62.141.80","131.243.1.10","TCP","74","37885  >  21 [SYN] Seq=2267672001 Win=5840 Len=0 MSS=1460 SACK_PERM=1 TSval=323151191 TSecr=0 WS=1"
"9796","4855.499439","157.215.230.139","131.243.1.10","TCP","58","21986  >  21 [SYN] Seq=1927027190 Win=6144 Len=0 MSS=1368"
"9872","4864.745252","131.243.1.10","76.62.141.80","TCP","54","21  >  37885 [FIN, ACK] Seq=193794653 Ack=2267672061 Win=17520 Len=0"
"9877","4929.901341","131.243.1.10","18.23.245.184","TCP","54","21  >  2489 [FIN, ACK] Seq=2168709367 Ack=2642655 Win=16616 Len=0"
"9880","4941.297082","76.62.141.80","131.243.1.10","TCP","74","38041  >  21 [SYN] Seq=2359617895 Win=5840 Len=0 MSS=1460 SACK_PERM=1 TSval=323160221 TSecr=0 WS=1"
"9939","4958.677927","131.243.1.10","76.62.141.80","TCP","54","21  >  38041 [FIN, ACK] Seq=1941767021 Ack=2359618016 Win=17520 Len=0"
"9941","5000.296549","76.62.141.80","131.243.1.10","TCP","74","38141  >  21 [SYN] Seq=2428491720 Win=5840 Len=0 MSS=1460 SACK_PERM=1 TSval=323166122 TSecr=0 WS=1"
"9997","5006.103863","203.139.202.26","131.243.2.12","TCP","58","55549  >  21 [SYN] Seq=1423724933 Win=16384 Len=0 MSS=1460"
"10028","5021.967173","254.213.124.61","131.243.2.12","TCP","62","1200  >  21 [SYN] Seq=4805563 Win=8192 Len=0 MSS=1460 SACK_PERM=1"
"10038","5026.936799","131.213.89.179","131.243.1.10","TCP","58","3866  >  21 [SYN] Seq=443754931 Win=8192 Len=0 MSS=1460"
"10086","5028.181551","76.62.141.80","131.243.1.10","TCP","74","38191  >  21 [SYN] Seq=2461311091 Win=5840 Len=0 MSS=1460 SACK_PERM=1 TSval=323168910 TSecr=0 WS=1"
"10182","5049.247853","131.243.2.12","254.213.124.61","TCP","54","21  >  1200 [FIN, ACK] Seq=505634894 Ack=4805626 Win=64240 Len=0"
"10185","5154.301811","152.172.117.61","131.243.1.10","TCP","62","1926  >  21 [SYN] Seq=3292358249 Win=16384 Len=0 MSS=1460 SACK_PERM=1"
"10187","5154.344280","152.172.117.61","131.243.1.10","TCP","62","1923  >  21 [SYN] Seq=3292148777 Win=16384 Len=0 MSS=1460 SACK_PERM=1"
"10220","5156.613879","152.172.117.61","131.243.1.10","TCP","62"," 1923  >  21 [SYN] Seq=3292148777 Win=16384 Len=0 MSS=1460 SACK_PERM=1"
"10263","5163.470903","131.243.1.10","152.172.117.61","TCP","54","21  >  1923 [FIN, ACK] Seq=1845190095 Ack=3292148779 Win=17520 Len=0"
"10304","5205.136336","173.218.67.133","131.243.1.10","TCP","74","33311  >  21 [SYN] Seq=2498043033 Win=5840 Len=0 MSS=1460 SACK_PERM=1 TSval=42472 TSecr=0 WS=1"
"10362","5207.376482","131.243.1.10","173.218.67.133","TCP","54","21  >  33311 [FIN, ACK] Seq=1024498458 Ack=2498043121 Win=17520 Len=0"
"10365","5334.807163","131.243.1.10","131.213.89.179","TCP","54","21  >  3866 [FIN, ACK] Seq=526117679 Ack=443755068 Win=17520 Len=0"
"10367","5410.902990","97.0.158.29","131.243.1.10","TCP","74","46189  >  21 [SYN] Seq=2703202794 Win=5840 Len=0 MSS=1460 SACK_PERM=1 TSval=494332448 TSecr=0 WS=1"
"10426","5412.062217","131.243.1.10","97.0.158.29","TCP","54","21  >  46189 [FIN, ACK] Seq=4236534483 Ack=2703202860 Win=17520 Len=0"
"10433","5480.583128","131.243.1.10","157.215.230.139","TCP","54","21  >  21986 [FIN, ACK] Seq=1181396059 Ack=1927027301 Win=16416 Len=0"
"10437","5612.490809","161.206.176.161","131.243.1.10","TCP","62","2726  >  21 [SYN] Seq=3530878059 Win=16384 Len=0 MSS=1460 SACK_PERM=1"
"10500","5674.021037","131.243.1.10","161.206.176.161","TCP","54","21  >  2726 [FIN, ACK] Seq=1634528857 Ack=3530878155 Win=17520 Len=0"
"10502","5683.632795","21.97.107.165","131.243.1.10","TCP","62","60804  >  21 [SYN] Seq=2816766624 Win=64240 Len=0 MSS=1380 SACK_PERM=1"
"10558","5690.446162","131.243.1.10","21.97.107.165","TCP","54","21  >  60804 [FIN, ACK] Seq=3500937770 Ack=2816766741 Win=16560 Len=0"
"10562","5701.622984","21.97.107.165","131.243.1.10","TCP","62","60835  >  21 [SYN] Seq=3760902752 Win=64240 Len=0 MSS=1380 SACK_PERM=1"
"10624","5872.816503","212.7.211.138","131.243.1.10","TCP","62","2110  >  21 [SYN] Seq=4096161 Win=8192 Len=0 MSS=1460 SACK_PERM=1"
"10673","5874.806743","212.7.211.138","131.243.1.10","TCP","62","2111  >  21 [SYN] Seq=4098175 Win=8192 Len=0 MSS=1460 SACK_PERM=1"
"10730","5884.658543","131.243.1.10","212.7.211.138","TCP","54","21  >  2110 [FIN, ACK] Seq=557307413 Ack=4096213 Win=17520 Len=0"
"10736","5961.376466","207.249.252.183","131.243.1.10","TCP","58","41431  >  21 [SYN] Seq=4099085767 Win=512 Len=0 MSS=1460"
"10800","6023.061520","209.187.104.128","131.243.1.10","TCP","74","32811  >  21 [SYN] Seq=3356135987 Win=5840 Len=0 MSS=1460 SACK_PERM=1 TSval=248127 TSecr=0 WS=1"
"10899","6073.296801","136.118.224.122","131.243.2.12","TCP","78","1533  >  21 [SYN] Seq=1508965868 Win=44620 Len=0 MSS=1460 WS=8 TSval=0 TSecr=0 SACK_PERM=1"
"10960","6121.566634","214.53.92.97","131.243.1.10","TCP","62","3146  >  21 [SYN] Seq=801720437 Win=64240 Len=0 MSS=1414 SACK_PERM=1"
"11142","6133.703703","131.243.1.10","214.53.92.97","TCP","54","21  >  3146 [FIN, ACK] Seq=1295544214 Ack=801721147 Win=16968 Len=0"
"11289","6268.552548","131.243.1.10","207.249.252.183","TCP","54","21  >  41431 [FIN, ACK] Seq=886519019 Ack=4099085922 Win=17520 Len=0"
"11385","6345.336655","146.25.22.32","131.243.1.10","TCP","62","2060  >  21 [SYN] Seq=1420544899 Win=64240 Len=0 MSS=1460 SACK_PERM=1"
"11510","6401.474761","131.243.1.10","209.187.104.128","TCP","54","21  >  32811 [FIN, ACK] Seq=1964045596 Ack=3356136212 Win=17520 Len=0"
"11533","6416.996660","143.248.150.114","131.243.1.10","TCP","62","1437  >  21 [SYN] Seq=3903431 Win=8192 Len=0 MSS=536 SACK_PERM=1"
"11592","6421.655479","143.248.150.114","131.243.1.10","TCP","62","1439  >  21 [SYN] Seq=3908073 Win=8192 Len=0 MSS=536 SACK_PERM=1"
"11688","6430.061717","131.243.1.10","143.248.150.114","TCP","54","21  >  1439 [FIN, ACK] Seq=1722693040 Ack=3908169 Win=16616 Len=0"
"11774","6438.850468","143.248.150.114","131.243.1.10","TCP","62","1441  >  21 [SYN] Seq=3925283 Win=8192 Len=0 MSS=536 SACK_PERM=1"
"11988","6566.141516","136.118.224.122","131.243.2.12","TCP","78","3668  >  21 [SYN] Seq=1637062701 Win=44620 Len=0 MSS=1460 WS=8 TSval=0 TSecr=0 SACK_PERM=1"
"12197","6648.628830","131.243.1.10","146.25.22.32","TCP","54","21  >  2060 [FIN, ACK] Seq=87962719 Ack=1420545045 Win=17520 Len=0"
"12295","6685.510620","157.231.148.18","131.243.2.12","TCP","62","2847  >  21 [SYN] Seq=1663378762 Win=16384 Len=0 MSS=1460 SACK_PERM=1"
"12394","6716.707078","38.93.253.216","131.243.2.12","TCP","62","1348  >  21 [SYN] Seq=141231675 Win=16384 Len=0 MSS=1460 SACK_PERM=1"
"12435","6723.420844","61.157.171.227","131.243.1.10","TCP","62","4251  >  21 [SYN] Seq=2888105025 Win=64240 Len=0 MSS=1416 SACK_PERM=1"
"12448","6726.353677","61.157.171.227","131.243.1.10","TCP","62"," 4251  >  21 [SYN] Seq=2888105025 Win=64240 Len=0 MSS=1416 SACK_PERM=1"
"12652","6765.134922","204.88.125.120","131.243.1.10","TCP","62","18242  >  21 [SYN] Seq=2620859861 Win=8760 Len=0 MSS=1460 SACK_PERM=1"
"13030","6855.577847","131.243.1.10","204.88.125.120","TCP","54","21  >  18242 [FIN, ACK] Seq=524304146 Ack=2620859966 Win=17520 Len=0"
"13688","7026.509723","32.183.12.123","131.243.1.10","TCP","62","61469  >  21 [SYN] Seq=1877815318 Win=16384 Len=0 MSS=1460 SACK_PERM=1"
"13771","7034.294946","131.243.1.10","61.157.171.227","TCP","54","21  >  4251 [FIN, ACK] Seq=1886063719 Ack=2888105147 Win=16992 Len=0"
"13803","7041.994458","15.190.17.141","131.243.1.10","TCP","58","54423  >  21 [SYN] Seq=1961390238 Win=64240 Len=0 MSS=1460"
"13965","7081.488477","131.243.1.10","15.190.17.141","TCP","54","21  >  54423 [FIN, ACK] Seq=1489359994 Ack=1961390342 Win=17520 Len=0"
"14470","7290.780033","15.190.17.141","131.243.1.10","TCP","58","59940  >  21 [SYN] Seq=3035942043 Win=64240 Len=0 MSS=1460"
"14720","7399.077352","131.243.1.10","15.190.17.141","TCP","54","21  >  59940 [FIN, ACK] Seq=487295050 Ack=3035942141 Win=17520 Len=0"
"14869","7736.087305","175.111.96.67","131.243.1.10","TCP","62","2292  >  21 [SYN] Seq=3087606085 Win=64240 Len=0 MSS=1460"
"14931","7884.226616","144.11.225.104","131.243.2.12","TCP","62","3020  >  21 [SYN] Seq=2182563523 Win=16384 Len=0 MSS=1460 SACK_PERM=1"
"14986","7909.853751","144.11.225.104","131.243.2.12","TCP","62","3023  >  21 [SYN] Seq=2189114226 Win=16384 Len=0 MSS=1460 SACK_PERM=1"
"14988","7912.800464","144.11.225.104","131.243.2.12","TCP","62"," 3023  >  21 [SYN] Seq=2189114226 Win=16384 Len=0 MSS=1460 SACK_PERM=1"
"15015","8038.551564","131.243.1.10","175.111.96.67","TCP","54","21  >  2292 [FIN, ACK] Seq=2199405136 Ack=3087606210 Win=17520 Len=0"
"15018","8053.440302","146.25.22.32","131.243.1.10","TCP","62","2166  >  21 [SYN] Seq=1851663639 Win=64240 Len=0 MSS=1460 SACK_PERM=1"
"15092","8117.237519","144.11.225.104","131.243.2.12","TCP","62","3027  >  21 [SYN] Seq=2241046772 Win=16384 Len=0 MSS=1460 SACK_PERM=1"
"15120","8194.984762","84.68.192.198","131.243.1.10","TCP","74","1669  >  21 [SYN] Seq=2908082118 Win=57344 Len=0 MSS=1380 WS=1 TSval=1219880107 TSecr=0"
"15184","8198.038328","131.243.1.10","84.68.192.198","TCP","54","21  >  1669 [FIN, ACK] Seq=1928414502 Ack=2908082206 Win=16560 Len=0"
"15188","8230.480645","157.231.148.18","131.243.2.12","TCP","62","5412  >  21 [SYN] Seq=2070494882 Win=16384 Len=0 MSS=1460 SACK_PERM=1"
"15190","8233.540004","157.231.148.18","131.243.2.12","TCP","62"," 5412  >  21 [SYN] Seq=2070494882 Win=16384 Len=0 MSS=1460 SACK_PERM=1"
"15211","8289.920692","154.171.221.209","128.3.12.44","TCP","74","1142  >  21 [SYN] Seq=466844630 Win=57344 Len=0 MSS=1460 WS=1 TSval=6227503 TSecr=0"
"15266","8315.330091","241.49.40.187","131.243.1.10","TCP","58","1872  >  21 [SYN] Seq=39911158 Win=8192 Len=0 MSS=1460"
"15317","8316.911162","241.49.40.187","131.243.1.10","TCP","58","1873  >  21 [SYN] Seq=39911165 Win=8192 Len=0 MSS=1460"
"15385","8324.666947","197.217.232.215","131.243.1.10","TCP","74","37944  >  21 [SYN] Seq=3609370337 Win=5840 Len=0 MSS=1460 SACK_PERM=1 TSval=146771804 TSecr=0 WS=1"
"15448","8326.890438","131.243.1.10","241.49.40.187","TCP","54","21  >  1872 [FIN, ACK] Seq=1933570683 Ack=39911210 Win=17520 Len=0"
"15467","8338.862113","131.243.1.10","197.217.232.215","TCP","54","21  >  37944 [FIN, ACK] Seq=567358708 Ack=3609370440 Win=17520 Len=0"
"15469","8339.869315","197.217.232.215","131.243.1.10","TCP","74","37947  >  21 [SYN] Seq=3636506586 Win=5840 Len=0 MSS=1460 SACK_PERM=1 TSval=146773325 TSecr=0 WS=1"
"15508","8340.367141","131.243.2.12","144.11.225.104","TCP","54","21  >  3020 [FIN, ACK] Seq=885488395 Ack=2182563763 Win=64240 Len=0"
"15534","8354.413119","197.217.232.215","131.243.1.10","TCP","74","37951  >  21 [SYN] Seq=3642476772 Win=5840 Len=0 MSS=1460 SACK_PERM=1 TSval=146774779 TSecr=0 WS=1"
"15588","8358.676662","131.243.1.10","146.25.22.32","TCP","54","21  >  2166 [FIN, ACK] Seq=2142750722 Ack=1851663803 Win=17520 Len=0"
"15599","8369.709330","197.217.232.215","131.243.1.10","TCP","74","37955  >  21 [SYN] Seq=3651356844 Win=5840 Len=0 MSS=1460 SACK_PERM=1 TSval=146776309 TSecr=0 WS=1"
"15657","8385.948722","197.217.232.215","131.243.1.10","TCP","74","37957  >  21 [SYN] Seq=3674803190 Win=5840 Len=0 MSS=1460 SACK_PERM=1 TSval=146777933 TSecr=0 WS=1"
"15715","8400.475849","165.78.71.101","128.3.28.48","TCP","74","38417  >  21 [SYN] Seq=1591427115 Win=5840 Len=0 MSS=1460 SACK_PERM=1 TSval=1003500407 TSecr=0 WS=1"
"15738","8400.861634","128.3.28.48","165.78.71.101","TCP","66","21  >  38417 [FIN, ACK] Seq=3426063394 Ack=1591427216 Win=5792 Len=0 TSval=2268976094 TSecr=1003500603"
"15741","8400.934976","165.78.71.101","128.3.28.48","TCP","74","38419  >  21 [SYN] Seq=1578765152 Win=5840 Len=0 MSS=1460 SACK_PERM=1 TSval=1003500642 TSecr=0 WS=1"
"15767","8401.940725","165.78.71.101","128.3.28.48","TCP","74","38421  >  21 [SYN] Seq=1584562740 Win=5840 Len=0 MSS=1460 SACK_PERM=1 TSval=1003501157 TSecr=0 WS=1"
"15786","8403.233563","197.217.232.215","131.243.1.10","TCP","74","37975  >  21 [SYN] Seq=3696859937 Win=5840 Len=0 MSS=1460 SACK_PERM=1 TSval=146779659 TSecr=0 WS=1"
"15852","8438.823060","108.97.140.165","131.243.1.10","TCP","74","47604  >  21 [SYN] Seq=1618053314 Win=5840 Len=0 MSS=1460 SACK_PERM=1 TSval=43806902 TSecr=0 WS=1"
"15898","8501.776757","131.243.1.10","108.97.140.165","TCP","54","21  >  47604 [FIN, ACK] Seq=2087696287 Ack=1618053357 Win=17520 Len=0"
"15900","8517.390501","197.217.232.215","131.243.1.10","TCP","74","37988  >  21 [SYN] Seq=3837765439 Win=5840 Len=0 MSS=1460 SACK_PERM=1 TSval=146791077 TSecr=0 WS=1"
"15953","8524.060393","241.49.40.187","131.243.1.10","TCP","58","1930  >  21 [SYN] Seq=40039808 Win=8192 Len=0 MSS=1460"
"16006","8530.989276","82.143.24.12","131.243.2.12","TCP","62","3848  >  21 [SYN] Seq=878482411 Win=16384 Len=0 MSS=1460 SACK_PERM=1"
"16020","8532.577058","197.217.232.215","131.243.1.10","TCP","74","38001  >  21 [SYN] Seq=3849366968 Win=5840 Len=0 MSS=1460 SACK_PERM=1 TSval=146792596 TSecr=0 WS=1"
"16100","8546.552827","131.243.1.10","197.217.232.215","TCP","54","21  >  38001 [FIN, ACK] Seq=1798805136 Ack=3849367072 Win=17520 Len=0"
"16128","8601.100865","197.113.3.99","128.3.20.245","TCP","62","1845  >  21 [SYN] Seq=785261745 Win=8760 Len=0 MSS=1460"
"16151","8606.397357","197.113.3.99","128.3.20.245","TCP","62","1847  >  21 [SYN] Seq=786680335 Win=8760 Len=0 MSS=1460"
"16181","8682.495146","82.143.24.12","131.243.2.12","TCP","62","4707  >  21 [SYN] Seq=928513909 Win=16384 Len=0 MSS=1460 SACK_PERM=1"
"16205","8694.585813","82.143.24.12","131.243.2.12","TCP","62","4566  >  21 [SYN] Seq=932724381 Win=16384 Len=0 MSS=1460 SACK_PERM=1"
"16304","8758.741600","82.143.24.12","131.243.2.12","TCP","62","1523  >  21 [SYN] Seq=956446784 Win=16384 Len=0 MSS=1460 SACK_PERM=1"
"16307","8759.169551","82.143.24.12","131.243.2.12","TCP","62","3141  >  21 [SYN] Seq=956676525 Win=16384 Len=0 MSS=1460 SACK_PERM=1"
"16320","8760.028676","137.89.200.240","131.243.1.10","TCP","74","54047  >  21 [SYN] Seq=1964292869 Win=5840 Len=0 MSS=1460 SACK_PERM=1 TSval=872764329 TSecr=0 WS=1"
"16390","8762.228104","117.30.154.129","131.243.1.10","TCP","62","63560  >  21 [SYN] Seq=597705 Win=8192 Len=0 MSS=1414 SACK_PERM=1"
"16457","8763.582000","131.243.1.10","137.89.200.240","TCP","54","21  >  54047 [FIN, ACK] Seq=4086438365 Ack=1964293000 Win=17520 Len=0"
"16482","8766.833349","131.243.1.10","117.30.154.129","TCP","54","21  >  63560 [FIN, ACK] Seq=1717283597 Ack=597845 Win=16968 Len=0"
"16560","8887.717154","197.113.3.99","128.3.20.245","TCP","62","1852  >  21 [SYN] Seq=856929551 Win=8760 Len=0 MSS=1460"
"16580","8985.516838","216.43.247.103","131.243.1.10","TCP","74","35217  >  21 [SYN] Seq=2188799900 Win=5840 Len=0 MSS=1460 SACK_PERM=1 TSval=1910012850 TSecr=0 WS=1"
"16647","9000.149702","131.243.1.10","216.43.247.103","TCP","54","21  >  35217 [FIN, ACK] Seq=3348569028 Ack=2188800020 Win=17520 Len=0"
"16655","9085.751825","128.3.12.44","154.171.221.209","TCP","54","21  >  1142 [FIN, ACK] Seq=1932480474 Ack=466844779 Win=4096 Len=0"
"16660","9214.934311","128.3.20.245","197.113.3.99","TCP","54","21  >  1847 [FIN, ACK] Seq=1895376748 Ack=786680473 Win=8632 Len=0"
"16664","9229.832986","131.243.2.12","157.231.148.18","TCP","54","21  >  5412 [RST] Seq=933552460 Win=64240 Len=0"
"16666","9410.903167","161.60.254.203","131.243.1.10","TCP","62","3596  >  21 [SYN] Seq=2135173337 Win=8760 Len=0 MSS=1460 SACK_PERM=1"
"16668","9413.847173","161.60.254.203","131.243.1.10","TCP","62"," 3596  >  21 [SYN] Seq=2135173337 Win=8760 Len=0 MSS=1460 SACK_PERM=1"
"16705","9438.019622","117.30.154.129","131.243.1.10","TCP","62","63557  >  21 [SYN] Seq=1273671 Win=8192 Len=0 MSS=1414 SACK_PERM=1"
"16795","9466.878799","131.243.1.10","161.60.254.203","TCP","54","21  >  3596 [FIN, ACK] Seq=4070652205 Ack=2135173404 Win=17520 Len=0"
"16799","9746.368128","38.93.253.216","131.243.2.12","TCP","62","5253  >  21 [SYN] Seq=1500500161 Win=16384 Len=0 MSS=1460 SACK_PERM=1"
"16900","9806.031512","38.93.253.216","203.174.5.11","TCP","62","5195  >  21 [SYN] Seq=1527412683 Win=16384 Len=0 MSS=1460 SACK_PERM=1"
"16963","9824.685478","34.214.121.62","131.243.1.10","TCP","74","34915  >  21 [SYN] Seq=3211049219 Win=5840 Len=0 MSS=1460 SACK_PERM=1 TSval=224906357 TSecr=0 WS=1"
"17042","9830.924828","131.243.1.10","34.214.121.62","TCP","54","21  >  34915 [FIN, ACK] Seq=834271940 Ack=3211049321 Win=17520 Len=0"
"17377","9941.417015","133.183.60.94","131.243.1.10","TCP","62","21527  >  21 [SYN] Seq=458067793 Win=64240 Len=0 MSS=1460 SACK_PERM=1"
"17446","9945.302971","131.243.1.10","133.183.60.94","TCP","54","21  >  21527 [FIN, ACK] Seq=3402244263 Ack=458067880 Win=17520 Len=0"
"17468","9951.242478","146.25.22.32","131.243.1.10","TCP","62","2387  >  21 [SYN] Seq=2335282523 Win=64240 Len=0 MSS=1460 SACK_PERM=1"
"17547","9955.026150","131.243.1.10","146.25.22.32","TCP","54","21  >  2387 [FIN, ACK] Seq=3454019495 Ack=2335282673 Win=17520 Len=0"
"17548","9955.029595","146.25.22.32","131.243.1.10","TCP","62","2389  >  21 [SYN] Seq=2336334856 Win=64240 Len=0 MSS=1460 SACK_PERM=1"
"18017","10094.115600","4.0.203.124","203.174.5.11","TCP","62","41456  >  21 [SYN] Seq=4081039490 Win=32768 Len=0 MSS=1380 WS=1"
"18025","10096.157744","4.0.203.124","203.174.5.11","TCP","62"," 41456  >  21 [SYN] Seq=4081039490 Win=32768 Len=0 MSS=1380 WS=1"
"18164","10140.607886","179.248.25.199","131.243.1.10","TCP","62","56607  >  21 [SYN] Seq=200219260 Win=64240 Len=0 MSS=1460 SACK_PERM=1"
"18420","10196.730461","131.243.1.10","179.248.25.199","TCP","54","21  >  56607 [FIN, ACK] Seq=537134251 Ack=200219427 Win=17520 Len=0"
"18676","10277.599970","150.142.170.91","131.243.1.10","TCP","62","1807  >  21 [SYN] Seq=3762255669 Win=16384 Len=0 MSS=1460 SACK_PERM=1"
"18989","10376.070458","0.154.22.194","131.243.1.10","TCP","78","3311  >  21 [SYN] Seq=2848338067 Win=32767 Len=0 MSS=1460 WS=1 TSval=0 TSecr=0 SACK_PERM=1"
"19050","10379.079298","131.243.1.10","0.154.22.194","TCP","54","21  >  3311 [FIN, ACK] Seq=1969742211 Ack=2848338169 Win=17520 Len=0"
"19051","10379.083792","0.154.22.194","131.243.1.10","TCP","78","3315  >  21 [SYN] Seq=2849304527 Win=32767 Len=0 MSS=1460 WS=1 TSval=0 TSecr=0 SACK_PERM=1"
"19120","10387.131267","0.154.22.194","131.243.1.10","TCP","78","3319  >  21 [SYN] Seq=2851474561 Win=32767 Len=0 MSS=1460 WS=1 TSval=0 TSecr=0 SACK_PERM=1"
"19167","10390.219251","0.154.22.194","131.243.1.10","TCP","78","3322  >  21 [SYN] Seq=2852393933 Win=32767 Len=0 MSS=1460 WS=1 TSval=0 TSecr=0 SACK_PERM=1"
"19217","10391.692303","0.154.22.194","131.243.1.10","TCP","78","3326  >  21 [SYN] Seq=2852966654 Win=32767 Len=0 MSS=1460 WS=1 TSval=0 TSecr=0 SACK_PERM=1"
"19304","10395.056567","0.154.22.194","131.243.1.10","TCP","78","3331  >  21 [SYN] Seq=2853999799 Win=32767 Len=0 MSS=1460 WS=1 TSval=0 TSecr=0 SACK_PERM=1"
"19386","10410.193735","203.174.5.11","38.93.253.216","TCP","54","21  >  5195 [FIN, ACK] Seq=636041219 Ack=1527421152 Win=32768 Len=0"
"19389","10438.621760","222.186.198.110","131.243.2.12","TCP","62","2834  >  21 [SYN] Seq=1807288724 Win=16384 Len=0 MSS=1460 SACK_PERM=1"
"19598","10585.023251","131.243.1.10","150.142.170.91","TCP","54","21  >  1807 [FIN, ACK] Seq=4235019999 Ack=3762255769 Win=17520 Len=0"
"19793","10695.868287","10.48.254.166","131.243.1.10","TCP","62","43453  >  21 [SYN] Seq=2367183766 Win=16384 Len=0 MSS=1460 SACK_PERM=1"
"19865","10706.671146","131.243.1.10","10.48.254.166","TCP","54","21  >  43453 [FIN, ACK] Seq=998072443 Ack=2367183821 Win=17520 Len=0"
"19909","10734.455359","230.101.18.175","128.3.12.44","TCP","74","3747  >  21 [SYN] Seq=2335379494 Win=57344 Len=0 MSS=1460 WS=1 TSval=315552864 TSecr=0"
"20100","11019.395036","133.183.60.94","131.243.1.10","TCP","62","22160  >  21 [SYN] Seq=743673837 Win=64240 Len=0 MSS=1460 SACK_PERM=1"
"20156","11021.663441","131.243.1.10","133.183.60.94","TCP","54","21  >  22160 [FIN, ACK] Seq=3661389659 Ack=743673925 Win=17520 Len=0"
"20160","11067.786268","133.183.60.94","131.243.1.10","TCP","62","22211  >  21 [SYN] Seq=756979442 Win=64240 Len=0 MSS=1460 SACK_PERM=1"
"20220","11197.687182","13.199.22.210","131.243.1.10","TCP","62","1876  >  21 [SYN] Seq=3471135529 Win=16384 Len=0 MSS=1460 SACK_PERM=1"
"20410","11206.792621","13.199.22.210","131.243.1.10","TCP","62","1879  >  21 [SYN] Seq=3473585588 Win=16384 Len=0 MSS=1460 SACK_PERM=1"
"20479","11292.545531","173.112.82.221","131.243.1.10","TCP","78","3774  >  21 [SYN] Seq=2248263698 Win=44620 Len=0 MSS=1460 WS=8 TSval=0 TSecr=0 SACK_PERM=1"
"20782","11426.437106","147.74.11.41","131.243.1.10","TCP","62","2423  >  21 [SYN] Seq=7256667 Win=8192 Len=0 MSS=1460 SACK_PERM=1"
"20917","11474.049465","163.50.170.250","131.243.1.10","TCP","62","18479  >  21 [SYN] Seq=2086862217 Win=16384 Len=0 MSS=1460 SACK_PERM=1"
"21004","11488.208859","131.243.1.10","163.50.170.250","TCP","54","21  >  18479 [FIN, ACK] Seq=4055996945 Ack=2086862333 Win=17520 Len=0"
