"1","0.000000","113.165.230.66","131.243.1.10","TCP","62","63267  >  21 [SYN] Seq=1678493483 Win=64240 Len=0 MSS=1460 SACK_PERM=1"
"56","91.565033","181.223.231.99","131.243.2.12","TCP","62","3362  >  21 [SYN] Seq=2469850254 Win=16384 Len=0 MSS=1460 SACK_PERM=1"
"119","126.553363","123.125.239.10","128.3.28.48","TCP","74","63004  >  21 [SYN] Seq=1171148531 Win=5840 Len=0 MSS=1460 SACK_PERM=1 TSval=314098082 TSecr=0 WS=1"
"152","130.084813","128.3.28.48","123.125.239.10","TCP","66","21  >  63004 [FIN, ACK] Seq=2887784308 Ack=1171148632 Win=5792 Len=0 TSval=2233538969 TSecr=314099851"
"153","130.091331","123.125.239.10","128.3.28.48","TCP","74","63011  >  21 [SYN] Seq=1179361229 Win=5840 Len=0 MSS=1460 SACK_PERM=1 TSval=314099854 TSecr=0 WS=1"
"189","135.002801","123.125.239.10","128.3.28.48","TCP","74","63016  >  21 [SYN] Seq=1184413743 Win=5840 Len=0 MSS=1460 SACK_PERM=1 TSval=314102420 TSecr=0 WS=1"
"311","194.648779","79.37.53.67","131.243.2.12","TCP","62","38255  >  21 [SYN] Seq=934586305 Win=16384 Len=0 MSS=1460 SACK_PERM=1"
"383","207.545969","79.37.53.67","131.243.2.12","TCP","54"," 38255  >  21 [FIN, ACK] Seq=934586618 Ack=2850454274 Win=16657 Len=0"
"401","216.393164","79.37.53.67","203.174.5.11","TCP","62","39897  >  21 [SYN] Seq=950349522 Win=16384 Len=0 MSS=1460 SACK_PERM=1"
"507","229.250687","79.37.53.67","203.174.5.11","TCP","54"," 39897  >  21 [FIN, ACK] Seq=950350118 Ack=863809124 Win=16386 Len=0"
"512","229.255209","203.174.5.11","79.37.53.67","TCP","54","21  >  39897 [FIN, ACK] Seq=863809138 Ack=950350119 Win=32768 Len=0"
"642","309.204589","131.243.1.10","113.165.230.66","TCP","54","21  >  63267 [FIN, ACK] Seq=2848450177 Ack=1678493544 Win=17520 Len=0"
"659","317.903117","182.125.36.184","131.243.1.10","TCP","58","46477  >  21 [SYN] Seq=2629967346 Win=8760 Len=0 MSS=1460"
"720","333.014547","240.86.67.4","131.243.1.10","TCP","62","4036  >  21 [SYN] Seq=1950806314 Win=16384 Len=0 MSS=1460 SACK_PERM=1"
"799","346.056505","131.243.1.10","240.86.67.4","TCP","54","21  >  4036 [FIN, ACK] Seq=2446012272 Ack=1950806436 Win=17520 Len=0"
"932","427.781391","116.106.109.148","131.243.1.10","TCP","62","4931  >  21 [SYN] Seq=1274017979 Win=64240 Len=0 MSS=1460 SACK_PERM=1"
"1302","583.488722","72.192.229.59","128.3.12.44","TCP","74","2997  >  21 [SYN] Seq=1503100016 Win=32120 Len=0 MSS=1460 SACK_PERM=1 TSval=60821156 TSecr=0 WS=1"
"1347","588.042784","79.37.53.67","131.243.2.12","TCP","62","37361  >  21 [SYN] Seq=1170577317 Win=16384 Len=0 MSS=1460 SACK_PERM=1"
"1393","596.195524","224.220.166.101","131.243.1.10","TCP","62","56537  >  21 [SYN] Seq=1130017749 Win=32768 Len=0 MSS=1460 WS=1"
"1445","597.305338","246.94.203.142","203.174.5.11","TCP","62","2658  >  21 [SYN] Seq=4068834244 Win=16384 Len=0 MSS=1460 SACK_PERM=1"
"1513","606.004739","131.243.1.10","116.106.109.148","TCP","54","21  >  4931 [FIN, ACK] Seq=4289575684 Ack=1274018389 Win=17520 Len=0"
"1541","609.971716","72.192.229.59","128.3.12.44","TCP","74","3001  >  21 [SYN] Seq=1529309888 Win=32120 Len=0 MSS=1460 SACK_PERM=1 TSval=60823805 TSecr=0 WS=1"
"1542","609.971926","128.3.12.44","72.192.229.59","TCP","54","21  >  2997 [FIN, ACK] Seq=129664737 Ack=1503100250 Win=4096 Len=0"
"1556","611.076824","79.37.53.67","203.174.5.11","TCP","62","40225  >  21 [SYN] Seq=1186864425 Win=16384 Len=0 MSS=1460 SACK_PERM=1"
"1624","616.594746","131.243.1.10","224.220.166.101","TCP","54","21  >  56537 [FIN, ACK] Seq=4013432653 Ack=1130017862 Win=17520 Len=0"
"1628","616.920177","72.192.229.59","128.3.12.44","TCP","74","3003  >  21 [SYN] Seq=1548218916 Win=32120 Len=0 MSS=1460 SACK_PERM=1 TSval=60824499 TSecr=0 WS=1"
"1689","622.055800","128.3.12.44","72.192.229.59","TCP","54","21  >  3003 [FIN, ACK] Seq=135808438 Ack=1548219078 Win=4096 Len=0"
"1690","622.060256","72.192.229.59","128.3.12.44","TCP","74","3005  >  21 [SYN] Seq=1543681211 Win=32120 Len=0 MSS=1460 SACK_PERM=1 TSval=60825013 TSecr=0 WS=1"
"1711","623.523959","79.37.53.67","203.174.5.11","TCP","54"," 40225  >  21 [FIN, ACK] Seq=1186864779 Ack=867904827 Win=16683 Len=0"
"1716","623.527817","203.174.5.11","79.37.53.67","TCP","54","21  >  40225 [FIN, ACK] Seq=867904841 Ack=1186864780 Win=32768 Len=0"
"1821","649.280013","131.243.1.10","182.125.36.184","TCP","54","21  >  46477 [FIN, ACK] Seq=304252235 Ack=2629967400 Win=17520 Len=0"
"1848","658.590381","27.172.198.213","131.243.1.10","TCP","74","1025  >  21 [SYN] Seq=1586062586 Win=5840 Len=0 MSS=1460 SACK_PERM=1 TSval=10610719 TSecr=0 WS=1"
"1983","684.440312","177.87.134.55","131.243.1.10","TCP","62","14462  >  21 [SYN] Seq=4203434425 Win=16384 Len=0 MSS=1460 SACK_PERM=1"
"2048","687.184550","131.243.1.10","177.87.134.55","TCP","54","21  >  14462 [FIN, ACK] Seq=2437755949 Ack=4203434559 Win=17520 Len=0"
"2153","736.109534","72.192.229.59","128.3.12.44","TCP","74","3014  >  21 [SYN] Seq=1686578557 Win=32120 Len=0 MSS=1460 SACK_PERM=1 TSval=60836418 TSecr=0 WS=1"
"2211","755.310998","195.55.62.39","131.243.1.10","TCP","78","52511  >  21 [SYN] Seq=3684174973 Win=16384 Len=0 MSS=1460 SACK_PERM=1 WS=1 TSval=148884112 TSecr=0"
"2284","759.713096","131.243.1.10","27.172.198.213","TCP","54","21  >  1025 [FIN, ACK] Seq=1469383021 Ack=1586062686 Win=17520 Len=0"
"2323","784.629027","158.218.249.29","131.243.1.10","TCP","74","40517  >  21 [SYN] Seq=1919850843 Win=5608 Len=0 MSS=1402 TSval=309536559 TSecr=0 WS=1"
"2388","786.830732","158.218.249.29","131.243.1.10","TCP","74","48676  >  21 [SYN] Seq=1925727702 Win=5608 Len=0 MSS=1402 TSval=309536779 TSecr=0 WS=1"
"2456","790.878434","131.243.1.10","158.218.249.29","TCP","54","21  >  48676 [FIN, ACK] Seq=4199817153 Ack=1925727843 Win=16824 Len=0"
"2459","790.881343","131.243.1.10","158.218.249.29","TCP","54","21  >  40517 [FIN, ACK] Seq=485992920 Ack=1919850960 Win=16824 Len=0"
"2538","840.910511","65.240.185.205","131.243.2.12","TCP","62","1841  >  21 [SYN] Seq=3124187105 Win=16384 Len=0 MSS=1460 SACK_PERM=1"
"2577","849.900141","16.18.143.122","131.243.1.10","TCP","74","3601  >  21 [SYN] Seq=2699103329 Win=16384 Len=0 MSS=1460 WS=1 TSval=1680806044 TSecr=0"
"2652","855.072629","131.243.1.10","16.18.143.122","TCP","54","21  >  3601 [FIN, ACK] Seq=3585165053 Ack=2699103435 Win=17520 Len=0"
"2943","965.795819","230.101.18.175","128.3.12.44","TCP","74","1914  >  21 [SYN] Seq=2631955524 Win=57344 Len=0 MSS=1460 WS=1 TSval=279964170 TSecr=0"
"3007","982.204114","79.37.53.67","131.243.2.12","TCP","62","37332  >  21 [SYN] Seq=1407814872 Win=16384 Len=0 MSS=1460 SACK_PERM=1"
"3088","997.127756","79.37.53.67","131.243.2.12","TCP","54"," 37332  >  21 [FIN, ACK] Seq=1407815186 Ack=2971971885 Win=16657 Len=0"
"3100","1004.193116","79.37.53.67","203.174.5.11","TCP","62","38798  >  21 [SYN] Seq=1423931211 Win=16384 Len=0 MSS=1460 SACK_PERM=1"
"3189","1016.569004","203.174.5.11","79.37.53.67","TCP","54","21  >  38798 [FIN, ACK] Seq=883072922 Ack=1423931632 Win=32768 Len=0"
"3253","1056.736875","131.243.1.10","195.55.62.39","TCP","54","21  >  52511 [FIN, ACK] Seq=2516193410 Ack=3684175045 Win=17520 Len=0"
"3465","1193.751233","41.54.26.143","131.243.1.10","TCP","62","18676  >  21 [SYN] Seq=1109730945 Win=16384 Len=0 MSS=1400 SACK_PERM=1"
"3536","1199.819238","203.174.5.11","246.94.203.142","TCP","54","21  >  2658 [FIN, ACK] Seq=867400397 Ack=4068842189 Win=32768 Len=0"
"3559","1232.259520","131.243.1.10","41.54.26.143","TCP","54","21  >  18676 [FIN, ACK] Seq=688268360 Ack=1109731080 Win=16800 Len=0"
"3569","1359.106848","181.223.231.99","131.243.2.12","TCP","62","2921  >  21 [SYN] Seq=212682238 Win=16384 Len=0 MSS=1460 SACK_PERM=1"
"3587","1361.844170","79.37.53.67","131.243.2.12","TCP","62","40373  >  21 [SYN] Seq=1641289142 Win=16384 Len=0 MSS=1460 SACK_PERM=1"
"3683","1385.388847","79.37.53.67","203.174.5.11","TCP","62","39096  >  21 [SYN] Seq=1657917497 Win=16384 Len=0 MSS=1460 SACK_PERM=1"
"3793","1420.360243","89.124.219.32","131.243.2.12","TCP","62","1886  >  21 [SYN] Seq=1567835972 Win=16384 Len=0 MSS=1460 SACK_PERM=1"
"3841","1432.019538","123.125.239.10","128.3.28.48","TCP","74","63662  >  21 [SYN] Seq=2541902128 Win=5840 Len=0 MSS=1460 SACK_PERM=1 TSval=314766563 TSecr=0 WS=1"
"3887","1437.712185","123.125.239.10","128.3.28.48","TCP","74","63666  >  21 [SYN] Seq=2540436333 Win=5840 Len=0 MSS=1460 SACK_PERM=1 TSval=314769479 TSecr=0 WS=1"
"3933","1443.649735","1.126.179.169","131.243.1.10","TCP","58","12340  >  21 [SYN] Seq=725323911 Win=512 Len=0 MSS=1460"
"4067","1459.978740","69.88.8.56","131.243.1.10","TCP","62","2569  >  21 [SYN] Seq=3829444673 Win=64240 Len=0 MSS=1460 SACK_PERM=1"
"4188","1474.840097","131.243.1.10","69.88.8.56","TCP","54","21  >  2569 [FIN, ACK] Seq=2352169986 Ack=3829444764 Win=17520 Len=0"
"4225","1480.149358","131.243.1.10","1.126.179.169","TCP","54","21  >  12340 [FIN, ACK] Seq=997335029 Ack=725324186 Win=17520 Len=0"
"4276","1495.115862","104.205.27.72","128.3.28.48","TCP","74","42694  >  21 [SYN] Seq=2708560480 Win=5840 Len=0 MSS=1460 SACK_PERM=1 TSval=335107530 TSecr=0 WS=1"
"4308","1496.647515","128.3.28.48","104.205.27.72","TCP","66","21  >  42694 [FIN, ACK] Seq=50012060 Ack=2708560581 Win=5792 Len=0 TSval=2233675612 TSecr=335108315"
"4309","1496.657565","104.205.27.72","128.3.28.48","TCP","74","42696  >  21 [SYN] Seq=2721548107 Win=5840 Len=0 MSS=1460 SACK_PERM=1 TSval=335108318 TSecr=0 WS=1"
"4344","1498.139052","104.205.27.72","128.3.28.48","TCP","74","42698  >  21 [SYN] Seq=2712879308 Win=5840 Len=0 MSS=1460 SACK_PERM=1 TSval=335109079 TSecr=0 WS=1"
"4402","1505.838991","104.205.27.72","128.3.28.48","TCP","74","42700  >  21 [SYN] Seq=2727342159 Win=5840 Len=0 MSS=1460 SACK_PERM=1 TSval=335113022 TSecr=0 WS=1"
"4466","1519.171471","30.146.52.247","131.243.1.10","TCP","62","2412  >  21 [SYN] Seq=775738884 Win=8192 Len=0 MSS=1380 SACK_PERM=1"
"4537","1523.469217","104.205.27.72","128.3.28.48","TCP","74","42702  >  21 [SYN] Seq=2754166692 Win=5840 Len=0 MSS=1460 SACK_PERM=1 TSval=335122051 TSecr=0 WS=1"
"4581","1525.509820","104.205.27.72","128.3.28.48","TCP","74","42704  >  21 [SYN] Seq=2767961232 Win=5840 Len=0 MSS=1460 SACK_PERM=1 TSval=335123096 TSecr=0 WS=1"
"4625","1527.876331","104.205.27.72","128.3.28.48","TCP","74","42706  >  21 [SYN] Seq=2758752492 Win=5840 Len=0 MSS=1460 SACK_PERM=1 TSval=335124308 TSecr=0 WS=1"
"4700","1532.761359","136.108.93.122","203.174.5.11","TCP","62","29456  >  21 [SYN] Seq=2973765677 Win=32768 Len=0 MSS=1460 WS=1"
"4748","1536.815260","20.191.125.223","242.70.74.100","TCP","58","52099  >  21 [SYN] Seq=1131396769 Win=8760 Len=0 MSS=1460"
"4753","1536.997430","30.146.52.247","131.243.1.10","TCP","62","2414  >  21 [SYN] Seq=1189977737 Win=8192 Len=0 MSS=1380 SACK_PERM=1"
"4882","1540.324619","242.70.74.100","20.191.125.223","TCP","54","21  >  52099 [FIN, ACK] Seq=26259510 Ack=1131396907 Win=8760 Len=0"
"4918","1542.214315","131.243.1.10","30.146.52.247","TCP","54","21  >  2414 [FIN, ACK] Seq=3887975213 Ack=1189977845 Win=16560 Len=0"
"4919","1542.215310","30.146.52.247","131.243.1.10","TCP","62","2416  >  21 [SYN] Seq=129593226 Win=8192 Len=0 MSS=1380 SACK_PERM=1"
"5384","1648.182423","120.186.15.61","131.243.1.10","TCP","74","3333  >  21 [SYN] Seq=2580967875 Win=16060 Len=0 MSS=1460 SACK_PERM=1 TSval=26161526 TSecr=0 WS=1"
"5449","1651.385144","4.251.189.14","131.243.1.10","TCP","74","60211  >  21 [SYN] Seq=2626169397 Win=5840 Len=0 MSS=1460 SACK_PERM=1 TSval=50541110 TSecr=0 WS=1"
"5525","1654.052844","131.243.1.10","4.251.189.14","TCP","54","21  >  60211 [FIN, ACK] Seq=2750399755 Ack=2626169514 Win=17520 Len=0"
"5559","1662.452948","168.254.152.132","131.243.2.12","TCP","62","2135  >  21 [SYN] Seq=2745912265 Win=16384 Len=0 MSS=1460 SACK_PERM=1"
"5616","1672.220350","191.27.3.166","131.243.1.10","TCP","62","37624  >  21 [SYN] Seq=2232748994 Win=64240 Len=0 MSS=1460 SACK_PERM=1"
"5763","1693.989382","131.243.1.10","120.186.15.61","TCP","54","21  >  3333 [FIN, ACK] Seq=1880616623 Ack=2580967974 Win=17520 Len=0"
"5806","1704.245888","8.113.23.107","128.3.12.44","TCP","74","10514  >  21 [SYN] Seq=3051394548 Win=57344 Len=0 MSS=1460 WS=1 TSval=1914132 TSecr=0"
"5840","1706.398989","128.3.12.44","8.113.23.107","TCP","54","21  >  10514 [FIN, ACK] Seq=315136437 Ack=3051394668 Win=4096 Len=0"
"6013","1748.319671","249.44.109.25","128.3.28.48","TCP","74","4136  >  21 [SYN] Seq=2714954371 Win=5840 Len=0 MSS=1460 SACK_PERM=1 TSval=160843415 TSecr=0 WS=1"
"6043","1749.633971","128.3.28.48","249.44.109.25","TCP","66","21  >  4136 [FIN, ACK] Seq=316150793 Ack=2714954472 Win=5792 Len=0 TSval=2233700908 TSecr=160843547"
"6044","1749.645162","249.44.109.25","128.3.28.48","TCP","74","4140  >  21 [SYN] Seq=2725840120 Win=5840 Len=0 MSS=1460 SACK_PERM=1 TSval=160843548 TSecr=0 WS=1"
"6082","1751.604047","249.44.109.25","128.3.28.48","TCP","74","4200  >  21 [SYN] Seq=2720602644 Win=5840 Len=0 MSS=1460 SACK_PERM=1 TSval=160843744 TSecr=0 WS=1"
"6108","1753.308423","79.37.53.67","131.243.2.12","TCP","62","39753  >  21 [SYN] Seq=1877665772 Win=16384 Len=0 MSS=1460 SACK_PERM=1"
"6130","1754.526921","128.3.28.48","249.44.109.25","TCP","66","21  >  4200 [FIN, ACK] Seq=318983009 Ack=2720602744 Win=5792 Len=0 TSval=2233701398 TSecr=160844036"
"6234","1769.241618","30.146.52.247","131.243.1.10","TCP","62","2439  >  21 [SYN] Seq=816570905 Win=8192 Len=0 MSS=1380 SACK_PERM=1"
"6298","1773.335523","30.146.52.247","131.243.1.10","TCP","62","2440  >  21 [SYN] Seq=590354120 Win=8192 Len=0 MSS=1380 SACK_PERM=1"
"6347","1775.555577","79.37.53.67","203.174.5.11","TCP","62","38586  >  21 [SYN] Seq=1893612447 Win=16384 Len=0 MSS=1460 SACK_PERM=1"
"6548","1801.718783","66.165.111.206","131.243.1.10","TCP","62","4559  >  21 [SYN] Seq=1923057539 Win=64800 Len=0 MSS=1440 SACK_PERM=1"
"6793","1823.936074","6.57.196.120","131.243.1.10","TCP","74","2302  >  21 [SYN] Seq=2322712151 Win=32120 Len=0 MSS=1460 SACK_PERM=1 TSval=262567166 TSecr=0 WS=1"
"6859","1825.936004","131.243.1.10","6.57.196.120","TCP","54","21  >  2302 [FIN, ACK] Seq=1655587942 Ack=2322712238 Win=17520 Len=0"
"6891","1832.866284","6.57.196.120","131.243.1.10","TCP","74","2304  >  21 [SYN] Seq=2346003212 Win=32120 Len=0 MSS=1460 SACK_PERM=1 TSval=262568058 TSecr=0 WS=1"
"7041","1853.975719","131.243.1.10","191.27.3.166","TCP","54","21  >  37624 [FIN, ACK] Seq=1063807858 Ack=2232749098 Win=17520 Len=0"
"7162","1884.543232","30.146.52.247","131.243.1.10","TCP","62","2450  >  21 [SYN] Seq=1083272609 Win=8192 Len=0 MSS=1380 SACK_PERM=1"
"7253","1891.443693","30.146.52.247","131.243.1.10","TCP","62","2455  >  21 [SYN] Seq=765647945 Win=8192 Len=0 MSS=1380 SACK_PERM=1"
"7254","1891.443693","30.146.52.247","131.243.1.10","TCP","62","2454  >  21 [SYN] Seq=1293574387 Win=8192 Len=0 MSS=1380 SACK_PERM=1"
"7255","1891.443963","30.146.52.247","131.243.1.10","TCP","62","2456  >  21 [SYN] Seq=1443972475 Win=8192 Len=0 MSS=1380 SACK_PERM=1"
"7448","1899.357119","30.146.52.247","131.243.1.10","TCP","62","2461  >  21 [SYN] Seq=1643152422 Win=8192 Len=0 MSS=1380 SACK_PERM=1"
"7667","1938.564968","179.192.184.110","131.243.1.10","TCP","62","34259  >  21 [SYN] Seq=2240561738 Win=16384 Len=0 MSS=1402 SACK_PERM=1"
"7952","2009.692460","40.159.39.117","131.243.2.12","TCP","62","1350  >  21 [SYN] Seq=3819789687 Win=16384 Len=0 MSS=1460 SACK_PERM=1"
"8011","2025.329188","89.124.219.32","131.243.2.12","TCP","54"," 1886  >  21 [FIN, ACK] Seq=1567844364 Ack=3042863981 Win=16748 Len=0"
"8138","2104.874041","131.243.1.10","66.165.111.206","TCP","54","21  >  4559 [FIN, ACK] Seq=912693043 Ack=1923058216 Win=17280 Len=0"
"8238","2168.910161","79.37.53.67","203.174.5.11","TCP","62","38046  >  21 [SYN] Seq=2129590580 Win=16384 Len=0 MSS=1460 SACK_PERM=1"
"8353","2207.684514","0.52.194.105","131.243.1.10","TCP","62","3131  >  21 [SYN] Seq=2086921672 Win=64240 Len=0 MSS=1460 SACK_PERM=1"
"8475","2241.916291","131.243.1.10","179.192.184.110","TCP","54","21  >  34259 [FIN, ACK] Seq=646771417 Ack=2240561895 Win=16824 Len=0"
"8544","2294.644745","131.243.1.10","0.52.194.105","TCP","54","21  >  3131 [FIN, ACK] Seq=105079599 Ack=2086921802 Win=17520 Len=0"
"8609","2364.750689","86.220.148.131","131.243.2.12","TCP","62","1126  >  21 [SYN] Seq=1090312 Win=8192 Len=0 MSS=536 SACK_PERM=1"
"8674","2385.075381","42.46.167.1","131.243.1.10","TCP","58","55522  >  21 [SYN] Seq=3419305693 Win=16384 Len=0 MSS=512"
"8724","2385.588853","131.243.1.10","42.46.167.1","TCP","54","21  >  55522 [FIN, ACK] Seq=2611023375 Ack=3419305759 Win=16384 Len=0"
"8729","2387.333694","131.243.2.12","86.220.148.131","TCP","54","21  >  1126 [FIN, ACK] Seq=3215428098 Ack=1090495 Win=65392 Len=0"
"8736","2389.717968","86.220.148.131","131.243.2.12","TCP","62","1131  >  21 [SYN] Seq=1115288 Win=8192 Len=0 MSS=536 SACK_PERM=1"
"8779","2403.439595","86.220.148.131","131.243.2.12","TCP","62","1133  >  21 [SYN] Seq=1129014 Win=8192 Len=0 MSS=536 SACK_PERM=1"
"8781","2404.384459","3.16.238.33","131.243.1.10","TCP","62","1999  >  21 [SYN] Seq=2862671309 Win=64240 Len=0 MSS=1452 SACK_PERM=1"
"8905","2413.350077","86.220.148.131","131.243.2.12","TCP","62","1135  >  21 [SYN] Seq=1138897 Win=8192 Len=0 MSS=536 SACK_PERM=1"
"8925","2417.558046","131.243.1.10","3.16.238.33","TCP","54","21  >  1999 [FIN, ACK] Seq=2190433061 Ack=2862671542 Win=17424 Len=0"
"8956","2434.948997","86.220.148.131","131.243.2.12","TCP","62","1138  >  21 [SYN] Seq=1160518 Win=8192 Len=0 MSS=536 SACK_PERM=1"
"8988","2440.821246","86.220.148.131","131.243.2.12","TCP","62","1142  >  21 [SYN] Seq=1166376 Win=8192 Len=0 MSS=536 SACK_PERM=1"
"9025","2448.593094","86.220.148.131","131.243.2.12","TCP","62","1144  >  21 [SYN] Seq=1174149 Win=8192 Len=0 MSS=536 SACK_PERM=1"
"9032","2449.805546","86.220.148.131","131.243.2.12","TCP","62","1145  >  21 [SYN] Seq=1175346 Win=8192 Len=0 MSS=536 SACK_PERM=1"
"9035","2450.195412","86.220.148.131","131.243.2.12","TCP","62","1146  >  21 [SYN] Seq=1175765 Win=8192 Len=0 MSS=536 SACK_PERM=1"
"9038","2450.435449","86.220.148.131","131.243.2.12","TCP","62","1147  >  21 [SYN] Seq=1175971 Win=8192 Len=0 MSS=536 SACK_PERM=1"
"9165","2479.935886","189.30.8.121","131.243.1.10","TCP","62","42968  >  21 [SYN] Seq=4093048810 Win=16384 Len=0 MSS=1460 SACK_PERM=1"
"9212","2480.524676","216.17.33.81","131.243.1.10","TCP","62","3277  >  21 [SYN] Seq=3448048119 Win=16384 Len=0 MSS=1460 SACK_PERM=1"
"9276","2482.432555","131.243.1.10","216.17.33.81","TCP","54","21  >  3277 [FIN, ACK] Seq=3065142876 Ack=3448048275 Win=17520 Len=0"
"9277","2482.433240","216.17.33.81","131.243.1.10","TCP","62","3279  >  21 [SYN] Seq=3448566602 Win=16384 Len=0 MSS=1460 SACK_PERM=1"
"9333","2483.852727","131.243.1.10","189.30.8.121","TCP","54","21  >  42968 [FIN, ACK] Seq=1337755256 Ack=4093048926 Win=17520 Len=0"
"9343","2484.459549","216.17.33.81","131.243.1.10","TCP","62","3281  >  21 [SYN] Seq=3449134337 Win=16384 Len=0 MSS=1460 SACK_PERM=1"
"9401","2486.380572","216.17.33.81","131.243.1.10","TCP","62","3283  >  21 [SYN] Seq=3449663539 Win=16384 Len=0 MSS=1460 SACK_PERM=1"
"9461","2490.339525","132.67.54.229","131.243.1.10","TCP","62","3856  >  21 [SYN] Seq=11120417 Win=8192 Len=0 MSS=1460 SACK_PERM=1"
"9566","2510.018582","3.16.238.33","131.243.1.10","TCP","62","2146  >  21 [SYN] Seq=1852895550 Win=16384 Len=0 MSS=1452 SACK_PERM=1"
"9647","2512.911187","3.16.238.33","131.243.1.10","TCP","62","2148  >  21 [SYN] Seq=1853717327 Win=16384 Len=0 MSS=1452 SACK_PERM=1"
"9856","2549.061135","79.37.53.67","131.243.2.12","TCP","62","40638  >  21 [SYN] Seq=2351849352 Win=16384 Len=0 MSS=1460 SACK_PERM=1"
"9868","2549.837431","131.243.1.10","132.67.54.229","TCP","54","21  >  3856 [FIN, ACK] Seq=3705952831 Ack=11120780 Win=17520 Len=0"
"9882","2552.062948","131.243.1.10","3.16.238.33","TCP","54","21  >  2148 [FIN, ACK] Seq=649112880 Ack=1853717406 Win=17424 Len=0"
"9946","2579.320754","79.37.53.67","203.174.5.11","TCP","62","39776  >  21 [SYN] Seq=2369581459 Win=16384 Len=0 MSS=1460 SACK_PERM=1"
"9968","2596.960082","160.231.206.89","131.243.1.10","TCP","62","1586  >  21 [SYN] Seq=9411981 Win=8192 Len=0 MSS=1460 SACK_PERM=1"
"10024","2603.912450","159.216.169.116","128.3.12.44","TCP","74","32777  >  21 [SYN] Seq=3547649380 Win=5840 Len=0 MSS=1460 SACK_PERM=1 TSval=692870 TSecr=0 WS=1"
"10080","2669.626899","132.67.54.229","131.243.1.10","TCP","62","3877  >  21 [SYN] Seq=11299839 Win=8192 Len=0 MSS=1460 SACK_PERM=1"
"10129","2678.698906","132.67.54.229","131.243.1.10","TCP","62","4053  >  21 [SYN] Seq=11308790 Win=8192 Len=0 MSS=1460 SACK_PERM=1"
"10174","2684.606309","131.243.1.10","132.67.54.229","TCP","54","21  >  4053 [FIN, ACK] Seq=146855762 Ack=11308833 Win=17520 Len=0"
"10176","2685.405445","132.67.54.229","131.243.1.10","TCP","62","4115  >  21 [SYN] Seq=11315486 Win=8192 Len=0 MSS=1460 SACK_PERM=1"
"10246","2706.306839","154.153.143.71","131.243.1.10","TCP","74","56303  >  21 [SYN] Seq=3424969350 Win=5840 Len=0 MSS=1412 SACK_PERM=1 TSval=97575 TSecr=0 WS=1"
"10306","2713.048600","131.243.1.10","154.153.143.71","TCP","54","21  >  56303 [FIN, ACK] Seq=3023219976 Ack=3424969430 Win=16944 Len=0"
"10317","2737.042823","101.114.196.190","131.243.1.10","TCP","58","10063  >  21 [SYN] Seq=1119764053 Win=8192 Len=0 MSS=1460"
"10377","2775.606252","131.243.1.10","132.67.54.229","TCP","54","21  >  4115 [FIN, ACK] Seq=4256106580 Ack=11315603 Win=17520 Len=0"
"10379","2782.154469","132.67.54.229","131.243.1.10","TCP","62","4139  >  21 [SYN] Seq=11412095 Win=8192 Len=0 MSS=1460 SACK_PERM=1"
"10444","2873.694787","42.46.167.1","128.3.12.44","TCP","58","55803  >  21 [SYN] Seq=3126035446 Win=16384 Len=0 MSS=512"
"10471","2874.343000","128.3.12.44","42.46.167.1","TCP","54","21  >  55803 [FIN, ACK] Seq=496512478 Ack=3126035522 Win=4096 Len=0"
"10474","2962.693499","79.37.53.67","131.243.2.12","TCP","62","37691  >  21 [SYN] Seq=2593182138 Win=16384 Len=0 MSS=1460 SACK_PERM=1"
"10531","2989.506449","79.37.53.67","203.174.5.11","TCP","62","40283  >  21 [SYN] Seq=2610320181 Win=16384 Len=0 MSS=1460 SACK_PERM=1"
"10634","3017.245743","128.3.12.44","159.216.169.116","TCP","54","21  >  32777 [FIN, ACK] Seq=454016796 Ack=3547649613 Win=4096 Len=0"
"10650","3119.797859","131.243.1.10","101.114.196.190","TCP","54","21  >  10063 [FIN, ACK] Seq=1500522842 Ack=1119764196 Win=17520 Len=0"
"10651","3119.805860","101.114.196.190","131.243.1.10","TCP","58","10066  >  21 [SYN] Seq=1207434129 Win=8192 Len=0 MSS=1460"
"10703","3125.188159","182.6.9.175","128.3.32.63","TCP","74","33006  >  21 [SYN] Seq=4176052118 Win=5840 Len=0 MSS=1460 SACK_PERM=1 TSval=3662874 TSecr=0 WS=1"
"10748","3163.985824","101.114.196.190","131.243.1.10","TCP","58","10068  >  21 [SYN] Seq=1217625083 Win=8192 Len=0 MSS=1460"
"10801","3178.971274","107.34.21.92","131.243.2.12","TCP","66","1099  >  21 [SYN] Seq=2345298682 Win=60352 Len=0 MSS=1460 WS=4 SACK_PERM=1"
"10864","3209.882810","84.68.192.198","131.243.1.10","TCP","74","1658  >  21 [SYN] Seq=159375807 Win=57344 Len=0 MSS=1380 WS=1 TSval=1184769085 TSecr=0"
"10935","3212.924366","131.243.1.10","84.68.192.198","TCP","54","21  >  1658 [FIN, ACK] Seq=3521080407 Ack=159375895 Win=16560 Len=0"
"10955","3213.727324","101.114.196.190","131.243.1.10","TCP","58","10070  >  21 [SYN] Seq=1229070799 Win=8192 Len=0 MSS=1460"
"11078","3248.856047","101.114.196.190","131.243.1.10","TCP","58","10072  >  21 [SYN] Seq=1237221347 Win=8192 Len=0 MSS=1460"
"11145","3254.844545","101.114.196.190","131.243.1.10","TCP","58","10074  >  21 [SYN] Seq=1238698633 Win=8192 Len=0 MSS=1460"
"11340","3334.276650","121.195.250.138","128.3.12.44","TCP","62","1368  >  21 [SYN] Seq=2973117409 Win=44032 Len=0 MSS=1452 SACK_PERM=1"
"11365","3337.254876","121.195.250.138","128.3.12.44","TCP","62","1370  >  21 [SYN] Seq=2973971327 Win=44032 Len=0 MSS=1452 SACK_PERM=1"
"11421","3352.689597","79.37.53.67","131.243.2.12","TCP","62","38908  >  21 [SYN] Seq=2829157153 Win=16384 Len=0 MSS=1460 SACK_PERM=1"
"11458","3357.419410","121.195.250.138","128.3.12.44","TCP","62","1372  >  21 [SYN] Seq=2979071713 Win=44032 Len=0 MSS=1452 SACK_PERM=1"
"11522","3365.858512","79.37.53.67","131.243.2.12","TCP","54"," 38908  >  21 [FIN, ACK] Seq=2829157485 Ack=3385736510 Win=16635 Len=0"
"11559","3386.099052","35.73.33.202","131.243.1.10","TCP","74","1052  >  21 [SYN] Seq=304584139 Win=5840 Len=0 MSS=1460 SACK_PERM=1 TSval=978476 TSecr=0 WS=1"
"11660","3406.222159","148.253.227.51","131.243.1.10","TCP","62","1059  >  21 [SYN] Seq=1472894 Win=8192 Len=0 MSS=536 SACK_PERM=1"
"11812","3432.822884","148.253.227.51","131.243.1.10","TCP","62","1061  >  21 [SYN] Seq=1499502 Win=8192 Len=0 MSS=536 SACK_PERM=1"
"11903","3449.126954","47.125.91.135","131.243.2.12","TCP","62","2255  >  21 [SYN] Seq=4066784043 Win=16384 Len=0 MSS=1460 SACK_PERM=1"
"11914","3450.209775","24.190.46.234","131.243.1.10","TCP","58","64846  >  21 [SYN] Seq=3584156901 Win=8760 Len=0 MSS=1460"
"11971","3450.650510","131.243.1.10","24.190.46.234","TCP","54","21  >  64846 [FIN, ACK] Seq=3767177961 Ack=3584156976 Win=17520 Len=0"
"11984","3454.599180","35.73.33.202","131.243.1.10","TCP","74","1054  >  21 [SYN] Seq=373294933 Win=5840 Len=0 MSS=1460 SACK_PERM=1 TSval=985326 TSecr=0 WS=1"
"12066","3461.057839","128.3.12.44","121.195.250.138","TCP","54","21  >  1368 [FIN, ACK] Seq=586688410 Ack=2973117476 Win=4096 Len=0"
"12068","3461.248612","216.43.247.103","131.243.1.10","TCP","74","53830  >  21 [SYN] Seq=232787550 Win=5840 Len=0 MSS=1460 SACK_PERM=1 TSval=1874847580 TSecr=0 WS=1"
"12109","3463.417656","26.250.204.76","131.243.1.10","TCP","62","3205  >  21 [SYN] Seq=2771092683 Win=65535 Len=0 MSS=1360 SACK_PERM=1"
"12178","3465.209996","131.243.1.10","26.250.204.76","TCP","54","21  >  3205 [FIN, ACK] Seq=1185176793 Ack=2771092884 Win=17680 Len=0"
"12179","3465.266935","26.250.204.76","131.243.1.10","TCP","62","3207  >  21 [SYN] Seq=2771615365 Win=65535 Len=0 MSS=1360 SACK_PERM=1"
"12273","3475.734146","131.243.1.10","216.43.247.103","TCP","54","21  >  53830 [FIN, ACK] Seq=1990658906 Ack=232787669 Win=17520 Len=0"
"12346","3514.697528","98.192.203.106","131.243.1.10","TCP","62","29027  >  21 [SYN] Seq=2827168482 Win=64240 Len=0 MSS=1400 SACK_PERM=1"
"12405","3517.181805","82.143.24.12","131.243.2.12","TCP","62","2281  >  21 [SYN] Seq=1567752780 Win=16384 Len=0 MSS=1460 SACK_PERM=1"
"12427","3520.684891","141.62.47.110","128.3.12.44","TCP","78","54659  >  21 [SYN] Seq=3168085820 Win=16384 Len=0 MSS=1460 SACK_PERM=1 WS=1 TSval=318802994 TSecr=0"
"12635","3574.946691","101.114.196.190","131.243.1.10","TCP","58","10076  >  21 [SYN] Seq=1311953051 Win=8192 Len=0 MSS=1460"
"12810","3617.185922","131.243.1.10","35.73.33.202","TCP","54","21  >  1052 [FIN, ACK] Seq=3430876057 Ack=304584261 Win=17520 Len=0"
"12814","3617.567048","82.143.24.12","131.243.2.12","TCP","62","2290  >  21 [SYN] Seq=1603923254 Win=16384 Len=0 MSS=1460 SACK_PERM=1"
"13154","3718.180499","131.243.1.10","148.253.227.51","TCP","54","21  >  1059 [FIN, ACK] Seq=44677541 Ack=1473229 Win=16616 Len=0"
"13209","3748.271029","110.112.122.22","131.243.2.12","TCP","62","2211  >  21 [SYN] Seq=1501643335 Win=16384 Len=0 MSS=1460 SACK_PERM=1"
"13268","3763.428252","79.37.53.67","131.243.2.12","TCP","62","37675  >  21 [SYN] Seq=3068999937 Win=16384 Len=0 MSS=1460 SACK_PERM=1"
"13429","3845.892431","82.143.24.12","131.243.2.12","TCP","62","3016  >  21 [SYN] Seq=1699462399 Win=16384 Len=0 MSS=1460 SACK_PERM=1"
"13584","3910.642016","143.106.218.181","131.243.1.10","TCP","74","60305  >  21 [SYN] Seq=3834635 Win=5840 Len=0 MSS=1460 SACK_PERM=1 TSval=16290425 TSecr=0 WS=1"
"13692","3955.397814","43.8.145.97","131.243.1.10","TCP","78","40210  >  21 [SYN] Seq=1962597323 Win=32850 Len=0 WS=2 TSval=320826488 TSecr=0 SACK_PERM=1 MSS=1414"
"13731","3956.684136","131.243.1.10","143.106.218.181","TCP","54","21  >  60305 [FIN, ACK] Seq=1481990639 Ack=3834785 Win=17520 Len=0"
"13742","3961.626434","0.131.191.60","131.243.1.10","TCP","62","1269  >  21 [SYN] Seq=373423 Win=8192 Len=0 MSS=1422 SACK_PERM=1"
"13952","3982.920066","0.131.191.60","131.243.1.10","TCP","62","1285  >  21 [SYN] Seq=394712 Win=8192 Len=0 MSS=1422 SACK_PERM=1"
"14010","3987.084338","131.243.1.10","0.131.191.60","TCP","54","21  >  1269 [FIN, ACK] Seq=1319497271 Ack=373785 Win=17064 Len=0"
"14055","4024.407588","40.12.141.141","242.70.74.100","TCP","62","2362  >  21 [SYN] Seq=98614441 Win=64240 Len=0 MSS=1460 SACK_PERM=1"
"14098","4040.088890","82.143.24.12","131.243.2.12","TCP","62","4882  >  21 [SYN] Seq=1790567523 Win=16384 Len=0 MSS=1460 SACK_PERM=1"
"14233","4094.962308","131.243.1.10","43.8.145.97","TCP","54","21  >  40210 [FIN, ACK] Seq=2594651772 Ack=1962597497 Win=16968 Len=0"
"14308","4151.191559","79.37.53.67","131.243.2.12","TCP","62","36156  >  21 [SYN] Seq=3304410189 Win=16384 Len=0 MSS=1460 SACK_PERM=1"
"14385","4173.410379","79.37.53.67","203.174.5.11","TCP","62","39666  >  21 [SYN] Seq=3320450643 Win=16384 Len=0 MSS=1460 SACK_PERM=1"
"14443","4186.972136","79.37.53.67","203.174.5.11","TCP","54"," 39666  >  21 [FIN, ACK] Seq=3320450931 Ack=907328746 Win=16764 Len=0"
"14472","4212.676584","6.18.109.183","131.243.1.10","TCP","62","61341  >  21 [SYN] Seq=992702697 Win=64240 Len=0 MSS=1380 SACK_PERM=1"
"14575","4267.804569","6.18.109.183","131.243.1.10","TCP","62","61344  >  21 [SYN] Seq=875684325 Win=64240 Len=0 MSS=1380 SACK_PERM=1"
"14727","4279.486489","101.114.196.190","131.243.1.10","TCP","58","10089  >  21 [SYN] Seq=1473781608 Win=8192 Len=0 MSS=1460"
"14763","4282.644666","28.36.15.115","131.243.1.10","TCP","62","2089  >  21 [SYN] Seq=9351664 Win=8192 Len=0 MSS=1332"
"14977","4320.639597","217.148.52.180","131.243.2.12","TCP","62","1292  >  21 [SYN] Seq=2987523625 Win=16384 Len=0 MSS=1460 SACK_PERM=1"
"15052","4346.089236","107.34.21.92","131.243.2.12","TCP","66","2029  >  21 [SYN] Seq=2647434564 Win=60352 Len=0 MSS=1460 WS=4 SACK_PERM=1"
"15199","4383.946681","210.90.252.151","131.243.1.10","TCP","74","41042  >  21 [SYN] Seq=1209697051 Win=5840 Len=0 MSS=1460 SACK_PERM=1 TSval=1106202453 TSecr=0 WS=1"
"15321","4403.015693","101.114.196.190","131.243.1.10","TCP","58","10094  >  21 [SYN] Seq=1502116526 Win=8192 Len=0 MSS=1460"
"15456","4429.015644","11.61.231.160","131.243.1.10","TCP","74","41700  >  21 [SYN] Seq=1272449446 Win=5840 Len=0 MSS=1460 SACK_PERM=1 TSval=222964247 TSecr=0 WS=1"
"15512","4429.830283","101.114.196.190","131.243.1.10","TCP","58","10100  >  21 [SYN] Seq=1508312364 Win=8192 Len=0 MSS=1460"
"15568","4430.578288","131.243.1.10","11.61.231.160","TCP","54","21  >  41700 [FIN, ACK] Seq=3143518241 Ack=1272449520 Win=17520 Len=0"
"15783","4485.499039","154.30.244.212","131.243.1.10","TCP","62","5877  >  21 [SYN] Seq=1186610399 Win=64240 Len=0 MSS=1460 SACK_PERM=1"
"15851","4487.761629","131.243.1.10","154.30.244.212","TCP","54","21  >  5877 [FIN, ACK] Seq=2710611272 Ack=1186610498 Win=17520 Len=0"
"15852","4487.762041","154.30.244.212","131.243.1.10","TCP","62","5935  >  21 [SYN] Seq=796301330 Win=64240 Len=0 MSS=1460 SACK_PERM=1"
"15934","4494.802415","11.61.231.160","131.243.1.10","TCP","74","42267  >  21 [SYN] Seq=1330021315 Win=5840 Len=0 MSS=1460 SACK_PERM=1 TSval=222970826 TSecr=0 WS=1"
"16037","4504.544400","131.243.1.10","11.61.231.160","TCP","54","21  >  42267 [FIN, ACK] Seq=239502503 Ack=1330021497 Win=17520 Len=0"
"16077","4515.409510","107.34.21.92","131.243.2.12","TCP","66","2462  >  21 [SYN] Seq=2692513107 Win=60352 Len=0 MSS=1460 WS=4 SACK_PERM=1"
"16152","4527.881163","31.83.68.172","128.3.12.44","TCP","74","62242  >  21 [SYN] Seq=3403385377 Win=32768 Len=0 MSS=1460 WS=1 TSval=2969254267 TSecr=0"
"16262","4547.672288","79.37.53.67","131.243.2.12","TCP","62","38252  >  21 [SYN] Seq=3541176863 Win=16384 Len=0 MSS=1460 SACK_PERM=1"
"16401","4560.390353","79.37.53.67","131.243.2.12","TCP","54"," 38252  >  21 [FIN, ACK] Seq=3541177285 Ack=3599852877 Win=16527 Len=0"
"16461","4571.754617","131.243.1.10","6.18.109.183","TCP","54","21  >  61344 [FIN, ACK] Seq=1059789610 Ack=875684912 Win=16560 Len=0"
"16472","4574.325951","11.61.231.160","131.243.1.10","TCP","74","42808  >  21 [SYN] Seq=1406365165 Win=5840 Len=0 MSS=1460 SACK_PERM=1 TSval=222978778 TSecr=0 WS=1"
"16601","4585.794945","131.243.1.10","28.36.15.115","TCP","54","21  >  2089 [FIN, ACK] Seq=1920727712 Ack=9351787 Win=17316 Len=0"
"16638","4592.303273","31.83.68.172","128.3.12.44","TCP","74","62249  >  21 [SYN] Seq=3900442425 Win=32768 Len=0 MSS=1460 WS=1 TSval=2969254396 TSecr=0"
"16762","4611.315175","96.73.248.101","128.3.12.44","TCP","78","5715  >  21 [SYN] Seq=1013511707 Win=16384 Len=0 MSS=1460 SACK_PERM=1 WS=1 TSval=101400953 TSecr=0"
"17063","4660.701954","101.114.196.190","131.243.1.10","TCP","58","10103  >  21 [SYN] Seq=1561203264 Win=8192 Len=0 MSS=1460"
"17320","4703.683343","228.99.213.82","128.3.12.44","TCP","62","2749  >  21 [SYN] Seq=2263277514 Win=16384 Len=0 MSS=1460 SACK_PERM=1"
"17360","4707.086532","228.99.213.82","128.3.12.44","TCP","62","2752  >  21 [SYN] Seq=2264275987 Win=16384 Len=0 MSS=1460 SACK_PERM=1"
"17371","4707.652862","91.7.201.120","128.3.12.44","TCP","58","42761  >  21 [SYN] Seq=3621401948 Win=8760 Len=0 MSS=1380"
"17458","4714.065882","128.3.12.44","228.99.213.82","TCP","54","21  >  2752 [FIN, ACK] Seq=809344882 Ack=2264276135 Win=4096 Len=0"
"17552","4732.108823","156.139.170.126","131.243.1.10","TCP","62","33435  >  21 [SYN] Seq=3115811751 Win=24820 Len=0 SACK_PERM=1 MSS=1460"
"17585","4732.346200","128.3.12.44","141.62.47.110","TCP","54","21  >  54659 [FIN, ACK] Seq=619840775 Ack=3168086001 Win=4096 Len=0"
"17637","4735.288490","131.243.1.10","156.139.170.126","TCP","54","21  >  33435 [FIN, ACK] Seq=1645681035 Ack=3115811884 Win=17520 Len=0"
"17643","4735.677810","101.114.196.190","131.243.1.10","TCP","58","10105  >  21 [SYN] Seq=1578450108 Win=8192 Len=0 MSS=1460"
"17645","4735.712373","108.44.231.26","131.243.1.10","TCP","62","36574  >  21 [SYN] Seq=3774948539 Win=64240 Len=0 MSS=1460 SACK_PERM=1"
"17738","4738.365055","11.61.231.160","131.243.1.10","TCP","74","44400  >  21 [SYN] Seq=1598634829 Win=5840 Len=0 MSS=1460 SACK_PERM=1 TSval=222995182 TSecr=0 WS=1"
"17741","4738.417346","97.89.211.226","128.3.12.44","TCP","74","49239  >  21 [SYN] Seq=1370389872 Win=65535 Len=0 MSS=1460 WS=2 TSval=384502 TSecr=0"
"17857","4741.897629","131.243.1.10","11.61.231.160","TCP","54","21  >  44400 [FIN, ACK] Seq=3897981339 Ack=1598634955 Win=17520 Len=0"
"17864","4742.729850","233.135.80.34","131.243.1.10","TCP","58","41318  >  21 [SYN] Seq=3725668916 Win=8760 Len=0 MSS=1460"
"17936","4744.499712","131.243.1.10","233.135.80.34","TCP","54","21  >  41318 [FIN, ACK] Seq=3969704962 Ack=3725668976 Win=17520 Len=0"
"17940","4744.518100","128.3.12.44","97.89.211.226","TCP","54","21  >  49239 [FIN, ACK] Seq=814400435 Ack=1370389990 Win=4096 Len=0"
"18095","4771.575550","107.34.21.92","131.243.2.12","TCP","66","1836  >  21 [SYN] Seq=2758897541 Win=60352 Len=0 MSS=1460 WS=4 SACK_PERM=1"
"18213","4787.818014","131.243.1.10","154.30.244.212","TCP","54","21  >  5935 [FIN, ACK] Seq=302567598 Ack=796301428 Win=17520 Len=0"
"18231","4788.492969","101.114.196.190","131.243.1.10","TCP","58","10108  >  21 [SYN] Seq=1590609951 Win=8192 Len=0 MSS=1460"
"18319","4793.503672","169.16.94.254","131.243.1.10","TCP","58","23639  >  21 [SYN] Seq=1833445473 Win=33580 Len=0 MSS=1460"
"18443","4802.887015","131.243.1.10","169.16.94.254","TCP","54","21  >  23639 [FIN, ACK] Seq=3854427752 Ack=1833445570 Win=17520 Len=0"
"18590","4824.473487","101.114.196.190","131.243.1.10","TCP","58","10110  >  21 [SYN] Seq=1598911296 Win=8192 Len=0 MSS=1460"
"18710","4834.021530","207.198.138.9","128.3.12.44","TCP","62","1321  >  21 [SYN] Seq=475656466 Win=8760 Len=0 MSS=1460 SACK_PERM=1"
"18880","4856.957962","254.240.108.155","131.243.1.10","TCP","74","32962  >  21 [SYN] Seq=1708870421 Win=5840 Len=0 MSS=1460 SACK_PERM=1 TSval=991924 TSecr=0 WS=1"
"18985","4862.562588","131.243.1.10","254.240.108.155","TCP","54","21  >  32962 [FIN, ACK] Seq=1198129281 Ack=1708870524 Win=17520 Len=0"
"18989","4863.203596","207.198.138.9","128.3.12.44","TCP","62","1323  >  21 [SYN] Seq=483047075 Win=8760 Len=0 MSS=1460 SACK_PERM=1"
"19259","4905.358387","12.201.183.87","128.3.12.44","TCP","74","60497  >  21 [SYN] Seq=2912200302 Win=16384 Len=0 MSS=1412 WS=1 TSval=8109737 TSecr=0"
"19279","4906.886920","128.3.12.44","31.83.68.172","TCP","54","21  >  62249 [FIN, ACK] Seq=785280589 Ack=3900442528 Win=4096 Len=0"
"19325","4910.544642","133.59.122.75","128.3.12.44","TCP","74","59337  >  21 [SYN] Seq=998759441 Win=16384 Len=0 MSS=1412 WS=1 TSval=17537282 TSecr=0"
"19327","4910.559714","128.3.12.44","12.201.183.87","TCP","54","21  >  60497 [FIN, ACK] Seq=839616441 Ack=2912200457 Win=4096 Len=0"
"19383","4915.342591","12.201.183.87","128.3.12.44","TCP","74","60468  >  21 [SYN] Seq=3777775467 Win=16384 Len=0 MSS=1412 WS=1 TSval=8109757 TSecr=0"
"19388","4915.388916","128.3.12.44","133.59.122.75","TCP","54","21  >  59337 [FIN, ACK] Seq=840384441 Ack=998759596 Win=4096 Len=0"
"19434","4919.102274","174.85.33.217","128.3.12.44","TCP","74","55791  >  21 [SYN] Seq=1437980430 Win=16384 Len=0 MSS=1412 WS=1 TSval=17537366 TSecr=0"
"19490","4923.328857","133.59.122.75","128.3.12.44","TCP","74","59318  >  21 [SYN] Seq=1877501688 Win=16384 Len=0 MSS=1412 WS=1 TSval=17537307 TSecr=0"
"19492","4923.345171","128.3.12.44","174.85.33.217","TCP","54","21  >  55791 [FIN, ACK] Seq=841856441 Ack=1437980585 Win=4096 Len=0"
"19537","4926.893728","242.70.74.100","40.12.141.141","TCP","54","21  >  2362 [FIN, ACK] Seq=348622356 Ack=98614529 Win=8760 Len=0"
"19589","4936.461231","79.37.53.67","131.243.2.12","TCP","62","41140  >  21 [SYN] Seq=3777670706 Win=16384 Len=0 MSS=1460 SACK_PERM=1"
"19732","4957.609426","79.37.53.67","203.174.5.11","TCP","62","40555  >  21 [SYN] Seq=3793539461 Win=16384 Len=0 MSS=1460 SACK_PERM=1"
"19817","4970.193799","79.37.53.67","203.174.5.11","TCP","54"," 40555  >  21 [FIN, ACK] Seq=3793539749 Ack=908800746 Win=16764 Len=0"
"19967","5017.496030","109.101.191.162","131.243.1.10","TCP","74","4246  >  21 [SYN] Seq=1897641993 Win=32120 Len=0 MSS=1460 SACK_PERM=1 TSval=135961299 TSecr=0 WS=1"
"20034","5020.087211","131.243.1.10","109.101.191.162","TCP","54","21  >  4246 [FIN, ACK] Seq=4095498376 Ack=1897642059 Win=17520 Len=0"
"20260","5093.516333","72.113.103.140","131.243.1.10","TCP","74","55285  >  21 [SYN] Seq=2882720741 Win=5840 Len=0 MSS=1460 SACK_PERM=1 TSval=786088296 TSecr=0 WS=1"
"20337","5098.160561","131.243.1.10","72.113.103.140","TCP","54","21  >  55285 [FIN, ACK] Seq=1949000003 Ack=2882720844 Win=17520 Len=0"
"20444","5141.840489","86.165.2.124","131.243.1.10","TCP","62","50119  >  21 [SYN] Seq=4244676483 Win=32768 Len=0 MSS=1460 WS=1"
"20551","5173.069301","79.36.161.226","131.243.1.10","TCP","58","32928  >  21 [SYN] Seq=509987997 Win=8760 Len=0 MSS=1460"
"20619","5175.937035","131.243.1.10","79.36.161.226","TCP","54","21  >  32928 [FIN, ACK] Seq=115057149 Ack=509988073 Win=17520 Len=0"
"20636","5182.858705","175.18.23.51","131.243.1.10","TCP","74","45629  >  21 [SYN] Seq=2327580616 Win=65535 Len=0 MSS=1460 WS=1 TSval=635948 TSecr=0"
"20714","5189.847162","131.243.1.10","175.18.23.51","TCP","54","21  >  45629 [FIN, ACK] Seq=1040896409 Ack=2327580777 Win=17520 Len=0"
"20789","5227.069324","116.177.87.124","131.243.1.10","TCP","74","4062  >  21 [SYN] Seq=2106195122 Win=32120 Len=0 MSS=1460 SACK_PERM=1 TSval=150480876 TSecr=0 WS=1"
"20860","5229.706186","131.243.1.10","116.177.87.124","TCP","54","21  >  4062 [FIN, ACK] Seq=3378145686 Ack=2106195253 Win=17520 Len=0"
"20897","5251.740752","79.88.120.7","131.243.1.10","TCP","74","35140  >  21 [SYN] Seq=2127513281 Win=5840 Len=0 MSS=1460 SACK_PERM=1 TSval=136989 TSecr=0 WS=1"
"20986","5272.660833","97.171.4.194","131.243.1.10","TCP","62","3503  >  21 [SYN] Seq=2124977829 Win=16384 Len=0 MSS=1460 SACK_PERM=1"
"21147","5316.277098","131.243.1.10","79.88.120.7","TCP","54","21  >  35140 [FIN, ACK] Seq=3792880201 Ack=2127513467 Win=17520 Len=0"
"21154","5319.372315","176.173.163.126","131.243.1.10","TCP","62","2245  >  21 [SYN] Seq=468326827 Win=64240 Len=0 MSS=1460"
