"1","0.000000","113.165.230.66","131.243.1.10","TCP","62","63267  >  21 [SYN] Seq=1678493483 Win=64240 Len=0 MSS=1460 SACK_PERM=1"
"56","91.565033","181.223.231.99","131.243.2.12","TCP","62","3362  >  21 [SYN] Seq=2469850254 Win=16384 Len=0 MSS=1460 SACK_PERM=1"
"119","126.553363","123.125.239.10","128.3.28.48","TCP","74","63004  >  21 [SYN] Seq=1171148531 Win=5840 Len=0 MSS=1460 SACK_PERM=1 TSval=314098082 TSecr=0 WS=1"
"153","130.091331","123.125.239.10","128.3.28.48","TCP","74","63011  >  21 [SYN] Seq=1179361229 Win=5840 Len=0 MSS=1460 SACK_PERM=1 TSval=314099854 TSecr=0 WS=1"
"157","130.468216","123.125.239.10","128.3.28.48","TCP","54","63004  >  21 [RST] Seq=1171148632 Win=0 Len=0"
"189","135.002801","123.125.239.10","128.3.28.48","TCP","74","63016  >  21 [SYN] Seq=1184413743 Win=5840 Len=0 MSS=1460 SACK_PERM=1 TSval=314102420 TSecr=0 WS=1"
"192","135.232478","123.125.239.10","128.3.28.48","TCP","54","63011  >  21 [RST] Seq=1179361332 Win=0 Len=0"
"229","140.936254","123.125.239.10","128.3.28.48","TCP","54","63016  >  21 [RST] Seq=1184413843 Win=0 Len=0"
"311","194.648779","79.37.53.67","131.243.2.12","TCP","62","38255  >  21 [SYN] Seq=934586305 Win=16384 Len=0 MSS=1460 SACK_PERM=1"
"388","207.724500","79.37.53.67","131.243.2.12","TCP","54","38255  >  21 [RST] Seq=934586619 Win=0 Len=0"
"401","216.393164","79.37.53.67","203.174.5.11","TCP","62","39897  >  21 [SYN] Seq=950349522 Win=16384 Len=0 MSS=1460 SACK_PERM=1"
"514","229.433355","79.37.53.67","203.174.5.11","TCP","54","39897  >  21 [RST] Seq=950350119 Win=0 Len=0"
"642","309.204589","131.243.1.10","113.165.230.66","TCP","54","21  >  63267 [FIN, ACK] Seq=2848450177 Ack=1678493544 Win=17520 Len=0"
"659","317.903117","182.125.36.184","131.243.1.10","TCP","58","46477  >  21 [SYN] Seq=2629967346 Win=8760 Len=0 MSS=1460"
"720","333.014547","240.86.67.4","131.243.1.10","TCP","62","4036  >  21 [SYN] Seq=1950806314 Win=16384 Len=0 MSS=1460 SACK_PERM=1"
"799","346.056505","131.243.1.10","240.86.67.4","TCP","54","21  >  4036 [FIN, ACK] Seq=2446012272 Ack=1950806436 Win=17520 Len=0"
"801","346.592197","240.86.67.4","131.243.1.10","TCP","54","4036  >  21 [FIN, ACK] Seq=1950806436 Ack=2446012273 Win=17352 Len=0"
"932","427.781391","116.106.109.148","131.243.1.10","TCP","62","4931  >  21 [SYN] Seq=1274017979 Win=64240 Len=0 MSS=1460 SACK_PERM=1"
"1302","583.488722","72.192.229.59","128.3.12.44","TCP","74","2997  >  21 [SYN] Seq=1503100016 Win=32120 Len=0 MSS=1460 SACK_PERM=1 TSval=60821156 TSecr=0 WS=1"
"1347","588.042784","79.37.53.67","131.243.2.12","TCP","62","37361  >  21 [SYN] Seq=1170577317 Win=16384 Len=0 MSS=1460 SACK_PERM=1"
"1393","596.195524","224.220.166.101","131.243.1.10","TCP","62","56537  >  21 [SYN] Seq=1130017749 Win=32768 Len=0 MSS=1460 WS=1"
"1445","597.305338","246.94.203.142","203.174.5.11","TCP","62","2658  >  21 [SYN] Seq=4068834244 Win=16384 Len=0 MSS=1460 SACK_PERM=1"
"1498","601.752115","79.37.53.67","131.243.2.12","TCP","54","37361  >  21 [RST] Seq=1170577606 Win=0 Len=0"
"1511","606.003765","116.106.109.148","131.243.1.10","TCP","54","4931  >  21 [FIN, ACK] Seq=1274018388 Ack=4289575684 Win=63351 Len=0"
"1513","606.004739","131.243.1.10","116.106.109.148","TCP","54","21  >  4931 [FIN, ACK] Seq=4289575684 Ack=1274018389 Win=17520 Len=0"
"1541","609.971716","72.192.229.59","128.3.12.44","TCP","74","3001  >  21 [SYN] Seq=1529309888 Win=32120 Len=0 MSS=1460 SACK_PERM=1 TSval=60823805 TSecr=0 WS=1"
"1556","611.076824","79.37.53.67","203.174.5.11","TCP","62","40225  >  21 [SYN] Seq=1186864425 Win=16384 Len=0 MSS=1460 SACK_PERM=1"
"1622","616.593658","224.220.166.101","131.243.1.10","TCP","54","56537  >  21 [FIN, ACK] Seq=1130017861 Ack=4013432653 Win=32768 Len=0"
"1624","616.594746","131.243.1.10","224.220.166.101","TCP","54","21  >  56537 [FIN, ACK] Seq=4013432653 Ack=1130017862 Win=17520 Len=0"
"1628","616.920177","72.192.229.59","128.3.12.44","TCP","74","3003  >  21 [SYN] Seq=1548218916 Win=32120 Len=0 MSS=1460 SACK_PERM=1 TSval=60824499 TSecr=0 WS=1"
"1690","622.060256","72.192.229.59","128.3.12.44","TCP","74","3005  >  21 [SYN] Seq=1543681211 Win=32120 Len=0 MSS=1460 SACK_PERM=1 TSval=60825013 TSecr=0 WS=1"
"1722","623.705891","79.37.53.67","203.174.5.11","TCP","54","40225  >  21 [RST] Seq=1186864780 Win=0 Len=0"
"1821","649.280013","131.243.1.10","182.125.36.184","TCP","54","21  >  46477 [FIN, ACK] Seq=304252235 Ack=2629967400 Win=17520 Len=0"
"1848","658.590381","27.172.198.213","131.243.1.10","TCP","74","1025  >  21 [SYN] Seq=1586062586 Win=5840 Len=0 MSS=1460 SACK_PERM=1 TSval=10610719 TSecr=0 WS=1"
"1983","684.440312","177.87.134.55","131.243.1.10","TCP","62","14462  >  21 [SYN] Seq=4203434425 Win=16384 Len=0 MSS=1460 SACK_PERM=1"
"2048","687.184550","131.243.1.10","177.87.134.55","TCP","54","21  >  14462 [FIN, ACK] Seq=2437755949 Ack=4203434559 Win=17520 Len=0"
"2050","687.388078","177.87.134.55","131.243.1.10","TCP","54","14462  >  21 [FIN, ACK] Seq=4203434559 Ack=2437755950 Win=17348 Len=0"
"2077","694.860884","181.223.231.99","131.243.2.12","TCP","54","3362  >  21 [RST] Seq=2469858871 Win=0 Len=0"
"2153","736.109534","72.192.229.59","128.3.12.44","TCP","74","3014  >  21 [SYN] Seq=1686578557 Win=32120 Len=0 MSS=1460 SACK_PERM=1 TSval=60836418 TSecr=0 WS=1"
"2211","755.310998","195.55.62.39","131.243.1.10","TCP","78","52511  >  21 [SYN] Seq=3684174973 Win=16384 Len=0 MSS=1460 SACK_PERM=1 WS=1 TSval=148884112 TSecr=0"
"2282","759.712304","27.172.198.213","131.243.1.10","TCP","54","1025  >  21 [FIN, ACK] Seq=1586062685 Ack=1469383021 Win=5840 Len=0"
"2284","759.713096","131.243.1.10","27.172.198.213","TCP","54","21  >  1025 [FIN, ACK] Seq=1469383021 Ack=1586062686 Win=17520 Len=0"
"2323","784.629027","158.218.249.29","131.243.1.10","TCP","74","40517  >  21 [SYN] Seq=1919850843 Win=5608 Len=0 MSS=1402 TSval=309536559 TSecr=0 WS=1"
"2388","786.830732","158.218.249.29","131.243.1.10","TCP","74","48676  >  21 [SYN] Seq=1925727702 Win=5608 Len=0 MSS=1402 TSval=309536779 TSecr=0 WS=1"
"2459","790.881343","131.243.1.10","158.218.249.29","TCP","54","21  >  40517 [FIN, ACK] Seq=485992920 Ack=1919850960 Win=16824 Len=0"
"2460","791.053093","158.218.249.29","131.243.1.10","TCP","54","48676  >  21 [FIN, ACK] Seq=1925727843 Ack=4199817154 Win=5608 Len=0"
"2538","840.910511","65.240.185.205","131.243.2.12","TCP","62","1841  >  21 [SYN] Seq=3124187105 Win=16384 Len=0 MSS=1460 SACK_PERM=1"
"2577","849.900141","16.18.143.122","131.243.1.10","TCP","74","3601  >  21 [SYN] Seq=2699103329 Win=16384 Len=0 MSS=1460 WS=1 TSval=1680806044 TSecr=0"
"2652","855.072629","131.243.1.10","16.18.143.122","TCP","54","21  >  3601 [FIN, ACK] Seq=3585165053 Ack=2699103435 Win=17520 Len=0"
"2657","855.386598","16.18.143.122","131.243.1.10","TCP","54","3601  >  21 [FIN, ACK] Seq=2699103435 Ack=3585165054 Win=17520 Len=0"
"2661","855.703094","16.18.143.122","131.243.1.10","TCP","54","3601  >  21 [RST] Seq=2699103436 Win=0 Len=0"
"2855","906.893989","65.240.185.205","131.243.2.12","TCP","54","1841  >  21 [RST] Seq=3124188334 Win=0 Len=0"
"2943","965.795819","230.101.18.175","128.3.12.44","TCP","74","1914  >  21 [SYN] Seq=2631955524 Win=57344 Len=0 MSS=1460 WS=1 TSval=279964170 TSecr=0"
"3007","982.204114","79.37.53.67","131.243.2.12","TCP","62","37332  >  21 [SYN] Seq=1407814872 Win=16384 Len=0 MSS=1460 SACK_PERM=1"
"3093","997.306623","79.37.53.67","131.243.2.12","TCP","54","37332  >  21 [RST] Seq=1407815187 Win=0 Len=0"
"3100","1004.193116","79.37.53.67","203.174.5.11","TCP","62","38798  >  21 [SYN] Seq=1423931211 Win=16384 Len=0 MSS=1460 SACK_PERM=1"
"3191","1016.747300","79.37.53.67","203.174.5.11","TCP","54","38798  >  21 [RST] Seq=1423931632 Win=0 Len=0"
"3253","1056.736875","131.243.1.10","195.55.62.39","TCP","54","21  >  52511 [FIN, ACK] Seq=2516193410 Ack=3684175045 Win=17520 Len=0"
"3431","1171.679390","72.192.229.59","128.3.12.44","TCP","54","3001  >  21 [RST] Seq=1529310053 Win=0 Len=0"
"3465","1193.751233","41.54.26.143","131.243.1.10","TCP","62","18676  >  21 [SYN] Seq=1109730945 Win=16384 Len=0 MSS=1400 SACK_PERM=1"
"3538","1199.994659","246.94.203.142","203.174.5.11","TCP","54","2658  >  21 [RST] Seq=4068842189 Win=0 Len=0"
"3557","1232.257966","41.54.26.143","131.243.1.10","TCP","54","18676  >  21 [FIN, ACK] Seq=1109731079 Ack=688268360 Win=16369 Len=0"
"3559","1232.259520","131.243.1.10","41.54.26.143","TCP","54","21  >  18676 [FIN, ACK] Seq=688268360 Ack=1109731080 Win=16800 Len=0"
"3561","1253.949850","182.125.36.184","131.243.1.10","TCP","54","46477  >  21 [FIN, ACK] Seq=2629967400 Ack=304252236 Win=8760 Len=0"
"3563","1282.249955","72.192.229.59","128.3.12.44","TCP","54","3014  >  21 [FIN, ACK] Seq=1686578721 Ack=159872465 Win=32696 Len=0"
"3566","1282.283120","128.3.12.44","72.192.229.59","TCP","54","21  >  3014 [FIN, ACK] Seq=159872502 Ack=1686578722 Win=4096 Len=0"
"3568","1282.543953","72.192.229.59","128.3.12.44","TCP","54","3014  >  21 [RST] Seq=1686578722 Win=0 Len=0"
"3569","1359.106848","181.223.231.99","131.243.2.12","TCP","62","2921  >  21 [SYN] Seq=212682238 Win=16384 Len=0 MSS=1460 SACK_PERM=1"
"3587","1361.844170","79.37.53.67","131.243.2.12","TCP","62","40373  >  21 [SYN] Seq=1641289142 Win=16384 Len=0 MSS=1460 SACK_PERM=1"
"3666","1375.598531","79.37.53.67","131.243.2.12","TCP","54","40373  >  21 [RST] Seq=1641289456 Win=0 Len=0"
"3683","1385.388847","79.37.53.67","203.174.5.11","TCP","62","39096  >  21 [SYN] Seq=1657917497 Win=16384 Len=0 MSS=1460 SACK_PERM=1"
"3756","1400.945072","79.37.53.67","203.174.5.11","TCP","54","39096  >  21 [RST] Seq=1657917742 Win=0 Len=0"
"3793","1420.360243","89.124.219.32","131.243.2.12","TCP","62","1886  >  21 [SYN] Seq=1567835972 Win=16384 Len=0 MSS=1460 SACK_PERM=1"
"3841","1432.019538","123.125.239.10","128.3.28.48","TCP","74","63662  >  21 [SYN] Seq=2541902128 Win=5840 Len=0 MSS=1460 SACK_PERM=1 TSval=314766563 TSecr=0 WS=1"
"3887","1437.712185","123.125.239.10","128.3.28.48","TCP","74","63666  >  21 [SYN] Seq=2540436333 Win=5840 Len=0 MSS=1460 SACK_PERM=1 TSval=314769479 TSecr=0 WS=1"
"3890","1437.897494","123.125.239.10","128.3.28.48","TCP","54","63662  >  21 [RST] Seq=2541902255 Win=0 Len=0"
"3933","1443.649735","1.126.179.169","131.243.1.10","TCP","58","12340  >  21 [SYN] Seq=725323911 Win=512 Len=0 MSS=1460"
"3943","1444.177945","123.125.239.10","128.3.28.48","TCP","54","63666  >  21 [RST] Seq=2540436466 Win=0 Len=0"
"4067","1459.978740","69.88.8.56","131.243.1.10","TCP","62","2569  >  21 [SYN] Seq=3829444673 Win=64240 Len=0 MSS=1460 SACK_PERM=1"
"4186","1474.839208","69.88.8.56","131.243.1.10","TCP","54","2569  >  21 [FIN, ACK] Seq=3829444763 Ack=2352169986 Win=64079 Len=0"
"4188","1474.840097","131.243.1.10","69.88.8.56","TCP","54","21  >  2569 [FIN, ACK] Seq=2352169986 Ack=3829444764 Win=17520 Len=0"
"4223","1480.148462","1.126.179.169","131.243.1.10","TCP","54","12340  >  21 [FIN, ACK] Seq=725324185 Ack=997335029 Win=16060 Len=0"
"4225","1480.149358","131.243.1.10","1.126.179.169","TCP","54","21  >  12340 [FIN, ACK] Seq=997335029 Ack=725324186 Win=17520 Len=0"
"4276","1495.115862","104.205.27.72","128.3.28.48","TCP","74","42694  >  21 [SYN] Seq=2708560480 Win=5840 Len=0 MSS=1460 SACK_PERM=1 TSval=335107530 TSecr=0 WS=1"
"4309","1496.657565","104.205.27.72","128.3.28.48","TCP","74","42696  >  21 [SYN] Seq=2721548107 Win=5840 Len=0 MSS=1460 SACK_PERM=1 TSval=335108318 TSecr=0 WS=1"
"4312","1496.743196","104.205.27.72","128.3.28.48","TCP","54","42694  >  21 [RST] Seq=2708560581 Win=0 Len=0"
"4344","1498.139052","104.205.27.72","128.3.28.48","TCP","74","42698  >  21 [SYN] Seq=2712879308 Win=5840 Len=0 MSS=1460 SACK_PERM=1 TSval=335109079 TSecr=0 WS=1"
"4347","1498.205517","104.205.27.72","128.3.28.48","TCP","54","42696  >  21 [RST] Seq=2721548210 Win=0 Len=0"
"4382","1500.433016","104.205.27.72","128.3.28.48","TCP","54","42698  >  21 [RST] Seq=2712879408 Win=0 Len=0"
"4402","1505.838991","104.205.27.72","128.3.28.48","TCP","74","42700  >  21 [SYN] Seq=2727342159 Win=5840 Len=0 MSS=1460 SACK_PERM=1 TSval=335113022 TSecr=0 WS=1"
"4466","1519.171471","30.146.52.247","131.243.1.10","TCP","62","2412  >  21 [SYN] Seq=775738884 Win=8192 Len=0 MSS=1380 SACK_PERM=1"
"4537","1523.469217","104.205.27.72","128.3.28.48","TCP","74","42702  >  21 [SYN] Seq=2754166692 Win=5840 Len=0 MSS=1460 SACK_PERM=1 TSval=335122051 TSecr=0 WS=1"
"4540","1523.561058","104.205.27.72","128.3.28.48","TCP","54","42700  >  21 [RST] Seq=2727342287 Win=0 Len=0"
"4581","1525.509820","104.205.27.72","128.3.28.48","TCP","74","42704  >  21 [SYN] Seq=2767961232 Win=5840 Len=0 MSS=1460 SACK_PERM=1 TSval=335123096 TSecr=0 WS=1"
"4586","1525.602830","104.205.27.72","128.3.28.48","TCP","54","42702  >  21 [RST] Seq=2754166825 Win=0 Len=0"
"4625","1527.876331","104.205.27.72","128.3.28.48","TCP","74","42706  >  21 [SYN] Seq=2758752492 Win=5840 Len=0 MSS=1460 SACK_PERM=1 TSval=335124308 TSecr=0 WS=1"
"4629","1527.966091","104.205.27.72","128.3.28.48","TCP","54","42704  >  21 [RST] Seq=2767961359 Win=0 Len=0"
"4674","1530.309975","104.205.27.72","128.3.28.48","TCP","66","42706  >  21 [FIN, ACK] Seq=2758752624 Ack=85041219 Win=5840 Len=0 TSval=335125555 TSecr=2233678969"
"4676","1530.310712","128.3.28.48","104.205.27.72","TCP","66","21  >  42706 [FIN, ACK] Seq=85041256 Ack=2758752625 Win=5792 Len=0 TSval=2233678978 TSecr=335125555"
"4678","1530.405684","104.205.27.72","128.3.28.48","TCP","54","42706  >  21 [RST] Seq=2758752625 Win=0 Len=0"
"4700","1532.761359","136.108.93.122","203.174.5.11","TCP","62","29456  >  21 [SYN] Seq=2973765677 Win=32768 Len=0 MSS=1460 WS=1"
"4748","1536.815260","20.191.125.223","242.70.74.100","TCP","58","52099  >  21 [SYN] Seq=1131396769 Win=8760 Len=0 MSS=1460"
"4753","1536.997430","30.146.52.247","131.243.1.10","TCP","62","2414  >  21 [SYN] Seq=1189977737 Win=8192 Len=0 MSS=1380 SACK_PERM=1"
"4879","1540.317036","20.191.125.223","242.70.74.100","TCP","54","52099  >  21 [FIN, ACK] Seq=1131396906 Ack=26259496 Win=8760 Len=0"
"4882","1540.324619","242.70.74.100","20.191.125.223","TCP","54","21  >  52099 [FIN, ACK] Seq=26259510 Ack=1131396907 Win=8760 Len=0"
"4888","1540.495735","20.191.125.223","242.70.74.100","TCP","54","52099  >  21 [RST] Seq=1131396907 Win=0 Len=0"
"4901","1541.253169","136.108.93.122","203.174.5.11","TCP","54","29456  >  21 [RST] Seq=2973765821 Win=32768 Len=0"
"4919","1542.215310","30.146.52.247","131.243.1.10","TCP","62","2416  >  21 [SYN] Seq=129593226 Win=8192 Len=0 MSS=1380 SACK_PERM=1"
"5384","1648.182423","120.186.15.61","131.243.1.10","TCP","74","3333  >  21 [SYN] Seq=2580967875 Win=16060 Len=0 MSS=1460 SACK_PERM=1 TSval=26161526 TSecr=0 WS=1"
"5449","1651.385144","4.251.189.14","131.243.1.10","TCP","74","60211  >  21 [SYN] Seq=2626169397 Win=5840 Len=0 MSS=1460 SACK_PERM=1 TSval=50541110 TSecr=0 WS=1"
"5559","1662.452948","168.254.152.132","131.243.2.12","TCP","62","2135  >  21 [SYN] Seq=2745912265 Win=16384 Len=0 MSS=1460 SACK_PERM=1"
"5616","1672.220350","191.27.3.166","131.243.1.10","TCP","62","37624  >  21 [SYN] Seq=2232748994 Win=64240 Len=0 MSS=1460 SACK_PERM=1"
"5761","1693.988576","120.186.15.61","131.243.1.10","TCP","54","3333  >  21 [FIN, ACK] Seq=2580967973 Ack=1880616623 Win=16060 Len=0"
"5763","1693.989382","131.243.1.10","120.186.15.61","TCP","54","21  >  3333 [FIN, ACK] Seq=1880616623 Ack=2580967974 Win=17520 Len=0"
"5806","1704.245888","8.113.23.107","128.3.12.44","TCP","74","10514  >  21 [SYN] Seq=3051394548 Win=57344 Len=0 MSS=1460 WS=1 TSval=1914132 TSecr=0"
"5837","1706.386125","8.113.23.107","128.3.12.44","TCP","54","10514  >  21 [FIN, ACK] Seq=3051394667 Ack=315136400 Win=57344 Len=0"
"5840","1706.398989","128.3.12.44","8.113.23.107","TCP","54","21  >  10514 [FIN, ACK] Seq=315136437 Ack=3051394668 Win=4096 Len=0"
"5844","1706.606072","8.113.23.107","128.3.12.44","TCP","54","10514  >  21 [RST] Seq=3051394668 Win=0 Len=0"
"6013","1748.319671","249.44.109.25","128.3.28.48","TCP","74","4136  >  21 [SYN] Seq=2714954371 Win=5840 Len=0 MSS=1460 SACK_PERM=1 TSval=160843415 TSecr=0 WS=1"
"6044","1749.645162","249.44.109.25","128.3.28.48","TCP","74","4140  >  21 [SYN] Seq=2725840120 Win=5840 Len=0 MSS=1460 SACK_PERM=1 TSval=160843548 TSecr=0 WS=1"
"6047","1749.737609","249.44.109.25","128.3.28.48","TCP","54","4136  >  21 [RST] Seq=2714954472 Win=0 Len=0"
"6080","1751.376147","249.44.109.25","128.3.28.48","TCP","54","4140  >  21 [RST] Seq=2725840223 Win=0 Len=0"
"6082","1751.604047","249.44.109.25","128.3.28.48","TCP","74","4200  >  21 [SYN] Seq=2720602644 Win=5840 Len=0 MSS=1460 SACK_PERM=1 TSval=160843744 TSecr=0 WS=1"
"6108","1753.308423","79.37.53.67","131.243.2.12","TCP","62","39753  >  21 [SYN] Seq=1877665772 Win=16384 Len=0 MSS=1460 SACK_PERM=1"
"6128","1754.526086","249.44.109.25","128.3.28.48","TCP","66","4200  >  21 [FIN, ACK] Seq=2720602743 Ack=318982972 Win=5840 Len=0 TSval=160844036 TSecr=2233701386"
"6130","1754.526921","128.3.28.48","249.44.109.25","TCP","66","21  >  4200 [FIN, ACK] Seq=318983009 Ack=2720602744 Win=5792 Len=0 TSval=2233701398 TSecr=160844036"
"6132","1754.629576","249.44.109.25","128.3.28.48","TCP","54","4200  >  21 [RST] Seq=2720602744 Win=0 Len=0"
"6222","1767.013671","79.37.53.67","131.243.2.12","TCP","54","39753  >  21 [RST] Seq=1877666043 Win=0 Len=0"
"6234","1769.241618","30.146.52.247","131.243.1.10","TCP","62","2439  >  21 [SYN] Seq=816570905 Win=8192 Len=0 MSS=1380 SACK_PERM=1"
"6298","1773.335523","30.146.52.247","131.243.1.10","TCP","62","2440  >  21 [SYN] Seq=590354120 Win=8192 Len=0 MSS=1380 SACK_PERM=1"
"6347","1775.555577","79.37.53.67","203.174.5.11","TCP","62","38586  >  21 [SYN] Seq=1893612447 Win=16384 Len=0 MSS=1460 SACK_PERM=1"
"6493","1788.141837","79.37.53.67","203.174.5.11","TCP","54","38586  >  21 [RST] Seq=1893612912 Win=0 Len=0"
"6548","1801.718783","66.165.111.206","131.243.1.10","TCP","62","4559  >  21 [SYN] Seq=1923057539 Win=64800 Len=0 MSS=1440 SACK_PERM=1"
"6793","1823.936074","6.57.196.120","131.243.1.10","TCP","74","2302  >  21 [SYN] Seq=2322712151 Win=32120 Len=0 MSS=1460 SACK_PERM=1 TSval=262567166 TSecr=0 WS=1"
"6891","1832.866284","6.57.196.120","131.243.1.10","TCP","74","2304  >  21 [SYN] Seq=2346003212 Win=32120 Len=0 MSS=1460 SACK_PERM=1 TSval=262568058 TSecr=0 WS=1"
"6961","1834.837620","131.243.1.10","6.57.196.120","TCP","54","21  >  2304 [FIN, ACK] Seq=821508068 Ack=2346003319 Win=17520 Len=0"
"6962","1835.006698","6.57.196.120","131.243.1.10","TCP","54","2304  >  21 [FIN, ACK] Seq=2346003319 Ack=821508069 Win=32120 Len=0"
"7039","1853.974715","191.27.3.166","131.243.1.10","TCP","54","37624  >  21 [FIN, ACK] Seq=2232749097 Ack=1063807858 Win=64064 Len=0"
"7041","1853.975719","131.243.1.10","191.27.3.166","TCP","54","21  >  37624 [FIN, ACK] Seq=1063807858 Ack=2232749098 Win=17520 Len=0"
"7162","1884.543232","30.146.52.247","131.243.1.10","TCP","62","2450  >  21 [SYN] Seq=1083272609 Win=8192 Len=0 MSS=1380 SACK_PERM=1"
"7253","1891.443693","30.146.52.247","131.243.1.10","TCP","62","2455  >  21 [SYN] Seq=765647945 Win=8192 Len=0 MSS=1380 SACK_PERM=1"
"7254","1891.443693","30.146.52.247","131.243.1.10","TCP","62","2454  >  21 [SYN] Seq=1293574387 Win=8192 Len=0 MSS=1380 SACK_PERM=1"
"7255","1891.443963","30.146.52.247","131.243.1.10","TCP","62","2456  >  21 [SYN] Seq=1443972475 Win=8192 Len=0 MSS=1380 SACK_PERM=1"
"7448","1899.357119","30.146.52.247","131.243.1.10","TCP","62","2461  >  21 [SYN] Seq=1643152422 Win=8192 Len=0 MSS=1380 SACK_PERM=1"
"7531","1907.507055","30.146.52.247","131.243.1.10","TCP","54","2450  >  21 [RST] Seq=1083272761 Win=0 Len=0"
"7535","1908.355020","30.146.52.247","131.243.1.10","TCP","54","2454  >  21 [FIN, ACK] Seq=1293574468 Ack=3254160829 Win=8013 Len=0"
"7541","1908.875915","30.146.52.247","131.243.1.10","TCP","54","2454  >  21 [RST] Seq=1293574469 Win=0 Len=0"
"7543","1908.877889","131.243.1.10","30.146.52.247","TCP","54","21  >  2454 [RST] Seq=3254160866 Win=0 Len=0"
"7667","1938.564968","179.192.184.110","131.243.1.10","TCP","62","34259  >  21 [SYN] Seq=2240561738 Win=16384 Len=0 MSS=1402 SACK_PERM=1"
"7856","1963.853812","181.223.231.99","131.243.2.12","TCP","54","2921  >  21 [RST] Seq=212691993 Win=0 Len=0"
"7952","2009.692460","40.159.39.117","131.243.2.12","TCP","62","1350  >  21 [SYN] Seq=3819789687 Win=16384 Len=0 MSS=1460 SACK_PERM=1"
"8016","2025.515859","89.124.219.32","131.243.2.12","TCP","54","1886  >  21 [RST] Seq=1567844365 Win=0 Len=0"
"8111","2087.783775","131.243.1.10","30.146.52.247","TCP","54","21  >  2440 [FIN, ACK] Seq=362255058 Ack=590354216 Win=16560 Len=0"
"8138","2104.874041","131.243.1.10","66.165.111.206","TCP","54","21  >  4559 [FIN, ACK] Seq=912693043 Ack=1923058216 Win=17280 Len=0"
"8140","2105.142109","66.165.111.206","131.243.1.10","TCP","54","4559  >  21 [FIN, ACK] Seq=1923058216 Ack=912693044 Win=64732 Len=0"
"8238","2168.910161","79.37.53.67","203.174.5.11","TCP","62","38046  >  21 [SYN] Seq=2129590580 Win=16384 Len=0 MSS=1460 SACK_PERM=1"
"8315","2182.057893","79.37.53.67","203.174.5.11","TCP","54","38046  >  21 [RST] Seq=2129590913 Win=0 Len=0"
"8353","2207.684514","0.52.194.105","131.243.1.10","TCP","62","3131  >  21 [SYN] Seq=2086921672 Win=64240 Len=0 MSS=1460 SACK_PERM=1"
"8515","2267.057998","168.254.152.132","131.243.2.12","TCP","54","2135  >  21 [RST] Seq=2745915722 Win=0 Len=0"
"8542","2294.643698","0.52.194.105","131.243.1.10","TCP","54","3131  >  21 [FIN, ACK] Seq=2086921801 Ack=105079599 Win=63907 Len=0"
"8544","2294.644745","131.243.1.10","0.52.194.105","TCP","54","21  >  3131 [FIN, ACK] Seq=105079599 Ack=2086921802 Win=17520 Len=0"
"8609","2364.750689","86.220.148.131","131.243.2.12","TCP","62","1126  >  21 [SYN] Seq=1090312 Win=8192 Len=0 MSS=536 SACK_PERM=1"
"8674","2385.075381","42.46.167.1","131.243.1.10","TCP","58","55522  >  21 [SYN] Seq=3419305693 Win=16384 Len=0 MSS=512"
"8722","2385.587920","42.46.167.1","131.243.1.10","TCP","54","55522  >  21 [FIN, ACK] Seq=3419305758 Ack=2611023375 Win=16384 Len=0"
"8724","2385.588853","131.243.1.10","42.46.167.1","TCP","54","21  >  55522 [FIN, ACK] Seq=2611023375 Ack=3419305759 Win=16384 Len=0"
"8734","2388.277576","86.220.148.131","131.243.2.12","TCP","54","1126  >  21 [RST] Seq=1090495 Win=0 Len=0"
"8736","2389.717968","86.220.148.131","131.243.2.12","TCP","62","1131  >  21 [SYN] Seq=1115288 Win=8192 Len=0 MSS=536 SACK_PERM=1"
"8779","2403.439595","86.220.148.131","131.243.2.12","TCP","62","1133  >  21 [SYN] Seq=1129014 Win=8192 Len=0 MSS=536 SACK_PERM=1"
"8781","2404.384459","3.16.238.33","131.243.1.10","TCP","62","1999  >  21 [SYN] Seq=2862671309 Win=64240 Len=0 MSS=1452 SACK_PERM=1"
"8874","2407.987837","86.220.148.131","131.243.2.12","TCP","54","1133  >  21 [RST] Seq=1129049 Win=0 Len=0"
"8887","2408.937363","131.243.2.12","86.220.148.131","TCP","54","21  >  1131 [FIN, ACK] Seq=3219291524 Ack=1115400 Win=65392 Len=0"
"8901","2409.989882","86.220.148.131","131.243.2.12","TCP","54","1131  >  21 [RST] Seq=1115400 Win=0 Len=0"
"8905","2413.350077","86.220.148.131","131.243.2.12","TCP","62","1135  >  21 [SYN] Seq=1138897 Win=8192 Len=0 MSS=536 SACK_PERM=1"
"8956","2434.948997","86.220.148.131","131.243.2.12","TCP","62","1138  >  21 [SYN] Seq=1160518 Win=8192 Len=0 MSS=536 SACK_PERM=1"
"8988","2440.821246","86.220.148.131","131.243.2.12","TCP","62","1142  >  21 [SYN] Seq=1166376 Win=8192 Len=0 MSS=536 SACK_PERM=1"
"8991","2441.016093","86.220.148.131","131.243.2.12","TCP","54","1138  >  21 [FIN, ACK] Seq=1160644 Ack=3226133102 Win=8132 Len=0"
"8996","2442.073410","86.220.148.131","131.243.2.12","TCP","54","1138  >  21 [RST] Seq=1160645 Win=0 Len=0"
"9025","2448.593094","86.220.148.131","131.243.2.12","TCP","62","1144  >  21 [SYN] Seq=1174149 Win=8192 Len=0 MSS=536 SACK_PERM=1"
"9032","2449.805546","86.220.148.131","131.243.2.12","TCP","62","1145  >  21 [SYN] Seq=1175346 Win=8192 Len=0 MSS=536 SACK_PERM=1"
"9035","2450.195412","86.220.148.131","131.243.2.12","TCP","62","1146  >  21 [SYN] Seq=1175765 Win=8192 Len=0 MSS=536 SACK_PERM=1"
"9038","2450.435449","86.220.148.131","131.243.2.12","TCP","62","1147  >  21 [SYN] Seq=1175971 Win=8192 Len=0 MSS=536 SACK_PERM=1"
"9158","2472.785519","86.220.148.131","131.243.2.12","TCP","54","1135  >  21 [RST] Seq=1139021 Win=0 Len=0"
"9165","2479.935886","189.30.8.121","131.243.1.10","TCP","62","42968  >  21 [SYN] Seq=4093048810 Win=16384 Len=0 MSS=1460 SACK_PERM=1"
"9212","2480.524676","216.17.33.81","131.243.1.10","TCP","62","3277  >  21 [SYN] Seq=3448048119 Win=16384 Len=0 MSS=1460 SACK_PERM=1"
"9277","2482.433240","216.17.33.81","131.243.1.10","TCP","62","3279  >  21 [SYN] Seq=3448566602 Win=16384 Len=0 MSS=1460 SACK_PERM=1"
"9333","2483.852727","131.243.1.10","189.30.8.121","TCP","54","21  >  42968 [FIN, ACK] Seq=1337755256 Ack=4093048926 Win=17520 Len=0"
"9334","2483.946355","189.30.8.121","131.243.1.10","TCP","54","42968  >  21 [FIN, ACK] Seq=4093048926 Ack=1337755257 Win=17356 Len=0"
"9343","2484.459549","216.17.33.81","131.243.1.10","TCP","62","3281  >  21 [SYN] Seq=3449134337 Win=16384 Len=0 MSS=1460 SACK_PERM=1"
"9398","2486.378095","216.17.33.81","131.243.1.10","TCP","54","3281  >  21 [FIN, ACK] Seq=3449134492 Ack=1592778853 Win=17284 Len=0"
"9401","2486.380572","216.17.33.81","131.243.1.10","TCP","62","3283  >  21 [SYN] Seq=3449663539 Win=16384 Len=0 MSS=1460 SACK_PERM=1"
"9461","2490.339525","132.67.54.229","131.243.1.10","TCP","62","3856  >  21 [SYN] Seq=11120417 Win=8192 Len=0 MSS=1460 SACK_PERM=1"
"9566","2510.018582","3.16.238.33","131.243.1.10","TCP","62","2146  >  21 [SYN] Seq=1852895550 Win=16384 Len=0 MSS=1452 SACK_PERM=1"
"9647","2512.911187","3.16.238.33","131.243.1.10","TCP","62","2148  >  21 [SYN] Seq=1853717327 Win=16384 Len=0 MSS=1452 SACK_PERM=1"
"9847","2540.546342","179.192.184.110","131.243.1.10","TCP","54","34259  >  21 [RST] Seq=2240561895 Win=0 Len=0"
"9856","2549.061135","79.37.53.67","131.243.2.12","TCP","62","40638  >  21 [SYN] Seq=2351849352 Win=16384 Len=0 MSS=1460 SACK_PERM=1"
"9927","2562.441989","79.37.53.67","131.243.2.12","TCP","54","40638  >  21 [RST] Seq=2351849619 Win=0 Len=0"
"9940","2578.951080","3.16.238.33","131.243.1.10","TCP","54","2146  >  21 [FIN, ACK] Seq=1852895781 Ack=389902755 Win=16849 Len=0"
"9942","2578.952174","131.243.1.10","3.16.238.33","TCP","54","21  >  2146 [FIN, ACK] Seq=389902755 Ack=1852895782 Win=17424 Len=0"
"9946","2579.320754","79.37.53.67","203.174.5.11","TCP","62","39776  >  21 [SYN] Seq=2369581459 Win=16384 Len=0 MSS=1460 SACK_PERM=1"
"9952","2580.716272","79.37.53.67","203.174.5.11","TCP","54","39776  >  21 [RST] Seq=2369581460 Win=0 Len=0"
"9968","2596.960082","160.231.206.89","131.243.1.10","TCP","62","1586  >  21 [SYN] Seq=9411981 Win=8192 Len=0 MSS=1460 SACK_PERM=1"
"10024","2603.912450","159.216.169.116","128.3.12.44","TCP","74","32777  >  21 [SYN] Seq=3547649380 Win=5840 Len=0 MSS=1460 SACK_PERM=1 TSval=692870 TSecr=0 WS=1"
"10070","2614.137250","40.159.39.117","131.243.2.12","TCP","54","1350  >  21 [FIN, ACK] Seq=3819794321 Ack=3146037035 Win=16118 Len=0"
"10073","2614.317582","40.159.39.117","131.243.2.12","TCP","54","1350  >  21 [RST] Seq=3819794322 Win=0 Len=0"
"10080","2669.626899","132.67.54.229","131.243.1.10","TCP","62","3877  >  21 [SYN] Seq=11299839 Win=8192 Len=0 MSS=1460 SACK_PERM=1"
"10129","2678.698906","132.67.54.229","131.243.1.10","TCP","62","4053  >  21 [SYN] Seq=11308790 Win=8192 Len=0 MSS=1460 SACK_PERM=1"
"10176","2685.405445","132.67.54.229","131.243.1.10","TCP","62","4115  >  21 [SYN] Seq=11315486 Win=8192 Len=0 MSS=1460 SACK_PERM=1"
"10179","2685.816251","132.67.54.229","131.243.1.10","TCP","54","4053  >  21 [RST] Seq=11308833 Win=0 Len=0"
"10246","2706.306839","154.153.143.71","131.243.1.10","TCP","74","56303  >  21 [SYN] Seq=3424969350 Win=5840 Len=0 MSS=1412 SACK_PERM=1 TSval=97575 TSecr=0 WS=1"
"10304","2713.047749","154.153.143.71","131.243.1.10","TCP","54","56303  >  21 [FIN, ACK] Seq=3424969429 Ack=3023219976 Win=5840 Len=0"
"10306","2713.048600","131.243.1.10","154.153.143.71","TCP","54","21  >  56303 [FIN, ACK] Seq=3023219976 Ack=3424969430 Win=16944 Len=0"
"10316","2722.272029","160.231.206.89","131.243.1.10","TCP","54","1586  >  21 [RST] Seq=9412077 Win=0 Len=0"
"10317","2737.042823","101.114.196.190","131.243.1.10","TCP","58","10063  >  21 [SYN] Seq=1119764053 Win=8192 Len=0 MSS=1460"
"10379","2782.154469","132.67.54.229","131.243.1.10","TCP","62","4139  >  21 [SYN] Seq=11412095 Win=8192 Len=0 MSS=1460 SACK_PERM=1"
"10428","2787.125021","131.243.1.10","216.17.33.81","TCP","54","21  >  3283 [FIN, ACK] Seq=1365884642 Ack=3449663694 Win=17520 Len=0"
"10434","2810.976859","132.67.54.229","131.243.1.10","TCP","54","4139  >  21 [FIN, ACK] Seq=11412156 Ack=2447997073 Win=8711 Len=0"
"10436","2810.977771","131.243.1.10","132.67.54.229","TCP","54","21  >  4139 [FIN, ACK] Seq=2447997073 Ack=11412157 Win=17520 Len=0"
"10444","2873.694787","42.46.167.1","128.3.12.44","TCP","58","55803  >  21 [SYN] Seq=3126035446 Win=16384 Len=0 MSS=512"
"10468","2874.330983","42.46.167.1","128.3.12.44","TCP","54","55803  >  21 [FIN, ACK] Seq=3126035521 Ack=496512441 Win=16384 Len=0"
"10471","2874.343000","128.3.12.44","42.46.167.1","TCP","54","21  >  55803 [FIN, ACK] Seq=496512478 Ack=3126035522 Win=4096 Len=0"
"10473","2874.362227","42.46.167.1","128.3.12.44","TCP","54","55803  >  21 [RST] Seq=3126035522 Win=0 Len=0"
"10474","2962.693499","79.37.53.67","131.243.2.12","TCP","62","37691  >  21 [SYN] Seq=2593182138 Win=16384 Len=0 MSS=1460 SACK_PERM=1"
"10530","2976.277530","79.37.53.67","131.243.2.12","TCP","54","37691  >  21 [RST] Seq=2593182453 Win=0 Len=0"
"10531","2989.506449","79.37.53.67","203.174.5.11","TCP","62","40283  >  21 [SYN] Seq=2610320181 Win=16384 Len=0 MSS=1460 SACK_PERM=1"
"10630","3002.113608","79.37.53.67","203.174.5.11","TCP","54","40283  >  21 [RST] Seq=2610320953 Win=0 Len=0"
"10631","3017.228231","159.216.169.116","128.3.12.44","TCP","54","32777  >  21 [FIN, ACK] Seq=3547649612 Ack=454016759 Win=5840 Len=0"
"10634","3017.245743","128.3.12.44","159.216.169.116","TCP","54","21  >  32777 [FIN, ACK] Seq=454016796 Ack=3547649613 Win=4096 Len=0"
"10636","3017.493606","159.216.169.116","128.3.12.44","TCP","54","32777  >  21 [RST] Seq=3547649613 Win=0 Len=0"
"10651","3119.805860","101.114.196.190","131.243.1.10","TCP","58","10066  >  21 [SYN] Seq=1207434129 Win=8192 Len=0 MSS=1460"
"10655","3119.983791","101.114.196.190","131.243.1.10","TCP","54","10063  >  21 [RST] Seq=1119764196 Win=0 Len=0"
"10703","3125.188159","182.6.9.175","128.3.32.63","TCP","74","33006  >  21 [SYN] Seq=4176052118 Win=5840 Len=0 MSS=1460 SACK_PERM=1 TSval=3662874 TSecr=0 WS=1"
"10748","3163.985824","101.114.196.190","131.243.1.10","TCP","58","10068  >  21 [SYN] Seq=1217625083 Win=8192 Len=0 MSS=1460"
"10750","3164.122125","101.114.196.190","131.243.1.10","TCP","54","10066  >  21 [RST] Seq=1207434276 Win=0 Len=0"
"10801","3178.971274","107.34.21.92","131.243.2.12","TCP","66","1099  >  21 [SYN] Seq=2345298682 Win=60352 Len=0 MSS=1460 WS=4 SACK_PERM=1"
"10864","3209.882810","84.68.192.198","131.243.1.10","TCP","74","1658  >  21 [SYN] Seq=159375807 Win=57344 Len=0 MSS=1380 WS=1 TSval=1184769085 TSecr=0"
"10955","3213.727324","101.114.196.190","131.243.1.10","TCP","58","10070  >  21 [SYN] Seq=1229070799 Win=8192 Len=0 MSS=1460"
"10959","3213.907671","101.114.196.190","131.243.1.10","TCP","54","10068  >  21 [RST] Seq=1217625224 Win=0 Len=0"
"11078","3248.856047","101.114.196.190","131.243.1.10","TCP","58","10072  >  21 [SYN] Seq=1237221347 Win=8192 Len=0 MSS=1460"
"11087","3249.058329","101.114.196.190","131.243.1.10","TCP","54","10070  >  21 [RST] Seq=1229070930 Win=0 Len=0"
"11145","3254.844545","101.114.196.190","131.243.1.10","TCP","58","10074  >  21 [SYN] Seq=1238698633 Win=8192 Len=0 MSS=1460"
"11340","3334.276650","121.195.250.138","128.3.12.44","TCP","62","1368  >  21 [SYN] Seq=2973117409 Win=44032 Len=0 MSS=1452 SACK_PERM=1"
"11365","3337.254876","121.195.250.138","128.3.12.44","TCP","62","1370  >  21 [SYN] Seq=2973971327 Win=44032 Len=0 MSS=1452 SACK_PERM=1"
"11421","3352.689597","79.37.53.67","131.243.2.12","TCP","62","38908  >  21 [SYN] Seq=2829157153 Win=16384 Len=0 MSS=1460 SACK_PERM=1"
"11458","3357.419410","121.195.250.138","128.3.12.44","TCP","62","1372  >  21 [SYN] Seq=2979071713 Win=44032 Len=0 MSS=1452 SACK_PERM=1"
"11527","3366.037825","79.37.53.67","131.243.2.12","TCP","54","38908  >  21 [RST] Seq=2829157486 Win=0 Len=0"
"11559","3386.099052","35.73.33.202","131.243.1.10","TCP","74","1052  >  21 [SYN] Seq=304584139 Win=5840 Len=0 MSS=1460 SACK_PERM=1 TSval=978476 TSecr=0 WS=1"
"11660","3406.222159","148.253.227.51","131.243.1.10","TCP","62","1059  >  21 [SYN] Seq=1472894 Win=8192 Len=0 MSS=536 SACK_PERM=1"
"11812","3432.822884","148.253.227.51","131.243.1.10","TCP","62","1061  >  21 [SYN] Seq=1499502 Win=8192 Len=0 MSS=536 SACK_PERM=1"
"11903","3449.126954","47.125.91.135","131.243.2.12","TCP","62","2255  >  21 [SYN] Seq=4066784043 Win=16384 Len=0 MSS=1460 SACK_PERM=1"
"11914","3450.209775","24.190.46.234","131.243.1.10","TCP","58","64846  >  21 [SYN] Seq=3584156901 Win=8760 Len=0 MSS=1460"
"11969","3450.649693","24.190.46.234","131.243.1.10","TCP","54","64846  >  21 [FIN, ACK] Seq=3584156975 Ack=3767177961 Win=8760 Len=0"
"11971","3450.650510","131.243.1.10","24.190.46.234","TCP","54","21  >  64846 [FIN, ACK] Seq=3767177961 Ack=3584156976 Win=17520 Len=0"
"11979","3450.975584","47.125.91.135","131.243.2.12","TCP","54","2255  >  21 [RST] Seq=4066784090 Win=0 Len=0"
"11984","3454.599180","35.73.33.202","131.243.1.10","TCP","74","1054  >  21 [SYN] Seq=373294933 Win=5840 Len=0 MSS=1460 SACK_PERM=1 TSval=985326 TSecr=0 WS=1"
"12063","3461.017075","121.195.250.138","128.3.12.44","TCP","54","1372  >  21 [RST] Seq=2979071827 Win=0 Len=0"
"12068","3461.248612","216.43.247.103","131.243.1.10","TCP","74","53830  >  21 [SYN] Seq=232787550 Win=5840 Len=0 MSS=1460 SACK_PERM=1 TSval=1874847580 TSecr=0 WS=1"
"12071","3461.296798","121.195.250.138","128.3.12.44","TCP","54","1368  >  21 [RST] Seq=2973117476 Win=0 Len=0"
"12109","3463.417656","26.250.204.76","131.243.1.10","TCP","62","3205  >  21 [SYN] Seq=2771092683 Win=65535 Len=0 MSS=1360 SACK_PERM=1"
"12176","3465.209015","26.250.204.76","131.243.1.10","TCP","54","3205  >  21 [FIN, ACK] Seq=2771092883 Ack=1185176793 Win=65183 Len=0"
"12179","3465.266935","26.250.204.76","131.243.1.10","TCP","62","3207  >  21 [SYN] Seq=2771615365 Win=65535 Len=0 MSS=1360 SACK_PERM=1"
"12346","3514.697528","98.192.203.106","131.243.1.10","TCP","62","29027  >  21 [SYN] Seq=2827168482 Win=64240 Len=0 MSS=1400 SACK_PERM=1"
"12405","3517.181805","82.143.24.12","131.243.2.12","TCP","62","2281  >  21 [SYN] Seq=1567752780 Win=16384 Len=0 MSS=1460 SACK_PERM=1"
"12427","3520.684891","141.62.47.110","128.3.12.44","TCP","78","54659  >  21 [SYN] Seq=3168085820 Win=16384 Len=0 MSS=1460 SACK_PERM=1 WS=1 TSval=318802994 TSecr=0"
"12485","3526.098116","98.192.203.106","131.243.1.10","TCP","54","29027  >  21 [RST] Seq=2827168594 Win=0 Len=0"
"12634","3574.942275","131.243.1.10","101.114.196.190","TCP","54","21  >  10074 [RST] Seq=4189318003 Win=0 Len=0"
"12635","3574.946691","101.114.196.190","131.243.1.10","TCP","58","10076  >  21 [SYN] Seq=1311953051 Win=8192 Len=0 MSS=1460"
"12719","3583.212187","82.143.24.12","131.243.2.12","TCP","54","2281  >  21 [RST] Seq=1567753300 Win=0 Len=0"
"12758","3595.652931","148.253.227.51","131.243.1.10","TCP","54","1061  >  21 [RST] Seq=1499606 Win=0 Len=0"
"12814","3617.567048","82.143.24.12","131.243.2.12","TCP","62","2290  >  21 [SYN] Seq=1603923254 Win=16384 Len=0 MSS=1460 SACK_PERM=1"
"13087","3684.913454","82.143.24.12","131.243.2.12","TCP","54","2290  >  21 [RST] Seq=1603924055 Win=0 Len=0"
"13154","3718.180499","131.243.1.10","148.253.227.51","TCP","54","21  >  1059 [FIN, ACK] Seq=44677541 Ack=1473229 Win=16616 Len=0"
"13173","3725.924587","35.73.33.202","131.243.1.10","TCP","54","1054  >  21 [FIN, ACK] Seq=373295224 Ack=3172050625 Win=5840 Len=0"
"13209","3748.271029","110.112.122.22","131.243.2.12","TCP","62","2211  >  21 [SYN] Seq=1501643335 Win=16384 Len=0 MSS=1460 SACK_PERM=1"
"13268","3763.428252","79.37.53.67","131.243.2.12","TCP","62","37675  >  21 [SYN] Seq=3068999937 Win=16384 Len=0 MSS=1460 SACK_PERM=1"
"13294","3765.901410","131.243.1.10","26.250.204.76","TCP","54","21  >  3207 [FIN, ACK] Seq=1848457200 Ack=2771615565 Win=17680 Len=0"
"13300","3766.219852","26.250.204.76","131.243.1.10","TCP","54","3207  >  21 [RST] Seq=2771615565 Win=0 Len=0"
"13354","3776.800873","79.37.53.67","131.243.2.12","TCP","54","37675  >  21 [RST] Seq=3069000184 Win=0 Len=0"
"13379","3785.139681","107.34.21.92","131.243.2.12","TCP","54","1099  >  21 [RST] Seq=2345307072 Win=0 Len=0"
"13396","3807.442745","148.253.227.51","131.243.1.10","TCP","54","1059  >  21 [RST] Seq=1473229 Win=0 Len=0"
"13429","3845.892431","82.143.24.12","131.243.2.12","TCP","62","3016  >  21 [SYN] Seq=1699462399 Win=16384 Len=0 MSS=1460 SACK_PERM=1"
"13475","3861.821399","113.165.230.66","131.243.1.10","TCP","54","63267  >  21 [RST] Seq=1678493544 Win=0 Len=0"
"13584","3910.642016","143.106.218.181","131.243.1.10","TCP","74","60305  >  21 [SYN] Seq=3834635 Win=5840 Len=0 MSS=1460 SACK_PERM=1 TSval=16290425 TSecr=0 WS=1"
"13621","3911.205492","82.143.24.12","131.243.2.12","TCP","54","3016  >  21 [RST] Seq=1699463093 Win=0 Len=0"
"13692","3955.397814","43.8.145.97","131.243.1.10","TCP","78","40210  >  21 [SYN] Seq=1962597323 Win=32850 Len=0 WS=2 TSval=320826488 TSecr=0 SACK_PERM=1 MSS=1414"
"13731","3956.684136","131.243.1.10","143.106.218.181","TCP","54","21  >  60305 [FIN, ACK] Seq=1481990639 Ack=3834785 Win=17520 Len=0"
"13733","3957.132722","143.106.218.181","131.243.1.10","TCP","54","60305  >  21 [FIN, ACK] Seq=3834785 Ack=1481990640 Win=7908 Len=0"
"13742","3961.626434","0.131.191.60","131.243.1.10","TCP","62","1269  >  21 [SYN] Seq=373423 Win=8192 Len=0 MSS=1422 SACK_PERM=1"
"13952","3982.920066","0.131.191.60","131.243.1.10","TCP","62","1285  >  21 [SYN] Seq=394712 Win=8192 Len=0 MSS=1422 SACK_PERM=1"
"14008","3987.083520","0.131.191.60","131.243.1.10","TCP","54","1269  >  21 [FIN, ACK] Seq=373784 Ack=1319497271 Win=7194 Len=0"
"14010","3987.084338","131.243.1.10","0.131.191.60","TCP","54","21  >  1269 [FIN, ACK] Seq=1319497271 Ack=373785 Win=17064 Len=0"
"14052","4022.910938","0.131.191.60","131.243.1.10","TCP","54","1285  >  21 [RST] Seq=394812 Win=0 Len=0"
"14055","4024.407588","40.12.141.141","242.70.74.100","TCP","62","2362  >  21 [SYN] Seq=98614441 Win=64240 Len=0 MSS=1460 SACK_PERM=1"
"14098","4040.088890","82.143.24.12","131.243.2.12","TCP","62","4882  >  21 [SYN] Seq=1790567523 Win=16384 Len=0 MSS=1460 SACK_PERM=1"
"14233","4094.962308","131.243.1.10","43.8.145.97","TCP","54","21  >  40210 [FIN, ACK] Seq=2594651772 Ack=1962597497 Win=16968 Len=0"
"14234","4095.119125","43.8.145.97","131.243.1.10","TCP","54","40210  >  21 [FIN, ACK] Seq=1962597497 Ack=2594651773 Win=65044 Len=0"
"14265","4105.515588","82.143.24.12","131.243.2.12","TCP","54","4882  >  21 [RST] Seq=1790568167 Win=0 Len=0"
"14308","4151.191559","79.37.53.67","131.243.2.12","TCP","62","36156  >  21 [SYN] Seq=3304410189 Win=16384 Len=0 MSS=1460 SACK_PERM=1"
"14378","4164.775531","79.37.53.67","131.243.2.12","TCP","54","36156  >  21 [RST] Seq=3304410522 Win=0 Len=0"
"14385","4173.410379","79.37.53.67","203.174.5.11","TCP","62","39666  >  21 [SYN] Seq=3320450643 Win=16384 Len=0 MSS=1460 SACK_PERM=1"
"14450","4187.156165","79.37.53.67","203.174.5.11","TCP","54","39666  >  21 [RST] Seq=3320450932 Win=0 Len=0"
"14472","4212.676584","6.18.109.183","131.243.1.10","TCP","62","61341  >  21 [SYN] Seq=992702697 Win=64240 Len=0 MSS=1380 SACK_PERM=1"
"14575","4267.804569","6.18.109.183","131.243.1.10","TCP","62","61344  >  21 [SYN] Seq=875684325 Win=64240 Len=0 MSS=1380 SACK_PERM=1"
"14727","4279.486489","101.114.196.190","131.243.1.10","TCP","58","10089  >  21 [SYN] Seq=1473781608 Win=8192 Len=0 MSS=1460"
"14763","4282.644666","28.36.15.115","131.243.1.10","TCP","62","2089  >  21 [SYN] Seq=9351664 Win=8192 Len=0 MSS=1332"
"14977","4320.639597","217.148.52.180","131.243.2.12","TCP","62","1292  >  21 [SYN] Seq=2987523625 Win=16384 Len=0 MSS=1460 SACK_PERM=1"
