"1","0.000000","248.38.9.24","131.243.1.10","TCP","74","41553  >  21 [SYN] Seq=1314531094 Win=5840 Len=0 MSS=1460 SACK_PERM=1 TSval=3118435140 TSecr=0 WS=1"
"55","181.169693","217.148.52.180","131.243.2.12","TCP","62","2471  >  21 [SYN] Seq=3240012531 Win=16384 Len=0 MSS=1460 SACK_PERM=1"
"115","214.658574","59.30.70.208","128.3.28.48","TCP","74","34500  >  21 [SYN] Seq=2376548815 Win=4452 Len=0 MSS=1484 SACK_PERM=1 TSval=409860 TSecr=0 WS=1"
"278","299.953907","229.246.115.157","131.243.1.10","TCP","58","56646  >  21 [SYN] Seq=3601681547 Win=61320 Len=0 MSS=1460"
"373","320.670464","189.30.8.121","131.243.1.10","TCP","62","40570  >  21 [SYN] Seq=3857849774 Win=16384 Len=0 MSS=1460 SACK_PERM=1"
"714","469.183003","7.82.237.222","131.243.1.10","TCP","62","5973  >  21 [SYN] Seq=2836082884 Win=64240 Len=0 MSS=1460 SACK_PERM=1"
"982","559.299725","152.191.35.146","128.3.28.48","TCP","74","34528  >  21 [SYN] Seq=2757745484 Win=4452 Len=0 MSS=1484 SACK_PERM=1 TSval=444325 TSecr=0 WS=1"
"1232","672.104564","45.7.36.127","131.243.2.12","TCP","62","2945  >  21 [SYN] Seq=1291332707 Win=8192 Len=0 MSS=1460 SACK_PERM=1"
"1628","822.100125","161.126.87.140","131.243.1.10","TCP","62","1819  >  21 [SYN] Seq=2931886122 Win=64240 Len=0 MSS=1452 SACK_PERM=1"
"1720","848.339938","91.198.76.64","131.243.1.10","TCP","74","61149  >  21 [SYN] Seq=2133859527 Win=5840 Len=0 MSS=1414 SACK_PERM=1 TSval=16744644 TSecr=0 WS=1"
"2260","1005.801986","189.214.156.168","131.243.1.10","TCP","62","3017  >  21 [SYN] Seq=1637976573 Win=8760 Len=0 MSS=536 SACK_PERM=1"
"2293","1009.621110","173.112.82.221","131.243.1.10","TCP","78","3887  >  21 [SYN] Seq=4090061794 Win=44620 Len=0 MSS=1460 WS=8 TSval=0 TSecr=0 SACK_PERM=1"
"2458","1058.658334","168.254.152.132","131.243.2.12","TCP","62","2523  >  21 [SYN] Seq=1546644010 Win=16384 Len=0 MSS=1460 SACK_PERM=1"
"2604","1110.250958","4.251.189.14","131.243.1.10","TCP","74","37465  >  21 [SYN] Seq=2480776528 Win=5840 Len=0 MSS=1460 SACK_PERM=1 TSval=85092584 TSecr=0 WS=1"
"2727","1130.548455","148.111.20.136","131.243.1.10","TCP","74","51858  >  21 [SYN] Seq=2511075633 Win=5840 Len=0 MSS=1460 SACK_PERM=1 TSval=24353085 TSecr=0 WS=1"
"3035","1210.970672","249.44.109.25","128.3.28.48","TCP","74","1286  >  21 [SYN] Seq=2594401953 Win=5840 Len=0 MSS=1460 SACK_PERM=1 TSval=195399166 TSecr=0 WS=1"
"3479","1319.138518","55.84.210.42","131.243.1.10","TCP","62","3552  >  21 [SYN] Seq=3664903931 Win=32767 Len=0 MSS=1324 SACK_PERM=1"
"3570","1349.116272","82.143.24.12","131.243.2.12","TCP","62","3868  >  21 [SYN] Seq=1278870484 Win=16384 Len=0 MSS=1460 SACK_PERM=1"
"3621","1368.002076","232.8.175.74","131.243.1.10","TCP","58","63068  >  21 [SYN] Seq=3108712002 Win=8760 Len=0 MSS=1460"
"3770","1397.507006","178.214.186.1","131.243.1.10","TCP","74","60407  >  21 [SYN] Seq=3726390522 Win=5840 Len=0 MSS=1380 SACK_PERM=1 TSval=119568921 TSecr=0 WS=1"
"4890","1844.469748","216.43.247.103","131.243.1.10","TCP","74","58752  >  21 [SYN] Seq=3247196764 Win=5840 Len=0 MSS=1460 SACK_PERM=1 TSval=1909298758 TSecr=0 WS=1"
"4950","1850.699881","16.69.134.221","131.243.2.12","TCP","62","4517  >  21 [SYN] Seq=3465098127 Win=16384 Len=0 MSS=1460 SACK_PERM=1"
"5230","1905.844067","150.70.97.75","131.243.1.10","TCP","74","2130  >  21 [SYN] Seq=3301524672 Win=32120 Len=0 MSS=1460 SACK_PERM=1 TSval=342513391 TSecr=0 WS=1"
"5461","2256.864522","250.225.145.152","131.243.1.10","TCP","62","1267  >  21 [SYN] Seq=2007889 Win=8192 Len=0 MSS=536 SACK_PERM=1"
"5537","2333.119291","18.197.41.194","131.243.1.10","TCP","58","25202  >  21 [SYN] Seq=3498156635 Win=32768 Len=0 MSS=1460"
"5598","2345.851666","237.180.56.133","131.243.1.10","TCP","62","3276  >  21 [SYN] Seq=1323715783 Win=16384 Len=0 MSS=1360 SACK_PERM=1"
"5773","2475.883014","44.120.49.173","109.103.64.27","TCP","58","4936  >  21 [SYN] Seq=24263792 Win=8192 Len=0 MSS=1460"
"6186","2769.867612","69.157.45.176","131.243.2.12","TCP","62","2479  >  21 [SYN] Seq=2787842498 Win=64240 Len=0 MSS=1460 SACK_PERM=1"
"6236","2819.158148","143.156.1.2","131.243.2.12","TCP","62","3167  >  21 [SYN] Seq=598276253 Win=16384 Len=0 MSS=1460 SACK_PERM=1"
"6310","2868.194999","47.125.91.135","131.243.2.12","TCP","62","1300  >  21 [SYN] Seq=238381077 Win=16384 Len=0 MSS=1460 SACK_PERM=1"
"6390","2914.830573","24.190.46.234","131.243.1.10","TCP","58","48576  >  21 [SYN] Seq=2413775609 Win=8760 Len=0 MSS=1460"
"6490","3023.725069","75.16.160.171","131.243.2.12","TCP","74","55508  >  21 [SYN] Seq=217413204 Win=65535 Len=0 MSS=1460 WS=1 TSval=1929749 TSecr=0"
"6518","3044.037779","244.173.253.244","131.243.2.12","TCP","74","51770  >  21 [SYN] Seq=99526660 Win=65535 Len=0 MSS=1460 WS=1 TSval=1780416 TSecr=0"
"6520","3044.263430","90.227.190.180","131.243.2.12","TCP","62","3904  >  21 [SYN] Seq=1987179967 Win=16384 Len=0 MSS=1460 SACK_PERM=1"
"6723","3119.361988","171.142.200.244","131.243.1.10","TCP","74","33011  >  21 [SYN] Seq=301681035 Win=5808 Len=0 MSS=1412 SACK_PERM=1 TSval=1202176 TSecr=0 WS=1"
"6936","3145.391734","43.27.105.111","128.3.28.48","TCP","62","17134  >  21 [SYN] Seq=3233997189 Win=16384 Len=0 MSS=1460 SACK_PERM=1"
"7479","3306.364903","192.232.226.84","131.243.1.10","TCP","74","33728  >  21 [SYN] Seq=499649924 Win=5840 Len=0 MSS=1460 SACK_PERM=1 TSval=10497202 TSecr=0 WS=1"
"7628","3351.966009","120.151.219.31","131.243.1.10","TCP","62","50236  >  21 [SYN] Seq=3093969718 Win=64240 Len=0 MSS=1380 SACK_PERM=1"
"8020","3512.481932","84.68.192.198","131.243.1.10","TCP","74","1594  >  21 [SYN] Seq=3117017266 Win=57344 Len=0 MSS=1380 WS=1 TSval=1219411870 TSecr=0"
"8199","3555.603779","18.23.245.184","131.243.1.10","TCP","62","1915  >  21 [SYN] Seq=1898881 Win=8192 Len=0 MSS=536 SACK_PERM=1"
"8261","3574.253778","129.80.74.185","131.243.1.10","TCP","62","19542  >  21 [SYN] Seq=19508663 Win=8192 Len=0 MSS=1460 SACK_PERM=1"
"8788","3736.490808","132.239.174.251","131.243.1.10","TCP","62","35056  >  21 [SYN] Seq=2671301654 Win=16384 Len=0 MSS=1436 SACK_PERM=1"
"8847","3910.686665","239.248.79.130","131.243.1.10","TCP","74","2794  >  21 [SYN] Seq=959109208 Win=32120 Len=0 MSS=1460 SACK_PERM=1 TSval=167544579 TSecr=0 WS=1"
"8924","3915.623815","37.113.117.74","131.243.1.10","TCP","74","53763  >  21 [SYN] Seq=1364227951 Win=5840 Len=0 MSS=1460 SACK_PERM=1 TSval=329631335 TSecr=0 WS=1"
"9127","4045.565058","143.248.150.114","131.243.1.10","TCP","62","1201  >  21 [SYN] Seq=1532177 Win=8192 Len=0 MSS=536 SACK_PERM=1"
"9241","4196.699256","184.177.31.177","131.243.1.10","TCP","66","1084  >  21 [SYN] Seq=1162727178 Win=10728 Len=0 MSS=1418 WS=4 SACK_PERM=1"
"9552","4482.215731","193.248.9.31","131.243.1.10","TCP","74","33094  >  21 [SYN] Seq=1738534005 Win=5840 Len=0 MSS=1452 SACK_PERM=1 TSval=198976 TSecr=0 WS=1"
"9631","4692.911158","116.177.87.124","131.243.1.10","TCP","74","2785  >  21 [SYN] Seq=1963533716 Win=32120 Len=0 MSS=1460 SACK_PERM=1 TSval=185039815 TSecr=0 WS=1"
"9700","4803.332740","213.17.189.200","131.243.1.10","TCP","74","46205  >  21 [SYN] Seq=2063954069 Win=5840 Len=0 MSS=1460 TSval=24083687 TSecr=0 WS=1"
"9760","4850.998704","76.62.141.80","131.243.1.10","TCP","74","37885  >  21 [SYN] Seq=2267672001 Win=5840 Len=0 MSS=1460 SACK_PERM=1 TSval=323151191 TSecr=0 WS=1"
"9796","4855.499439","157.215.230.139","131.243.1.10","TCP","58","21986  >  21 [SYN] Seq=1927027190 Win=6144 Len=0 MSS=1368"
"9997","5006.103863","203.139.202.26","131.243.2.12","TCP","58","55549  >  21 [SYN] Seq=1423724933 Win=16384 Len=0 MSS=1460"
"10028","5021.967173","254.213.124.61","131.243.2.12","TCP","62","1200  >  21 [SYN] Seq=4805563 Win=8192 Len=0 MSS=1460 SACK_PERM=1"
"10038","5026.936799","131.213.89.179","131.243.1.10","TCP","58","3866  >  21 [SYN] Seq=443754931 Win=8192 Len=0 MSS=1460"
"10185","5154.301811","152.172.117.61","131.243.1.10","TCP","62","1926  >  21 [SYN] Seq=3292358249 Win=16384 Len=0 MSS=1460 SACK_PERM=1"
"10304","5205.136336","173.218.67.133","131.243.1.10","TCP","74","33311  >  21 [SYN] Seq=2498043033 Win=5840 Len=0 MSS=1460 SACK_PERM=1 TSval=42472 TSecr=0 WS=1"
"10367","5410.902990","97.0.158.29","131.243.1.10","TCP","74","46189  >  21 [SYN] Seq=2703202794 Win=5840 Len=0 MSS=1460 SACK_PERM=1 TSval=494332448 TSecr=0 WS=1"
"10437","5612.490809","161.206.176.161","131.243.1.10","TCP","62","2726  >  21 [SYN] Seq=3530878059 Win=16384 Len=0 MSS=1460 SACK_PERM=1"
"10502","5683.632795","21.97.107.165","131.243.1.10","TCP","62","60804  >  21 [SYN] Seq=2816766624 Win=64240 Len=0 MSS=1380 SACK_PERM=1"
"10624","5872.816503","212.7.211.138","131.243.1.10","TCP","62","2110  >  21 [SYN] Seq=4096161 Win=8192 Len=0 MSS=1460 SACK_PERM=1"
"10736","5961.376466","207.249.252.183","131.243.1.10","TCP","58","41431  >  21 [SYN] Seq=4099085767 Win=512 Len=0 MSS=1460"
"10800","6023.061520","209.187.104.128","131.243.1.10","TCP","74","32811  >  21 [SYN] Seq=3356135987 Win=5840 Len=0 MSS=1460 SACK_PERM=1 TSval=248127 TSecr=0 WS=1"
"10899","6073.296801","136.118.224.122","131.243.2.12","TCP","78","1533  >  21 [SYN] Seq=1508965868 Win=44620 Len=0 MSS=1460 WS=8 TSval=0 TSecr=0 SACK_PERM=1"
"10960","6121.566634","214.53.92.97","131.243.1.10","TCP","62","3146  >  21 [SYN] Seq=801720437 Win=64240 Len=0 MSS=1414 SACK_PERM=1"
"11385","6345.336655","146.25.22.32","131.243.1.10","TCP","62","2060  >  21 [SYN] Seq=1420544899 Win=64240 Len=0 MSS=1460 SACK_PERM=1"
"12295","6685.510620","157.231.148.18","131.243.2.12","TCP","62","2847  >  21 [SYN] Seq=1663378762 Win=16384 Len=0 MSS=1460 SACK_PERM=1"
"12394","6716.707078","38.93.253.216","131.243.2.12","TCP","62","1348  >  21 [SYN] Seq=141231675 Win=16384 Len=0 MSS=1460 SACK_PERM=1"
"12435","6723.420844","61.157.171.227","131.243.1.10","TCP","62","4251  >  21 [SYN] Seq=2888105025 Win=64240 Len=0 MSS=1416 SACK_PERM=1"
"12652","6765.134922","204.88.125.120","131.243.1.10","TCP","62","18242  >  21 [SYN] Seq=2620859861 Win=8760 Len=0 MSS=1460 SACK_PERM=1"
"13688","7026.509723","32.183.12.123","131.243.1.10","TCP","62","61469  >  21 [SYN] Seq=1877815318 Win=16384 Len=0 MSS=1460 SACK_PERM=1"
"13803","7041.994458","15.190.17.141","131.243.1.10","TCP","58","54423  >  21 [SYN] Seq=1961390238 Win=64240 Len=0 MSS=1460"
"14869","7736.087305","175.111.96.67","131.243.1.10","TCP","62","2292  >  21 [SYN] Seq=3087606085 Win=64240 Len=0 MSS=1460"
"14931","7884.226616","144.11.225.104","131.243.2.12","TCP","62","3020  >  21 [SYN] Seq=2182563523 Win=16384 Len=0 MSS=1460 SACK_PERM=1"
"15211","8289.920692","154.171.221.209","128.3.12.44","TCP","74","1142  >  21 [SYN] Seq=466844630 Win=57344 Len=0 MSS=1460 WS=1 TSval=6227503 TSecr=0"
"15266","8315.330091","241.49.40.187","131.243.1.10","TCP","58","1872  >  21 [SYN] Seq=39911158 Win=8192 Len=0 MSS=1460"
"15385","8324.666947","197.217.232.215","131.243.1.10","TCP","74","37944  >  21 [SYN] Seq=3609370337 Win=5840 Len=0 MSS=1460 SACK_PERM=1 TSval=146771804 TSecr=0 WS=1"
"15715","8400.475849","165.78.71.101","128.3.28.48","TCP","74","38417  >  21 [SYN] Seq=1591427115 Win=5840 Len=0 MSS=1460 SACK_PERM=1 TSval=1003500407 TSecr=0 WS=1"
"15852","8438.823060","108.97.140.165","131.243.1.10","TCP","74","47604  >  21 [SYN] Seq=1618053314 Win=5840 Len=0 MSS=1460 SACK_PERM=1 TSval=43806902 TSecr=0 WS=1"
"16128","8601.100865","197.113.3.99","128.3.20.245","TCP","62","1845  >  21 [SYN] Seq=785261745 Win=8760 Len=0 MSS=1460"
"16320","8760.028676","137.89.200.240","131.243.1.10","TCP","74","54047  >  21 [SYN] Seq=1964292869 Win=5840 Len=0 MSS=1460 SACK_PERM=1 TSval=872764329 TSecr=0 WS=1"
"16390","8762.228104","117.30.154.129","131.243.1.10","TCP","62","63560  >  21 [SYN] Seq=597705 Win=8192 Len=0 MSS=1414 SACK_PERM=1"
"16666","9410.903167","161.60.254.203","131.243.1.10","TCP","62","3596  >  21 [SYN] Seq=2135173337 Win=8760 Len=0 MSS=1460 SACK_PERM=1"
"16963","9824.685478","34.214.121.62","131.243.1.10","TCP","74","34915  >  21 [SYN] Seq=3211049219 Win=5840 Len=0 MSS=1460 SACK_PERM=1 TSval=224906357 TSecr=0 WS=1"
"17377","9941.417015","133.183.60.94","131.243.1.10","TCP","62","21527  >  21 [SYN] Seq=458067793 Win=64240 Len=0 MSS=1460 SACK_PERM=1"
"18017","10094.115600","4.0.203.124","203.174.5.11","TCP","62","41456  >  21 [SYN] Seq=4081039490 Win=32768 Len=0 MSS=1380 WS=1"
"18164","10140.607886","179.248.25.199","131.243.1.10","TCP","62","56607  >  21 [SYN] Seq=200219260 Win=64240 Len=0 MSS=1460 SACK_PERM=1"
"18676","10277.599970","150.142.170.91","131.243.1.10","TCP","62","1807  >  21 [SYN] Seq=3762255669 Win=16384 Len=0 MSS=1460 SACK_PERM=1"
"18989","10376.070458","0.154.22.194","131.243.1.10","TCP","78","3311  >  21 [SYN] Seq=2848338067 Win=32767 Len=0 MSS=1460 WS=1 TSval=0 TSecr=0 SACK_PERM=1"
"19389","10438.621760","222.186.198.110","131.243.2.12","TCP","62","2834  >  21 [SYN] Seq=1807288724 Win=16384 Len=0 MSS=1460 SACK_PERM=1"
"19793","10695.868287","10.48.254.166","131.243.1.10","TCP","62","43453  >  21 [SYN] Seq=2367183766 Win=16384 Len=0 MSS=1460 SACK_PERM=1"
"19909","10734.455359","230.101.18.175","128.3.12.44","TCP","74","3747  >  21 [SYN] Seq=2335379494 Win=57344 Len=0 MSS=1460 WS=1 TSval=315552864 TSecr=0"
"20220","11197.687182","13.199.22.210","131.243.1.10","TCP","62","1876  >  21 [SYN] Seq=3471135529 Win=16384 Len=0 MSS=1460 SACK_PERM=1"
"20782","11426.437106","147.74.11.41","131.243.1.10","TCP","62","2423  >  21 [SYN] Seq=7256667 Win=8192 Len=0 MSS=1460 SACK_PERM=1"
"20917","11474.049465","163.50.170.250","131.243.1.10","TCP","62","18479  >  21 [SYN] Seq=2086862217 Win=16384 Len=0 MSS=1460 SACK_PERM=1"
"21214","11590.540941","49.50.98.246","131.243.1.10","TCP","62","2510  >  21 [SYN] Seq=1206049036 Win=16384 Len=0 MSS=1260 SACK_PERM=1"
"21322","11615.642110","22.129.74.56","131.243.1.10","TCP","62","2470  >  21 [SYN] Seq=3810780250 Win=16384 Len=0 MSS=1460 SACK_PERM=1"
"21570","11732.602227","110.112.122.22","131.243.2.12","TCP","62","3494  >  21 [SYN] Seq=3395152678 Win=16384 Len=0 MSS=1460 SACK_PERM=1"
"21582","11736.898123","58.255.243.65","131.243.1.10","TCP","66","1025  >  21 [SYN] Seq=2585479912 Win=32767 Len=0 MSS=1460 WS=1 SACK_PERM=1"
"22028","11863.562070","20.105.218.163","131.243.2.12","TCP","66","1122  >  21 [SYN] Seq=4281042442 Win=60352 Len=0 MSS=1460 WS=4 SACK_PERM=1"
"22285","11995.461057","38.5.158.54","131.243.2.12","TCP","62","4191  >  21 [SYN] Seq=1221788870 Win=64240 Len=0 MSS=1460 SACK_PERM=1"
"22465","12211.630862","8.24.194.121","128.3.180.73","TCP","74","64225  >  21 [SYN] Seq=1311938050 Win=5840 Len=0 MSS=1460 SACK_PERM=1 TSval=9608745 TSecr=0 WS=1"
"22557","12351.050952","60.36.91.126","131.243.2.12","TCP","62","4563  >  21 [SYN] Seq=3274000621 Win=16384 Len=0 MSS=1460 SACK_PERM=1"
"22666","12370.407318","19.249.82.185","131.243.1.10","TCP","62","2010  >  21 [SYN] Seq=3240033873 Win=8760 Len=0 MSS=1460 SACK_PERM=1"
"23535","12518.596149","119.143.49.53","131.243.1.10","TCP","62","1091  >  21 [SYN] Seq=3612321007 Win=16384 Len=0 MSS=1460 SACK_PERM=1"
"24011","12644.755751","8.205.135.192","128.3.28.48","TCP","74","58296  >  21 [SYN] Seq=1066595026 Win=5840 Len=0 MSS=1400 SACK_PERM=1 TSval=5820729 TSecr=0 WS=1"
"25826","13094.534581","73.231.82.55","131.243.1.10","TCP","58","59417  >  21 [SYN] Seq=1187471577 Win=8760 Len=0 MSS=1460"
"26338","13270.534636","165.128.231.76","131.243.1.10","TCP","58","5218  >  21 [SYN] Seq=4289213317 Win=512 Len=0 MSS=1460"
"26426","13291.491699","49.103.49.196","131.243.1.10","TCP","74","49899  >  21 [SYN] Seq=2764464076 Win=5840 Len=0 MSS=1460 SACK_PERM=1 TSval=42470053 TSecr=0 WS=1"
"26956","13633.842415","219.177.120.106","131.243.1.10","TCP","74","59281  >  21 [SYN] Seq=4046974364 Win=8192 Len=0 MSS=1460 WS=1 TSval=15267355 TSecr=0"
"27550","13765.478460","139.48.62.62","131.243.1.10","TCP","78","40900  >  21 [SYN] Seq=1979790987 Win=16384 Len=0 MSS=1460 SACK_PERM=1 WS=1 TSval=1247681599 TSecr=0"
"27745","13831.212224","221.118.242.64","109.103.64.27","TCP","62","3292  >  21 [SYN] Seq=2404300687 Win=16384 Len=0 MSS=1460 SACK_PERM=1"
"27784","13836.336684","65.53.20.42","131.243.1.10","TCP","62","4331  >  21 [SYN] Seq=2653381999 Win=16384 Len=0 MSS=1460 SACK_PERM=1"
"27944","13880.595188","124.222.114.147","128.3.12.44","TCP","74","63268  >  21 [SYN] Seq=543767440 Win=16384 Len=0 MSS=1460 WS=1 TSval=0 TSecr=0"
"28170","14056.888970","187.190.50.169","128.3.12.44","TCP","74","11745  >  21 [SYN] Seq=2219778698 Win=16384 Len=0 MSS=1400 WS=1 TSval=0 TSecr=0"
"28201","14213.805797","160.71.218.255","131.243.1.10","TCP","62","3782  >  21 [SYN] Seq=3339833787 Win=8760 Len=0 MSS=1460 SACK_PERM=1"
"29889","14534.324474","213.24.52.183","128.3.12.44","TCP","74","33974  >  21 [SYN] Seq=3778172415 Win=5840 Len=0 MSS=1452 SACK_PERM=1 TSval=18909554 TSecr=0 WS=2"
"30103","14780.181849","16.87.232.184","131.243.1.10","TCP","62","1072  >  21 [SYN] Seq=266902861 Win=16384 Len=0 MSS=1460 SACK_PERM=1"
"30691","15073.234335","93.184.100.33","128.3.12.44","TCP","62","1310  >  21 [SYN] Seq=5670682 Win=8192 Len=0 MSS=1460 SACK_PERM=1"
"30743","15079.118438","117.105.159.60","131.243.1.10","TCP","74","32973  >  21 [SYN] Seq=34595323 Win=5840 Len=0 MSS=1460 SACK_PERM=1 TSval=3456745 TSecr=0 WS=1"
"32131","15390.005223","217.211.132.163","131.243.1.10","TCP","62","1079  >  21 [SYN] Seq=1578797293 Win=16384 Len=0 MSS=1460 SACK_PERM=1"
"32723","15754.003219","83.1.240.233","131.243.2.12","TCP","62","2244  >  21 [SYN] Seq=2118006820 Win=64240 Len=0 MSS=1460 SACK_PERM=1"
"33155","16131.948808","131.201.66.31","203.174.5.11","TCP","62","2234  >  21 [SYN] Seq=2457824640 Win=16384 Len=0 MSS=1460 SACK_PERM=1"
"34062","16384.581178","98.7.14.113","131.243.1.10","TCP","62","50216  >  21 [SYN] Seq=2747080 Win=8192 Len=0 MSS=1414"
"34481","16467.974879","206.175.122.94","128.3.12.44","TCP","62","3532  >  21 [SYN] Seq=3851954900 Win=8760 Len=0 MSS=1460 SACK_PERM=1"
"35345","16708.387716","167.132.136.3","128.3.12.44","TCP","74","39886  >  21 [SYN] Seq=1756583747 Win=5840 Len=0 MSS=1460 SACK_PERM=1 TSval=37498146 TSecr=0 WS=1"
"35841","16922.098556","76.152.197.160","131.243.2.12","TCP","62","1360  >  21 [SYN] Seq=359800679 Win=16384 Len=0 MSS=1460 SACK_PERM=1"
"36320","17146.793913","224.163.220.10","131.243.1.10","TCP","74","51091  >  21 [SYN] Seq=2318685988 Win=32768 Len=0 MSS=1460 WS=1 TSval=137487880 TSecr=0"
"36614","17341.057203","80.96.243.218","131.243.1.10","TCP","74","33468  >  21 [SYN] Seq=2415504171 Win=5840 Len=0 MSS=1460 SACK_PERM=1 TSval=1048760 TSecr=0 WS=1"
"36796","17461.354488","196.227.5.254","131.243.1.10","TCP","74","53203  >  21 [SYN] Seq=2560254853 Win=5840 Len=0 MSS=1460 SACK_PERM=1 TSval=167035630 TSecr=0 WS=1"
"36899","17518.011053","75.254.162.229","131.243.1.10","TCP","74","38378  >  21 [SYN] Seq=1829154339 Win=5840 Len=0 MSS=1460 TSval=8100528 TSecr=0 WS=1"
"36981","17523.663705","48.82.133.230","131.243.1.10","TCP","62","3056  >  21 [SYN] Seq=3364532505 Win=8760 Len=0 MSS=1460 SACK_PERM=1"
"37396","17593.458576","62.40.240.133","131.243.1.10","TCP","62","48858  >  21 [SYN] Seq=2689043956 Win=64240 Len=0 MSS=1460 SACK_PERM=1"
"37475","17615.414972","109.82.249.52","131.243.1.10","TCP","74","32786  >  21 [SYN] Seq=2731010565 Win=5840 Len=0 MSS=1460 SACK_PERM=1 TSval=176821 TSecr=0 WS=1"
"37552","17655.514668","165.114.58.48","131.243.1.10","TCP","66","4101  >  21 [SYN] Seq=1516141493 Win=58944 Len=0 MSS=1322 WS=4 SACK_PERM=1"
"37698","17690.074616","239.87.156.4","131.243.1.10","TCP","74","32653  >  21 [SYN] Seq=77737992 Win=65535 Len=0 MSS=1460 WS=1 TSval=338209 TSecr=0"
"37835","17752.628250","52.23.39.95","131.243.2.12","TCP","62","4143  >  21 [SYN] Seq=650331355 Win=16384 Len=0 MSS=1460 SACK_PERM=1"
"38211","18006.351608","104.94.75.193","131.243.1.10","TCP","62","3291  >  21 [SYN] Seq=2608256460 Win=8576 Len=0 MSS=536 SACK_PERM=1"
"38256","18010.620708","72.187.225.100","131.243.1.10","TCP","74","2286  >  21 [SYN] Seq=3014736886 Win=5840 Len=0 MSS=1460 SACK_PERM=1 TSval=97160419 TSecr=0 WS=2"
"38313","18012.547408","53.199.193.137","242.70.74.100","TCP","74","4312  >  21 [SYN] Seq=94092818 Win=5840 Len=0 MSS=1460 SACK_PERM=1 TSval=115350200 TSecr=0 WS=1"
"38510","18167.604311","165.252.43.195","131.243.2.12","TCP","62","3202  >  21 [SYN] Seq=2678859488 Win=16384 Len=0 MSS=1460 SACK_PERM=1"
"38857","18253.109649","155.127.0.177","131.243.2.12","TCP","62","2837  >  21 [SYN] Seq=1074172991 Win=16384 Len=0 MSS=1460 SACK_PERM=1"
"40711","18511.071248","21.155.187.213","131.243.1.10","TCP","62","3386  >  21 [SYN] Seq=3380403492 Win=16384 Len=0 MSS=1460 SACK_PERM=1"
"41432","18591.045706","20.107.147.116","131.243.1.10","TCP","74","1065  >  21 [SYN] Seq=3761412957 Win=5840 Len=0 MSS=1412 SACK_PERM=1 TSval=52272723 TSecr=0 WS=1"
"42103","18663.005080","63.158.224.139","131.243.1.10","TCP","74","32879  >  21 [SYN] Seq=3864280579 Win=4848 Len=0 MSS=1616 SACK_PERM=1 TSval=149670 TSecr=0 WS=2"
"44367","19166.716919","190.35.217.89","128.3.28.48","TCP","74","2756  >  21 [SYN] Seq=64754241 Win=5840 Len=0 MSS=1460 SACK_PERM=1 TSval=506799222 TSecr=0 WS=1"
"44585","19257.550545","125.213.16.119","203.174.5.11","TCP","62","1188  >  21 [SYN] Seq=2270578410 Win=64240 Len=0 MSS=1460 SACK_PERM=1"
"44602","19260.572831","71.226.190.160","229.54.79.176","TCP","62","1298  >  21 [SYN] Seq=1140487 Win=8192 Len=0 MSS=1474 SACK_PERM=1"
"44774","19298.595481","246.94.203.142","131.243.2.12","TCP","62","3357  >  21 [SYN] Seq=4049799570 Win=16384 Len=0 MSS=1460 SACK_PERM=1"
"45226","19392.550698","51.124.71.132","131.243.1.10","TCP","58","34234  >  21 [SYN] Seq=2587460698 Win=8760 Len=0 MSS=1460"
"46679","19674.811116","174.141.105.254","131.243.1.10","TCP","74","33105  >  21 [SYN] Seq=487492501 Win=5840 Len=0 MSS=1460 SACK_PERM=1 TSval=1915529 TSecr=0 WS=1"
"48173","20066.495856","223.151.205.58","131.243.1.10","TCP","62","4702  >  21 [SYN] Seq=1152957318 Win=16384 Len=0 MSS=1452 SACK_PERM=1"
"50123","20683.905913","68.194.173.23","131.243.1.10","TCP","74","1091  >  21 [SYN] Seq=2038763602 Win=5808 Len=0 MSS=1412 SACK_PERM=1 TSval=5651224 TSecr=0 WS=2"
"50285","20747.297388","139.152.166.28","128.3.12.44","TCP","74","2105  >  21 [SYN] Seq=2927761967 Win=32768 Len=0 MSS=1460 WS=1 TSval=164673874 TSecr=0"
"51236","20957.770019","200.51.200.214","131.243.1.10","TCP","62","54423  >  21 [SYN] Seq=1636257263 Win=24820 Len=0 SACK_PERM=1 MSS=1460"
"51335","20964.110945","18.51.157.217","131.243.1.10","TCP","62","39758  >  21 [SYN] Seq=1200689241 Win=24820 Len=0 SACK_PERM=1 MSS=1460"
"51757","21012.046423","209.49.122.50","131.243.1.10","TCP","62","33235  >  21 [SYN] Seq=738008031 Win=5840 Len=0 MSS=1460"
"52300","21097.487552","44.112.60.19","131.243.1.10","TCP","62","54700  >  21 [SYN] Seq=802615332 Win=32768 Len=0 MSS=1460 WS=1"
"52535","21139.029829","73.104.3.43","131.243.2.12","TCP","62","3814  >  21 [SYN] Seq=3217669604 Win=16384 Len=0 MSS=1460 SACK_PERM=1"
"54516","21523.498868","21.242.196.102","131.243.1.10","TCP","62","22314  >  21 [SYN] Seq=222702642 Win=24820 Len=0 SACK_PERM=1 MSS=1460"
"54781","21594.314299","238.227.210.142","128.3.28.48","TCP","74","40996  >  21 [SYN] Seq=2635464795 Win=5840 Len=0 MSS=1460 SACK_PERM=1 TSval=118543378 TSecr=0 WS=1"
"54961","21625.073565","10.120.254.228","131.243.1.10","TCP","62","1808  >  21 [SYN] Seq=1876721477 Win=64240 Len=0 MSS=1460 SACK_PERM=1"
"55564","21711.339085","113.128.42.87","131.243.1.10","TCP","74","62773  >  21 [SYN] Seq=2747963227 Win=5840 Len=0 MSS=1460 SACK_PERM=1 TSval=1833389303 TSecr=0 WS=1"
"56496","22134.071906","175.61.131.91","128.3.12.44","TCP","62","4176  >  21 [SYN] Seq=918161251 Win=32768 Len=0 MSS=1460 WS=1"
"57079","22581.807661","209.97.35.198","131.243.1.10","TCP","74","41377  >  21 [SYN] Seq=3821855410 Win=5840 Len=0 MSS=1322 SACK_PERM=1 TSval=24606645 TSecr=0 WS=1"
"57117","22582.518598","218.157.251.51","128.3.12.44","TCP","78","33343  >  21 [SYN] Seq=376448415 Win=16384 Len=0 MSS=1460 SACK_PERM=1 WS=1 TSval=747960254 TSecr=0"
"57180","22591.542581","18.196.27.111","131.243.1.10","TCP","62","2259  >  21 [SYN] Seq=51829501 Win=16384 Len=0 MSS=1460 SACK_PERM=1"
"57593","22690.759916","204.120.20.220","128.3.12.44","TCP","62","4469  >  21 [SYN] Seq=3274579544 Win=64800 Len=0 MSS=1440 SACK_PERM=1"
"59595","23392.507777","237.88.219.98","131.243.1.10","TCP","62","62261  >  21 [SYN] Seq=815320994 Win=16384 Len=0 MSS=1460 SACK_PERM=1"
"59872","23679.536715","101.250.49.97","131.243.1.10","TCP","62","1493  >  21 [SYN] Seq=1297111163 Win=64240 Len=0 MSS=1460 SACK_PERM=1"
"59929","23763.354589","70.139.194.5","131.243.2.12","TCP","62","3344  >  21 [SYN] Seq=1331266510 Win=16384 Len=0 MSS=1460 SACK_PERM=1"
"60197","23937.730432","23.186.97.163","131.243.1.10","TCP","62","1801  >  21 [SYN] Seq=4302105 Win=8192 Len=0 MSS=1460 SACK_PERM=1"
"60343","23983.239480","239.253.79.147","131.243.1.10","TCP","74","34249  >  21 [SYN] Seq=870613636 Win=5840 Len=0 MSS=1412 TSval=2566320 TSecr=0 WS=1"
"60750","24198.198114","98.176.85.186","131.243.1.10","TCP","62","2443  >  21 [SYN] Seq=3194293994 Win=16384 Len=0 MSS=1460 SACK_PERM=1"
"61283","24383.736694","205.155.78.239","128.3.12.44","TCP","58","52952  >  21 [SYN] Seq=2186215258 Win=64240 Len=0 MSS=1460"
"61409","24603.250964","202.237.90.170","242.70.74.100","TCP","58","11712  >  21 [SYN] Seq=86879 Win=8192 Len=0 MSS=1460"
"61467","24694.397314","147.224.71.202","128.3.12.44","TCP","78","54657  >  21 [SYN] Seq=3879647143 Win=16384 Len=0 MSS=1460 SACK_PERM=1 WS=1 TSval=2006145046 TSecr=0"
"61579","24849.831776","212.235.79.222","131.243.1.10","TCP","74","1065  >  21 [SYN] Seq=1957783326 Win=18276 Len=0 MSS=9138 SACK_PERM=1 TSval=1073457 TSecr=0 WS=1"
"61650","24857.946958","36.248.14.59","131.243.1.10","TCP","62","1624  >  21 [SYN] Seq=2703371341 Win=8760 Len=0 MSS=1460 SACK_PERM=1"
"61767","24890.330565","178.251.75.161","128.3.12.44","TCP","74","10574  >  21 [SYN] Seq=3261804491 Win=16384 Len=0 MSS=1460 WS=1 TSval=0 TSecr=0"
"61812","24991.812413","54.58.5.5","131.243.1.10","TCP","62","3726  >  21 [SYN] Seq=1002148920 Win=8760 Len=0 MSS=1460 SACK_PERM=1"
"61953","25102.290947","208.27.44.72","131.243.1.10","TCP","62","1494  >  21 [SYN] Seq=2181698648 Win=64240 Len=0 MSS=1400 SACK_PERM=1"
"62198","25423.098305","154.195.234.248","131.243.1.10","TCP","58","61475  >  21 [SYN] Seq=2830924729 Win=8760 Len=0 MSS=1460"
"62251","25472.681415","181.223.231.99","131.243.2.12","TCP","62","2565  >  21 [SYN] Seq=771371287 Win=16384 Len=0 MSS=1460 SACK_PERM=1"
"62413","25521.963236","97.70.42.106","131.243.1.10","TCP","62","1255  >  21 [SYN] Seq=862125370 Win=64240 Len=0 MSS=1440 SACK_PERM=1"
"62599","25540.984179","176.137.232.109","128.3.12.44","TCP","62","1514  >  21 [SYN] Seq=18661915 Win=62780 Len=0 MSS=1460 SACK_PERM=1"
"62649","25550.583487","117.24.23.165","131.243.1.10","TCP","66","3737  >  21 [SYN] Seq=2358219315 Win=17736 Len=0 MSS=1460 WS=2 SACK_PERM=1"
"62709","25552.468696","255.111.165.141","131.243.2.12","TCP","62","1615  >  21 [SYN] Seq=3403963094 Win=65535 Len=0 MSS=1460 SACK_PERM=1"
"63231","25634.848088","197.105.135.7","131.243.2.12","TCP","62","24695  >  21 [SYN] Seq=4092792650 Win=16384 Len=0 MSS=1460 SACK_PERM=1"
"63530","25671.558884","35.232.125.30","128.3.28.48","TCP","74","1025  >  21 [SYN] Seq=1960906815 Win=5808 Len=0 MSS=1412 SACK_PERM=1 TSval=262734 TSecr=0 WS=1"
"66142","25981.653487","73.180.196.60","131.243.1.10","TCP","74","33089  >  21 [SYN] Seq=2557034175 Win=4452 Len=0 MSS=1484 SACK_PERM=1 TSval=403541 TSecr=0 WS=1"
"66419","26006.343471","227.144.164.216","131.243.2.12","TCP","62","4927  >  21 [SYN] Seq=1994263015 Win=16384 Len=0 MSS=1460 SACK_PERM=1"
"70238","26274.776949","37.86.140.26","131.243.1.10","TCP","62","64581  >  21 [SYN] Seq=1373659630 Win=64240 Len=0 MSS=1452 SACK_PERM=1"
"71138","26354.718951","101.196.138.27","131.243.1.10","TCP","62","3905  >  21 [SYN] Seq=3042363863 Win=8760 Len=0 MSS=1460 SACK_PERM=1"
"73256","26639.671226","221.55.239.170","131.243.2.12","TCP","62","4700  >  21 [SYN] Seq=2868405938 Win=16384 Len=0 MSS=1460 SACK_PERM=1"
"73496","26655.123367","89.42.124.234","131.243.2.12","TCP","62","1707  >  21 [SYN] Seq=3090657373 Win=16384 Len=0 MSS=1460 SACK_PERM=1"
"73799","26671.334662","145.72.124.64","128.3.12.44","TCP","74","32797  >  21 [SYN] Seq=2791724768 Win=5840 Len=0 MSS=1460 SACK_PERM=1 TSval=68168 TSecr=0 WS=1"
"76497","26831.942404","28.161.128.104","131.243.1.10","TCP","74","4419  >  21 [SYN] Seq=3856649285 Win=5840 Len=0 MSS=1460 SACK_PERM=1 TSval=1789268083 TSecr=0 WS=1"
"78996","27109.764315","185.36.57.39","131.243.1.10","TCP","58","3749  >  21 [SYN] Seq=508014093 Win=8192 Len=0 MSS=1380"
"79741","27265.555447","48.158.170.254","131.243.1.10","TCP","74","17145  >  21 [SYN] Seq=48852554 Win=5840 Len=0 MSS=1322 SACK_PERM=1 TSval=435674 TSecr=0 WS=1"
"79970","27335.614589","9.95.82.129","131.243.1.10","TCP","62","3472  >  21 [SYN] Seq=153267680 Win=8760 Len=0 MSS=1460 SACK_PERM=1"
"80060","27340.706913","10.54.99.255","131.243.1.10","TCP","74","36303  >  21 [SYN] Seq=276049166 Win=5840 Len=0 MSS=1460 SACK_PERM=1 TSval=43233478 TSecr=0 WS=1"
"80926","27656.211082","93.231.35.44","203.174.5.11","TCP","62","2346  >  21 [SYN] Seq=2804693071 Win=64240 Len=0 MSS=1460 SACK_PERM=1"
"81543","28288.376663","130.10.35.180","128.3.12.44","TCP","62","1055  >  21 [SYN] Seq=1442775513 Win=8192 Len=0 MSS=536 SACK_PERM=1"
"81578","28298.790495","249.4.134.221","109.103.64.27","TCP","62","3732  >  21 [SYN] Seq=3167394495 Win=64240 Len=0 MSS=1460 SACK_PERM=1"
"81751","28507.950456","78.138.144.62","131.243.1.10","TCP","62","3077  >  21 [SYN] Seq=1203712629 Win=8760 Len=0 MSS=1460 SACK_PERM=1"
"81888","28684.853245","2.190.230.168","131.243.1.10","TCP","62","2086  >  21 [SYN] Seq=3930586865 Win=64240 Len=0 MSS=1460 SACK_PERM=1"
"81946","28721.645945","199.235.232.245","131.243.1.10","TCP","62","1341  >  21 [SYN] Seq=524758500 Win=8760 Len=0 MSS=1460 SACK_PERM=1"
"82012","29227.981410","61.37.132.17","93.154.168.114","TCP","62","1519  >  21 [SYN] Seq=1906819534 Win=16384 Len=0 MSS=1440 SACK_PERM=1"
"82033","29261.049961","67.38.38.206","131.243.1.83","TCP","62","1325  >  21 [SYN] Seq=3152141330 Win=16384 Len=0 MSS=1360 SACK_PERM=1"
"82092","29299.676391","92.209.69.32","131.243.2.12","TCP","78","2728  >  21 [SYN] Seq=530473548 Win=16384 Len=0 MSS=1460 WS=1 TSval=0 TSecr=0 SACK_PERM=1"
"82663","29506.039410","236.71.170.81","128.3.12.44","TCP","58","42831  >  21 [SYN] Seq=1914660967 Win=8760 Len=0 MSS=1460"
"84099","29777.537650","73.6.91.115","131.243.2.12","TCP","62","2190  >  21 [SYN] Seq=1731972367 Win=16384 Len=0 MSS=1460 SACK_PERM=1"
"85543","30009.219315","73.72.167.102","128.3.28.48","TCP","74","32778  >  21 [SYN] Seq=3810523308 Win=4452 Len=0 MSS=1484 SACK_PERM=1 TSval=19926 TSecr=0 WS=1"
"86197","30102.236408","18.155.227.37","128.3.12.44","TCP","74","4387  >  21 [SYN] Seq=3580913448 Win=57344 Len=0 MSS=1460 WS=1 TSval=156233802 TSecr=0"
"86711","30190.970695","249.123.7.161","131.243.1.10","TCP","58","1623  >  21 [SYN] Seq=621580226 Win=16384 Len=0 MSS=1460"
"86799","30195.837012","150.131.93.41","131.243.1.10","TCP","62","33955  >  21 [SYN] Seq=2539408297 Win=65535 Len=0 WS=8 MSS=1460"
"87318","30308.175758","47.79.170.139","131.243.2.12","TCP","62","2414  >  21 [SYN] Seq=975578196 Win=16384 Len=0 MSS=1460 SACK_PERM=1"
"87437","30345.286710","228.119.175.121","131.243.1.10","TCP","62","60012  >  21 [SYN] Seq=3824178659 Win=16384 Len=0 MSS=1460 SACK_PERM=1"
"88598","30599.764737","79.176.121.114","131.243.1.10","TCP","74","1533  >  21 [SYN] Seq=4210304013 Win=57344 Len=0 MSS=1460 WS=1 TSval=98223798 TSecr=0"
"89246","30716.370304","50.30.251.243","131.243.1.10","TCP","62","2291  >  21 [SYN] Seq=1219580021 Win=8760 Len=0 MSS=1460 SACK_PERM=1"
"90012","30808.838647","181.182.130.222","131.243.1.10","TCP","74","33325  >  21 [SYN] Seq=3766739363 Win=5808 Len=0 MSS=1412 SACK_PERM=1 TSval=7842077 TSecr=0 WS=1"
"90240","30859.131028","116.130.121.238","131.243.1.10","TCP","74","10367  >  21 [SYN] Seq=3622950532 Win=5840 Len=0 MSS=1460 SACK_PERM=1 TSval=38430635 TSecr=0 WS=1"
"90518","31002.171818","106.23.142.73","131.243.1.10","TCP","74","1237  >  21 [SYN] Seq=4017284681 Win=5840 Len=0 MSS=1460 SACK_PERM=1 TSval=2870732 TSecr=0 WS=1"
"90731","31083.238672","207.219.89.57","131.243.1.10","TCP","74","44731  >  21 [SYN] Seq=4045919073 Win=5840 Len=0 MSS=1460 SACK_PERM=1 TSval=4134991 TSecr=0 WS=1"
"90849","31142.839424","189.65.40.59","131.243.1.10","TCP","74","7661  >  21 [SYN] Seq=577242914 Win=32768 Len=0 MSS=1428 WS=1 TSval=3729461686 TSecr=0"
"90906","31163.103806","5.20.102.84","131.243.2.12","TCP","62","2617  >  21 [SYN] Seq=2632405283 Win=16384 Len=0 MSS=1460 SACK_PERM=1"
"91116","31252.508873","220.122.224.118","131.243.1.10","TCP","62","10822  >  21 [SYN] Seq=1751445878 Win=16384 Len=0 MSS=1460 SACK_PERM=1"
"91746","31449.442962","167.19.152.85","131.243.1.10","TCP","58","3519  >  21 [SYN] Seq=4328325 Win=8192 Len=0 MSS=1300"
"91817","31457.715892","15.67.80.252","131.243.1.10","TCP","74","1256  >  21 [SYN] Seq=2781945296 Win=57344 Len=0 MSS=1452 WS=1 TSval=22375976 TSecr=0"
"92180","31536.242143","236.135.226.142","131.243.2.12","TCP","62","2902  >  21 [SYN] Seq=414694348 Win=16384 Len=0 MSS=1460 SACK_PERM=1"
"92492","31589.040450","174.156.119.108","131.243.1.10","TCP","74","1135  >  21 [SYN] Seq=912539317 Win=8192 Len=0 MSS=512 WS=1 TSval=4876 TSecr=0"
"92603","31599.277213","89.124.219.32","131.243.2.12","TCP","62","4737  >  21 [SYN] Seq=9442800 Win=16384 Len=0 MSS=1460 SACK_PERM=1"
"93273","31707.710967","232.172.40.208","128.3.12.44","TCP","74","35512  >  21 [SYN] Seq=421654375 Win=5840 Len=0 MSS=1460 SACK_PERM=1 TSval=3609111 TSecr=0 WS=1"
"94490","32045.373627","54.0.153.144","131.243.1.10","TCP","74","38903  >  21 [SYN] Seq=761054838 Win=5840 Len=0 MSS=1460 SACK_PERM=1 TSval=2196566 TSecr=0 WS=1"
"94919","32293.082447","94.171.50.198","128.3.12.44","TCP","74","35462  >  21 [SYN] Seq=896954550 Win=5840 Len=0 MSS=1460 SACK_PERM=1 TSval=309540452 TSecr=0 WS=1"
"95072","32647.638961","237.185.73.148","131.243.1.10","TCP","62","3110  >  21 [SYN] Seq=497276768 Win=65535 Len=0 MSS=1452 SACK_PERM=1"
"95134","32712.397317","166.76.154.15","131.243.1.10","TCP","74","63811  >  21 [SYN] Seq=1533974567 Win=5840 Len=0 MSS=1460 SACK_PERM=1 TSval=1953270 TSecr=0 WS=1"
"95205","32729.569528","65.240.185.205","131.243.2.12","TCP","66","3099  >  21 [SYN] Seq=2809545375 Win=32767 Len=0 MSS=1460 WS=1 SACK_PERM=1"
"95608","32978.082742","127.41.21.123","131.243.1.10","TCP","74","41922  >  21 [SYN] Seq=1778384489 Win=5840 Len=0 MSS=1460 SACK_PERM=1 TSval=15504164 TSecr=0 WS=1"
"95683","33002.632255","160.155.126.44","131.243.1.10","TCP","74","13681  >  21 [SYN] Seq=1404663035 Win=5840 Len=0 MSS=1400 SACK_PERM=1 TSval=1045055 TSecr=0 WS=1"
"95752","33022.460045","60.172.197.12","131.243.1.10","TCP","62","2027  >  21 [SYN] Seq=566965278 Win=64512 Len=0 MSS=1260 SACK_PERM=1"
"95844","33141.262797","142.122.251.111","131.243.2.12","TCP","62","3629  >  21 [SYN] Seq=3815822546 Win=16384 Len=0 MSS=1460 SACK_PERM=1"
"95928","33190.549260","252.12.227.45","131.243.1.10","TCP","74","35468  >  21 [SYN] Seq=1993356789 Win=5840 Len=0 MSS=1460 SACK_PERM=1 TSval=3358030 TSecr=0 WS=1"
"96968","33575.341862","83.97.202.251","242.70.74.100","TCP","62","1804  >  21 [SYN] Seq=3236450573 Win=16384 Len=0 MSS=1460 SACK_PERM=1"
"96982","33579.462375","192.216.174.122","131.243.2.12","TCP","62","3363  >  21 [SYN] Seq=1099586442 Win=16384 Len=0 MSS=1460 SACK_PERM=1"
"97053","33585.351568","156.190.224.34","131.243.2.12","TCP","78","40559  >  21 [SYN] Seq=2438348908 Win=16384 Len=0 MSS=1460 SACK_PERM=1 WS=1 TSval=605553123 TSecr=0"
"97235","33623.930246","76.195.103.51","131.243.1.10","TCP","62","4870  >  21 [SYN] Seq=1893203671 Win=64240 Len=0 MSS=1460 SACK_PERM=1"
"97431","33638.757331","23.19.104.187","131.243.1.10","TCP","74","32819  >  21 [SYN] Seq=2458659511 Win=5808 Len=0 MSS=1412 SACK_PERM=1 TSval=385412 TSecr=0 WS=1"
"98266","34225.876763","92.154.179.20","131.243.1.10","TCP","62","63029  >  21 [SYN] Seq=84737692 Win=32768 Len=0 MSS=1460 WS=1"
"98931","34509.445952","165.2.238.121","131.243.1.10","TCP","74","4370  >  21 [SYN] Seq=1248854365 Win=16384 Len=0 MSS=1460 WS=1 TSval=167057632 TSecr=0"
"99169","34538.608103","169.245.157.14","131.243.1.10","TCP","58","4958  >  21 [SYN] Seq=2090755143 Win=16384 Len=0 MSS=1460"
"99683","34614.594684","57.84.88.52","131.243.1.10","TCP","62","1380  >  21 [SYN] Seq=414490637 Win=16384 Len=0 MSS=1460 SACK_PERM=1"
"100364","34698.733161","181.225.95.48","131.243.1.10","TCP","74","32879  >  21 [SYN] Seq=3554874472 Win=5840 Len=0 MSS=1460 SACK_PERM=1 TSval=88146 TSecr=0 WS=1"
"101567","34857.268574","79.223.243.242","131.243.1.10","TCP","74","4136  >  21 [SYN] Seq=592120990 Win=4848 Len=0 MSS=1616 SACK_PERM=1 TSval=130711 TSecr=0 WS=1"
"104091","35305.937112","214.153.191.211","131.243.1.10","TCP","74","30470  >  21 [SYN] Seq=4232258397 Win=5840 Len=0 MSS=1460 TSval=17002648 TSecr=0 WS=1"
"104417","35398.836312","102.246.59.135","131.243.1.10","TCP","74","11034  >  21 [SYN] Seq=16868337 Win=5840 Len=0 MSS=1460 SACK_PERM=1 TSval=103329 TSecr=0 WS=1"
"105067","35683.858048","80.46.250.63","128.3.20.245","TCP","62","1059  >  21 [SYN] Seq=2314442 Win=8192 Len=0 MSS=536 SACK_PERM=1"
"105213","35722.046220","63.186.251.146","131.243.1.10","TCP","62","36325  >  21 [SYN] Seq=2729525219 Win=8192 Len=0 MSS=1460 SACK_PERM=1"
"105774","35978.324873","211.57.73.255","131.243.2.12","TCP","62","1375  >  21 [SYN] Seq=1766936749 Win=16384 Len=0 MSS=1460 SACK_PERM=1"
"106839","36216.211612","213.230.14.206","131.243.1.10","TCP","78","40039  >  21 [SYN] Seq=159307622 Win=49152 Len=0 MSS=1460 WS=4 TSval=9792742 TSecr=0 SACK_PERM=1"
"107227","36288.719243","219.119.242.226","131.243.1.10","TCP","62","12798  >  21 [SYN] Seq=1705467347 Win=16384 Len=0 MSS=1460 SACK_PERM=1"
"107561","36352.289266","136.122.112.38","131.243.1.10","TCP","74","35670  >  21 [SYN] Seq=1130774754 Win=5840 Len=0 MSS=1460 TSval=280442219 TSecr=0 WS=1"
"108036","36453.537740","88.130.229.190","131.243.56.235","TCP","62","3168  >  21 [SYN] Seq=4155205439 Win=16384 Len=0 MSS=1460 SACK_PERM=1"
"109546","36911.216640","201.225.143.185","131.243.1.10","TCP","62","61075  >  21 [SYN] Seq=3272906 Win=8192 Len=0 MSS=1460 SACK_PERM=1"
"109835","36988.913709","87.193.12.97","128.3.12.44","TCP","74","1224  >  21 [SYN] Seq=3386046731 Win=57344 Len=0 MSS=1452 WS=1 TSval=16322648 TSecr=0"
"109999","37026.690564","75.182.158.74","128.3.28.48","TCP","74","32907  >  21 [SYN] Seq=1860151355 Win=5840 Len=0 MSS=1460 SACK_PERM=1 TSval=9079118 TSecr=0 WS=1"
"110882","37177.424006","229.226.233.186","131.243.1.10","TCP","62","2605  >  21 [SYN] Seq=3245878372 Win=16384 Len=0 MSS=1460 SACK_PERM=1"
"111499","37226.598214","161.248.223.152","131.243.2.12","TCP","78","1178  >  21 [SYN] Seq=4168334535 Win=55168 Len=0 MSS=1460 WS=8 TSval=0 TSecr=0 SACK_PERM=1"
"111610","37243.813633","65.158.82.26","131.243.1.10","TCP","62","45304  >  21 [SYN] Seq=3511182882 Win=64512 Len=0 MSS=1460 SACK_PERM=1"
"111728","37258.390293","63.190.10.41","219.25.254.81","TCP","62","3103  >  21 [SYN] Seq=2329189930 Win=65535 Len=0 MSS=1414 SACK_PERM=1"
"112117","37325.769467","89.84.118.117","86.110.60.6","TCP","62","3241  >  21 [SYN] Seq=1356301015 Win=8760 Len=0 MSS=1460 SACK_PERM=1"
"113021","37457.862875","12.31.155.170","128.3.12.44","TCP","78","51481  >  21 [SYN] Seq=3348627372 Win=16384 Len=0 MSS=1460 SACK_PERM=1 WS=1 TSval=580318169 TSecr=0"
"113999","37744.203540","221.165.172.33","86.110.60.6","TCP","62","3281  >  21 [SYN] Seq=1453443711 Win=8760 Len=0 MSS=1460 SACK_PERM=1"
"114088","37768.865400","168.108.180.210","131.243.1.10","TCP","74","50709  >  21 [SYN] Seq=2517695475 Win=5808 Len=0 MSS=1412 TSval=295893445 TSecr=0 WS=1"
"114527","37915.402046","0.209.26.152","128.3.12.44","TCP","74","32807  >  21 [SYN] Seq=2643677062 Win=5840 Len=0 MSS=1460 SACK_PERM=1 TSval=45724 TSecr=0 WS=1"
"115094","38320.380552","23.31.245.99","131.243.1.10","TCP","62","61580  >  21 [SYN] Seq=23149852 Win=32767 Len=0 MSS=1412 SACK_PERM=1"
"115199","38367.008075","113.187.213.87","131.243.1.10","TCP","62","52609  >  21 [SYN] Seq=984721783 Win=24820 Len=0 SACK_PERM=1 MSS=1460"
"115294","38404.513071","34.175.214.0","131.243.2.12","TCP","62","5742  >  21 [SYN] Seq=161641435 Win=16384 Len=0 MSS=1460 SACK_PERM=1"
"115394","38429.407782","207.239.30.114","131.243.1.10","TCP","74","49188  >  21 [SYN] Seq=2875877349 Win=32768 Len=0 MSS=1460 WS=1 TSval=2054 TSecr=0"
"116142","38603.757076","43.75.228.116","44.76.136.98","TCP","74","3278  >  21 [SYN] Seq=3585369274 Win=5840 Len=0 MSS=1460 SACK_PERM=1 TSval=630813354 TSecr=0 WS=1"
"117213","38750.789535","107.34.21.92","131.243.2.12","TCP","66","2280  >  21 [SYN] Seq=954610305 Win=60352 Len=0 MSS=1460 WS=4 SACK_PERM=1"
"118093","38910.316538","5.73.72.237","131.243.1.10","TCP","74","4883  >  21 [SYN] Seq=3725966694 Win=5840 Len=0 MSS=1372 SACK_PERM=1 TSval=1065323267 TSecr=0 WS=1"
"119927","39213.461059","132.117.139.183","131.243.1.10","TCP","74","62602  >  21 [SYN] Seq=2151805655 Win=32768 Len=0 MSS=1460 WS=1 TSval=3369770117 TSecr=0"
"125480","39807.570950","88.34.47.48","131.243.1.10","TCP","58","44975  >  21 [SYN] Seq=2242571156 Win=33580 Len=0 MSS=1460"
"127360","40028.233091","234.69.80.183","131.243.1.10","TCP","74","64125  >  21 [SYN] Seq=3333466320 Win=8192 Len=0 MSS=1460 WS=1 TSval=48985649 TSecr=0"
"127543","40030.474449","160.150.170.213","131.243.1.10","TCP","62","2508  >  21 [SYN] Seq=2737598196 Win=64240 Len=0 MSS=1460 SACK_PERM=1"
"129439","40239.922085","42.30.77.233","131.243.2.12","TCP","62","3082  >  21 [SYN] Seq=3972460694 Win=16384 Len=0 MSS=1460 SACK_PERM=1"
"131920","40480.877952","161.86.54.158","128.3.12.44","TCP","78","11119  >  21 [SYN] Seq=211552973 Win=16384 Len=0 MSS=1460 SACK_PERM=1 WS=1 TSval=1084668275 TSecr=0"
"132100","40492.737390","115.210.47.101","131.243.1.10","TCP","74","33282  >  21 [SYN] Seq=931555062 Win=5840 Len=0 MSS=1460 SACK_PERM=1 TSval=7981563 TSecr=0 WS=1"
"133221","40628.346845","52.22.252.60","131.243.1.10","TCP","74","61187  >  21 [SYN] Seq=1257258880 Win=5840 Len=0 MSS=1460 SACK_PERM=1 TSval=1026366 TSecr=0 WS=1"
"133808","40793.920792","25.68.209.200","131.243.1.10","TCP","74","1038  >  21 [SYN] Seq=2709041483 Win=32768 Len=0 MSS=1428 WS=1 TSval=760634493 TSecr=0"
"133934","40816.391757","204.212.42.153","128.3.12.44","TCP","74","1560  >  21 [SYN] Seq=3763045193 Win=57344 Len=0 MSS=1452 WS=1 TSval=555015 TSecr=0"
"134123","40894.246513","30.52.123.142","131.243.1.10","TCP","62","35613  >  21 [SYN] Seq=3296060677 Win=24820 Len=0 SACK_PERM=1 MSS=1460"
"134306","40942.013648","150.53.76.10","131.243.1.10","TCP","62","1107  >  21 [SYN] Seq=2705144125 Win=16384 Len=0 MSS=1460"
"134557","41020.890243","206.4.6.146","131.243.1.10","TCP","62","2149  >  21 [SYN] Seq=3261190658 Win=64240 Len=0 MSS=1460 SACK_PERM=1"
"134624","41093.203467","142.238.159.102","131.243.1.10","TCP","74","10467  >  21 [SYN] Seq=1584229518 Win=5840 Len=0 MSS=1460 SACK_PERM=1 TSval=1153951 TSecr=0 WS=2"
"134709","41115.991161","49.28.205.110","131.243.1.10","TCP","62","1191  >  21 [SYN] Seq=5507673 Win=8192 Len=0 MSS=1460 SACK_PERM=1"
"134836","41138.653825","244.194.170.53","131.243.1.10","TCP","78","63327  >  21 [SYN] Seq=3912169657 Win=64240 Len=0 MSS=1460 WS=1 TSval=0 TSecr=0 SACK_PERM=1"
"135168","41204.920680","142.113.9.0","131.243.1.10","TCP","62","1045  >  21 [SYN] Seq=242078 Win=11680 Len=0 MSS=536 SACK_PERM=1"
"135368","41247.893793","122.61.158.172","131.243.1.10","TCP","62","1314  >  21 [SYN] Seq=127695585 Win=8760 Len=0 MSS=1460 SACK_PERM=1"
"136088","41424.773885","98.197.218.164","131.243.193.93","TCP","62","3949  >  21 [SYN] Seq=1220690299 Win=16384 Len=0 MSS=1460 SACK_PERM=1"
"136710","41561.080197","197.62.236.228","128.3.12.44","TCP","62","35201  >  21 [SYN] Seq=2768593755 Win=65280 Len=0 MSS=1360 SACK_PERM=1"
"136822","41579.979783","138.65.189.194","128.3.12.44","TCP","74","1861  >  21 [SYN] Seq=2255730465 Win=5840 Len=0 MSS=1460 SACK_PERM=1 TSval=103865714 TSecr=0 WS=1"
"137429","41695.020263","56.189.64.222","131.243.1.10","TCP","62","27465  >  21 [SYN] Seq=1025032554 Win=16384 Len=0 MSS=1450 SACK_PERM=1"
"137768","41769.600722","84.155.130.23","131.243.1.10","TCP","62","3397  >  21 [SYN] Seq=1741970986 Win=64240 Len=0 MSS=1460 SACK_PERM=1"
"137960","41816.453741","202.36.95.133","131.243.1.10","TCP","62","33306  >  21 [SYN] Seq=3148757617 Win=32767 Len=0 MSS=1402 SACK_PERM=1"
"138188","41875.016886","242.104.25.229","128.3.28.48","TCP","74","62853  >  21 [SYN] Seq=377898672 Win=5840 Len=0 MSS=1412 SACK_PERM=1 TSval=766373 TSecr=0 WS=1"
"138443","41934.361146","8.235.219.228","131.243.1.10","TCP","74","1058  >  21 [SYN] Seq=2361580576 Win=5840 Len=0 MSS=1460 SACK_PERM=1 TSval=342458 TSecr=0 WS=1"
"139309","42299.630356","23.55.109.161","131.243.1.10","TCP","74","34798  >  21 [SYN] Seq=2999001984 Win=5840 Len=0 MSS=1460 SACK_PERM=1 TSval=57459119 TSecr=0 WS=1"
"139447","42428.021021","183.57.175.126","131.243.1.10","TCP","78","27922  >  21 [SYN] Seq=1264631735 Win=16384 Len=0 MSS=1460 SACK_PERM=1 WS=1 TSval=183206860 TSecr=0"
"139604","42452.221376","54.231.248.204","131.243.1.10","TCP","62","1477  >  21 [SYN] Seq=3516691 Win=8192 Len=0 MSS=536 SACK_PERM=1"
"140613","42922.363609","195.232.210.35","131.243.2.12","TCP","62","1428  >  21 [SYN] Seq=3422074611 Win=16384 Len=0 MSS=1460 SACK_PERM=1"
"140881","42970.001313","7.229.252.69","131.243.1.10","TCP","62","1822  >  21 [SYN] Seq=2853661819 Win=64240 Len=0 MSS=1460 SACK_PERM=1"
"140913","42970.153834","165.16.26.143","131.243.1.10","TCP","74","29215  >  21 [SYN] Seq=3759197956 Win=5840 Len=0 MSS=1460 SACK_PERM=1 TSval=3171590 TSecr=0 WS=1"
"142918","43232.857556","138.205.202.81","131.243.1.10","TCP","74","1903  >  21 [SYN] Seq=3986247651 Win=32120 Len=0 MSS=1460 SACK_PERM=1 TSval=404516265 TSecr=0 WS=1"
"144138","43514.687357","77.127.89.121","131.243.1.83","TCP","74","34050  >  21 [SYN] Seq=4291296436 Win=5840 Len=0 MSS=1460 SACK_PERM=1 TSval=1896661201 TSecr=0 WS=1"
"144357","43580.622871","122.8.173.156","128.3.12.44","TCP","62","2240  >  21 [SYN] Seq=951255922 Win=16384 Len=0 MSS=1380 SACK_PERM=1"
"147639","44195.326657","163.197.216.143","131.243.1.10","TCP","62","4724  >  21 [SYN] Seq=2430261747 Win=8760 Len=0 MSS=1460 SACK_PERM=1"
"148413","44341.619388","228.54.193.254","131.243.1.10","TCP","74","3486  >  21 [SYN] Seq=736565374 Win=32120 Len=0 MSS=1460 SACK_PERM=1 TSval=255872286 TSecr=0 WS=1"
"148611","44356.653629","125.253.42.25","131.243.2.12","TCP","62","4508  >  21 [SYN] Seq=951820007 Win=16384 Len=0 MSS=1460 SACK_PERM=1"
"151501","44613.355467","29.89.122.122","128.3.12.44","TCP","74","1051  >  21 [SYN] Seq=3306440948 Win=5840 Len=0 MSS=1380 SACK_PERM=1 TSval=171438 TSecr=0 WS=1"
"151638","44623.436049","68.247.168.69","131.243.1.10","TCP","62","3353  >  21 [SYN] Seq=2280401010 Win=16384 Len=0 MSS=1460 SACK_PERM=1"
"152482","44747.614786","243.34.153.10","128.3.12.44","TCP","74","62645  >  21 [SYN] Seq=2903109340 Win=57344 Len=0 MSS=1460 WS=1 TSval=43806480 TSecr=0"
"155621","45180.248783","25.156.24.127","131.243.1.10","TCP","62","64615  >  21 [SYN] Seq=215527598 Win=64240 Len=0 MSS=1452 SACK_PERM=1"
"156339","45298.437612","60.18.19.57","131.243.1.10","TCP","74","1596  >  21 [SYN] Seq=4189781459 Win=4452 Len=0 MSS=1484 SACK_PERM=1 TSval=2604913 TSecr=0 WS=1"
"156662","45347.453773","53.67.96.225","131.243.1.10","TCP","74","33806  >  21 [SYN] Seq=1944525664 Win=5840 Len=0 MSS=1460 TSval=13950858 TSecr=0 WS=1"
"157085","45438.652259","237.28.193.71","128.3.28.48","TCP","74","56322  >  21 [SYN] Seq=1708621452 Win=5840 Len=0 MSS=1460 SACK_PERM=1 TSval=32325868 TSecr=0 WS=1"
"157293","45479.374453","230.254.210.117","131.243.1.10","TCP","62","18072  >  21 [SYN] Seq=3638186656 Win=16384 Len=0 MSS=1460 SACK_PERM=1"
"157592","45527.500892","200.228.167.27","203.174.5.11","TCP","62","64657  >  21 [SYN] Seq=1363465419 Win=64240 Len=0 MSS=1460 SACK_PERM=1"
"157800","45915.813655","104.78.52.162","128.3.12.44","TCP","62","1179  >  21 [SYN] Seq=3372804133 Win=16384 Len=0 MSS=1460 SACK_PERM=1"
"158015","46459.943345","248.186.1.156","131.243.1.10","TCP","62","1092  >  21 [SYN] Seq=4282032704 Win=16384 Len=0 MSS=1460 SACK_PERM=1"
"158117","46485.204061","74.176.55.50","131.243.1.10","TCP","62","62419  >  21 [SYN] Seq=2502501130 Win=16384 Len=0 MSS=1460 SACK_PERM=1"
"158749","46820.727598","190.200.111.237","242.70.74.100","TCP","62","4369  >  21 [SYN] Seq=166883385 Win=8192 Len=0 MSS=1460 SACK_PERM=1"
"160636","47332.126328","57.131.75.201","131.243.1.10","TCP","74","33192  >  21 [SYN] Seq=4203123832 Win=5840 Len=0 MSS=1460 SACK_PERM=1 TSval=4105914 TSecr=0 WS=1"
"161393","47629.976511","220.132.103.54","131.243.1.10","TCP","58","48717  >  21 [SYN] Seq=37884069 Win=8760 Len=0 MSS=1460"
"162064","47899.940392","243.130.145.15","131.243.2.12","TCP","74","1395  >  21 [SYN] Seq=344860520 Win=5840 Len=0 MSS=1460 SACK_PERM=1 TSval=379265961 TSecr=0 WS=1"
"162289","48017.342026","176.152.171.164","131.243.1.10","TCP","62","28335  >  21 [SYN] Seq=4433575 Win=8192 Len=0 MSS=1460 SACK_PERM=1"
"163154","48235.478721","123.88.136.168","131.243.1.10","TCP","58","37980  >  21 [SYN] Seq=372393023 Win=8760 Len=0 MSS=1460"
"163224","48301.389622","86.107.63.216","131.243.1.10","TCP","78","14252  >  21 [SYN] Seq=3099670611 Win=16384 Len=0 MSS=1460 SACK_PERM=1 WS=1 TSval=38280596 TSecr=0"
"163369","48412.987486","42.244.132.196","131.243.1.10","TCP","74","60115  >  21 [SYN] Seq=1518495910 Win=16384 Len=0 MSS=1452 WS=1 TSval=0 TSecr=0"
"163804","48713.272560","69.30.229.129","131.243.1.10","TCP","62","1864  >  21 [SYN] Seq=1994335300 Win=8760 Len=0 MSS=1460 SACK_PERM=1"
"163898","48733.363211","121.77.46.153","131.243.1.10","TCP","58","1675  >  21 [SYN] Seq=1167621048 Win=16384 Len=0 MSS=1460"
"163967","48738.450675","234.129.51.135","131.243.1.10","TCP","62","10027  >  21 [SYN] Seq=50439203 Win=16384 Len=0 MSS=1460 SACK_PERM=1"
"164686","48937.794333","240.110.204.190","131.243.1.10","TCP","74","35630  >  21 [SYN] Seq=1315859318 Win=5840 Len=0 MSS=1322 SACK_PERM=1 TSval=38170298 TSecr=0 WS=1"
"164860","49174.160228","156.139.170.126","131.243.1.10","TCP","62","37728  >  21 [SYN] Seq=4091842134 Win=24820 Len=0 SACK_PERM=1 MSS=1460"
"165240","49628.031914","146.15.82.192","109.103.64.27","TCP","66","4071  >  21 [SYN] Seq=2431102135 Win=5840 Len=0 MSS=1460 SACK_PERM=1 WS=1"
"165328","49662.123898","83.27.116.42","131.243.1.10","TCP","62","7455  >  21 [SYN] Seq=2987203451 Win=64240 Len=0 MSS=1460 SACK_PERM=1"
"165560","49794.105433","124.8.48.90","131.243.56.235","TCP","62","4285  >  21 [SYN] Seq=3221409352 Win=64240 Len=0 MSS=1460 SACK_PERM=1"
"165623","49815.589049","172.125.153.219","131.243.1.10","TCP","62","1277  >  21 [SYN] Seq=767833 Win=8192 Len=0 MSS=536 SACK_PERM=1"
"165988","49989.788418","99.31.61.101","131.243.1.10","TCP","74","62965  >  21 [SYN] Seq=2366707760 Win=5840 Len=0 MSS=1460 SACK_PERM=1 TSval=1854383 TSecr=0 WS=1"
"166424","50139.041665","99.76.250.164","131.243.2.12","TCP","62","61026  >  21 [SYN] Seq=161414895 Win=8192 Len=0 MSS=1460 SACK_PERM=1"
"167605","50434.910260","4.153.126.156","131.243.1.10","TCP","62","2267  >  21 [SYN] Seq=5135181 Win=8192 Len=0 MSS=536 SACK_PERM=1"
"167912","50503.114148","108.160.29.189","131.243.1.10","TCP","62","3437  >  21 [SYN] Seq=2117113692 Win=64240 Len=0 MSS=1452 SACK_PERM=1"
"169417","51020.995224","59.143.84.169","131.243.2.12","TCP","62","1256  >  21 [SYN] Seq=2471359108 Win=16384 Len=0 MSS=1460 SACK_PERM=1"
"169792","51143.215671","177.7.14.224","131.243.1.10","TCP","62","1262  >  21 [SYN] Seq=630940209 Win=16384 Len=0 MSS=1400"
"170202","51250.967018","2.229.105.87","131.243.1.10","TCP","74","50078  >  21 [SYN] Seq=73842150 Win=32768 Len=0 MSS=1460 WS=1 TSval=981358922 TSecr=0"
"171101","51481.995589","55.68.153.64","128.3.12.44","TCP","62","3301  >  21 [SYN] Seq=3823766825 Win=2144 Len=0 MSS=1460 SACK_PERM=1"
"171620","51681.334524","40.86.60.56","131.243.1.10","TCP","66","62182  >  21 [SYN] Seq=2510746518 Win=65535 Len=0 WS=2 SACK_PERM=1 MSS=1460"
"171700","51758.267664","93.120.234.91","128.3.12.44","TCP","74","4378  >  21 [SYN] Seq=1434835904 Win=57344 Len=0 MSS=1380 WS=1 TSval=3449566181 TSecr=0"
"171775","51896.905373","38.67.154.111","131.243.1.10","TCP","74","1607  >  21 [SYN] Seq=279884619 Win=32120 Len=0 MSS=1460 SACK_PERM=1 TSval=243286780 TSecr=0 WS=1"
"172457","52230.779778","230.35.154.215","131.243.1.10","TCP","62","15816  >  21 [SYN] Seq=3805676983 Win=16384 Len=0 MSS=1460 SACK_PERM=1"
"172720","52909.478202","104.112.51.242","131.243.1.10","TCP","74","57472  >  21 [SYN] Seq=1382493446 Win=5840 Len=0 MSS=1460 SACK_PERM=1 TSval=127450990 TSecr=0 WS=1"
"172982","53015.119471","135.234.177.81","131.243.1.10","TCP","78","47487  >  21 [SYN] Seq=1223004557 Win=32850 Len=0 WS=2 TSval=109243436 TSecr=0 SACK_PERM=1 MSS=1460"
"174962","53490.571983","126.63.134.108","131.243.1.10","TCP","74","41465  >  21 [SYN] Seq=1948082376 Win=5840 Len=0 MSS=1460 SACK_PERM=1 TSval=180396824 TSecr=0 WS=1"
"175257","53547.080260","109.101.191.162","131.243.1.10","TCP","74","4448  >  21 [SYN] Seq=1998652609 Win=32120 Len=0 MSS=1460 SACK_PERM=1 TSval=27063521 TSecr=0 WS=1"
"175419","53610.822578","221.213.13.56","78.56.58.89","TCP","62","64800  >  21 [SYN] Seq=4112909229 Win=64240 Len=0 MSS=1460 SACK_PERM=1"
"176184","53966.187446","177.196.211.230","131.243.1.10","TCP","62","1123  >  21 [SYN] Seq=336290 Win=8192 Len=0 MSS=1460 SACK_PERM=1"
"178787","54636.845467","221.48.69.3","131.243.1.10","TCP","74","4725  >  21 [SYN] Seq=3174429321 Win=5840 Len=0 MSS=1460 TSval=73823832 TSecr=0 WS=1"
"179968","54861.601183","96.88.100.70","128.3.12.44","TCP","74","47182  >  21 [SYN] Seq=3734048132 Win=5840 Len=0 MSS=1380 SACK_PERM=1 TSval=2091110954 TSecr=0"
"180128","54875.193097","142.56.12.93","131.243.1.10","TCP","62","1371  >  21 [SYN] Seq=4248729 Win=23360 Len=0 MSS=1414 SACK_PERM=1"
"181157","55154.931102","249.237.242.135","131.243.1.10","TCP","62","2060  >  21 [SYN] Seq=34516531 Win=8192 Len=0 MSS=536 SACK_PERM=1"
"181333","55256.506028","249.162.232.161","131.243.1.10","TCP","74","32783  >  21 [SYN] Seq=3820145513 Win=5840 Len=0 MSS=1460 SACK_PERM=1 TSval=148192 TSecr=0 WS=1"
"181487","55322.522730","3.216.186.208","131.243.1.10","TCP","74","34237  >  21 [SYN] Seq=3881223846 Win=5840 Len=0 MSS=1460 SACK_PERM=1 TSval=82648706 TSecr=0 WS=1"
"181562","55344.885287","92.0.137.12","131.243.1.10","TCP","74","55100  >  21 [SYN] Seq=3911027301 Win=5840 Len=0 MSS=1460 SACK_PERM=1 TSval=3647932109 TSecr=0 WS=1"
"181697","55446.463648","154.125.41.198","131.243.1.10","TCP","74","3929  >  21 [SYN] Seq=4027032489 Win=5840 Len=0 MSS=1460 SACK_PERM=1 TSval=238687895 TSecr=0 WS=1"
"181832","55471.758244","182.92.140.177","131.243.1.10","TCP","62","63449  >  21 [SYN] Seq=3474384610 Win=64240 Len=0 MSS=1432 SACK_PERM=1"
"181885","55475.525365","59.241.80.53","86.110.60.6","TCP","62","1167  >  21 [SYN] Seq=3677300206 Win=16384 Len=0 MSS=1460 SACK_PERM=1"
"182139","55847.138634","226.81.143.72","131.243.1.10","TCP","62","1391  >  21 [SYN] Seq=3964542402 Win=64240 Len=0 MSS=1460 SACK_PERM=1"
"182323","56067.738787","186.89.225.107","242.70.74.100","TCP","62","3497  >  21 [SYN] Seq=2037786092 Win=16384 Len=0 MSS=1460 SACK_PERM=1"
"182349","56222.288741","13.172.243.255","131.243.1.10","TCP","62","15512  >  21 [SYN] Seq=3117947948 Win=16384 Len=0 MSS=1460 SACK_PERM=1"
"183959","56686.520902","114.207.221.113","131.243.1.10","TCP","62","48741  >  21 [SYN] Seq=3960242603 Win=24820 Len=0 SACK_PERM=1 MSS=1460"
"184961","56891.064409","136.67.138.179","131.243.1.10","TCP","58","4685  >  21 [SYN] Seq=2081216000 Win=32768 Len=0 MSS=1460"
"185005","56891.595529","128.150.176.248","131.243.1.10","TCP","74","35359  >  21 [SYN] Seq=1242661692 Win=5840 Len=0 MSS=1460 SACK_PERM=1 TSval=21205148 TSecr=0 WS=1"
"185876","57182.589319","38.43.22.104","131.243.1.10","TCP","62","1581  >  21 [SYN] Seq=2148958842 Win=16384 Len=0 MSS=1460 SACK_PERM=1"
"186283","57217.438217","242.171.60.166","128.3.12.44","TCP","74","64351  >  21 [SYN] Seq=3242449686 Win=16384 Len=0 MSS=1460 WS=1 TSval=0 TSecr=0"
"186499","57303.750733","91.77.55.54","131.243.1.10","TCP","62","20318  >  21 [SYN] Seq=3414430238 Win=32768 Len=0 MSS=1460 WS=1"
"187436","57817.202637","29.5.26.75","131.243.193.93","TCP","74","61988  >  21 [SYN] Seq=3461033575 Win=8192 Len=0 MSS=1460 WS=1 TSval=347335983 TSecr=0"
"187575","57974.973741","157.115.222.79","131.243.1.10","TCP","74","62781  >  21 [SYN] Seq=2583543203 Win=32768 Len=0 MSS=1460 WS=1 TSval=10963 TSecr=0"
"187789","58229.135679","121.204.82.134","131.243.2.12","TCP","62","3709  >  21 [SYN] Seq=74429286 Win=64240 Len=0 MSS=1460 SACK_PERM=1"
"189420","58755.471125","127.115.69.174","131.243.1.10","TCP","74","53097  >  21 [SYN] Seq=3214416644 Win=5840 Len=0 MSS=1460 TSval=19347490 TSecr=0 WS=1"
"189601","58796.182669","208.220.212.205","131.243.1.10","TCP","74","16355  >  21 [SYN] Seq=319234193 Win=5840 Len=0 MSS=1350 TSval=435583727 TSecr=0 WS=1"
"189805","59087.660744","149.63.43.106","128.3.28.48","TCP","66","1972  >  21 [SYN] Seq=2799097010 Win=5840 Len=0 MSS=1460 WS=1"
"189888","59501.467570","110.0.43.49","131.243.1.10","TCP","62","35371  >  21 [SYN] Seq=418295760 Win=24820 Len=0 SACK_PERM=1 MSS=1460"
"189949","59844.085080","94.115.110.217","128.3.12.44","TCP","74","57615  >  21 [SYN] Seq=3388773412 Win=5840 Len=0 MSS=1460 SACK_PERM=1 TSval=3513188932 TSecr=0 WS=1"
"189979","59878.326753","213.76.95.241","131.243.2.12","TCP","62","1059  >  21 [SYN] Seq=3370760699 Win=16384 Len=0 MSS=1460 SACK_PERM=1"
"190218","60030.349589","12.95.159.168","192.207.159.141","TCP","62","1293  >  21 [SYN] Seq=905726 Win=4288 Len=0 MSS=1452 SACK_PERM=1"
"190485","60186.394455","158.179.106.212","128.3.12.44","TCP","62","1468  >  21 [SYN] Seq=68935583 Win=16384 Len=0 MSS=1460 SACK_PERM=1"
"190799","60764.997433","114.65.171.55","128.3.12.44","TCP","74","33829  >  21 [SYN] Seq=919809608 Win=5840 Len=0 MSS=1460 SACK_PERM=1 TSval=15883318 TSecr=0 WS=1"
"191148","60924.735719","23.143.246.200","131.243.3.49","TCP","62","6380  >  21 [SYN] Seq=990865690 Win=32768 Len=0 MSS=1460 WS=1"
"192614","61486.416602","39.77.78.12","131.243.1.10","TCP","62","1585  >  21 [SYN] Seq=3324826288 Win=16384 Len=0 MSS=1460 SACK_PERM=1"
"192908","61602.649834","205.32.207.220","131.243.1.10","TCP","62","1200  >  21 [SYN] Seq=529542329 Win=8760 Len=0 MSS=1460 SACK_PERM=1"
"193138","61786.323601","197.99.103.162","131.243.1.10","TCP","62","55726  >  21 [SYN] Seq=4114987514 Win=16384 Len=0 MSS=1460 SACK_PERM=1"
"193239","62062.438109","132.35.151.202","131.243.1.10","TCP","74","63442  >  21 [SYN] Seq=2465153327 Win=5840 Len=0 MSS=1414 SACK_PERM=1 TSval=1495566 TSecr=0 WS=1"
"193308","62116.252470","77.222.43.116","131.243.1.10","TCP","62","2023  >  21 [SYN] Seq=2001939934 Win=16384 Len=0 MSS=1380 SACK_PERM=1"
"193485","62287.626197","155.95.241.100","128.3.12.44","TCP","74","57106  >  21 [SYN] Seq=2686769880 Win=5840 Len=0 MSS=1460 SACK_PERM=1 TSval=438020627 TSecr=0 WS=1"
"193512","62355.986785","132.88.200.72","128.3.12.44","TCP","74","60802  >  21 [SYN] Seq=672653845 Win=5840 Len=0 MSS=1460 SACK_PERM=1 TSval=955485988 TSecr=0 WS=1"
"193539","62361.665559","228.108.41.13","131.243.1.10","TCP","62","42244  >  21 [SYN] Seq=3443880698 Win=2920 Len=0 SACK_PERM=1 MSS=1460"
"193686","62399.051675","115.112.177.179","131.243.1.10","TCP","74","37555  >  21 [SYN] Seq=2756152597 Win=5840 Len=0 MSS=1460 SACK_PERM=1 TSval=1014237783 TSecr=0 WS=1"
"193743","62400.671553","109.115.171.214","128.3.28.48","TCP","74","36473  >  21 [SYN] Seq=2792494857 Win=5840 Len=0 MSS=1460 SACK_PERM=1 TSval=20680246 TSecr=0 WS=1"
"193960","62584.184777","17.57.42.181","131.243.1.10","TCP","78","1173  >  21 [SYN] Seq=94728106 Win=8192 Len=0 MSS=1460 WS=1 TSval=0 TSecr=0 SACK_PERM=1"
"194535","62852.353735","244.246.222.30","131.243.1.10","TCP","74","33118  >  21 [SYN] Seq=3352328916 Win=5840 Len=0 MSS=1460 SACK_PERM=1 TSval=8415391 TSecr=0 WS=1"
"197079","63276.459717","218.65.255.185","131.243.1.10","TCP","62","39050  >  21 [SYN] Seq=2074435896 Win=16384 Len=0 MSS=1414 SACK_PERM=1"
"198500","63476.820782","233.54.231.144","128.3.12.44","TCP","78","60430  >  21 [SYN] Seq=413583303 Win=32850 Len=0 WS=2 TSval=148620720 TSecr=0 SACK_PERM=1 MSS=1460"
"198826","63553.636368","224.187.175.90","131.243.1.10","TCP","62","56207  >  21 [SYN] Seq=1544588423 Win=16384 Len=0 MSS=1456 SACK_PERM=1"
"198909","63567.594846","110.194.218.69","128.3.12.44","TCP","58","64490  >  21 [SYN] Seq=1198312546 Win=8760 Len=0 MSS=1460"
"199303","63626.340113","171.1.7.162","128.3.28.48","TCP","74","33673  >  21 [SYN] Seq=3981767503 Win=5840 Len=0 MSS=1460 SACK_PERM=1 TSval=21239803 TSecr=0 WS=1"
"199487","63660.592728","14.8.249.73","131.243.1.10","TCP","74","63883  >  21 [SYN] Seq=3753132071 Win=5840 Len=0 MSS=1460 SACK_PERM=1 TSval=9081361 TSecr=0 WS=1"
"199579","63670.771930","112.11.35.238","131.243.1.10","TCP","74","3794  >  21 [SYN] Seq=3513066170 Win=5840 Len=0 MSS=1460 SACK_PERM=1 TSval=25435986 TSecr=0 WS=1"
"216177","64855.255608","53.209.26.78","131.243.1.10","TCP","74","33261  >  21 [SYN] Seq=1579397581 Win=5840 Len=0 MSS=1460 SACK_PERM=1 TSval=902889 TSecr=0 WS=1"
"219562","65327.686551","252.241.246.96","131.243.1.10","TCP","62","46195  >  21 [SYN] Seq=2512185850 Win=49640 Len=0 MSS=1460 SACK_PERM=1"
"221323","65897.574652","69.41.39.220","131.243.1.10","TCP","62","2143  >  21 [SYN] Seq=26295423 Win=8192 Len=0 MSS=1460 SACK_PERM=1"
"221538","66012.498533","120.198.119.152","131.243.1.10","TCP","62","3477  >  21 [SYN] Seq=642004992 Win=61440 Len=0 MSS=1460 WS=1"
"221612","66219.760458","227.195.236.76","131.243.1.10","TCP","58","44599  >  21 [SYN] Seq=1424112776 Win=64240 Len=0 MSS=1460"
"221671","66227.869600","249.131.115.59","131.243.64.10","TCP","62","1137  >  21 [SYN] Seq=483175278 Win=16384 Len=0 MSS=1460 SACK_PERM=1"
"221949","66293.095696","176.87.117.123","131.243.1.10","TCP","74","41114  >  21 [SYN] Seq=30303530 Win=5840 Len=0 MSS=1350 SACK_PERM=1 TSval=41176528 TSecr=0 WS=1"
"222022","66335.081307","163.243.239.96","131.243.1.10","TCP","62","33310  >  21 [SYN] Seq=3090084694 Win=16384 Len=0 MSS=1332 SACK_PERM=1"
"222209","66808.010708","186.154.182.123","131.243.1.10","TCP","74","10084  >  21 [SYN] Seq=2933306409 Win=16384 Len=0 MSS=1460 WS=1 TSval=0 TSecr=0"
"222286","66822.954474","65.100.203.248","131.243.1.10","TCP","62","53472  >  21 [SYN] Seq=414704079 Win=24820 Len=0 SACK_PERM=1 MSS=1460"
"222501","67103.281890","132.255.2.152","131.243.1.10","TCP","62","1362  >  21 [SYN] Seq=3510616388 Win=5840 Len=0 MSS=1460"
"222687","67294.488461","117.21.117.233","131.243.1.10","TCP","62","4674  >  21 [SYN] Seq=1606993139 Win=64240 Len=0 MSS=1460 SACK_PERM=1"
"222826","67350.427776","225.100.60.13","131.243.1.10","TCP","62","1100  >  21 [SYN] Seq=3796409299 Win=64240 Len=0 MSS=1460"
"223262","67491.979542","114.85.69.52","131.243.1.10","TCP","58","1730  >  21 [SYN] Seq=3696963578 Win=512 Len=0 MSS=1460"
"223342","67530.482241","55.101.48.221","131.243.1.10","TCP","74","1342  >  21 [SYN] Seq=2953573145 Win=57344 Len=0 MSS=1414 WS=1 TSval=57741461 TSecr=0"
"223974","67859.881428","234.244.208.153","131.243.1.10","TCP","74","1841  >  21 [SYN] Seq=1033071569 Win=8192 Len=0 MSS=1460 WS=1 TSval=394482 TSecr=0"
"224034","68047.817080","174.103.108.68","128.3.12.44","TCP","78","12694  >  21 [SYN] Seq=2178361099 Win=16384 Len=0 MSS=1460 WS=1 TSval=320994032 TSecr=0"
"224118","68538.809846","144.112.146.203","131.243.1.10","TCP","62","32986  >  21 [SYN] Seq=2582443166 Win=16384 Len=0 MSS=1400 SACK_PERM=1"
"224722","68591.491850","68.48.93.14","131.243.1.10","TCP","62","48679  >  21 [SYN] Seq=2282360244 Win=64240 Len=0 MSS=1460 SACK_PERM=1"
"225876","68838.964337","16.31.10.206","131.243.1.10","TCP","62","2635  >  21 [SYN] Seq=36286828 Win=65535 Len=0 MSS=1460 SACK_PERM=1"
"226033","68876.717566","90.63.230.194","128.3.12.44","TCP","62","64455  >  21 [SYN] Seq=804672936 Win=64240 Len=0 MSS=1414 SACK_PERM=1"
"226131","69235.135909","223.218.252.131","131.243.1.10","TCP","58","46223  >  21 [SYN] Seq=1800820679 Win=8760 Len=0 MSS=1460"
"226563","69426.344911","29.43.0.171","131.243.2.12","TCP","62","4721  >  21 [SYN] Seq=3067374444 Win=64240 Len=0 MSS=1460 SACK_PERM=1"
"226583","69430.813775","113.119.83.133","109.103.64.27","TCP","62","1455  >  21 [SYN] Seq=209269194 Win=16384 Len=0 MSS=1460 SACK_PERM=1"
"226751","69508.697042","203.248.105.180","131.243.1.10","TCP","62","1089  >  21 [SYN] Seq=1376132 Win=8192 Len=0 MSS=536 SACK_PERM=1"
"227822","70099.845743","129.46.223.60","131.243.1.10","TCP","62","55054  >  21 [SYN] Seq=154889193 Win=5840 Len=0 MSS=1460 SACK_PERM=1"
"227892","70134.083067","126.246.56.2","131.243.1.10","TCP","62","1171  >  21 [SYN] Seq=1150080222 Win=5360 Len=0 MSS=1332"
"228134","70241.404494","66.150.59.108","131.243.1.10","TCP","74","3468  >  21 [SYN] Seq=3227002793 Win=57344 Len=0 MSS=1460 WS=1 TSval=200040921 TSecr=0"
"228176","70242.563012","209.233.102.212","131.243.1.10","TCP","74","32821  >  21 [SYN] Seq=2248225981 Win=4452 Len=0 MSS=1484 SACK_PERM=1 TSval=406674 TSecr=0 WS=1"
"228708","70497.501438","83.57.102.76","131.243.1.10","TCP","62","22163  >  21 [SYN] Seq=3741372276 Win=16384 Len=0 MSS=1460 SACK_PERM=1"
"229011","70648.029234","27.78.89.76","131.243.1.10","TCP","62","4925  >  21 [SYN] Seq=1453136987 Win=8760 Len=0 MSS=1460 SACK_PERM=1"
"230059","70942.964428","4.85.215.32","131.243.1.10","TCP","62","4166  >  21 [SYN] Seq=1813648995 Win=8760 Len=0 MSS=1460 SACK_PERM=1"
"230819","71144.402266","61.166.90.124","86.110.60.6","TCP","62","1295  >  21 [SYN] Seq=2232522395 Win=64240 Len=0 MSS=1460 SACK_PERM=1"
"230874","71169.054043","143.109.199.127","128.3.28.48","TCP","58","37137  >  21 [SYN] Seq=3544264210 Win=5840 Len=0 MSS=1460"
"230986","71248.389833","149.134.10.246","128.3.28.48","TCP","58","32844  >  21 [SYN] Seq=400222728 Win=5840 Len=0 MSS=1460"
"232089","71642.158328","66.68.80.50","131.243.1.10","TCP","62","3156  >  21 [SYN] Seq=816373224 Win=16384 Len=0 MSS=1460 SACK_PERM=1"
"232625","71835.348075","164.166.204.10","131.243.1.10","TCP","62","51689  >  21 [SYN] Seq=4180384468 Win=16384 Len=0 MSS=1380 SACK_PERM=1"
"232778","71869.904001","80.37.169.239","128.3.12.44","TCP","74","1025  >  21 [SYN] Seq=4179405604 Win=5840 Len=0 MSS=1460 SACK_PERM=1 TSval=1191895 TSecr=0 WS=1"
"232820","71874.761596","219.218.2.234","131.243.1.10","TCP","62","1356  >  21 [SYN] Seq=248285897 Win=16384 Len=0 MSS=1460 SACK_PERM=1"
"235203","72554.059588","71.11.166.176","131.243.1.10","TCP","74","2053  >  21 [SYN] Seq=41977214 Win=5840 Len=0 MSS=1436 SACK_PERM=1 TSval=51540 TSecr=0 WS=1"
"235678","72650.954628","87.51.227.21","131.243.1.10","TCP","62","61327  >  21 [SYN] Seq=1249277 Win=8192 Len=0 MSS=1460 SACK_PERM=1"
"236531","72732.916188","213.30.184.86","131.243.1.10","TCP","62","30117  >  21 [SYN] Seq=1071294870 Win=64240 Len=0 MSS=1460 SACK_PERM=1"
"237006","72934.559867","40.226.158.89","131.243.1.10","TCP","58","37250  >  21 [SYN] Seq=347798788 Win=8760 Len=0 MSS=1460"
"237327","73443.708843","79.179.251.247","131.243.1.10","TCP","62","4418  >  21 [SYN] Seq=2681074444 Win=64240 Len=0 MSS=1460 SACK_PERM=1"
"237927","74101.395527","238.125.210.199","131.243.1.10","TCP","74","64402  >  21 [SYN] Seq=42630170 Win=65535 Len=0 MSS=1460 WS=1 TSval=5902430 TSecr=0"
"238220","74255.475397","217.207.38.45","131.243.1.10","TCP","78","13207  >  21 [SYN] Seq=4054020433 Win=16384 Len=0 MSS=1460 SACK_PERM=1 WS=1 TSval=314734199 TSecr=0"
"238998","74743.497493","142.141.91.149","131.243.2.12","TCP","62","2302  >  21 [SYN] Seq=3312610018 Win=16384 Len=0 MSS=1460 SACK_PERM=1"
"239994","75082.641583","212.180.60.96","131.243.2.12","TCP","62","4453  >  21 [SYN] Seq=3107312355 Win=16384 Len=0 MSS=1460 SACK_PERM=1"
"241382","75833.402774","129.64.134.193","131.243.1.10","TCP","62","12631  >  21 [SYN] Seq=1863705075 Win=64240 Len=0 MSS=1460 SACK_PERM=1"
"242164","76393.819032","67.64.134.183","131.243.1.10","TCP","74","1032  >  21 [SYN] Seq=1464944433 Win=5840 Len=0 MSS=1460 SACK_PERM=1 TSval=32480939 TSecr=0 WS=1"
"242372","76441.824471","18.26.181.1","131.243.1.10","TCP","74","64161  >  21 [SYN] Seq=431339680 Win=5840 Len=0 MSS=1460 SACK_PERM=1 TSval=110147057 TSecr=0 WS=1"
"242516","76473.260381","246.109.155.46","131.243.1.10","TCP","62","27576  >  21 [SYN] Seq=119519409 Win=33580 Len=0 SACK_PERM=1 MSS=1460"
"242855","76623.675851","68.148.33.212","131.243.1.10","TCP","62","1914  >  21 [SYN] Seq=5033140 Win=8192 Len=0 MSS=1460 SACK_PERM=1"
"243462","76870.859742","61.6.212.48","128.3.12.44","TCP","74","65192  >  21 [SYN] Seq=4227400267 Win=16384 Len=0 MSS=1460 WS=1 TSval=19109 TSecr=0"
"245382","77210.693247","175.156.82.252","131.243.1.10","TCP","74","42099  >  21 [SYN] Seq=1218790876 Win=32120 Len=0 MSS=1460 SACK_PERM=1 TSval=670151399 TSecr=0 WS=1"
"245664","77353.888526","123.125.239.10","128.3.28.48","TCP","74","61380  >  21 [SYN] Seq=1572552407 Win=5840 Len=0 MSS=1460 SACK_PERM=1 TSval=530882674 TSecr=0 WS=1"
"245935","77480.311871","1.46.157.115","242.70.74.100","TCP","62","55983  >  21 [SYN] Seq=2470446247 Win=64240 Len=0 MSS=1414 SACK_PERM=1"
"245984","77549.221401","244.130.46.193","131.243.1.10","TCP","74","32994  >  21 [SYN] Seq=1713321531 Win=5840 Len=0 MSS=1460 SACK_PERM=1 TSval=219304 TSecr=0 WS=1"
"246176","77642.866540","74.218.79.24","131.243.1.10","TCP","74","33089  >  21 [SYN] Seq=1657087054 Win=5840 Len=0 MSS=1460 SACK_PERM=1 TSval=111085637 TSecr=0 WS=1"
"246337","77744.558001","117.14.188.61","131.243.1.10","TCP","62","33055  >  21 [SYN] Seq=2235030152 Win=16384 Len=0 MSS=1460 SACK_PERM=1"
"246984","78061.847251","185.90.84.96","109.160.54.58","TCP","74","2468  >  21 [SYN] Seq=2070605467 Win=32120 Len=0 MSS=1460 SACK_PERM=1 TSval=167779902 TSecr=0 WS=1"
"247591","78431.605401","47.190.32.70","131.243.2.12","TCP","62","1210  >  21 [SYN] Seq=1599455328 Win=16384 Len=0 MSS=1460 SACK_PERM=1"
"251056","79373.549197","112.211.22.34","128.3.12.44","TCP","74","1769  >  21 [SYN] Seq=3142511254 Win=57344 Len=0 MSS=1414 WS=1 TSval=71221166 TSecr=0"
"251209","79435.670696","236.85.160.128","131.243.1.10","TCP","62","1525  >  21 [SYN] Seq=3119480987 Win=16384 Len=0 MSS=1360 SACK_PERM=1"
"251405","79562.690244","26.197.185.76","131.243.1.10","TCP","62","3669  >  21 [SYN] Seq=3962827237 Win=16384 Len=0 MSS=1460 SACK_PERM=1"
"251607","79685.847000","72.139.17.124","131.243.1.10","TCP","74","64921  >  21 [SYN] Seq=476385499 Win=5840 Len=0 MSS=1452 SACK_PERM=1 TSval=1039802 TSecr=0 WS=1"
"251695","79859.844347","59.59.218.28","131.243.1.10","TCP","62","1471  >  21 [SYN] Seq=2702659 Win=8192 Len=0 MSS=1460 SACK_PERM=1"
"251907","80256.397844","3.50.196.57","128.3.12.44","TCP","62","1054  >  21 [SYN] Seq=175460 Win=8192 Len=0 MSS=512 SACK_PERM=1"
"251974","80291.279726","148.75.24.53","128.3.32.63","TCP","62","2288  >  21 [SYN] Seq=931072000 Win=32768 Len=0 MSS=1460 WS=1"
"252013","80316.195244","36.89.165.164","131.243.1.10","TCP","62","64809  >  21 [SYN] Seq=3420749010 Win=64240 Len=0 MSS=1460 SACK_PERM=1"
"252556","80553.047018","215.156.189.72","131.243.1.10","TCP","58","35798  >  21 [SYN] Seq=2353042091 Win=8760 Len=0 MSS=1460"
"252730","80556.780936","51.96.80.84","131.243.1.10","TCP","74","10066  >  21 [SYN] Seq=4254785378 Win=57344 Len=0 MSS=1460 WS=1 TSval=69983 TSecr=0"
"253003","80611.436890","42.108.8.116","131.243.1.10","TCP","74","3686  >  21 [SYN] Seq=1372693308 Win=16060 Len=0 MSS=1380 SACK_PERM=1 TSval=1293919816 TSecr=0 WS=1"
"253343","80691.145109","123.200.33.41","128.3.28.48","TCP","62","2306  >  21 [SYN] Seq=3667252279 Win=16384 Len=0 MSS=1460 SACK_PERM=1"
"253658","80814.382844","253.114.77.210","131.243.1.10","TCP","58","65445  >  21 [SYN] Seq=349822102 Win=8760 Len=0 MSS=1380"
"255227","81696.997360","48.191.139.130","131.243.1.10","TCP","62","2354  >  21 [SYN] Seq=2103832 Win=8192 Len=0 MSS=536 SACK_PERM=1"
"255426","81785.172483","255.165.66.19","128.3.28.48","TCP","74","1050  >  21 [SYN] Seq=607978502 Win=5808 Len=0 MSS=1412 SACK_PERM=1 TSval=89097811 TSecr=0 WS=1"
"257512","82318.908357","64.37.211.186","128.3.12.44","TCP","74","33254  >  21 [SYN] Seq=2327195803 Win=5840 Len=0 MSS=1460 SACK_PERM=1 TSval=14868757 TSecr=0 WS=1"
"258293","82525.269458","28.131.230.19","131.243.1.10","TCP","66","52431  >  21 [SYN] Seq=2545694682 Win=5840 Len=0 MSS=1460 SACK_PERM=1 WS=1"
"259500","82694.741906","167.67.226.104","131.243.2.12","TCP","74","6420  >  21 [SYN] Seq=2585753903 Win=65535 Len=0 MSS=1460 WS=1 TSval=186940 TSecr=0"
"259542","82698.021860","130.140.30.45","131.243.1.10","TCP","62","64872  >  21 [SYN] Seq=18222383 Win=8192 Len=0 MSS=1460 SACK_PERM=1"
"259802","82720.034083","105.216.15.73","131.243.2.12","TCP","74","35507  >  21 [SYN] Seq=1095150111 Win=65535 Len=0 MSS=1460 WS=1 TSval=2095182 TSecr=0"
"260647","82883.985919","113.120.111.174","131.243.1.10","TCP","62","64314  >  21 [SYN] Seq=799302397 Win=16384 Len=0 MSS=1460 SACK_PERM=1"
"261635","83330.464118","222.38.6.47","44.76.136.98","TCP","62","63271  >  21 [SYN] Seq=3666686387 Win=16384 Len=0 MSS=1460 SACK_PERM=1"
"261643","83410.681594","250.180.225.181","189.246.241.212","TCP","62","3915  >  21 [SYN] Seq=3722168532 Win=16384 Len=0 MSS=1460 SACK_PERM=1"
"262492","83802.741287","221.44.70.167","128.3.28.48","TCP","74","62841  >  21 [SYN] Seq=3892470931 Win=5840 Len=0 MSS=1412 SACK_PERM=1 TSval=7882606 TSecr=0 WS=1"
"262844","83915.763693","53.231.143.122","131.243.1.10","TCP","62","1757  >  21 [SYN] Seq=4206236467 Win=16384 Len=0 MSS=1460 SACK_PERM=1"
"265037","84406.033868","44.30.187.72","131.243.1.10","TCP","78","34985  >  21 [SYN] Seq=1474845386 Win=16384 Len=0 MSS=1460 SACK_PERM=1 WS=1 TSval=117237079 TSecr=0"
"266644","84677.449642","86.112.72.99","131.243.1.10","TCP","62","1036  >  21 [SYN] Seq=10421897 Win=8192 Len=0 MSS=536 SACK_PERM=1"
"268074","84974.054401","155.138.180.253","128.3.12.44","TCP","78","63108  >  21 [SYN] Seq=1954903823 Win=44620 Len=0 MSS=1440 WS=8 TSval=0 TSecr=0 SACK_PERM=1"
"268687","85269.151002","45.93.33.36","128.3.12.44","TCP","78","34006  >  21 [SYN] Seq=869728494 Win=16384 Len=0 MSS=1460 SACK_PERM=1 WS=1 TSval=460830276 TSecr=0"
"268953","85354.828876","159.105.179.102","131.243.1.10","TCP","62","1790  >  21 [SYN] Seq=1138382841 Win=65535 Len=0 MSS=1420 SACK_PERM=1"
