"1","0.000000","142.164.6.70","131.243.1.10","TCP","62","1313  >  21 [SYN] Seq=1734984547 Win=8760 Len=0 MSS=1460 SACK_PERM=1"
"91","105.078090","73.6.91.115","131.243.2.12","TCP","62","2027  >  21 [SYN] Seq=4190971401 Win=16384 Len=0 MSS=1460 SACK_PERM=1"
"400","222.785014","82.143.24.12","131.243.2.12","TCP","62","3537  >  21 [SYN] Seq=2986625670 Win=16384 Len=0 MSS=1460 SACK_PERM=1"
"485","251.651531","79.37.53.67","131.243.2.12","TCP","62","35280  >  21 [SYN] Seq=4133316359 Win=16384 Len=0 MSS=1460 SACK_PERM=1"
"730","372.521806","67.243.63.146","131.243.1.10","TCP","62","1380  >  21 [SYN] Seq=3849101 Win=8192 Len=0 MSS=1460 SACK_PERM=1"
"1343","499.134708","40.175.116.120","128.3.12.44","TCP","78","45958  >  21 [SYN] Seq=897728278 Win=16384 Len=0 MSS=1460 SACK_PERM=1 WS=1 TSval=959726359 TSecr=0"
"1762","690.823856","172.211.70.122","131.243.1.10","TCP","74","40037  >  21 [SYN] Seq=2645955037 Win=5840 Len=0 MSS=1460 TSval=317460990 TSecr=0 WS=2"
"1831","697.902054","245.22.38.204","203.174.5.11","TCP","62","3157  >  21 [SYN] Seq=1981005324 Win=64240 Len=0 MSS=1460 SACK_PERM=1"
"1966","778.278657","180.69.204.185","131.243.1.10","TCP","74","1494  >  21 [SYN] Seq=2848098330 Win=5840 Len=0 MSS=1460 SACK_PERM=1 TSval=1981421 TSecr=0 WS=1"
"2043","836.432440","89.42.124.234","203.174.5.11","TCP","62","1158  >  21 [SYN] Seq=3481078044 Win=64240 Len=0 MSS=1460 SACK_PERM=1"
"2125","1199.329314","230.23.2.245","131.243.1.10","TCP","74","35879  >  21 [SYN] Seq=3166086907 Win=5808 Len=0 MSS=1412 SACK_PERM=1 TSval=9278925 TSecr=0 WS=1"
"2161","1201.271073","207.82.132.32","131.243.193.93","TCP","74","65056  >  21 [SYN] Seq=3425332968 Win=5840 Len=0 MSS=1460 SACK_PERM=1 TSval=2653119 TSecr=0 WS=1"
"2390","1575.626263","122.28.199.241","131.243.1.10","TCP","62","3136  >  21 [SYN] Seq=2969649892 Win=8760 Len=0 MSS=1460 SACK_PERM=1"
"2517","1702.802170","104.205.27.72","128.3.28.48","TCP","74","42009  >  21 [SYN] Seq=3905625284 Win=5840 Len=0 MSS=1460 SACK_PERM=1 TSval=202397446 TSecr=0 WS=1"
"2607","1792.402291","4.251.189.14","131.243.1.10","TCP","74","46315  >  21 [SYN] Seq=3795674049 Win=5840 Len=0 MSS=1460 SACK_PERM=1 TSval=24626074 TSecr=0 WS=1"
"2678","1814.810246","148.111.20.136","131.243.1.10","TCP","74","43567  >  21 [SYN] Seq=3822039560 Win=5840 Len=0 MSS=1460 SACK_PERM=1 TSval=74020629 TSecr=0 WS=1"
"2803","1874.840447","24.239.126.222","131.243.1.10","TCP","74","57740  >  21 [SYN] Seq=1079805767 Win=32768 Len=0 MSS=1460 WS=1 TSval=3497007375 TSecr=0"
"2867","1898.205790","249.44.109.25","128.3.28.48","TCP","74","2932  >  21 [SYN] Seq=3899323806 Win=5840 Len=0 MSS=1460 SACK_PERM=1 TSval=134926338 TSecr=0 WS=1"
"2948","2182.202389","62.87.148.206","131.243.1.10","TCP","62","20553  >  21 [SYN] Seq=1533753869 Win=16384 Len=0 MSS=1460 SACK_PERM=1"
"3147","2342.012401","168.29.177.209","131.243.1.10","TCP","58","4616  >  21 [SYN] Seq=425406182 Win=4096 Len=0 MSS=1460"
"3187","2398.835045","127.115.69.174","131.243.1.10","TCP","74","54196  >  21 [SYN] Seq=134031576 Win=5840 Len=0 MSS=1460 TSval=306876388 TSecr=0 WS=1"
"3274","2427.837515","209.75.218.182","131.243.1.10","TCP","74","33006  >  21 [SYN] Seq=566720768 Win=5840 Len=0 MSS=1460 SACK_PERM=1 TSval=229667 TSecr=0 WS=1"
"3375","2456.757825","84.68.192.198","131.243.1.10","TCP","74","1184  >  21 [SYN] Seq=2442447545 Win=57344 Len=0 MSS=1380 WS=1 TSval=1158759429 TSecr=0"
"3484","2610.326519","53.55.176.50","131.243.1.10","TCP","62","10011  >  21 [SYN] Seq=17309033 Win=65535 Len=0 MSS=1460 SACK_PERM=1"
"3713","2648.311975","246.94.203.142","203.174.5.11","TCP","62","1070  >  21 [SYN] Seq=3346926217 Win=16384 Len=0 MSS=1460 SACK_PERM=1"
"3913","2708.446505","216.43.247.103","131.243.1.10","TCP","74","42534  >  21 [SYN] Seq=469423174 Win=5840 Len=0 MSS=1460 SACK_PERM=1 TSval=1848837730 TSecr=0 WS=1"
"5256","3059.310300","24.83.76.105","131.243.1.10","TCP","62","1978  >  21 [SYN] Seq=2120492376 Win=16384 Len=0 MSS=1460"
"5596","3096.403234","49.143.255.248","131.243.1.10","TCP","62","17772  >  21 [SYN] Seq=409164775 Win=64240 Len=0 MSS=1460 SACK_PERM=1"
"5998","3192.129150","157.198.151.233","131.243.1.10","TCP","74","3519  >  21 [SYN] Seq=1131138061 Win=32120 Len=0 MSS=1460 SACK_PERM=1 TSval=41054097 TSecr=0 WS=1"
"6097","3213.362019","213.30.184.86","131.243.1.10","TCP","62","53045  >  21 [SYN] Seq=1117365431 Win=64240 Len=0 MSS=1460 SACK_PERM=1"
"6294","3309.310991","114.201.61.120","131.243.1.10","TCP","62","1236  >  21 [SYN] Seq=3504166 Win=8192 Len=0 MSS=536 SACK_PERM=1"
"6671","3504.393643","66.224.210.96","131.243.1.10","TCP","74","64460  >  21 [SYN] Seq=1319903559 Win=5840 Len=0 MSS=1460 SACK_PERM=1 TSval=1744052 TSecr=0 WS=1"
"6794","3616.817813","24.190.46.234","131.243.1.10","TCP","58","36078  >  21 [SYN] Seq=2853901118 Win=8760 Len=0 MSS=1460"
"6925","3844.943127","198.132.228.204","128.3.28.48","TCP","62","4218  >  21 [SYN] Seq=3898299642 Win=16384 Len=0 MSS=1460 SACK_PERM=1"
"6994","4116.951094","169.92.87.70","203.174.5.11","TCP","62","2722  >  21 [SYN] Seq=899654746 Win=16384 Len=0 MSS=1460 SACK_PERM=1"
"7636","4401.873731","157.231.148.18","131.243.2.12","TCP","62","1678  >  21 [SYN] Seq=2738632225 Win=16384 Len=0 MSS=1460 SACK_PERM=1"
"8779","4538.515883","107.34.21.92","131.243.2.12","TCP","62","4303  >  21 [SYN] Seq=2507109066 Win=16384 Len=0 MSS=1460 SACK_PERM=1"
"12144","4851.342717","83.27.116.42","131.243.1.10","TCP","62","34142  >  21 [SYN] Seq=3065272175 Win=64240 Len=0 MSS=1460 SACK_PERM=1"
"14095","5247.501404","255.143.100.71","131.243.1.10","TCP","62","2517  >  21 [SYN] Seq=3794639057 Win=64240 Len=0 MSS=1460 SACK_PERM=1"
"14453","5366.019371","177.81.214.10","203.174.5.11","TCP","74","1249  >  21 [SYN] Seq=3263617581 Win=32568 Len=0 MSS=472 SACK_PERM=1 TSval=111777887 TSecr=0 WS=1"
"14495","5378.008254","116.177.87.124","131.243.1.10","TCP","74","3150  >  21 [SYN] Seq=3279849938 Win=32120 Len=0 MSS=1460 SACK_PERM=1 TSval=124561754 TSecr=0 WS=1"
"14839","5422.987213","38.5.158.54","131.243.2.12","TCP","62","2520  >  21 [SYN] Seq=2167604509 Win=16384 Len=0 MSS=1460 SACK_PERM=1"
"15258","5537.420617","12.47.80.49","131.243.1.10","TCP","74","2074  >  21 [SYN] Seq=1799203319 Win=5840 Len=0 MSS=1460 SACK_PERM=1 TSval=986718068 TSecr=0 WS=1"
"16323","6070.284673","97.0.158.29","131.243.1.10","TCP","74","47802  >  21 [SYN] Seq=4013815541 Win=5840 Len=0 MSS=1460 SACK_PERM=1 TSval=433865417 TSecr=0 WS=1"
"17747","6767.292469","9.134.163.63","131.243.1.10","TCP","62","2295  >  21 [SYN] Seq=967493357 Win=16384 Len=0 MSS=1460 SACK_PERM=1"
"18170","6951.420481","165.196.252.224","131.243.1.10","TCP","62","1096  >  21 [SYN] Seq=18435518 Win=8192 Len=0 MSS=536 SACK_PERM=1"
"19733","7376.653200","131.201.66.31","131.243.2.12","TCP","62","4702  >  21 [SYN] Seq=894671545 Win=35100 Len=0 MSS=1460 SACK_PERM=1"
"20210","7464.388946","94.115.110.217","128.3.12.44","TCP","74","53384  >  21 [SYN] Seq=217468467 Win=5840 Len=0 MSS=1460 SACK_PERM=1 TSval=3447403055 TSecr=0 WS=1"
"20301","7486.494085","42.47.103.207","131.243.1.10","TCP","62","61645  >  21 [SYN] Seq=34055153 Win=8192 Len=0 MSS=1460 SACK_PERM=1"
"20365","7494.078564","123.229.236.233","131.243.1.10","TCP","66","1086  >  21 [SYN] Seq=3716810910 Win=16384 Len=0 MSS=1452 WS=1 SACK_PERM=1"
"20898","7600.343144","6.80.138.33","131.243.1.10","TCP","74","36252  >  21 [SYN] Seq=1583076829 Win=5840 Len=0 MSS=1460 SACK_PERM=1 TSval=13677845 TSecr=0 WS=1"
"21954","7900.319481","106.20.55.102","131.243.1.10","TCP","62","1454  >  21 [SYN] Seq=511417104 Win=16384 Len=0 MSS=1460 SACK_PERM=1"
"22300","7944.029179","102.182.6.132","131.243.1.10","TCP","74","52287  >  21 [SYN] Seq=1698719749 Win=5840 Len=0 MSS=1460 TSval=338729781 TSecr=0 WS=1"
"22593","7977.151618","127.1.58.114","131.243.1.10","TCP","62","1151  >  21 [SYN] Seq=2282535 Win=8192 Len=0 MSS=1460"
"23058","8077.170278","141.25.137.236","131.243.1.10","TCP","62","1123  >  21 [SYN] Seq=6392914 Win=5840 Len=0 MSS=1460 SACK_PERM=1"
"23311","8253.105037","211.57.73.255","131.243.2.12","TCP","62","1262  >  21 [SYN] Seq=2167627862 Win=16384 Len=0 MSS=1460 SACK_PERM=1"
"23977","8378.106651","225.76.177.112","131.243.1.10","TCP","62","3480  >  21 [SYN] Seq=10752287 Win=8192 Len=0 MSS=1460 SACK_PERM=1"
"24603","8559.890674","72.115.210.168","131.243.193.93","TCP","62","2151  >  21 [SYN] Seq=4531052 Win=8192 Len=0 MSS=536 SACK_PERM=1"
"25629","9051.337781","131.88.227.195","131.243.1.10","TCP","74","1308  >  21 [SYN] Seq=505568379 Win=57344 Len=0 MSS=1460 WS=1 TSval=97368358 TSecr=0"
"25773","9091.392849","165.78.71.101","128.3.28.48","TCP","74","36530  >  21 [SYN] Seq=2926026246 Win=5840 Len=0 MSS=1460 SACK_PERM=1 TSval=693790102 TSecr=0 WS=1"
"25953","9157.219185","108.97.140.165","131.243.1.10","TCP","74","48530  >  21 [SYN] Seq=2928133099 Win=5840 Len=0 MSS=1460 SACK_PERM=1 TSval=268870996 TSecr=0 WS=1"
"26045","9190.400328","76.166.36.94","128.3.12.44","TCP","74","34819  >  21 [SYN] Seq=355585952 Win=5840 Len=0 MSS=1380 SACK_PERM=1 TSval=79272507 TSecr=0 WS=1"
"26159","9222.927934","150.121.58.207","128.3.12.44","TCP","58","2092  >  21 [SYN] Seq=1190577387 Win=8192 Len=0 MSS=1380"
"26220","9242.219999","193.183.106.128","131.243.1.10","TCP","58","34901  >  21 [SYN] Seq=2871781812 Win=8192 Len=0 MSS=1380"
"26276","9245.433104","186.4.2.111","131.243.1.10","TCP","58","4698  >  21 [SYN] Seq=3794204489 Win=8192 Len=0 MSS=1460"
"28195","9778.317321","114.177.57.83","131.243.1.10","TCP","58","49002  >  21 [SYN] Seq=3225138735 Win=64240 Len=0 MSS=1460"
"28288","9798.787507","42.210.238.96","131.243.1.10","TCP","62","1838  >  21 [SYN] Seq=2878067271 Win=16384 Len=0 MSS=1440 SACK_PERM=1"
"28606","9959.027126","165.252.43.195","131.243.2.12","TCP","62","2972  >  21 [SYN] Seq=2905121763 Win=16384 Len=0 MSS=1460 SACK_PERM=1"
"28744","10001.284878","103.235.43.184","131.243.1.10","TCP","62","62169  >  21 [SYN] Seq=3356390204 Win=16384 Len=0 MSS=1460 SACK_PERM=1"
"29168","10116.065376","189.116.125.99","131.243.1.10","TCP","74","54110  >  21 [SYN] Seq=2002511608 Win=5840 Len=0 MSS=1380 SACK_PERM=1 TSval=54584350 TSecr=0 WS=1"
"29539","10188.278733","18.255.20.15","131.243.1.10","TCP","74","61077  >  21 [SYN] Seq=4091109005 Win=5840 Len=0 MSS=1412 SACK_PERM=1 TSval=53415 TSecr=0 WS=1"
"29877","10294.572205","20.105.218.163","131.243.2.12","TCP","62","2102  >  21 [SYN] Seq=2485184133 Win=16384 Len=0 MSS=1460 SACK_PERM=1"
"30829","10478.561415","41.79.73.209","128.3.28.48","TCP","74","33082  >  21 [SYN] Seq=1459071900 Win=32440 Len=0 MSS=1404 SACK_PERM=1 TSval=188395528 TSecr=0 WS=1"
"31812","10655.309768","232.76.144.51","131.243.1.10","TCP","74","32867  >  21 [SYN] Seq=327464109 Win=5840 Len=0 MSS=1452 SACK_PERM=1 TSval=128486 TSecr=0 WS=1"
"32163","10755.252059","150.205.207.154","131.243.1.10","TCP","78","2827  >  21 [SYN] Seq=3405163144 Win=32768 Len=0 MSS=1460 WS=1 TSval=0 TSecr=0 SACK_PERM=1"
"32305","10783.458402","120.16.202.242","131.243.1.10","TCP","62","10219  >  21 [SYN] Seq=400630575 Win=16384 Len=0 MSS=1460 SACK_PERM=1"
"32518","10820.198766","82.145.243.51","131.243.1.10","TCP","62","1483  >  21 [SYN] Seq=410010813 Win=16384 Len=0 MSS=1460 SACK_PERM=1"
"32816","10861.867790","69.163.37.69","131.243.1.10","TCP","62","32849  >  21 [SYN] Seq=2797172771 Win=64240 Len=0 MSS=1460 SACK_PERM=1"
"33236","10914.153675","163.64.85.121","131.243.1.10","TCP","62","1068  >  21 [SYN] Seq=2240203630 Win=16384 Len=0 MSS=1460 SACK_PERM=1"
"33498","10969.142711","216.74.174.215","128.3.12.44","TCP","62","3725  >  21 [SYN] Seq=4251601099 Win=16384 Len=0 MSS=1452 SACK_PERM=1"
"33750","11232.049188","245.101.211.214","131.243.1.10","TCP","74","32972  >  21 [SYN] Seq=886869339 Win=5840 Len=0 MSS=1460 SACK_PERM=1 TSval=13092197 TSecr=0 WS=1"
"33922","11489.450857","38.93.253.216","203.174.5.11","TCP","62","4318  >  21 [SYN] Seq=1942454101 Win=35100 Len=0 MSS=1460 SACK_PERM=1"
"34320","11607.506672","227.150.66.109","131.243.1.10","TCP","62","1840  >  21 [SYN] Seq=2993549439 Win=8760 Len=0 MSS=1460 SACK_PERM=1"
"34784","11747.664665","222.128.122.183","131.243.1.10","TCP","62","62665  >  21 [SYN] Seq=1544117621 Win=64240 Len=0 MSS=1460 SACK_PERM=1"
"34841","11751.185327","23.189.2.205","131.243.1.10","TCP","74","1027  >  21 [SYN] Seq=1393759028 Win=5840 Len=0 MSS=1460 SACK_PERM=1 TSval=100883 TSecr=0 WS=1"
"35187","11803.118020","143.177.34.19","131.243.1.10","TCP","62","4375  >  21 [SYN] Seq=3557075347 Win=8760 Len=0 MSS=1460 SACK_PERM=1"
"35601","11891.686679","45.226.3.174","131.243.1.10","TCP","74","44691  >  21 [SYN] Seq=1576415860 Win=5840 Len=0 MSS=1460 TSval=1228776 TSecr=0 WS=1"
"35672","11897.792060","254.17.77.244","131.243.2.12","TCP","62","64322  >  21 [SYN] Seq=6098535 Win=8192 Len=0 MSS=1460 SACK_PERM=1"
"36320","12011.570636","167.32.55.8","128.3.12.44","TCP","62","3143  >  21 [SYN] Seq=3700672143 Win=16384 Len=0 MSS=1460 SACK_PERM=1"
"36696","12184.738122","110.112.122.22","131.243.2.12","TCP","62","3547  >  21 [SYN] Seq=527679972 Win=16384 Len=0 MSS=1460 SACK_PERM=1"
"37700","12550.636897","128.243.207.56","131.243.1.10","TCP","62","1320  >  21 [SYN] Seq=2244996619 Win=8760 Len=0 MSS=1460 SACK_PERM=1"
"38985","12851.189706","134.179.167.38","131.243.1.10","TCP","74","50279  >  21 [SYN] Seq=3950965730 Win=32768 Len=0 MSS=1460 WS=1 TSval=1443650016 TSecr=0"
"39260","12937.550473","188.89.214.143","131.243.1.10","TCP","62","38176  >  21 [SYN] Seq=2932762817 Win=64240 Len=0 MSS=1460 SACK_PERM=1"
"39475","13149.426626","120.105.54.244","131.243.1.10","TCP","62","2390  >  21 [SYN] Seq=642865057 Win=16384 Len=0 MSS=1360 SACK_PERM=1"
"39532","13176.079748","152.50.112.133","128.3.12.44","TCP","74","1234  >  21 [SYN] Seq=599624504 Win=57344 Len=0 MSS=1460 WS=1 TSval=1153161 TSecr=0"
"39565","13305.075279","105.99.75.92","131.243.1.10","TCP","74","63348  >  21 [SYN] Seq=3054234489 Win=5840 Len=0 MSS=1412 SACK_PERM=1 TSval=555209 TSecr=0 WS=2"
"39783","13376.646773","188.121.245.62","131.243.1.10","TCP","62","2142  >  21 [SYN] Seq=15015443 Win=8192 Len=0 MSS=1322 SACK_PERM=1"
"41461","13741.265638","77.112.39.234","131.243.1.10","TCP","74","57757  >  21 [SYN] Seq=3229043361 Win=5808 Len=0 MSS=1412 SACK_PERM=1 TSval=672711 TSecr=0 WS=1"
"42003","13781.646211","73.231.82.55","131.243.1.10","TCP","58","53572  >  21 [SYN] Seq=3983448332 Win=8760 Len=0 MSS=1460"
"43600","13988.715720","161.193.137.36","131.243.1.10","TCP","62","61060  >  21 [SYN] Seq=3684970211 Win=8760 Len=0 MSS=1460 SACK_PERM=1"
"44028","14020.003507","176.193.178.169","131.243.1.10","TCP","78","62598  >  21 [SYN] Seq=1664156094 Win=16384 Len=0 MSS=1452 SACK_PERM=1 WS=1 TSval=664721350 TSecr=0"
"44160","14031.055210","197.105.135.7","131.243.2.12","TCP","62","33337  >  21 [SYN] Seq=270658339 Win=16384 Len=0 MSS=1460 SACK_PERM=1"
"45848","14310.106413","255.126.43.101","128.3.12.44","TCP","74","50491  >  21 [SYN] Seq=4132671252 Win=5840 Len=0 MSS=1460 SACK_PERM=1 TSval=198207259 TSecr=0 WS=1"
"46000","14352.609977","140.90.232.130","128.3.12.44","TCP","74","46127  >  21 [SYN] Seq=4165662947 Win=5840 Len=0 MSS=1460 SACK_PERM=1 TSval=245133694 TSecr=0 WS=1"
"46185","14440.585169","139.48.62.62","131.243.1.10","TCP","78","1318  >  21 [SYN] Seq=525166899 Win=16384 Len=0 MSS=1460 SACK_PERM=1 WS=1 TSval=1246471855 TSecr=0"
"46481","14568.914082","65.227.173.163","131.243.1.10","TCP","62","37081  >  21 [SYN] Seq=3835389392 Win=64240 Len=0 MSS=1460 SACK_PERM=1"
"46695","14643.769981","12.248.73.217","131.243.1.10","TCP","62","1431  >  21 [SYN] Seq=3688001783 Win=64240 Len=0 MSS=1460 SACK_PERM=1"
"46814","14680.617686","155.127.0.177","131.243.2.12","TCP","66","5025  >  21 [SYN] Seq=847663426 Win=16960 Len=0 MSS=1460 WS=16 SACK_PERM=1"
"47211","14908.503046","147.240.86.185","131.243.1.10","TCP","74","46297  >  21 [SYN] Seq=1803084416 Win=5840 Len=0 MSS=1460 SACK_PERM=1 TSval=2084975714 TSecr=0 WS=1"
"47418","14988.763247","113.170.127.199","131.243.1.10","TCP","62","4637  >  21 [SYN] Seq=3903944834 Win=16384 Len=0 MSS=1460 SACK_PERM=1"
"47870","15024.670981","173.218.67.133","131.243.1.10","TCP","74","33379  >  21 [SYN] Seq=590049866 Win=5840 Len=0 MSS=1460 SACK_PERM=1 TSval=75309 TSecr=0 WS=1"
"48838","15166.459455","169.59.118.27","131.243.1.10","TCP","74","1176  >  21 [SYN] Seq=778169970 Win=5840 Len=0 MSS=1460 TSval=733455 TSecr=0 WS=1"
"49606","15530.803536","11.58.227.219","131.243.1.10","TCP","62","9627  >  21 [SYN] Seq=1963896346 Win=32767 Len=0 MSS=1322 SACK_PERM=1"
"49727","15759.566542","111.222.166.141","131.243.1.10","TCP","62","1079  >  21 [SYN] Seq=10453667 Win=8192 Len=0 MSS=1460 SACK_PERM=1"
"49809","15836.818608","133.183.60.94","131.243.1.10","TCP","62","3886  >  21 [SYN] Seq=4086906048 Win=64240 Len=0 MSS=1460 SACK_PERM=1"
"49869","15849.026802","94.99.144.179","131.243.1.10","TCP","74","1128  >  21 [SYN] Seq=1658685387 Win=4848 Len=0 MSS=1616 SACK_PERM=1 TSval=7532020 TSecr=0 WS=1"
"50177","16061.271923","241.172.208.75","131.243.1.10","TCP","74","1224  >  21 [SYN] Seq=1868882946 Win=5840 Len=0 MSS=1460 SACK_PERM=1 TSval=7067287 TSecr=0 WS=1"
"50311","16074.341026","244.195.221.109","131.243.2.12","TCP","62","1936  >  21 [SYN] Seq=857984492 Win=64240 Len=0 MSS=1380 SACK_PERM=1"
"50374","16282.769072","219.81.128.59","131.243.1.10","TCP","62","1587  >  21 [SYN] Seq=2226729188 Win=8760 Len=0 MSS=1460 SACK_PERM=1"
"50793","16377.664492","116.26.146.22","131.243.1.10","TCP","62","1825  >  21 [SYN] Seq=3167945306 Win=11520 Len=0 MSS=1460 SACK_PERM=1"
"51176","16441.512470","109.101.191.162","131.243.1.10","TCP","74","3279  >  21 [SYN] Seq=2089708835 Win=32120 Len=0 MSS=1460 SACK_PERM=1 TSval=111168168 TSecr=0 WS=1"
"52994","16928.428805","229.117.73.96","128.3.12.44","TCP","78","6480  >  21 [SYN] Seq=2659918691 Win=16384 Len=0 MSS=1460 SACK_PERM=1 WS=1 TSval=331769115 TSecr=0"
"53405","17080.475333","92.222.78.98","128.3.12.44","TCP","74","3429  >  21 [SYN] Seq=2750620202 Win=32120 Len=0 MSS=1460 SACK_PERM=1 TSval=18207048 TSecr=0 WS=1"
"53587","17153.208009","59.119.174.139","131.243.1.10","TCP","58","52064  >  21 [SYN] Seq=2358476689 Win=8760 Len=0 MSS=1460"
"53656","17400.252501","49.134.164.249","131.243.1.10","TCP","74","65481  >  21 [SYN] Seq=3450610981 Win=16384 Len=0 MSS=1460 WS=1 TSval=0 TSecr=0"
"53731","17454.415687","35.110.180.140","131.243.1.10","TCP","74","3142  >  21 [SYN] Seq=3169264725 Win=32120 Len=0 MSS=1460 SACK_PERM=1 TSval=51965244 TSecr=0 WS=1"
"53799","17538.954405","129.163.126.82","128.3.20.245","TCP","62","2208  >  21 [SYN] Seq=73817830 Win=65535 Len=0 MSS=1372 SACK_PERM=1"
"54456","17800.422211","163.50.170.250","131.243.1.10","TCP","62","49027  >  21 [SYN] Seq=900369348 Win=16384 Len=0 MSS=1460 SACK_PERM=1"
"54519","17830.996062","172.46.42.88","131.243.1.10","TCP","74","3143  >  21 [SYN] Seq=3807509928 Win=5840 Len=0 MSS=1460 SACK_PERM=1 TSval=530533923 TSecr=0 WS=1"
"54609","17926.229474","152.78.9.17","131.243.1.10","TCP","74","64734  >  21 [SYN] Seq=3818086004 Win=5840 Len=0 MSS=1460 SACK_PERM=1 TSval=10486325 TSecr=0 WS=1"
"54720","17953.406453","158.214.230.206","128.3.12.44","TCP","74","13695  >  21 [SYN] Seq=3017812731 Win=16384 Len=0 MSS=1460 WS=1 TSval=0 TSecr=0"
"54766","17966.300196","136.118.224.122","131.243.2.12","TCP","78","3565  >  21 [SYN] Seq=2244890650 Win=44620 Len=0 MSS=1460 WS=8 TSval=0 TSecr=0 SACK_PERM=1"
"55199","18178.396112","42.30.77.233","131.243.2.12","TCP","62","6668  >  21 [SYN] Seq=1954194030 Win=64240 Len=0 MSS=1460 SACK_PERM=1"
"55905","18387.645438","100.249.76.9","131.243.2.12","TCP","66","1142  >  21 [SYN] Seq=2625596689 Win=32767 Len=0 MSS=1460 WS=1 SACK_PERM=1"
"57024","18620.569511","99.120.228.142","131.243.1.10","TCP","58","43149  >  21 [SYN] Seq=3068772703 Win=64240 Len=0 MSS=1460"
"57559","18730.881401","17.177.104.232","86.110.60.6","TCP","62","1827  >  21 [SYN] Seq=2198307189 Win=16384 Len=0 MSS=1440 SACK_PERM=1"
"58761","18915.685942","127.134.164.196","131.243.1.10","TCP","74","50989  >  21 [SYN] Seq=559406915 Win=5840 Len=0 MSS=1460 SACK_PERM=1 TSval=603371429 TSecr=0 WS=1"
"59336","18985.741991","45.7.36.127","131.243.2.12","TCP","78","4026  >  21 [SYN] Seq=2672208857 Win=65535 Len=0 MSS=1460 WS=8 TSval=0 TSecr=0 SACK_PERM=1"
"60184","19113.767294","217.83.255.63","131.243.1.10","TCP","78","1279  >  21 [SYN] Seq=7549624 Win=45680 Len=0 MSS=1460 WS=8 TSval=0 TSecr=0 SACK_PERM=1"
"61606","19334.005741","188.206.49.124","131.243.193.93","TCP","74","49744  >  21 [SYN] Seq=1646760156 Win=32768 Len=0 MSS=1460 WS=1 TSval=19689 TSecr=0"
"61862","19381.303566","44.43.236.112","131.243.1.10","TCP","62","1239  >  21 [SYN] Seq=506191899 Win=64512 Len=0 MSS=1460 SACK_PERM=1"
"61941","19387.629796","141.92.198.155","203.174.5.11","TCP","62","1925  >  21 [SYN] Seq=4079122148 Win=16384 Len=0 MSS=1460 SACK_PERM=1"
"62863","19607.131161","98.95.181.58","86.110.60.6","TCP","62","20419  >  21 [SYN] Seq=365513 Win=8192 Len=0 MSS=1428 SACK_PERM=1"
"63227","19668.535475","72.181.178.3","131.243.1.10","TCP","62","33801  >  21 [SYN] Seq=1769625309 Win=64240 Len=0 MSS=1380 SACK_PERM=1"
"63479","19704.824037","117.30.184.93","131.243.1.10","TCP","62","1117  >  21 [SYN] Seq=1983760249 Win=16384 Len=0 MSS=1460 SACK_PERM=1"
"63752","19725.482481","217.148.52.180","131.243.2.12","TCP","62","3409  >  21 [SYN] Seq=2723109969 Win=16384 Len=0 MSS=1460 SACK_PERM=1"
"64471","19857.965969","190.35.217.89","128.3.28.48","TCP","74","2493  >  21 [SYN] Seq=1403685423 Win=5840 Len=0 MSS=1460 SACK_PERM=1 TSval=446309008 TSecr=0 WS=1"
"65692","20078.619227","51.124.71.132","131.243.1.10","TCP","58","42403  >  21 [SYN] Seq=1496451689 Win=8760 Len=0 MSS=1460"
"66892","20310.778083","31.155.60.14","131.243.1.10","TCP","66","61459  >  21 [SYN] Seq=2296985510 Win=16384 Len=0 MSS=1414 WS=1 SACK_PERM=1"
"67287","20518.500040","9.195.91.167","131.243.56.235","TCP","62","2399  >  21 [SYN] Seq=3069296841 Win=64240 Len=0 MSS=1460 SACK_PERM=1"
"67585","20705.705816","154.166.241.195","131.243.1.10","TCP","62","1740  >  21 [SYN] Seq=19632963 Win=28280 Len=0 MSS=1414 SACK_PERM=1"
"67678","20718.902158","62.40.240.133","131.243.1.10","TCP","62","3946  >  21 [SYN] Seq=168367117 Win=64240 Len=0 MSS=1460 SACK_PERM=1"
"67898","20737.438439","239.87.156.4","131.243.1.10","TCP","74","57471  >  21 [SYN] Seq=2783791694 Win=65535 Len=0 MSS=1460 WS=1 TSval=819709 TSecr=0"
"68114","20807.331089","188.112.20.144","131.243.1.10","TCP","62","1410  >  21 [SYN] Seq=1872349 Win=8192 Len=0 MSS=536 SACK_PERM=1"
"68403","20866.431306","84.63.233.180","131.243.1.10","TCP","62","2815  >  21 [SYN] Seq=4070994538 Win=16384 Len=0 MSS=1460 SACK_PERM=1"
"69353","21266.929858","8.140.239.183","131.243.1.10","TCP","62","4719  >  21 [SYN] Seq=283908578 Win=64240 Len=0 MSS=1412"
"69868","21581.230064","7.167.69.53","131.243.1.10","TCP","62","2598  >  21 [SYN] Seq=4173075597 Win=64800 Len=0 MSS=1440 SACK_PERM=1"
"70049","21642.715084","18.51.157.217","131.243.1.10","TCP","62","42675  >  21 [SYN] Seq=971067518 Win=24820 Len=0 SACK_PERM=1 MSS=1460"
"70097","21643.883709","200.51.200.214","131.243.1.10","TCP","62","40390  >  21 [SYN] Seq=1433988284 Win=24820 Len=0 SACK_PERM=1 MSS=1460"
"70513","21782.126820","245.105.23.166","131.243.1.10","TCP","62","3490  >  21 [SYN] Seq=1122464020 Win=64240 Len=0 MSS=1460 SACK_PERM=1"
"70743","21840.055819","52.23.39.95","131.243.2.12","TCP","62","3158  >  21 [SYN] Seq=284472262 Win=16384 Len=0 MSS=1460 SACK_PERM=1"
"70953","22036.706444","236.135.226.142","131.243.2.12","TCP","62","1223  >  21 [SYN] Seq=3920306295 Win=16384 Len=0 MSS=1460 SACK_PERM=1"
"71454","22213.349895","21.242.196.102","131.243.1.10","TCP","62","14516  >  21 [SYN] Seq=3402014129 Win=24820 Len=0 SACK_PERM=1 MSS=1460"
"73523","22903.931126","83.10.133.169","131.243.1.10","TCP","58","3116  >  21 [SYN] Seq=994956575 Win=8192 Len=0 MSS=1460"
"73842","22942.728987","92.153.240.120","131.243.1.10","TCP","62","1335  >  21 [SYN] Seq=2764061708 Win=16384 Len=0 MSS=1460 SACK_PERM=1"
"74221","23012.674695","187.18.15.111","109.103.64.27","TCP","58","4313  >  21 [SYN] Seq=653663782 Win=8192 Len=0 MSS=1460"
"75184","23234.550679","83.139.153.25","131.243.1.10","TCP","62","33268  >  21 [SYN] Seq=1991330997 Win=64240 Len=0 MSS=1460 SACK_PERM=1"
"75336","23242.269587","166.72.28.214","203.174.5.11","TCP","62","22622  >  21 [SYN] Seq=4243376044 Win=16384 Len=0 MSS=1460 SACK_PERM=1"
"75426","23249.131225","200.131.126.75","203.174.5.11","TCP","74","49432  >  21 [SYN] Seq=3885053104 Win=5840 Len=0 MSS=1460 SACK_PERM=1 TSval=1840905431 TSecr=0 WS=1"
"76678","23785.086060","242.4.57.99","131.243.1.83","TCP","74","1310  >  21 [SYN] Seq=1146348266 Win=5840 Len=0 MSS=1460 SACK_PERM=1 TSval=1884906 TSecr=0 WS=1"
"76858","23927.214347","84.150.201.32","128.3.28.48","TCP","74","32784  >  21 [SYN] Seq=1408245349 Win=5840 Len=0 MSS=1460 SACK_PERM=1 TSval=61310 TSecr=0 WS=1"
"77394","24070.384108","128.70.138.248","131.243.1.10","TCP","62","1452  >  21 [SYN] Seq=537009569 Win=8760 Len=0 MSS=1460 SACK_PERM=1"
"77742","24139.088199","81.38.119.105","131.243.1.10","TCP","74","55462  >  21 [SYN] Seq=3477434309 Win=5840 Len=0 MSS=1460 SACK_PERM=1 TSval=46343766 TSecr=0 WS=1"
"77814","24178.908613","118.110.62.142","203.174.5.11","TCP","62","2244  >  21 [SYN] Seq=1883211931 Win=64240 Len=0 MSS=1460 SACK_PERM=1"
"78256","24238.166715","120.221.194.180","131.243.1.10","TCP","78","29140  >  21 [SYN] Seq=2160187385 Win=35040 Len=0 MSS=1380 TSval=0 TSecr=0 SACK_PERM=1"
"79944","24517.834685","160.67.168.82","131.243.1.10","TCP","58","38025  >  21 [SYN] Seq=2160373305 Win=64240 Len=0 MSS=1460"
"80107","24566.243337","70.83.168.104","131.243.1.10","TCP","62","1387  >  21 [SYN] Seq=3051999 Win=8192 Len=0 MSS=1360 SACK_PERM=1"
"80380","24604.695720","104.181.5.156","131.243.1.10","TCP","62","47260  >  21 [SYN] Seq=2692199123 Win=16384 Len=0 MSS=1380 SACK_PERM=1"
"80532","24632.852382","143.156.1.2","131.243.2.12","TCP","62","2974  >  21 [SYN] Seq=296642655 Win=16384 Len=0 MSS=1460 SACK_PERM=1"
"81000","24734.598867","97.75.199.255","131.243.1.10","TCP","62","3936  >  21 [SYN] Seq=2442266161 Win=16384 Len=0 MSS=1460 SACK_PERM=1"
"81380","24788.019053","53.35.98.207","128.3.12.44","TCP","66","55433  >  21 [SYN] Seq=3135063385 Win=49152 Len=0 MSS=1332 WS=1 SACK_PERM=1"
"82260","24937.314662","79.251.181.125","131.243.1.10","TCP","62","1307  >  21 [SYN] Seq=1221926 Win=8192 Len=0 MSS=1460 SACK_PERM=1"
"82446","24953.576644","58.244.246.143","131.243.1.10","TCP","74","50764  >  21 [SYN] Seq=2851947647 Win=65535 Len=0 MSS=1460 WS=1 TSval=764980 TSecr=0"
"83593","25145.203920","219.199.12.246","128.3.28.48","TCP","62","1098  >  21 [SYN] Seq=33673824 Win=8192 Len=0 MSS=536 SACK_PERM=1"
"84342","25335.500698","210.108.184.159","131.243.1.10","TCP","62","32590  >  21 [SYN] Seq=1860188128 Win=16384 Len=0 MSS=1380 SACK_PERM=1"
"84479","25375.115418","175.61.131.91","128.3.12.44","TCP","62","1134  >  21 [SYN] Seq=110992751 Win=32768 Len=0 MSS=1460 WS=1"
"84927","25572.728199","51.88.161.58","131.243.1.10","TCP","62","63786  >  21 [SYN] Seq=7198008 Win=8192 Len=0 MSS=1460 SACK_PERM=1"
"85589","25777.982869","62.207.37.99","131.243.1.10","TCP","74","1025  >  21 [SYN] Seq=3352889226 Win=5840 Len=0 MSS=1460 SACK_PERM=1 TSval=3906531 TSecr=0 WS=1"
"86019","25972.011138","7.78.244.35","109.103.64.27","TCP","62","3604  >  21 [SYN] Seq=907399996 Win=16384 Len=0 MSS=1460 SACK_PERM=1"
"86028","25975.820483","16.69.134.221","131.243.2.12","TCP","62","1692  >  21 [SYN] Seq=3443749246 Win=16384 Len=0 MSS=1460 SACK_PERM=1"
"86424","26067.708186","200.3.129.34","131.243.193.93","TCP","62","1395  >  21 [SYN] Seq=846413151 Win=16384 Len=0 MSS=1436 SACK_PERM=1"
"87603","26241.732534","75.16.160.171","131.243.1.10","TCP","74","52943  >  21 [SYN] Seq=2395284027 Win=65535 Len=0 MSS=1460 WS=1 TSval=765229 TSecr=0"
"93991","26866.169541","37.152.217.89","131.243.1.10","TCP","62","2515  >  21 [SYN] Seq=307680542 Win=16384 Len=0 MSS=1460 SACK_PERM=1"
"94466","27027.062658","46.73.123.189","131.243.2.12","TCP","62","1167  >  21 [SYN] Seq=153557357 Win=8160 Len=0 MSS=1360 SACK_PERM=1"
"94832","27152.442726","12.63.0.68","131.243.1.10","TCP","62","65273  >  21 [SYN] Seq=5478850 Win=8192 Len=0 MSS=1452 SACK_PERM=1"
"94978","27170.598764","87.106.191.42","131.243.1.10","TCP","62","24701  >  21 [SYN] Seq=171747216 Win=16384 Len=0 MSS=1400 SACK_PERM=1"
"95270","27276.125196","189.89.200.219","131.243.1.10","TCP","74","61614  >  21 [SYN] Seq=2753247058 Win=5840 Len=0 MSS=1414 SACK_PERM=1 TSval=112128 TSecr=0 WS=1"
"95398","27305.713466","120.14.219.195","128.3.28.48","TCP","74","3172  >  21 [SYN] Seq=662730895 Win=5840 Len=0 MSS=1460 TSval=1114812565 TSecr=0 WS=1"
"95839","27357.009709","147.31.62.145","131.243.1.10","TCP","62","22784  >  21 [SYN] Seq=2118178880 Win=16384 Len=0 MSS=1460 SACK_PERM=1"
"95913","27371.958075","93.57.49.162","131.243.1.10","TCP","62","1051  >  21 [SYN] Seq=1187049513 Win=8760 Len=0 MSS=1380 SACK_PERM=1"
"95946","27373.197459","28.161.128.104","131.243.1.10","TCP","74","2638  >  21 [SYN] Seq=754174987 Win=5840 Len=0 MSS=1460 SACK_PERM=1 TSval=1728747381 TSecr=0 WS=1"
"96587","27770.184529","237.120.235.116","131.243.1.10","TCP","62","1695  >  21 [SYN] Seq=2286207981 Win=16384 Len=0 MSS=1460 SACK_PERM=1"
"97039","27827.005192","74.158.227.46","131.243.1.10","TCP","58","43551  >  21 [SYN] Seq=3073675608 Win=65535 Len=0 MSS=1448"
"97314","27849.776379","190.241.198.22","131.243.1.10","TCP","74","1788  >  21 [SYN] Seq=1337287176 Win=32120 Len=0 MSS=1460 SACK_PERM=1 TSval=9861505 TSecr=0 WS=1"
"97501","27860.632236","216.80.96.14","131.243.1.10","TCP","74","33590  >  21 [SYN] Seq=1231781940 Win=2920 Len=0 MSS=1460 TSval=125974253 TSecr=0"
"97797","27876.968850","177.22.172.184","81.245.216.94","TCP","62","1731  >  21 [SYN] Seq=2084055743 Win=16384 Len=0 MSS=1272 SACK_PERM=1"
"98637","27927.649986","170.87.202.165","128.3.12.44","TCP","74","32898  >  21 [SYN] Seq=1344524885 Win=5840 Len=0 MSS=1460 SACK_PERM=1 TSval=375613 TSecr=0 WS=1"
"98779","27934.904521","168.130.194.222","128.3.12.44","TCP","62","1222  >  21 [SYN] Seq=2454696561 Win=64240 Len=0 MSS=1380"
"102135","28152.123342","250.135.108.221","131.243.1.10","TCP","62","1086  >  21 [SYN] Seq=1877787260 Win=16384 Len=0 MSS=1460 SACK_PERM=1"
"102198","28236.630193","224.213.131.57","131.243.1.10","TCP","62","32662  >  21 [SYN] Seq=1374502286 Win=64240 Len=0 MSS=1460 SACK_PERM=1"
"102455","28245.594157","68.186.75.49","131.243.1.10","TCP","74","13474  >  21 [SYN] Seq=1673902307 Win=5840 Len=0 MSS=1460 SACK_PERM=1 TSval=1690229 TSecr=0 WS=1"
"102624","28508.187113","234.54.244.246","128.3.12.44","TCP","74","1752  >  21 [SYN] Seq=1977948128 Win=16060 Len=0 MSS=1460 SACK_PERM=1 TSval=41180540 TSecr=0 WS=1"
"102860","28594.533757","65.240.185.205","131.243.2.12","TCP","62","1046  >  21 [SYN] Seq=4233015644 Win=16384 Len=0 MSS=1460 SACK_PERM=1"
"102884","28601.427210","203.72.189.30","131.243.1.10","TCP","62","1111  >  21 [SYN] Seq=1271114116 Win=16384 Len=0 MSS=1260 SACK_PERM=1"
"103187","28690.472749","109.62.34.102","131.243.1.10","TCP","62","3688  >  21 [SYN] Seq=1327992371 Win=16384 Len=0 MSS=1332 SACK_PERM=1"
"103317","28721.169866","74.108.2.26","201.218.43.164","TCP","62","1039  >  21 [SYN] Seq=2397253094 Win=16384 Len=0 MSS=1460 SACK_PERM=1"
"103596","29033.504675","144.87.84.186","131.243.1.10","TCP","74","33004  >  21 [SYN] Seq=2763202519 Win=5840 Len=0 MSS=1460 SACK_PERM=1 TSval=451916 TSecr=0 WS=1"
"103991","29193.351642","228.152.16.107","131.243.1.10","TCP","66","3647  >  21 [SYN] Seq=3589057681 Win=65535 Len=0 MSS=1260 WS=1 SACK_PERM=1"
"104884","29604.744874","147.245.45.191","128.3.12.44","TCP","78","61095  >  21 [SYN] Seq=2784186326 Win=16384 Len=0 MSS=1460 SACK_PERM=1 WS=1 TSval=719732900 TSecr=0"
"105465","29860.657243","130.24.176.37","131.243.2.12","TCP","62","2274  >  21 [SYN] Seq=986913823 Win=16384 Len=0 MSS=1460 SACK_PERM=1"
"105617","29888.973187","99.126.219.220","131.243.1.10","TCP","62","3585  >  21 [SYN] Seq=4019074765 Win=64240 Len=0 MSS=1460 SACK_PERM=1"
"106671","30083.214613","83.1.240.233","131.243.2.12","TCP","62","2835  >  21 [SYN] Seq=2340400916 Win=16384 Len=0 MSS=1460 SACK_PERM=1"
"107058","30153.293557","226.83.151.16","128.3.12.44","TCP","78","15517  >  21 [SYN] Seq=4052713017 Win=16384 Len=0 MSS=1460 SACK_PERM=1 WS=1 TSval=523995517 TSecr=0"
"110924","30451.385127","168.254.152.132","131.243.2.12","TCP","62","3418  >  21 [SYN] Seq=943695196 Win=16384 Len=0 MSS=1460 SACK_PERM=1"
"112574","30565.414447","26.236.81.102","131.243.1.10","TCP","78","1277  >  21 [SYN] Seq=57458784 Win=32767 Len=0 MSS=1460 WS=1 TSval=0 TSecr=0 SACK_PERM=1"
"114670","30685.259606","230.64.161.182","131.243.1.10","TCP","62","1056  >  21 [SYN] Seq=693804956 Win=5840 Len=0 MSS=1360 SACK_PERM=1"
"115268","30723.783326","231.142.227.34","131.243.1.10","TCP","74","46087  >  21 [SYN] Seq=3735759164 Win=5840 Len=0 MSS=1452 SACK_PERM=1 TSval=43732536 TSecr=0 WS=1"
"116184","30785.193423","186.191.193.185","128.3.12.44","TCP","74","60445  >  21 [SYN] Seq=687838198 Win=16384 Len=0 MSS=1460 WS=1 TSval=0 TSecr=0"
"116952","30836.388982","89.124.219.32","131.243.2.12","TCP","62","1506  >  21 [SYN] Seq=3133828715 Win=16384 Len=0 MSS=1460 SACK_PERM=1"
"117255","30876.870248","249.123.7.161","131.243.1.10","TCP","58","1479  >  21 [SYN] Seq=2070382721 Win=16384 Len=0 MSS=1460"
"117352","30883.098986","150.131.93.41","131.243.1.10","TCP","62","52427  >  21 [SYN] Seq=4138842705 Win=65535 Len=0 WS=8 MSS=1460"
"117769","31007.230440","87.244.84.163","131.243.1.10","TCP","62","3131  >  21 [SYN] Seq=1450067760 Win=16384 Len=0 MSS=1360"
"117879","31027.519770","79.162.92.45","193.27.244.141","TCP","62","2313  >  21 [SYN] Seq=2756982051 Win=16384 Len=0 MSS=1460 SACK_PERM=1"
"118141","31113.183360","236.71.170.81","128.3.12.44","TCP","58","47820  >  21 [SYN] Seq=1082965767 Win=8760 Len=0 MSS=1460"
"118549","31307.913146","126.88.149.97","128.3.12.44","TCP","74","58053  >  21 [SYN] Seq=152341168 Win=16384 Len=0 MSS=1460 WS=1 TSval=0 TSecr=0"
"118792","31467.036511","255.111.165.141","131.243.2.12","TCP","62","2913  >  21 [SYN] Seq=950789478 Win=65535 Len=0 MSS=1460 SACK_PERM=1"
"119433","31642.501513","79.176.121.114","131.243.1.10","TCP","74","2277  >  21 [SYN] Seq=289286579 Win=57344 Len=0 MSS=1460 WS=1 TSval=37778630 TSecr=0"
"119829","31739.410010","102.207.27.181","86.110.60.6","TCP","62","3269  >  21 [SYN] Seq=337272419 Win=16384 Len=0 MSS=1460 SACK_PERM=1"
"121821","32255.437494","235.96.20.232","128.3.12.44","TCP","62","35866  >  21 [SYN] Seq=864514896 Win=24820 Len=0 SACK_PERM=1 MSS=1460"
"121997","32352.445402","104.233.244.25","131.243.1.10","TCP","62","64750  >  21 [SYN] Seq=2407887385 Win=16384 Len=0 MSS=1460 SACK_PERM=1"
"122051","32370.405763","12.146.249.18","131.243.1.10","TCP","58","34292  >  21 [SYN] Seq=3371214879 Win=8760 Len=0 MSS=1460"
"122113","32545.048380","183.173.223.0","131.243.1.10","TCP","62","1284  >  21 [SYN] Seq=3346731319 Win=16384 Len=0 MSS=1414 SACK_PERM=1"
"122804","32755.211180","113.194.160.64","131.243.1.10","TCP","58","40993  >  21 [SYN] Seq=2596864733 Win=33580 Len=0 MSS=1380"
"123084","32882.111941","37.215.39.177","203.174.5.11","TCP","62","16588  >  21 [SYN] Seq=3314494183 Win=16384 Len=0 MSS=1400 SACK_PERM=1"
"123092","32884.697083","226.97.1.163","131.243.1.10","TCP","58","4606  >  21 [SYN] Seq=3681009160 Win=8192 Len=0 MSS=1460"
"123349","32932.853483","116.7.108.90","131.243.1.10","TCP","62","50227  >  21 [SYN] Seq=121016468 Win=65535 Len=0 MSS=1452 SACK_PERM=1"
"124101","33154.559814","144.72.190.29","131.243.1.10","TCP","62","3111  >  21 [SYN] Seq=1472314994 Win=16384 Len=0 MSS=1460 SACK_PERM=1"
"125256","33713.699227","15.127.253.120","128.3.12.44","TCP","62","2000  >  21 [SYN] Seq=14405856 Win=8192 Len=0 MSS=1460 SACK_PERM=1"
"125462","33816.171630","234.69.80.183","131.243.1.10","TCP","74","59183  >  21 [SYN] Seq=275191966 Win=8192 Len=0 MSS=1460 WS=1 TSval=47762046 TSecr=0"
"126136","34055.867261","233.223.232.34","131.243.1.10","TCP","62","1197  >  21 [SYN] Seq=3761740755 Win=64240 Len=0 MSS=1460 SACK_PERM=1"
"127117","34348.958931","21.106.139.129","131.243.1.10","TCP","62","64168  >  21 [SYN] Seq=613046351 Win=16384 Len=0 MSS=1460 SACK_PERM=1"
"127174","34351.388226","91.172.143.162","131.243.1.10","TCP","74","32166  >  21 [SYN] Seq=3481226863 Win=32768 Len=0 MSS=1460 WS=1 TSval=3753046 TSecr=0"
"127804","34426.077192","171.227.247.63","131.243.1.10","TCP","58","3810  >  21 [SYN] Seq=77984355 Win=8192 Len=0 MSS=1460"
"127901","34436.842474","53.29.116.244","131.243.1.10","TCP","74","32818  >  21 [SYN] Seq=3726895501 Win=5840 Len=0 MSS=1452 SACK_PERM=1 TSval=1502858 TSecr=0 WS=1"
"128347","34660.072222","109.30.24.222","131.243.1.10","TCP","62","56980  >  21 [SYN] Seq=1267007803 Win=64240 Len=0 MSS=1380 SACK_PERM=1"
"128535","34758.146432","116.233.10.27","131.243.1.10","TCP","62","65369  >  21 [SYN] Seq=4974738 Win=24820 Len=0 SACK_PERM=1 MSS=1460"
"128681","34789.944147","12.227.103.178","131.243.1.10","TCP","62","1833  >  21 [SYN] Seq=209640448 Win=16616 Len=0 MSS=1412 WS=1"
"128795","34816.158832","92.154.179.20","131.243.1.10","TCP","62","65470  >  21 [SYN] Seq=654031214 Win=32768 Len=0 MSS=1460 WS=1"
"130094","35184.371818","133.183.250.196","128.3.12.44","TCP","74","36398  >  21 [SYN] Seq=122861172 Win=5840 Len=0 MSS=1460 SACK_PERM=1 TSval=43931108 TSecr=0 WS=1"
"130171","35195.559616","165.2.238.121","131.243.1.10","TCP","74","4694  >  21 [SYN] Seq=2875901557 Win=16384 Len=0 MSS=1460 WS=1 TSval=165848161 TSecr=0"
"131577","36082.457180","178.228.214.14","131.243.1.10","TCP","62","3397  >  21 [SYN] Seq=426877198 Win=16384 Len=0 MSS=1332 SACK_PERM=1"
"132074","36338.110582","60.36.91.126","131.243.2.12","TCP","62","1963  >  21 [SYN] Seq=3534560056 Win=16384 Len=0 MSS=1460 SACK_PERM=1"
"132351","36402.396916","168.114.120.200","131.243.1.10","TCP","74","1149  >  21 [SYN] Seq=1765734209 Win=5840 Len=0 MSS=1460 SACK_PERM=1 TSval=695261 TSecr=0 WS=1"
"132677","36481.522909","193.233.64.176","131.243.2.12","TCP","62","1266  >  21 [SYN] Seq=2091862579 Win=64240 Len=0 MSS=1460 SACK_PERM=1"
"133188","36592.960408","137.17.226.104","131.243.1.10","TCP","62","1024  >  21 [SYN] Seq=4290375 Win=65535 Len=0 MSS=512 SACK_PERM=1"
"134242","36801.339442","189.30.8.121","131.243.1.10","TCP","62","41914  >  21 [SYN] Seq=2595950306 Win=16384 Len=0 MSS=1460 SACK_PERM=1"
"134674","36871.710961","77.31.239.154","131.243.1.10","TCP","62","34945  >  21 [SYN] Seq=2290089268 Win=16384 Len=0 MSS=1402 SACK_PERM=1"
"134915","36900.457334","213.230.14.206","131.243.1.10","TCP","78","13812  >  21 [SYN] Seq=1280615 Win=49152 Len=0 MSS=1460 WS=4 TSval=8595358 TSecr=0 SACK_PERM=1"
"135234","36964.745905","103.37.124.28","131.243.1.10","TCP","62","3231  >  21 [SYN] Seq=1862132176 Win=8760 Len=0 MSS=1460 SACK_PERM=1"
"136320","37581.707521","168.0.213.190","131.243.193.93","TCP","78","45710  >  21 [SYN] Seq=1408018283 Win=8192 Len=0 MSS=1460 WS=1 TSval=0 TSecr=0 SACK_PERM=1"
"136498","37662.150302","70.139.194.5","131.243.2.12","TCP","62","2164  >  21 [SYN] Seq=4101533732 Win=16384 Len=0 MSS=1460 SACK_PERM=1"
"136880","37748.028275","18.216.147.137","131.243.1.10","TCP","62","3781  >  21 [SYN] Seq=2710269603 Win=64240 Len=0 MSS=1460 SACK_PERM=1"
"137335","37904.353998","152.210.64.226","131.243.1.10","TCP","62","3129  >  21 [SYN] Seq=1939927121 Win=8760 Len=0 MSS=1460 SACK_PERM=1"
"137895","38238.424288","164.124.5.51","131.243.1.10","TCP","58","2568  >  21 [SYN] Seq=108191307 Win=8192 Len=0 MSS=1452"
"138053","38494.050082","224.111.139.206","242.70.74.100","TCP","62","4319  >  21 [SYN] Seq=2702710245 Win=16384 Len=0 MSS=1460 SACK_PERM=1"
"138153","38548.902576","33.152.70.19","131.243.1.10","TCP","74","4252  >  21 [SYN] Seq=3869869582 Win=5840 Len=0 MSS=1460 SACK_PERM=1 TSval=180622803 TSecr=0 WS=1"
"138212","38571.197669","126.121.244.87","131.243.1.10","TCP","74","32902  >  21 [SYN] Seq=3982224795 Win=5840 Len=0 MSS=1372 SACK_PERM=1 TSval=389046 TSecr=0 WS=1"
"138295","38614.859887","36.221.95.46","131.243.1.10","TCP","74","32862  >  21 [SYN] Seq=3928067494 Win=5840 Len=0 MSS=1420 SACK_PERM=1 TSval=1087563 TSecr=0 WS=1"
"138381","38670.278947","226.253.22.106","128.3.12.44","TCP","74","65463  >  21 [SYN] Seq=931414549 Win=16384 Len=0 MSS=1460 WS=1 TSval=0 TSecr=0"
"138438","38753.553623","68.157.72.101","131.243.1.10","TCP","74","1428  >  21 [SYN] Seq=111704126 Win=5840 Len=0 MSS=1460 SACK_PERM=1 TSval=127390700 TSecr=0 WS=1"
"138582","38873.934415","121.249.98.127","131.243.1.10","TCP","74","1300  >  21 [SYN] Seq=4233483879 Win=4452 Len=0 MSS=1484 SACK_PERM=1 TSval=2334285 TSecr=0 WS=2"
"140046","39486.273413","81.182.32.72","131.243.1.10","TCP","66","2192  >  21 [SYN] Seq=905968368 Win=60352 Len=0 MSS=1460 WS=4 SACK_PERM=1"
"140300","39510.164711","58.154.48.6","131.243.1.10","TCP","78","2081  >  21 [SYN] Seq=4685231 Win=8192 Len=0 MSS=1414 WS=1 TSval=0 TSecr=0 SACK_PERM=1"
"140370","39541.083673","122.93.162.156","131.243.1.10","TCP","62","3029  >  21 [SYN] Seq=3943611245 Win=39424 Len=0 MSS=1414 SACK_PERM=1"
"140425","39548.716993","31.25.84.166","131.243.1.10","TCP","58","3437  >  21 [SYN] Seq=714688000 Win=32768 Len=0 MSS=1460"
"140713","40209.120957","217.171.228.209","103.106.164.29","TCP","62","4421  >  21 [SYN] Seq=2289515674 Win=16384 Len=0 MSS=1460 SACK_PERM=1"
"140769","40264.732488","194.242.111.113","131.243.1.10","TCP","62","49261  >  21 [SYN] Seq=1063510068 Win=32768 Len=0 MSS=1432 WS=1"
"140835","40396.798568","160.161.237.23","131.243.1.10","TCP","62","1608  >  21 [SYN] Seq=31689681 Win=8192 Len=0 MSS=536 SACK_PERM=1"
"140902","40453.002967","181.223.231.99","131.243.2.12","TCP","62","2745  >  21 [SYN] Seq=1246404206 Win=16384 Len=0 MSS=1460 SACK_PERM=1"
"140938","40469.564602","206.120.230.233","131.243.1.10","TCP","62","63820  >  21 [SYN] Seq=886751726 Win=64240 Len=0 MSS=1460 SACK_PERM=1"
"141077","40480.512729","215.82.236.16","131.243.1.10","TCP","74","61967  >  21 [SYN] Seq=3193477671 Win=5840 Len=0 MSS=1460 SACK_PERM=1 TSval=2223063 TSecr=0 WS=1"
"141165","40491.669881","88.34.47.48","131.243.1.10","TCP","58","25825  >  21 [SYN] Seq=4249680706 Win=33580 Len=0 MSS=1460"
"142152","40927.593430","64.37.1.243","131.243.2.12","TCP","62","2290  >  21 [SYN] Seq=364835872 Win=8192 Len=0 MSS=1460 SACK_PERM=1"
"142710","41144.082352","250.234.72.252","131.243.1.10","TCP","74","2088  >  21 [SYN] Seq=2677201766 Win=5840 Len=0 MSS=1460 SACK_PERM=1 TSval=86071969 TSecr=0 WS=1"
"143424","41345.089177","6.30.34.164","131.243.2.12","TCP","62","64502  >  21 [SYN] Seq=10463575 Win=8192 Len=0 MSS=1460 SACK_PERM=1"
"143927","41679.017032","66.225.223.182","203.174.5.11","TCP","62","1335  >  21 [SYN] Seq=182546787 Win=8192 Len=0 MSS=1460 SACK_PERM=1"
"144414","41801.257711","30.52.123.142","131.243.1.10","TCP","62","46147  >  21 [SYN] Seq=1795169827 Win=24820 Len=0 SACK_PERM=1 MSS=1460"
"145176","42213.759777","221.55.239.170","131.243.2.12","TCP","62","1237  >  21 [SYN] Seq=2249681389 Win=16384 Len=0 MSS=1460 SACK_PERM=1"
"145733","42329.392913","69.157.45.176","131.243.2.12","TCP","62","3385  >  21 [SYN] Seq=894034143 Win=64240 Len=0 MSS=1460 SACK_PERM=1"
"145925","42402.605688","50.138.143.130","131.243.2.12","TCP","62","4433  >  21 [SYN] Seq=274234133 Win=16384 Len=0 MSS=1460 SACK_PERM=1"
"146484","42513.760090","76.152.197.160","131.243.2.12","TCP","62","1308  >  21 [SYN] Seq=648393050 Win=16384 Len=0 MSS=1460 SACK_PERM=1"
"146739","42550.016660","113.142.116.216","131.243.1.10","TCP","74","62612  >  21 [SYN] Seq=3555203146 Win=5840 Len=0 MSS=1460 SACK_PERM=1 TSval=51562002 TSecr=0 WS=1"
"146895","42570.670638","195.234.166.255","131.243.1.10","TCP","62","62239  >  21 [SYN] Seq=1911211891 Win=16384 Len=0 MSS=1460 SACK_PERM=1"
"147228","42621.672667","94.115.224.53","131.243.1.10","TCP","74","37289  >  21 [SYN] Seq=3974657108 Win=5840 Len=0 MSS=1460 SACK_PERM=1 TSval=513962282 TSecr=0 WS=1"
"148203","42811.368151","176.42.213.85","131.243.1.10","TCP","62","18806  >  21 [SYN] Seq=2253173865 Win=16384 Len=0 MSS=1460 SACK_PERM=1"
"148377","42819.490827","223.237.37.22","128.3.12.44","TCP","74","65258  >  21 [SYN] Seq=3552679890 Win=16384 Len=0 MSS=1412 WS=1 TSval=0 TSecr=0"
"148704","42944.197373","202.70.166.158","128.3.12.44","TCP","74","34116  >  21 [SYN] Seq=4292817177 Win=5840 Len=0 MSS=1452 SACK_PERM=1 TSval=2436700 TSecr=0 WS=1"
"148980","43129.826722","152.18.224.103","131.243.1.10","TCP","74","1663  >  21 [SYN] Seq=3507051391 Win=5840 Len=0 MSS=1436 SACK_PERM=1 TSval=45593259 TSecr=0 WS=1"
"149028","43130.734743","22.99.99.131","131.243.1.10","TCP","78","1566  >  21 [SYN] Seq=9014373 Win=8192 Len=0 MSS=1460 WS=1 TSval=0 TSecr=0 SACK_PERM=1"
"149149","43254.331989","46.231.91.41","131.243.1.10","TCP","74","4300  >  21 [SYN] Seq=354100317 Win=32120 Len=0 MSS=1460 SACK_PERM=1 TSval=4084112278 TSecr=0 WS=1"
"149244","43295.365837","110.194.218.69","128.3.12.44","TCP","58","50020  >  21 [SYN] Seq=2832804852 Win=8760 Len=0 MSS=1460"
"149289","43430.320637","152.134.200.240","131.243.1.10","TCP","62","11119  >  21 [SYN] Seq=1356769550 Win=64240 Len=0 MSS=1460 SACK_PERM=1"
"149367","43435.243179","230.101.18.175","131.243.1.10","TCP","74","4429  >  21 [SYN] Seq=3387133511 Win=57344 Len=0 MSS=1460 WS=1 TSval=258277086 TSecr=0"
"149649","43482.503543","253.226.179.73","131.243.2.12","TCP","62","1370  >  21 [SYN] Seq=702599125 Win=16384 Len=0 MSS=536 SACK_PERM=1"
"149870","43633.516904","27.73.76.23","131.243.1.10","TCP","62","1908  >  21 [SYN] Seq=2475861072 Win=16384 Len=0 MSS=1460 SACK_PERM=1"
"150181","43703.263810","18.150.19.93","131.243.1.10","TCP","62","57840  >  21 [SYN] Seq=2924583457 Win=32768 Len=0 MSS=1460 WS=1"
"151485","43953.833084","127.127.179.120","234.147.130.114","TCP","58","1506  >  21 [SYN] Seq=55966925 Win=8192 Len=0 MSS=1460"
"152930","44189.544696","233.115.147.228","131.243.1.10","TCP","62","2422  >  21 [SYN] Seq=2825762710 Win=64240 Len=0 MSS=1460 SACK_PERM=1"
"153021","44195.815043","109.164.79.190","86.110.60.6","TCP","62","21819  >  21 [SYN] Seq=636649756 Win=16384 Len=0 MSS=1460 SACK_PERM=1"
"154078","44687.181752","198.36.83.118","131.243.1.10","TCP","74","1855  >  21 [SYN] Seq=1860937402 Win=15972 Len=0 MSS=1412 SACK_PERM=1 TSval=36707672 TSecr=0 WS=1"
"155136","45050.083331","125.44.239.174","128.3.12.44","TCP","74","2998  >  21 [SYN] Seq=4204278318 Win=57344 Len=0 MSS=1460 WS=1 TSval=398132111 TSecr=0"
"155655","45410.732850","244.30.184.242","128.3.28.48","TCP","74","61371  >  21 [SYN] Seq=2645917328 Win=5840 Len=0 MSS=1412 SACK_PERM=1 TSval=677166 TSecr=0 WS=1"
"155955","45444.392959","22.97.19.4","242.70.74.100","TCP","62","2425  >  21 [SYN] Seq=3630645497 Win=16384 Len=0 MSS=1460 SACK_PERM=1"
"157583","45598.371378","10.120.254.228","203.174.5.11","TCP","62","2607  >  21 [SYN] Seq=2146807301 Win=64240 Len=0 MSS=1460 SACK_PERM=1"
"159648","45902.168931","253.78.110.67","131.243.1.10","TCP","66","2846  >  21 [SYN] Seq=3042278 Win=64752 Len=0 MSS=1460 WS=4 SACK_PERM=1"
"159926","45927.044693","28.6.158.214","131.243.1.10","TCP","62","1250  >  21 [SYN] Seq=3377397058 Win=64240 Len=0 MSS=1460 SACK_PERM=1"
"160128","45936.302164","157.94.151.3","131.243.1.10","TCP","62","1582  >  21 [SYN] Seq=3373114 Win=8192 Len=0 MSS=536 SACK_PERM=1"
"161651","46041.121990","152.217.163.112","131.243.1.10","TCP","62","1497  >  21 [SYN] Seq=5487232 Win=11680 Len=0 MSS=536 SACK_PERM=1"
"163370","46467.370979","203.201.32.47","131.243.1.10","TCP","74","33230  >  21 [SYN] Seq=2589218096 Win=5840 Len=0 MSS=1460 SACK_PERM=1 TSval=11346514 TSecr=0 WS=1"
"163589","46510.766429","192.117.164.234","128.3.12.44","TCP","62","4200  >  21 [SYN] Seq=894335343 Win=8760 Len=0 MSS=1460 SACK_PERM=1"
"163611","46513.778390","104.22.50.197","131.243.1.10","TCP","62","6010  >  21 [SYN] Seq=3825331707 Win=64240 Len=0 MSS=1460 SACK_PERM=1"
"164149","46592.099489","230.217.53.235","131.243.1.10","TCP","62","1489  >  21 [SYN] Seq=488981993 Win=8760 Len=0 MSS=1360 SACK_PERM=1"
"164719","46665.804692","78.75.88.175","131.243.1.10","TCP","74","62335  >  21 [SYN] Seq=2080604737 Win=5840 Len=0 MSS=1460 SACK_PERM=1 TSval=293022 TSecr=0 WS=1"
"165619","46870.491281","18.126.161.152","86.110.60.6","TCP","62","25961  >  21 [SYN] Seq=18194583 Win=8192 Len=0 MSS=1460 SACK_PERM=1"
"165854","46953.006565","220.12.18.251","131.243.1.10","TCP","62","2621  >  21 [SYN] Seq=2039814794 Win=32120 Len=0 MSS=1452 SACK_PERM=1"
"166022","47079.711684","21.243.130.98","131.243.193.93","TCP","74","41607  >  21 [SYN] Seq=2009455167 Win=5840 Len=0 MSS=1380 SACK_PERM=1 TSval=250628963 TSecr=0 WS=1"
"166206","47288.595204","102.224.98.172","131.243.1.10","TCP","62","1282  >  21 [SYN] Seq=2334763537 Win=16384 Len=0 MSS=1452 SACK_PERM=1"
"166260","47291.796620","136.13.156.253","131.243.56.235","TCP","62","4244  >  21 [SYN] Seq=1894159564 Win=8760 Len=0 MSS=1460 SACK_PERM=1"
"166982","47715.278908","121.182.81.167","131.243.1.10","TCP","62","1554  >  21 [SYN] Seq=2935464648 Win=16384 Len=0 MSS=1460 SACK_PERM=1"
"167229","47859.929651","87.47.213.33","131.243.1.10","TCP","62","4149  >  21 [SYN] Seq=2780436301 Win=8760 Len=0 MSS=1460 SACK_PERM=1"
"167494","48047.661051","87.166.178.80","128.3.12.44","TCP","74","33471  >  21 [SYN] Seq=2022478787 Win=5840 Len=0 MSS=1460 SACK_PERM=1 TSval=2615646 TSecr=0 WS=1"
"167545","48101.054305","72.46.219.87","131.243.1.10","TCP","58","2411  >  21 [SYN] Seq=7720150 Win=8192 Len=0 MSS=1460"
"167605","48345.569358","234.227.198.194","131.243.1.10","TCP","62","2109  >  21 [SYN] Seq=75745397 Win=8192 Len=0 MSS=1460 SACK_PERM=1"
"167672","48426.203193","28.127.34.194","131.243.1.10","TCP","74","33181  >  21 [SYN] Seq=1703736194 Win=5840 Len=0 MSS=1460 SACK_PERM=1 TSval=16336481 TSecr=0 WS=1"
"167796","48570.066410","3.99.18.179","131.243.1.10","TCP","74","63513  >  21 [SYN] Seq=798338417 Win=5840 Len=0 MSS=1460 SACK_PERM=1 TSval=251768 TSecr=0 WS=1"
"167860","48575.659037","243.130.145.15","131.243.2.12","TCP","74","2141  >  21 [SYN] Seq=1658112374 Win=5840 Len=0 MSS=1460 SACK_PERM=1 TSval=318783144 TSecr=0 WS=1"
"168206","49010.653585","4.49.32.139","131.243.1.10","TCP","62","1189  >  21 [SYN] Seq=3315761291 Win=8760 Len=0 MSS=1460 SACK_PERM=1"
"168282","49155.037598","231.148.154.225","131.243.1.10","TCP","74","1025  >  21 [SYN] Seq=1266750612 Win=5840 Len=0 MSS=1460 TSval=357483 TSecr=0 WS=1"
"168377","49280.492407","60.7.54.210","131.243.1.10","TCP","74","2445  >  21 [SYN] Seq=1661852251 Win=65535 Len=0 MSS=1460 WS=1 TSval=23356317 TSecr=0"
"168501","49297.967417","88.50.147.40","242.70.74.100","TCP","62","3325  >  21 [SYN] Seq=1563179365 Win=64512 Len=0 MSS=1360 SACK_PERM=1"
"168627","49373.925015","210.227.143.216","128.3.12.44","TCP","62","58130  >  21 [SYN] Seq=1438172595 Win=16384 Len=0 MSS=1460 SACK_PERM=1"
"168649","49417.216892","129.232.157.26","131.243.1.10","TCP","74","33695  >  21 [SYN] Seq=2541224215 Win=5840 Len=0 MSS=1460 SACK_PERM=1 TSval=428006 TSecr=0 WS=1"
"168706","49418.958535","121.77.46.153","131.243.1.10","TCP","58","4922  >  21 [SYN] Seq=1239743269 Win=16384 Len=0 MSS=1460"
"169264","49576.752440","45.6.57.105","131.243.1.10","TCP","62","2927  >  21 [SYN] Seq=2847113615 Win=64240 Len=0 MSS=1460 SACK_PERM=1"
"170122","49784.850905","36.26.165.92","131.243.1.10","TCP","74","32852  >  21 [SYN] Seq=2799250018 Win=5840 Len=0 MSS=1460 TSval=216827 TSecr=0 WS=1"
"170262","49843.935786","133.222.62.154","131.243.1.10","TCP","62","3282  >  21 [SYN] Seq=3728386020 Win=8760 Len=0 MSS=1460 SACK_PERM=1"
"170316","49848.077445","209.250.151.160","131.243.1.10","TCP","62","3210  >  21 [SYN] Seq=2884218880 Win=16384 Len=0 MSS=1460"
"170656","50145.063892","126.127.88.175","131.243.1.10","TCP","74","65338  >  21 [SYN] Seq=1529763233 Win=16384 Len=0 MSS=1452 WS=1 TSval=0 TSecr=0"
"171096","50342.493701","44.252.62.72","131.243.1.10","TCP","62","1089  >  21 [SYN] Seq=2072161 Win=8192 Len=0 MSS=1412 SACK_PERM=1"
"171354","50437.993106","230.254.210.117","131.243.1.10","TCP","62","21047  >  21 [SYN] Seq=1379272555 Win=16384 Len=0 MSS=1460 SACK_PERM=1"
"172110","50790.779537","129.95.100.98","128.3.12.44","TCP","78","44903  >  21 [SYN] Seq=2352517885 Win=16384 Len=0 MSS=1380 SACK_PERM=1 TSval=986299195 TSecr=0"
"172135","50956.002806","65.132.187.201","131.243.1.10","TCP","74","11894  >  21 [SYN] Seq=4219831875 Win=5840 Len=0 MSS=1420 SACK_PERM=1 TSval=13364122 TSecr=0 WS=1"
"173003","51371.495249","45.20.44.38","128.3.28.48","TCP","74","45465  >  21 [SYN] Seq=319282788 Win=5840 Len=0 MSS=1460 TSval=53708008 TSecr=0 WS=1"
"173070","51414.761757","176.109.122.59","131.243.1.10","TCP","74","49856  >  21 [SYN] Seq=3663199632 Win=32768 Len=0 MSS=1460 WS=1 TSval=2503033617 TSecr=0"
"173371","51655.723730","188.150.137.49","131.243.2.12","TCP","62","3681  >  21 [SYN] Seq=676288729 Win=16384 Len=0 MSS=1460 SACK_PERM=1"
"173427","51685.417280","71.2.245.78","128.3.12.44","TCP","74","30016  >  21 [SYN] Seq=57109333 Win=57344 Len=0 MSS=1460 WS=1 TSval=266993 TSecr=0"
"173483","51705.575103","167.121.169.105","131.243.1.10","TCP","62","3194  >  21 [SYN] Seq=1849629265 Win=64240 Len=0 MSS=1460 SACK_PERM=1"
"174555","52305.316177","123.88.136.168","131.243.1.10","TCP","58","50454  >  21 [SYN] Seq=1512353675 Win=8760 Len=0 MSS=1460"
"174657","52316.040075","239.130.58.206","131.243.1.10","TCP","62","20934  >  21 [SYN] Seq=3720233214 Win=16384 Len=0 MSS=1460 SACK_PERM=1"
"174884","52370.359661","40.86.60.56","131.243.1.10","TCP","66","38449  >  21 [SYN] Seq=2386262196 Win=65535 Len=0 WS=2 SACK_PERM=1 MSS=1460"
"175781","52590.394039","38.67.154.111","131.243.1.10","TCP","74","3753  >  21 [SYN] Seq=1605957906 Win=32120 Len=0 MSS=1460 SACK_PERM=1 TSval=182806566 TSecr=0 WS=1"
"176732","52805.964556","10.132.239.132","131.243.1.10","TCP","74","35757  >  21 [SYN] Seq=1659725874 Win=5840 Len=0 MSS=1380 SACK_PERM=1 TSval=17624333 TSecr=0 WS=1"
"177355","53122.629586","173.88.215.255","131.243.1.10","TCP","62","1583  >  21 [SYN] Seq=2727118642 Win=64240 Len=0 MSS=1460"
"177648","53558.747606","71.67.95.218","25.136.123.20","TCP","74","2484  >  21 [SYN] Seq=1949884422 Win=5840 Len=0 MSS=1460 SACK_PERM=1 TSval=686363048 TSecr=0 WS=1"
"177766","53577.973937","210.153.131.25","131.243.1.10","TCP","74","32895  >  21 [SYN] Seq=2842464739 Win=5840 Len=0 MSS=1460 SACK_PERM=1 TSval=622102 TSecr=0 WS=2"
"177961","53645.323401","177.114.15.121","131.243.1.10","TCP","74","3914  >  21 [SYN] Seq=158071027 Win=16384 Len=0 MSS=1460 WS=1 TSval=3058073 TSecr=0"
"178896","54017.128559","7.122.144.84","131.243.1.10","TCP","62","3177  >  21 [SYN] Seq=418364606 Win=16384 Len=0 MSS=1460 SACK_PERM=1"
"179236","54127.490641","130.145.94.188","131.243.1.10","TCP","78","50592  >  21 [SYN] Seq=875951739 Win=32850 Len=0 WS=2 TSval=48805096 TSecr=0 SACK_PERM=1 MSS=1460"
"179420","54257.063761","16.50.57.129","128.3.12.44","TCP","62","2109  >  21 [SYN] Seq=672863964 Win=8192 Len=0 MSS=1380 SACK_PERM=1"
"179528","54465.811743","47.66.137.127","131.243.1.10","TCP","62","4349  >  21 [SYN] Seq=4051756288 Win=16384 Len=0 MSS=1460 SACK_PERM=1"
"179587","54582.247987","149.167.44.137","203.174.5.11","TCP","62","12125  >  21 [SYN] Seq=5383867 Win=8192 Len=0 MSS=1460 SACK_PERM=1"
"179989","55031.162464","122.182.124.120","131.243.1.10","TCP","74","33011  >  21 [SYN] Seq=3670385328 Win=5808 Len=0 MSS=1412 SACK_PERM=1 TSval=1827952 TSecr=0 WS=1"
"180325","55639.598205","120.120.14.13","131.243.1.10","TCP","74","1453  >  21 [SYN] Seq=533451353 Win=5840 Len=0 MSS=1460 SACK_PERM=1 TSval=659980 TSecr=0 WS=1"
"180509","55811.215825","242.140.131.0","131.243.1.10","TCP","62","2278  >  21 [SYN] Seq=1960300528 Win=64240 Len=0 MSS=1452 SACK_PERM=1"
"180572","55836.647694","70.1.60.109","131.243.2.12","TCP","78","1266  >  21 [SYN] Seq=600538799 Win=44620 Len=0 MSS=1460 WS=8 TSval=0 TSecr=0 SACK_PERM=1"
"180617","55854.938518","53.4.213.165","131.243.1.10","TCP","74","1028  >  21 [SYN] Seq=1230163744 Win=57344 Len=0 MSS=1460 WS=1 TSval=3125978 TSecr=0"
"180841","55918.607622","90.227.190.180","131.243.2.12","TCP","62","1874  >  21 [SYN] Seq=4042887565 Win=16384 Len=0 MSS=1460 SACK_PERM=1"
"181487","56040.990127","92.0.137.12","131.243.1.10","TCP","74","58088  >  21 [SYN] Seq=950686912 Win=5840 Len=0 MSS=1460 SACK_PERM=1 TSval=3338238801 TSecr=0 WS=1"
"181637","56056.659530","154.125.41.198","131.243.1.10","TCP","74","3637  >  21 [SYN] Seq=967317404 Win=5840 Len=0 MSS=1460 SACK_PERM=1 TSval=3151532622 TSecr=0 WS=1"
"182752","56244.388217","166.51.184.94","131.243.1.10","TCP","62","3247  >  21 [SYN] Seq=1182927877 Win=16384 Len=0 MSS=1414 SACK_PERM=1"
"184000","56440.247672","154.195.234.248","131.243.1.10","TCP","58","47915  >  21 [SYN] Seq=3813457281 Win=8760 Len=0 MSS=1460"
"184712","56760.500724","80.174.251.180","131.243.1.10","TCP","62","1308  >  21 [SYN] Seq=4257127671 Win=16384 Len=0 MSS=1460 SACK_PERM=1"
"185149","56952.753501","156.32.138.207","128.3.12.44","TCP","78","30008  >  21 [SYN] Seq=2112764644 Win=16384 Len=0 MSS=1460 SACK_PERM=1 WS=1 TSval=199388905 TSecr=0"
"185638","57178.732097","114.207.221.113","131.243.1.10","TCP","62","57324  >  21 [SYN] Seq=853032405 Win=24820 Len=0 SACK_PERM=1 MSS=1460"
"186171","57443.142748","227.140.142.57","242.70.74.100","TCP","74","50215  >  21 [SYN] Seq=1909714758 Win=32768 Len=0 MSS=1460 WS=1 TSval=1821507081 TSecr=0"
"186235","57535.410456","136.67.138.179","131.243.1.10","TCP","58","1461  >  21 [SYN] Seq=927808000 Win=32768 Len=0 MSS=1460"
"186295","57551.622324","5.20.102.84","131.243.2.12","TCP","62","1668  >  21 [SYN] Seq=889585564 Win=16384 Len=0 MSS=1460 SACK_PERM=1"
"186343","57576.734590","128.150.176.248","131.243.1.10","TCP","74","43106  >  21 [SYN] Seq=2564444798 Win=5840 Len=0 MSS=1460 SACK_PERM=1 TSval=73262610 TSecr=0 WS=1"
"186620","57647.223942","96.88.100.70","128.3.12.44","TCP","74","36961  >  21 [SYN] Seq=4249129562 Win=5840 Len=0 MSS=1380 SACK_PERM=1 TSval=1782443621 TSecr=0"
"187086","57823.806986","149.79.61.207","131.243.1.10","TCP","62","55529  >  21 [SYN] Seq=682130007 Win=64240 Len=0 MSS=1460 SACK_PERM=1"
"187373","57879.806587","51.41.97.97","131.243.1.10","TCP","62","1633  >  21 [SYN] Seq=3325240760 Win=16384 Len=0 MSS=1380 SACK_PERM=1"
"188733","58614.731738","244.181.160.56","242.70.74.100","TCP","62","3960  >  21 [SYN] Seq=3205740429 Win=64240 Len=0 MSS=1460 SACK_PERM=1"
"188810","58671.365557","103.244.89.101","131.243.2.12","TCP","62","1948  >  21 [SYN] Seq=4047101567 Win=16384 Len=0 MSS=1452 SACK_PERM=1"
"188815","58674.361690","11.46.203.50","131.243.1.10","TCP","62","1056  >  21 [SYN] Seq=1513613754 Win=5840 Len=0 MSS=1360 SACK_PERM=1"
"189073","58774.847855","83.2.10.205","131.243.1.10","TCP","74","2221  >  21 [SYN] Seq=1004071590 Win=5808 Len=0 MSS=1412 SACK_PERM=1 TSval=1404148 TSecr=0 WS=1"
"189534","59004.037546","142.122.251.111","131.243.2.12","TCP","62","2846  >  21 [SYN] Seq=1104128903 Win=16384 Len=0 MSS=1460 SACK_PERM=1"
"190268","59214.491402","233.54.231.144","128.3.12.44","TCP","78","54871  >  21 [SYN] Seq=1701017092 Win=32850 Len=0 WS=2 TSval=87635734 TSecr=0 SACK_PERM=1 MSS=1460"
"190922","59378.811981","214.153.191.211","131.243.1.10","TCP","74","40675  >  21 [SYN] Seq=173780872 Win=5840 Len=0 MSS=1460 TSval=312574108 TSecr=0 WS=1"
"191379","59481.162037","208.220.212.205","131.243.1.10","TCP","74","1854  >  21 [SYN] Seq=2327382488 Win=5840 Len=0 MSS=1350 TSval=375103970 TSecr=0 WS=1"
"191694","59587.067762","71.151.161.149","131.243.56.235","TCP","62","1219  >  21 [SYN] Seq=2757044504 Win=16384 Len=0 MSS=1436 SACK_PERM=1"
"191944","59650.933207","238.17.58.83","131.243.1.10","TCP","74","61457  >  21 [SYN] Seq=385562852 Win=57344 Len=0 MSS=1460 WS=1 TSval=1960837 TSecr=0"
"192278","59767.018414","149.63.43.106","128.3.28.48","TCP","66","3752  >  21 [SYN] Seq=4137197512 Win=5840 Len=0 MSS=1460 WS=1"
"193109","60047.933954","212.61.0.5","131.243.1.10","TCP","62","2471  >  21 [SYN] Seq=70940308 Win=8192 Len=0 MSS=1460 SACK_PERM=1"
"193321","60126.300166","50.132.33.248","131.243.1.10","TCP","62","33741  >  21 [SYN] Seq=2027159176 Win=49640 Len=0 MSS=1460 SACK_PERM=1"
"194250","60510.097446","194.60.137.208","131.243.1.10","TCP","74","32795  >  21 [SYN] Seq=1361000995 Win=5840 Len=0 MSS=1460 SACK_PERM=1 TSval=240634 TSecr=0 WS=1"
"195534","60803.859595","253.128.82.93","131.243.1.10","TCP","62","3020  >  21 [SYN] Seq=1265644763 Win=8760 Len=0 MSS=1460 SACK_PERM=1"
"195832","60835.259028","102.237.40.194","163.86.146.154","TCP","62","3315  >  21 [SYN] Seq=1469222063 Win=64240 Len=0 MSS=1460 SACK_PERM=1"
"196153","60897.940709","158.60.77.47","131.243.2.12","TCP","62","54200  >  21 [SYN] Seq=80900093 Win=32768 Len=0 MSS=1392 WS=1"
"196912","61145.296768","251.185.2.64","131.243.1.10","TCP","62","1261  >  21 [SYN] Seq=554555484 Win=64240 Len=0 MSS=1452 SACK_PERM=1"
"197591","61650.925397","42.142.109.155","131.243.1.10","TCP","62","63640  >  21 [SYN] Seq=582227174 Win=16384 Len=0 MSS=1380 SACK_PERM=1"
"197644","61651.648089","211.187.71.171","131.243.1.10","TCP","62","63648  >  21 [SYN] Seq=4146734690 Win=16384 Len=0 MSS=1380 SACK_PERM=1"
"198824","62119.666398","144.59.105.28","131.243.1.10","TCP","62","4067  >  21 [SYN] Seq=1059027632 Win=16384 Len=0 MSS=1372 SACK_PERM=1"
"199612","62636.996500","212.235.39.59","131.243.1.10","TCP","74","1511  >  21 [SYN] Seq=3004730117 Win=16384 Len=0 MSS=1460 WS=1 TSval=130716 TSecr=0"
"200030","62970.395010","121.204.82.134","131.243.2.12","TCP","62","1153  >  21 [SYN] Seq=1099857778 Win=16384 Len=0 MSS=1460 SACK_PERM=1"
"200062","62974.072122","109.115.171.214","128.3.28.48","TCP","74","49002  >  21 [SYN] Seq=4103421659 Win=5840 Len=0 MSS=1460 SACK_PERM=1 TSval=334074348 TSecr=0 WS=1"
"200685","63043.692182","228.108.41.13","131.243.1.10","TCP","62","41700  >  21 [SYN] Seq=1832848439 Win=2920 Len=0 SACK_PERM=1 MSS=1460"
"201012","63073.508042","115.112.177.179","131.243.1.10","TCP","74","60807  >  21 [SYN] Seq=4067637742 Win=5840 Len=0 MSS=1460 SACK_PERM=1 TSval=953758820 TSecr=0 WS=1"
"202308","63222.928153","6.3.226.39","203.174.5.11","TCP","62","56393  >  21 [SYN] Seq=2106847426 Win=32768 Len=0 MSS=536 WS=1"
"203404","63608.461689","107.196.98.246","131.243.1.10","TCP","62","1581  >  21 [SYN] Seq=1964799838 Win=64240 Len=0 MSS=1460 SACK_PERM=1"
"204651","64133.881735","124.143.131.206","131.243.1.10","TCP","74","47311  >  21 [SYN] Seq=928203957 Win=5840 Len=0 MSS=1460 SACK_PERM=1 TSval=53961840 TSecr=0 WS=1"
"204968","64278.390118","9.186.61.58","128.3.12.44","TCP","78","56915  >  21 [SYN] Seq=2782228452 Win=16384 Len=0 MSS=1460 SACK_PERM=1 WS=1 TSval=789276112 TSecr=0"
"205517","64507.202594","38.27.55.21","131.243.1.10","TCP","62","3679  >  21 [SYN] Seq=397331254 Win=64240 Len=0 MSS=1460 SACK_PERM=1"
"206144","64670.950619","247.106.172.90","131.243.1.10","TCP","74","62122  >  21 [SYN] Seq=648784108 Win=16384 Len=0 MSS=1460 WS=1 TSval=0 TSecr=0"
"209104","65514.631517","125.126.63.198","131.243.1.10","TCP","62","4173  >  21 [SYN] Seq=62931081 Win=8760 Len=0 MSS=1460 SACK_PERM=1"
"211465","66412.454865","24.244.108.161","131.142.160.17","TCP","62","1064  >  21 [SYN] Seq=4069017 Win=8192 Len=0 MSS=536 SACK_PERM=1"
"213256","66704.542832","120.198.119.152","131.243.1.10","TCP","62","4928  >  21 [SYN] Seq=7591424 Win=61440 Len=0 MSS=1460 WS=1"
"215371","66961.007032","125.253.42.25","131.243.2.12","TCP","62","3311  >  21 [SYN] Seq=3662453482 Win=16384 Len=0 MSS=1460 SACK_PERM=1"
"216715","67076.705650","83.57.102.76","131.243.1.10","TCP","62","43359  >  21 [SYN] Seq=2043060157 Win=16384 Len=0 MSS=1460 SACK_PERM=1"
"217481","67161.524831","176.87.117.123","131.243.1.10","TCP","74","41632  >  21 [SYN] Seq=431349644 Win=5840 Len=0 MSS=1350 SACK_PERM=1 TSval=117317544 TSecr=0 WS=1"
"219421","67507.100123","65.100.203.248","131.243.1.10","TCP","62","49277  >  21 [SYN] Seq=252781428 Win=24820 Len=0 SACK_PERM=1 MSS=1460"
"220552","67783.905073","205.195.237.11","131.243.1.10","TCP","62","2091  >  21 [SYN] Seq=1426349963 Win=64240 Len=0 MSS=1460 SACK_PERM=1"
"220878","67820.707314","102.107.241.229","131.243.1.10","TCP","74","1402  >  21 [SYN] Seq=3797880450 Win=5840 Len=0 MSS=1460 SACK_PERM=1 TSval=329333455 TSecr=0 WS=1"
"221951","67911.078755","47.190.32.70","131.243.2.12","TCP","62","1083  >  21 [SYN] Seq=1032097370 Win=16384 Len=0 MSS=1460 SACK_PERM=1"
"226850","68262.259212","122.180.145.117","131.243.1.10","TCP","62","33006  >  21 [SYN] Seq=1445803010 Win=16384 Len=0 MSS=1322 SACK_PERM=1"
"227519","68308.195622","24.107.51.105","131.243.1.10","TCP","62","10100  >  21 [SYN] Seq=2707269139 Win=16384 Len=0 MSS=1412 SACK_PERM=1"
"227935","68328.283383","97.177.169.137","131.243.1.10","TCP","74","32815  >  21 [SYN] Seq=1052559663 Win=4422 Len=0 MSS=1474 SACK_PERM=1 TSval=194843 TSecr=0 WS=1"
"231493","68561.351810","74.39.12.106","131.243.1.10","TCP","74","33132  >  21 [SYN] Seq=1090914345 Win=5840 Len=0 MSS=1460 SACK_PERM=1 TSval=491826 TSecr=0 WS=1"
"236824","69153.539513","228.19.241.102","131.243.1.10","TCP","74","2759  >  21 [SYN] Seq=1886878617 Win=5840 Len=0 MSS=1460 SACK_PERM=1 TSval=80446626 TSecr=0 WS=1"
"237774","69441.304697","203.150.164.146","131.243.2.12","TCP","62","1932  >  21 [SYN] Seq=2085094964 Win=16384 Len=0 MSS=1460 SACK_PERM=1"
"239177","69834.188241","20.102.7.171","131.243.3.49","TCP","62","18784  >  21 [SYN] Seq=4244145152 Win=16616 Len=0 MSS=1460 WS=1"
"239381","69864.805483","223.218.252.131","131.243.1.10","TCP","58","48796  >  21 [SYN] Seq=3727396422 Win=8760 Len=0 MSS=1460"
"239459","69866.959616","150.236.214.203","131.243.1.10","TCP","62","1550  >  21 [SYN] Seq=30135538 Win=8192 Len=0 MSS=536 SACK_PERM=1"
"240050","69962.991733","89.167.248.255","131.243.1.10","TCP","62","1224  >  21 [SYN] Seq=4182635574 Win=16384 Len=0 MSS=1412 SACK_PERM=1"
"240444","70016.541885","122.104.253.90","131.243.1.10","TCP","74","33069  >  21 [SYN] Seq=3645142052 Win=5840 Len=0 MSS=1460 SACK_PERM=1 TSval=3955320 TSecr=0 WS=1"
"241494","70257.557869","119.254.68.75","128.3.28.48","TCP","74","48751  >  21 [SYN] Seq=3054551282 Win=5840 Len=0 MSS=1460 TSval=86293745 TSecr=0 WS=1"
"241951","70407.584296","156.65.72.98","131.243.1.83","TCP","74","35122  >  21 [SYN] Seq=3236768660 Win=5840 Len=0 MSS=1452 SACK_PERM=1 TSval=5357184 TSecr=0 WS=1"
"242416","70589.097190","57.171.69.110","131.243.1.10","TCP","62","1973  >  21 [SYN] Seq=3956622606 Win=64240 Len=0 MSS=1460 SACK_PERM=1"
"242708","70676.996533","42.42.97.227","131.243.1.10","TCP","66","1777  >  21 [SYN] Seq=2578564609 Win=55808 Len=0 MSS=1460 WS=4 SACK_PERM=1"
"243526","70927.728600","66.150.59.108","131.243.1.10","TCP","74","4026  >  21 [SYN] Seq=3911438698 Win=57344 Len=0 MSS=1460 WS=1 TSval=1353102320 TSecr=0"
"245316","71373.773559","165.166.76.61","109.103.64.27","TCP","62","2514  >  21 [SYN] Seq=1702117471 Win=16384 Len=0 MSS=1440 SACK_PERM=1"
"245916","71482.828816","194.28.213.86","131.243.1.10","TCP","74","2113  >  21 [SYN] Seq=63430903 Win=5840 Len=0 MSS=1460 SACK_PERM=1 TSval=29958395 TSecr=0 WS=1"
"246896","71747.749471","79.97.199.38","128.3.12.44","TCP","74","33354  >  21 [SYN] Seq=479552500 Win=5840 Len=0 MSS=1436 SACK_PERM=1 TSval=3058650 TSecr=0 WS=1"
"248076","72357.803438","153.8.110.101","131.243.1.10","TCP","74","34479  >  21 [SYN] Seq=1997327834 Win=5840 Len=0 MSS=1460 SACK_PERM=1 TSval=686010 TSecr=0 WS=1"
"248610","72607.894633","53.134.210.194","131.243.1.10","TCP","74","46934  >  21 [SYN] Seq=1261749369 Win=5840 Len=0 MSS=1460 SACK_PERM=1 TSval=427451407 TSecr=0 WS=1"
"249045","72906.641707","124.66.202.109","131.243.1.10","TCP","62","10240  >  21 [SYN] Seq=6360395 Win=8192 Len=0 MSS=1412 SACK_PERM=1"
"249123","72917.363360","215.166.125.212","131.243.1.10","TCP","74","1331  >  21 [SYN] Seq=1682135857 Win=32120 Len=0 MSS=1452 SACK_PERM=1 TSval=6244272 TSecr=0 WS=1"
"250083","73354.007876","35.108.232.251","131.243.1.10","TCP","62","1709  >  21 [SYN] Seq=3336989989 Win=8760 Len=0 MSS=536 SACK_PERM=1"
"250379","73447.721375","86.134.244.124","131.243.1.10","TCP","62","62401  >  21 [SYN] Seq=2195339431 Win=16384 Len=0 MSS=1460 SACK_PERM=1"
"250439","73625.172439","40.226.158.89","131.243.1.10","TCP","58","58463  >  21 [SYN] Seq=479250958 Win=8760 Len=0 MSS=1460"
"250510","73638.481119","191.175.151.42","131.243.1.10","TCP","62","3149  >  21 [SYN] Seq=2453047052 Win=16384 Len=0 MSS=1460 SACK_PERM=1"
"254992","74714.765424","84.212.31.222","131.243.1.10","TCP","62","64790  >  21 [SYN] Seq=1344624141 Win=16384 Len=0 MSS=1414 SACK_PERM=1"
"255216","75021.846048","228.60.216.236","131.243.1.10","TCP","62","1897  >  21 [SYN] Seq=16313748 Win=8192 Len=0 MSS=1460 SACK_PERM=1"
"255401","75717.284311","188.125.94.126","203.174.5.11","TCP","62","4547  >  21 [SYN] Seq=647487210 Win=8760 Len=0 MSS=1460 SACK_PERM=1"
"255458","75728.279848","96.146.79.23","131.243.1.10","TCP","62","62362  >  21 [SYN] Seq=1687898173 Win=64240 Len=0 MSS=1414 SACK_PERM=1"
"255620","75745.845640","209.142.139.64","128.3.12.44","TCP","74","1034  >  21 [SYN] Seq=1274260957 Win=57344 Len=0 MSS=1412 WS=1 TSval=109021 TSecr=0"
"255701","75835.951685","223.202.125.58","242.70.74.100","TCP","62","31162  >  21 [SYN] Seq=1352950663 Win=32768 Len=0 MSS=1380"
"255778","75971.097268","180.16.189.140","131.243.1.10","TCP","62","1246  >  21 [SYN] Seq=690112090 Win=5840 Len=0 MSS=1460 SACK_PERM=1"
"255839","76205.346715","47.125.91.135","131.243.2.12","TCP","62","3542  >  21 [SYN] Seq=2375200637 Win=16384 Len=0 MSS=1460 SACK_PERM=1"
"255996","76773.787650","251.41.24.29","131.243.1.10","TCP","62","4031  >  21 [SYN] Seq=570376485 Win=64240 Len=0 MSS=1460 SACK_PERM=1"
"256054","76998.248544","246.109.155.46","131.243.1.10","TCP","62","61788  >  21 [SYN] Seq=982598925 Win=33580 Len=0 SACK_PERM=1 MSS=1460"
"256108","77242.941856","6.106.102.125","131.243.2.12","TCP","62","1114  >  21 [SYN] Seq=101591367 Win=64240 Len=0 MSS=1460 SACK_PERM=1"
"256219","77272.172779","150.70.97.75","131.243.1.10","TCP","74","4300  >  21 [SYN] Seq=1887560252 Win=32120 Len=0 MSS=1460 SACK_PERM=1 TSval=289502768 TSecr=0 WS=1"
"256297","77335.381566","46.199.244.38","131.243.1.10","TCP","62","37922  >  21 [SYN] Seq=272018 Win=8192 Len=0 MSS=1460 SACK_PERM=1"
"256469","77620.589209","55.130.12.90","131.243.1.10","TCP","62","3378  >  21 [SYN] Seq=1358613238 Win=16384 Len=0 MSS=1360 SACK_PERM=1"
"256535","77844.441143","59.144.40.50","128.3.12.44","TCP","74","1625  >  21 [SYN] Seq=756310704 Win=57344 Len=0 MSS=1460 WS=1 TSval=2127718 TSecr=0"
"256743","78249.080192","239.180.92.238","131.243.1.10","TCP","74","40624  >  21 [SYN] Seq=2812268456 Win=5840 Len=0 MSS=1460 SACK_PERM=1 TSval=7511093 TSecr=0 WS=1"
"257151","78445.980914","140.95.236.81","131.243.2.12","TCP","62","2555  >  21 [SYN] Seq=1384159761 Win=16384 Len=0 MSS=1460 SACK_PERM=1"
"257892","78680.324625","75.43.96.96","131.243.2.12","TCP","62","1379  >  21 [SYN] Seq=1680487128 Win=16384 Len=0 MSS=1460 SACK_PERM=1"
"261093","79201.969507","92.209.69.32","131.243.2.12","TCP","78","1772  >  21 [SYN] Seq=2699401251 Win=16384 Len=0 MSS=1460 WS=1 TSval=0 TSecr=0 SACK_PERM=1"
"262267","79415.526021","172.164.18.181","131.243.1.10","TCP","74","1163  >  21 [SYN] Seq=3975774292 Win=32120 Len=0 MSS=1460 SACK_PERM=1 TSval=286732 TSecr=0 WS=1"
"263764","79645.036179","31.200.244.160","131.243.1.10","TCP","62","4310  >  21 [SYN] Seq=4129369349 Win=16384 Len=0 MSS=1380 SACK_PERM=1"
"265554","80000.089466","167.67.226.104","131.243.2.12","TCP","74","2951  >  21 [SYN] Seq=2141134125 Win=65535 Len=0 MSS=1460 WS=1 TSval=703800 TSecr=0"
"265602","80003.722049","244.173.253.244","131.243.2.12","TCP","74","52396  >  21 [SYN] Seq=1830806486 Win=65535 Len=0 MSS=1460 WS=1 TSval=723370 TSecr=0"
"265832","80041.636476","194.208.35.238","131.243.56.235","TCP","62","4371  >  21 [SYN] Seq=2980075539 Win=16384 Len=0 MSS=1460 SACK_PERM=1"
"266176","80104.370880","48.133.138.220","131.243.1.10","TCP","62","4198  >  21 [SYN] Seq=8301332 Win=8760 Len=0 MSS=1460 SACK_PERM=1"
"268466","80550.956252","152.133.133.98","128.3.28.48","TCP","74","37494  >  21 [SYN] Seq=1221853763 Win=5840 Len=0 MSS=1460 SACK_PERM=1 TSval=1153512633 TSecr=0 WS=1"
"268920","80614.490509","237.253.247.16","131.243.1.10","TCP","62","32771  >  21 [SYN] Seq=3649190936 Win=16384 Len=0 MSS=1460"
"270396","80968.585306","148.202.110.9","131.243.1.10","TCP","62","1032  >  21 [SYN] Seq=288923 Win=8192 Len=0 MSS=536 SACK_PERM=1"
"270585","81036.606424","8.128.166.3","131.243.1.10","TCP","74","1026  >  21 [SYN] Seq=1874084808 Win=5840 Len=0 MSS=1460 SACK_PERM=1 TSval=235583 TSecr=0 WS=1"
"270657","81079.946423","98.148.251.253","131.243.1.10","TCP","74","1085  >  21 [SYN] Seq=2561506652 Win=57344 Len=0 MSS=1460 WS=1 TSval=248829 TSecr=0"
"270768","81135.349933","175.156.82.252","131.243.1.10","TCP","74","56936  >  21 [SYN] Seq=1668238848 Win=32120 Len=0 MSS=1460 SACK_PERM=1 TSval=609988813 TSecr=0 WS=1"
"270898","81171.352982","215.156.189.72","131.243.1.10","TCP","58","65317  >  21 [SYN] Seq=3443314646 Win=8760 Len=0 MSS=1460"
"270975","81172.168879","47.165.232.103","131.243.1.10","TCP","62","1040  >  21 [SYN] Seq=497768 Win=8192 Len=0 MSS=536 SACK_PERM=1"
"271179","81223.977892","24.62.229.246","131.243.1.10","TCP","74","1113  >  21 [SYN] Seq=1783939705 Win=4422 Len=0 MSS=1474 SACK_PERM=1 TSval=100579 TSecr=0 WS=1"
"271264","81286.681501","42.108.8.116","131.243.1.10","TCP","74","2398  >  21 [SYN] Seq=2151306216 Win=16060 Len=0 MSS=1380 SACK_PERM=1 TSval=1233434356 TSecr=0 WS=1"
"272446","82143.056348","205.69.167.14","128.3.12.44","TCP","74","56637  >  21 [SYN] Seq=610794106 Win=16384 Len=0 MSS=1412 WS=1 TSval=0 TSecr=0"
"273100","82610.958414","255.165.66.19","128.3.28.48","TCP","74","1030  >  21 [SYN] Seq=1929037985 Win=5808 Len=0 MSS=1412 SACK_PERM=1 TSval=28617791 TSecr=0 WS=1"
"274355","83025.000334","11.37.230.254","128.3.12.44","TCP","74","39062  >  21 [SYN] Seq=3648378031 Win=5840 Len=0 MSS=1460 SACK_PERM=1 TSval=204582439 TSecr=0 WS=1"
"274657","83189.418031","28.131.230.19","131.243.1.10","TCP","66","48884  >  21 [SYN] Seq=3836713250 Win=5840 Len=0 MSS=1460 SACK_PERM=1 WS=1"
"274891","83563.437737","237.28.193.71","128.3.28.48","TCP","74","35569  >  21 [SYN] Seq=1153595081 Win=5840 Len=0 MSS=1460 SACK_PERM=1 TSval=66477372 TSecr=0 WS=1"
"275519","84015.751386","59.138.27.254","131.243.1.10","TCP","74","2283  >  21 [SYN] Seq=425905946 Win=5840 Len=0 MSS=1460 SACK_PERM=1 TSval=1222041 TSecr=0 WS=1"
"275746","84044.174253","248.38.158.214","131.243.1.10","TCP","62","1639  >  21 [SYN] Seq=4019385 Win=8192 Len=0 MSS=536 SACK_PERM=1"
"275947","84071.123761","47.46.63.157","131.243.1.10","TCP","62","3222  >  21 [SYN] Seq=4199998922 Win=8760 Len=0 MSS=1460 SACK_PERM=1"
"276675","84397.110671","171.153.201.216","131.243.2.12","TCP","62","4266  >  21 [SYN] Seq=2220570052 Win=64800 Len=0 MSS=1440 SACK_PERM=1"
"276693","84568.416506","17.210.251.231","131.243.1.10","TCP","74","40054  >  21 [SYN] Seq=1003516351 Win=5840 Len=0 MSS=1460 TSval=10235665 TSecr=0 WS=1"
"277454","84933.384590","116.209.217.150","102.174.154.179","TCP","62","1817  >  21 [SYN] Seq=1959093079 Win=16384 Len=0 MSS=1460 SACK_PERM=1"
"277585","84966.922129","75.54.220.221","131.243.1.10","TCP","62","2579  >  21 [SYN] Seq=2008385443 Win=16384 Len=0 MSS=1460 SACK_PERM=1"
"277905","85097.841965","243.147.118.220","131.243.1.10","TCP","62","62272  >  21 [SYN] Seq=10384345 Win=8192 Len=0 MSS=1460 SACK_PERM=1"
"279519","85810.465051","132.34.219.22","131.243.1.10","TCP","62","1108  >  21 [SYN] Seq=299498 Win=8192 Len=0 MSS=1322 SACK_PERM=1"
"281221","86061.810942","77.249.57.104","131.243.1.10","TCP","74","62898  >  21 [SYN] Seq=4248793976 Win=5840 Len=0 MSS=1460 SACK_PERM=1 TSval=10512644 TSecr=0 WS=1"
"282182","86279.993769","31.240.144.130","131.243.1.10","TCP","74","2532  >  21 [SYN] Seq=3644838796 Win=32120 Len=0 MSS=1460 SACK_PERM=1 TSval=83791193 TSecr=0 WS=1"
"282512","86335.871825","224.65.194.147","203.174.5.11","TCP","62","63210  >  21 [SYN] Seq=521097895 Win=16384 Len=0 MSS=1460 SACK_PERM=1"
