"3","0.172129","248.38.9.24","131.243.1.10","TCP","54","41553  >  21 [ACK] Seq=1314531095 Ack=3522283871 Win=5840 Len=0"
"57","181.359733","217.148.52.180","131.243.2.12","TCP","54","2471  >  21 [ACK] Seq=3240012532 Ack=4160427571 Win=17520 Len=0"
"119","214.957697","59.30.70.208","128.3.28.48","TCP","66","34500  >  21 [ACK] Seq=2376548816 Ack=3378153983 Win=4452 Len=0 TSval=409889 TSecr=2268157553"
"280","300.385137","229.246.115.157","131.243.1.10","TCP","54"," 56646  >  21 [ACK] Seq=3601681548 Ack=482135013 Win=0 Len=0"
"312","300.824489","229.246.115.157","131.243.1.10","TCP","54","56646  >  21 [ACK] Seq=3601681548 Ack=482136330 Win=61320 Len=0"
"376","320.765865","189.30.8.121","131.243.1.10","TCP","54","40570  >  21 [ACK] Seq=3857849775 Ack=3874753630 Win=17520 Len=0"
"453","333.627291","189.30.8.121","131.243.1.10","TCP","54","40595  >  21 [ACK] Seq=3861801732 Ack=3070745588 Win=17520 Len=0"
"716","469.336756","7.82.237.222","131.243.1.10","TCP","54","5973  >  21 [ACK] Seq=2836082885 Ack=4117658486 Win=64240 Len=0"
"805","490.066072","7.82.237.222","131.243.1.10","TCP","54","7485  >  21 [ACK] Seq=2842551018 Ack=1007098653 Win=64240 Len=0"
"985","559.589700","152.191.35.146","128.3.28.48","TCP","66","34528  >  21 [ACK] Seq=2757745485 Ack=3739857698 Win=4452 Len=0 TSval=444354 TSecr=2268192013"
"1030","570.736975","152.191.35.146","128.3.28.48","TCP","66","34530  >  21 [ACK] Seq=2780329857 Ack=3746425480 Win=4452 Len=0 TSval=445469 TSecr=2268193128"
"1078","585.509205","152.191.35.146","128.3.28.48","TCP","66","34532  >  21 [ACK] Seq=2799027953 Ack=3762298411 Win=4452 Len=0 TSval=446946 TSecr=2268194605"
"1234","672.275888","45.7.36.127","131.243.2.12","TCP","54","2945  >  21 [ACK] Seq=1291332708 Ack=4224685612 Win=8760 Len=0"
"1630","822.176503","161.126.87.140","131.243.1.10","TCP","54","1819  >  21 [ACK] Seq=2931886123 Ack=3250326096 Win=65340 Len=0"
"1722","848.471283","91.198.76.64","131.243.1.10","TCP","54","61149  >  21 [ACK] Seq=2133859528 Ack=1099545149 Win=5840 Len=0"
"1896","907.876795","161.126.87.140","131.243.1.10","TCP","54","1824  >  21 [ACK] Seq=2951351271 Ack=1653996698 Win=65340 Len=0"
"1982","918.034264","161.126.87.140","131.243.1.10","TCP","54","1826  >  21 [ACK] Seq=2953685134 Ack=1335315708 Win=65340 Len=0"
"2262","1006.484747","189.214.156.168","131.243.1.10","TCP","54","3017  >  21 [ACK] Seq=1637976574 Ack=3816381823 Win=9112 Len=0"
"2295","1009.792671","173.112.82.221","131.243.1.10","TCP","54","3887  >  21 [ACK] Seq=4090061795 Ack=4144702576 Win=65535 Len=0"
"2460","1058.854332","168.254.152.132","131.243.2.12","TCP","54","2523  >  21 [ACK] Seq=1546644011 Ack=4275810115 Win=17520 Len=0"
"2606","1110.338476","4.251.189.14","131.243.1.10","TCP","54","37465  >  21 [ACK] Seq=2480776529 Ack=299187677 Win=5840 Len=0"
"2729","1130.637910","148.111.20.136","131.243.1.10","TCP","54","51858  >  21 [ACK] Seq=2511075634 Ack=3387262941 Win=5840 Len=0"
"2948","1187.603670","168.254.152.132","131.243.2.12","TCP","54","1466  >  21 [ACK] Seq=1576231987 Ack=4292362851 Win=17520 Len=0"
"3038","1211.073669","249.44.109.25","128.3.28.48","TCP","66","1286  >  21 [ACK] Seq=2594401954 Ack=134197194 Win=5840 Len=0 TSval=195399177 TSecr=2268257174"
"3074","1212.446023","249.44.109.25","128.3.28.48","TCP","66","1288  >  21 [ACK] Seq=2585326591 Ack=131645312 Win=5840 Len=0 TSval=195399314 TSecr=2268257311"
"3105","1214.460200","249.44.109.25","128.3.28.48","TCP","66","1290  >  21 [ACK] Seq=2593112409 Ack=138913055 Win=5840 Len=0 TSval=195399515 TSecr=2268257511"
"3481","1319.345423","55.84.210.42","131.243.1.10","TCP","54","3552  >  21 [ACK] Seq=3664903932 Ack=3783934136 Win=32767 Len=0"
"3572","1349.361038","82.143.24.12","131.243.2.12","TCP","54","3868  >  21 [ACK] Seq=1278870485 Ack=18157421 Win=17520 Len=0"
"3623","1368.308117","232.8.175.74","131.243.1.10","TCP","54","63068  >  21 [ACK] Seq=3108712003 Ack=3387660696 Win=8760 Len=0"
"3772","1398.278539","178.214.186.1","131.243.1.10","TCP","54","60407  >  21 [ACK] Seq=3726390523 Ack=3033698579 Win=5840 Len=0"
"3853","1408.742923","178.214.186.1","131.243.1.10","TCP","54","60415  >  21 [ACK] Seq=3962290440 Ack=4208204251 Win=5840 Len=0"
"4227","1555.383270","232.8.175.74","131.243.1.10","TCP","54","63072  >  21 [ACK] Seq=3132369787 Ack=2460470658 Win=8760 Len=0"
"4306","1562.964213","232.8.175.74","131.243.1.10","TCP","54","63074  >  21 [ACK] Seq=3133455061 Ack=1783940912 Win=8760 Len=0"
"4590","1652.397732","152.191.35.146","128.3.28.48","TCP","66","34722  >  21 [ACK] Seq=3924136717 Ack=591562545 Win=4452 Len=0 TSval=553636 TSecr=2268301283"
"4892","1845.188741","216.43.247.103","131.243.1.10","TCP","54","58752  >  21 [ACK] Seq=3247196765 Ack=3225932125 Win=5840 Len=0"
"4952","1850.897865","16.69.134.221","131.243.2.12","TCP","54","4517  >  21 [ACK] Seq=3465098128 Ack=83179558 Win=17520 Len=0"
"5233","1906.015980","150.70.97.75","131.243.1.10","TCP","54","2130  >  21 [ACK] Seq=3301524673 Ack=2892670081 Win=32120 Len=0"
"5265","1906.216079","131.243.1.10","150.70.97.75","TCP","54","21  >  2130 [ACK] Seq=2892671395 Ack=3301524689 Win=17504 Len=0"
"5438","1935.761211","16.69.134.221","131.243.2.12","TCP","54"," 4517  >  21 [ACK] Seq=3465100875 Ack=83184319 Win=17382 Len=0"
"5465","2262.563634","250.225.145.152","131.243.1.10","TCP","54","1267  >  21 [ACK] Seq=2007890 Ack=3464407725 Win=8576 Len=0"
"5539","2333.269688","18.197.41.194","131.243.1.10","TCP","54","25202  >  21 [ACK] Seq=3498156636 Ack=2192896637 Win=33580 Len=0"
"5600","2346.715432","237.180.56.133","131.243.1.10","TCP","54","3276  >  21 [ACK] Seq=1323715784 Ack=16825283 Win=17680 Len=0"
"5653","2353.928110","18.197.41.194","131.243.1.10","TCP","54","25574  >  21 [ACK] Seq=3570394931 Ack=3644437069 Win=33580 Len=0"
"5734","2405.303097","82.143.24.12","131.243.2.12","TCP","54","3262  >  21 [ACK] Seq=3123447666 Ack=155435434 Win=17520 Len=0"
"5775","2475.959746","44.120.49.173","109.103.64.27","TCP","54","4936  >  21 [ACK] Seq=24263793 Ack=2687898558 Win=1460 Len=0"
"5803","2481.998713","82.143.24.12","131.243.2.12","TCP","54","1089  >  21 [ACK] Seq=3148109522 Ack=165493445 Win=17520 Len=0"
"5818","2489.637348","44.120.49.173","62.159.77.154","TCP","54","2007  >  21 [ACK] Seq=24271238 Ack=323900000 Win=1460 Len=0"
"5842","2492.157362","44.120.49.173","44.76.136.98","TCP","54","2207  >  21 [ACK] Seq=24272693 Ack=2072705665 Win=1460 Len=0"
"5882","2517.700737","44.120.49.173","189.246.241.212","TCP","54","4143  >  21 [ACK] Seq=24286674 Ack=433600000 Win=1460 Len=0"
"5884","2517.705600","44.120.49.173","123.47.104.102","TCP","54","4144  >  21 [ACK] Seq=24286688 Ack=2037642686 Win=1460 Len=0"
"5894","2517.803026","44.120.49.173","4.18.95.135","TCP","54","4151  >  21 [ACK] Seq=24286771 Ack=238665729 Win=1460 Len=0"
"5928","2519.209230","44.120.49.173","48.248.244.161","TCP","54","4266  >  21 [ACK] Seq=24287625 Ack=3781889982 Win=1460 Len=0"
"5977","2541.936139","82.143.24.12","131.243.2.12","TCP","54","3147  >  21 [ACK] Seq=3168390351 Ack=173414355 Win=17520 Len=0"
"6065","2606.837284","250.225.145.152","131.243.1.10","TCP","54","1290  >  21 [ACK] Seq=2356648 Ack=1923898442 Win=8576 Len=0"
"6118","2678.019169","82.143.24.12","131.243.2.12","TCP","54","3610  >  21 [ACK] Seq=3216165530 Ack=192217505 Win=17520 Len=0"
"6188","2770.078526","69.157.45.176","131.243.2.12","TCP","54","2479  >  21 [ACK] Seq=2787842499 Ack=204329645 Win=64240 Len=0"
"6238","2819.333001","143.156.1.2","131.243.2.12","TCP","54","3167  >  21 [ACK] Seq=598276254 Ack=212715357 Win=17520 Len=0"
"6312","2868.369545","47.125.91.135","131.243.2.12","TCP","54","1300  >  21 [ACK] Seq=238381078 Ack=220102632 Win=17520 Len=0"
"6392","2914.852992","24.190.46.234","131.243.1.10","TCP","54","48576  >  21 [ACK] Seq=2413775610 Ack=159066751 Win=8760 Len=0"
"6492","3023.986024","75.16.160.171","131.243.2.12","TCP","66","55508  >  21 [ACK] Seq=217413205 Ack=242020475 Win=65535 Len=0 TSval=1929749 TSecr=314246494"
"6522","3044.298921","244.173.253.244","131.243.2.12","TCP","66","51770  >  21 [ACK] Seq=99526661 Ack=244740851 Win=65535 Len=0 TSval=1780417 TSecr=314248525"
"6523","3044.443463","90.227.190.180","131.243.2.12","TCP","54","3904  >  21 [ACK] Seq=1987179968 Ack=244866350 Win=17520 Len=0"
"6566","3049.526883","244.173.253.244","131.243.2.12","TCP","66","53665  >  21 [ACK] Seq=370338453 Ack=245543546 Win=65535 Len=0 TSval=1780427 TSecr=314249048"
"6600","3053.651486","244.173.253.244","131.243.2.12","TCP","66","55120  >  21 [ACK] Seq=582556105 Ack=246161603 Win=65535 Len=0 TSval=1780435 TSecr=314249461"
"6725","3119.542622","171.142.200.244","131.243.1.10","TCP","54","33011  >  21 [ACK] Seq=301681036 Ack=3969871645 Win=5808 Len=0"
"6771","3120.314179","217.148.52.180","203.174.5.11","TCP","54","3241  >  21 [ACK] Seq=31237829 Ack=605120001 Win=17520 Len=0"
"6800","3121.731104","171.142.200.244","131.243.1.10","TCP","54","33013  >  21 [ACK] Seq=317341199 Ack=3208160582 Win=5808 Len=0"
"6942","3146.091075","43.27.105.111","128.3.28.48","TCP","54","17134  >  21 [ACK] Seq=3233997190 Ack=2161586594 Win=17520 Len=0"
"7128","3196.724930","43.27.105.111","128.3.28.48","TCP","54","18263  >  21 [ACK] Seq=3252580770 Ack=2221108320 Win=17520 Len=0"
"7369","3267.951615","43.27.105.111","128.3.28.48","TCP","54","19695  >  21 [ACK] Seq=3298967185 Ack=2298563530 Win=17520 Len=0"
"7481","3306.486940","192.232.226.84","131.243.1.10","TCP","54","33728  >  21 [ACK] Seq=499649925 Ack=3845919656 Win=5840 Len=0"
"7630","3352.200957","120.151.219.31","131.243.1.10","TCP","54","50236  >  21 [ACK] Seq=3093969719 Ack=286736228 Win=64860 Len=0"
"7923","3457.997531","69.157.45.176","203.174.5.11","TCP","54","1044  >  21 [ACK] Seq=3005183276 Ack=616512001 Win=64240 Len=0"
"8023","3512.654595","84.68.192.198","131.243.1.10","TCP","54","1594  >  21 [ACK] Seq=3117017267 Ack=2371308539 Win=57960 Len=0"
"8209","3558.965714","18.23.245.184","131.243.1.10","TCP","54","1915  >  21 [ACK] Seq=1898882 Ack=1163261938 Win=8576 Len=0"
"8271","3575.342867","192.232.226.84","131.243.1.10","TCP","54","33739  >  21 [ACK] Seq=770075470 Ack=509407600 Win=5840 Len=0"
"8320","3576.325315","129.80.74.185","131.243.1.10","TCP","54","19542  >  21 [ACK] Seq=19508664 Ack=3410837019 Win=8760 Len=0"
"8396","3586.667853","129.80.74.185","131.243.1.10","TCP","54","19546  >  21 [ACK] Seq=19520080 Ack=2450388449 Win=8760 Len=0"
"8605","3667.002950","18.23.245.184","131.243.1.10","TCP","54","2004  >  21 [ACK] Seq=2010474 Ack=582140519 Win=8576 Len=0"
"8790","3737.675858","132.239.174.251","131.243.1.10","TCP","54","35056  >  21 [ACK] Seq=2671301655 Ack=1088897552 Win=17232 Len=0"
"8849","3910.979492","239.248.79.130","131.243.1.10","TCP","54","2794  >  21 [ACK] Seq=959109209 Ack=145574165 Win=32120 Len=0"
"8927","3915.826832","37.113.117.74","131.243.1.10","TCP","54","53763  >  21 [ACK] Seq=1364227952 Ack=2034695566 Win=5840 Len=0"
"8978","3920.974847","37.113.117.74","131.243.1.10","TCP","54","53773  >  21 [ACK] Seq=1369968117 Ack=3644686113 Win=5840 Len=0"
"9014","3921.252083","91.198.76.64","131.243.1.10","TCP","54","61446  >  21 [ACK] Seq=1093397124 Ack=1167062910 Win=5840 Len=0"
"9129","4045.916434","143.248.150.114","131.243.1.10","TCP","54","1201  >  21 [ACK] Seq=1532178 Ack=4046295193 Win=8576 Len=0"
"9190","4072.221894","143.248.150.114","131.243.1.10","TCP","54","1203  >  21 [ACK] Seq=1558510 Ack=4284128603 Win=8576 Len=0"
"9243","4196.881752","184.177.31.177","131.243.1.10","TCP","54","1084  >  21 [ACK] Seq=1162727179 Ack=1697468049 Win=65535 Len=0"
"9319","4298.786224","18.23.245.184","131.243.1.10","TCP","54","2474  >  21 [ACK] Seq=2623851 Ack=3874567522 Win=8576 Len=0"
"9349","4304.325510","18.23.245.184","131.243.1.10","TCP","54","2489  >  21 [ACK] Seq=2642479 Ack=2168707385 Win=8576 Len=0"
"9419","4335.668626","192.232.226.84","131.243.1.10","TCP","54","33751  >  21 [ACK] Seq=1588560556 Ack=2519416319 Win=5840 Len=0"
"9554","4482.440146","193.248.9.31","131.243.1.10","TCP","54","33094  >  21 [ACK] Seq=1738534006 Ack=907419650 Win=5840 Len=0"
"9633","4693.071613","116.177.87.124","131.243.1.10","TCP","54","2785  >  21 [ACK] Seq=1963533717 Ack=900011733 Win=32120 Len=0"
"9702","4803.559793","213.17.189.200","131.243.1.10","TCP","54","46205  >  21 [ACK] Seq=2063954070 Ack=363818445 Win=5840 Len=0"
"9762","4851.536502","76.62.141.80","131.243.1.10","TCP","54","37885  >  21 [ACK] Seq=2267672002 Ack=193793050 Win=5840 Len=0"
"9802","4855.949935","157.215.230.139","131.243.1.10","TCP","54","21986  >  21 [ACK] Seq=1927027191 Ack=1181394414 Win=6144 Len=0"
"9846","4858.379900","131.243.1.10","157.215.230.139","TCP","54","21  >  21986 [ACK] Seq=1181395731 Ack=1927027207 Win=16400 Len=0"
"9882","4941.772952","76.62.141.80","131.243.1.10","TCP","54","38041  >  21 [ACK] Seq=2359617896 Ack=1941765363 Win=5840 Len=0"
"9943","5000.801218","76.62.141.80","131.243.1.10","TCP","54","38141  >  21 [ACK] Seq=2428491721 Ack=182535931 Win=5840 Len=0"
"10000","5006.855209","203.139.202.26","131.243.2.12","TCP","54","55549  >  21 [ACK] Seq=1423724934 Ack=503301305 Win=16060 Len=0"
"10034","5022.884609","254.213.124.61","131.243.2.12","TCP","54","1200  >  21 [ACK] Seq=4805564 Ack=505633083 Win=8760 Len=0"
"10040","5027.106623","131.213.89.179","131.243.1.10","TCP","54","3866  >  21 [ACK] Seq=443754932 Ack=526115876 Win=8760 Len=0"
"10096","5028.675077","76.62.141.80","131.243.1.10","TCP","54","38191  >  21 [ACK] Seq=2461311092 Ack=3496503013 Win=5840 Len=0"
"10189","5155.204342","152.172.117.61","131.243.1.10","TCP","54","1926  >  21 [ACK] Seq=3292358250 Ack=4228911423 Win=17520 Len=0"
"10229","5163.054837","152.172.117.61","131.243.1.10","TCP","54","1923  >  21 [ACK] Seq=3292148778 Ack=1845188779 Win=17520 Len=0"
"10306","5205.246028","173.218.67.133","131.243.1.10","TCP","54","33311  >  21 [ACK] Seq=2498043034 Ack=1024496821 Win=5840 Len=0"
"10369","5410.986446","97.0.158.29","131.243.1.10","TCP","54","46189  >  21 [ACK] Seq=2703202795 Ack=4236532845 Win=5840 Len=0"
"10439","5612.712726","161.206.176.161","131.243.1.10","TCP","54","2726  >  21 [ACK] Seq=3530878060 Ack=1634527202 Win=17520 Len=0"
"10504","5683.867905","21.97.107.165","131.243.1.10","TCP","54","60804  >  21 [ACK] Seq=2816766625 Ack=3500936127 Win=64860 Len=0"
"10564","5701.855899","21.97.107.165","131.243.1.10","TCP","54","60835  >  21 [ACK] Seq=3760902753 Ack=1477034424 Win=64860 Len=0"
"10626","5873.035446","212.7.211.138","131.243.1.10","TCP","54","2110  >  21 [ACK] Seq=4096162 Ack=557305895 Win=8760 Len=0"
"10658","5873.485834","131.243.1.10","212.7.211.138","TCP","54","21  >  2110 [ACK] Seq=557307210 Ack=4096178 Win=17504 Len=0"
"10675","5875.036486","212.7.211.138","131.243.1.10","TCP","54","2111  >  21 [ACK] Seq=4098176 Ack=879251231 Win=8760 Len=0"
"10738","5961.586445","207.249.252.183","131.243.1.10","TCP","54","41431  >  21 [ACK] Seq=4099085768 Ack=886517246 Win=7300 Len=0"
"10802","6023.498895","209.187.104.128","131.243.1.10","TCP","54","32811  >  21 [ACK] Seq=3356135988 Ack=1964043523 Win=5840 Len=0"
"10901","6075.221086","136.118.224.122","131.243.2.12","TCP","66","1533  >  21 [ACK] Seq=1508965869 Ack=644747054 Win=372296 Len=0 TSval=1829205 TSecr=314551448"
"10962","6121.725528","214.53.92.97","131.243.1.10","TCP","54","3146  >  21 [ACK] Seq=801720438 Ack=1295541280 Win=65044 Len=0"
"11387","6345.514982","146.25.22.32","131.243.1.10","TCP","54","2060  >  21 [ACK] Seq=1420544900 Ack=87960952 Win=64240 Len=0"
"11535","6417.365508","143.248.150.114","131.243.1.10","TCP","54","1437  >  21 [ACK] Seq=3903432 Ack=903441602 Win=8576 Len=0"
"11594","6422.007973","143.248.150.114","131.243.1.10","TCP","54","1439  >  21 [ACK] Seq=3908074 Ack=1722691407 Win=8576 Len=0"
"11779","6439.202963","143.248.150.114","131.243.1.10","TCP","54","1441  >  21 [ACK] Seq=3925284 Ack=188705122 Win=8576 Len=0"
"11992","6567.283427","136.118.224.122","131.243.2.12","TCP","66","3668  >  21 [ACK] Seq=1637062702 Ack=708627314 Win=372296 Len=0 TSval=1834134 TSecr=314600732"
"12297","6685.697305","157.231.148.18","131.243.2.12","TCP","54","2847  >  21 [ACK] Seq=1663378763 Ack=724080684 Win=17520 Len=0"
"12396","6716.897575","38.93.253.216","131.243.2.12","TCP","54","1348  >  21 [ACK] Seq=141231676 Ack=728036312 Win=17520 Len=0"
"12452","6726.645645","61.157.171.227","131.243.1.10","TCP","54","4251  >  21 [ACK] Seq=2888105026 Ack=1886061956 Win=65136 Len=0"
"12656","6765.660418","204.88.125.120","131.243.1.10","TCP","54","18242  >  21 [ACK] Seq=2620859862 Ack=524302483 Win=8760 Len=0"
"13690","7026.920194","32.183.12.123","131.243.1.10","TCP","54","61469  >  21 [ACK] Seq=1877815319 Ack=2518803496 Win=17520 Len=0"
"13809","7042.167091","15.190.17.141","131.243.1.10","TCP","54","54423  >  21 [ACK] Seq=1961390239 Ack=1489358333 Win=64240 Len=0"
"14472","7290.951922","15.190.17.141","131.243.1.10","TCP","54","59940  >  21 [ACK] Seq=3035942044 Ack=487293380 Win=64240 Len=0"
"14871","7736.282886","175.111.96.67","131.243.1.10","TCP","54","2292  >  21 [ACK] Seq=3087606086 Ack=2199403377 Win=64240 Len=0"
"14933","7884.425001","144.11.225.104","131.243.2.12","TCP","54","3020  >  21 [ACK] Seq=2182563524 Ack=885485431 Win=17520 Len=0"
"14990","7913.411328","144.11.225.104","131.243.2.12","TCP","54","3023  >  21 [ACK] Seq=2189114227 Ack=889212887 Win=17520 Len=0"
"15020","8053.620676","146.25.22.32","131.243.1.10","TCP","54","2166  >  21 [ACK] Seq=1851663640 Ack=2142748947 Win=64240 Len=0"
"15052","8053.893141","131.243.1.10","146.25.22.32","TCP","54","21  >  2166 [ACK] Seq=2142750261 Ack=1851663656 Win=17504 Len=0"
"15096","8117.445569","144.11.225.104","131.243.2.12","TCP","54","3027  >  21 [ACK] Seq=2241046773 Ack=918591023 Win=17520 Len=0"
"15122","8195.156879","84.68.192.198","131.243.1.10","TCP","54","1669  >  21 [ACK] Seq=2908082119 Ack=1928412757 Win=57960 Len=0"
"15192","8234.039797","157.231.148.18","131.243.2.12","TCP","54","5412  >  21 [ACK] Seq=2070494883 Ack=933550009 Win=17520 Len=0"
"15213","8290.143632","154.171.221.209","128.3.12.44","TCP","54","1142  >  21 [ACK] Seq=466844631 Ack=1932480001 Win=57344 Len=0"
"15270","8315.567522","241.49.40.187","131.243.1.10","TCP","54","1872  >  21 [ACK] Seq=39911159 Ack=1933569165 Win=8760 Len=0"
"15320","8317.176645","241.49.40.187","131.243.1.10","TCP","54","1873  >  21 [ACK] Seq=39911166 Ack=982729657 Win=8760 Len=0"
"15389","8324.878281","197.217.232.215","131.243.1.10","TCP","54","37944  >  21 [ACK] Seq=3609370338 Ack=567357113 Win=5840 Len=0"
"15471","8340.080639","197.217.232.215","131.243.1.10","TCP","54","37947  >  21 [ACK] Seq=3636506587 Ack=3584084470 Win=5840 Len=0"
"15536","8354.717398","197.217.232.215","131.243.1.10","TCP","54","37951  >  21 [ACK] Seq=3642476773 Ack=923023404 Win=5840 Len=0"
"15601","8369.920865","197.217.232.215","131.243.1.10","TCP","54","37955  >  21 [ACK] Seq=3651356845 Ack=217791147 Win=5840 Len=0"
"15659","8386.160255","197.217.232.215","131.243.1.10","TCP","54","37957  >  21 [ACK] Seq=3674803191 Ack=228173554 Win=5840 Len=0"
"15717","8400.501998","165.78.71.101","128.3.28.48","TCP","66","38417  >  21 [ACK] Seq=1591427116 Ack=3426063001 Win=5840 Len=0 TSval=1003500420 TSecr=2268976055"
"15743","8400.960780","165.78.71.101","128.3.28.48","TCP","66","38419  >  21 [ACK] Seq=1578765153 Ack=3429846591 Win=5840 Len=0 TSval=1003500655 TSecr=2268976101"
"15769","8401.971422","165.78.71.101","128.3.28.48","TCP","66","38421  >  21 [ACK] Seq=1584562741 Ack=3434988518 Win=5840 Len=0 TSval=1003501173 TSecr=2268976202"
"15788","8403.444560","197.217.232.215","131.243.1.10","TCP","54","37975  >  21 [ACK] Seq=3696859938 Ack=1005361733 Win=5840 Len=0"
"15854","8439.164556","108.97.140.165","131.243.1.10","TCP","54","47604  >  21 [ACK] Seq=1618053315 Ack=2087694818 Win=5840 Len=0"
"15902","8517.601660","197.217.232.215","131.243.1.10","TCP","54","37988  >  21 [ACK] Seq=3837765440 Ack=2441602569 Win=5840 Len=0"
"15955","8524.267883","241.49.40.187","131.243.1.10","TCP","54","1930  >  21 [ACK] Seq=40039809 Ack=1662650424 Win=8760 Len=0"
"16009","8531.474670","82.143.24.12","131.243.2.12","TCP","54","3848  >  21 [ACK] Seq=878482412 Ack=972858208 Win=17520 Len=0"
"16022","8532.788663","197.217.232.215","131.243.1.10","TCP","54","38001  >  21 [ACK] Seq=3849366969 Ack=1798803541 Win=5840 Len=0"
"16130","8601.460170","197.113.3.99","128.3.20.245","TCP","54","1845  >  21 [ACK] Seq=785261746 Ack=1893939974 Win=8760 Len=0"
"16153","8606.738737","197.113.3.99","128.3.20.245","TCP","54","1847  >  21 [ACK] Seq=786680336 Ack=1895375021 Win=8760 Len=0"
"16183","8682.988159","82.143.24.12","131.243.2.12","TCP","54","4707  >  21 [ACK] Seq=928513910 Ack=993034767 Win=17520 Len=0"
"16207","8695.084138","82.143.24.12","131.243.2.12","TCP","54","4566  >  21 [ACK] Seq=932724382 Ack=995172433 Win=17520 Len=0"
"16306","8759.167322","82.143.24.12","131.243.2.12","TCP","54","1523  >  21 [ACK] Seq=956446785 Ack=1003384645 Win=17520 Len=0"
"16310","8759.519864","82.143.24.12","131.243.2.12","TCP","54","3141  >  21 [ACK] Seq=956676526 Ack=1003444694 Win=17520 Len=0"
"16322","8760.194918","137.89.200.240","131.243.1.10","TCP","54","54047  >  21 [ACK] Seq=1964292870 Ack=4086436643 Win=5840 Len=0"
"16392","8762.365993","117.30.154.129","131.243.1.10","TCP","54","63560  >  21 [ACK] Seq=597706 Ack=1717281800 Win=8484 Len=0"
"16562","8888.078789","197.113.3.99","128.3.20.245","TCP","54","1852  >  21 [ACK] Seq=856929552 Ack=1965796135 Win=8760 Len=0"
"16582","8986.233332","216.43.247.103","131.243.1.10","TCP","54","35217  >  21 [ACK] Seq=2188799901 Ack=3348567306 Win=5840 Len=0"
"16670","9418.039749","161.60.254.203","131.243.1.10","TCP","54","3596  >  21 [ACK] Seq=2135173338 Ack=4070650556 Win=8760 Len=0"
"16707","9438.154977","117.30.154.129","131.243.1.10","TCP","54","63557  >  21 [ACK] Seq=1273672 Ack=3062200492 Win=8484 Len=0"
"16801","9746.559152","38.93.253.216","131.243.2.12","TCP","54","5253  >  21 [ACK] Seq=1500500162 Ack=1130523128 Win=17520 Len=0"
"16902","9806.225746","38.93.253.216","203.174.5.11","TCP","54","5195  >  21 [ACK] Seq=1527412684 Ack=636032001 Win=17520 Len=0"
"16967","9824.945364","34.214.121.62","131.243.1.10","TCP","54","34915  >  21 [ACK] Seq=3211049220 Ack=834270299 Win=5840 Len=0"
"17380","9941.576722","133.183.60.94","131.243.1.10","TCP","54","21527  >  21 [ACK] Seq=458067794 Ack=3402242649 Win=64240 Len=0"
"17412","9941.795137","131.243.1.10","133.183.60.94","TCP","54","21  >  21527 [ACK] Seq=3402243964 Ack=458067810 Win=17504 Len=0"
"17470","9951.421580","146.25.22.32","131.243.1.10","TCP","54","2387  >  21 [ACK] Seq=2335282524 Ack=3454017781 Win=64240 Len=0"
"17554","9955.214450","146.25.22.32","131.243.1.10","TCP","54","2389  >  21 [ACK] Seq=2336334857 Ack=4068539089 Win=64240 Len=0"
"18167","10140.811441","179.248.25.199","131.243.1.10","TCP","54","56607  >  21 [ACK] Seq=200219261 Ack=537132047 Win=64240 Len=0"
"18678","10277.803998","150.142.170.91","131.243.1.10","TCP","54","1807  >  21 [ACK] Seq=3762255670 Ack=4235018270 Win=17520 Len=0"
"18992","10376.416121","0.154.22.194","131.243.1.10","TCP","54","3311  >  21 [ACK] Seq=2848338068 Ack=1969740568 Win=32767 Len=0"
"19054","10379.328259","0.154.22.194","131.243.1.10","TCP","54","3315  >  21 [ACK] Seq=2849304528 Ack=2768892523 Win=32767 Len=0"
"19122","10387.424876","0.154.22.194","131.243.1.10","TCP","54","3319  >  21 [ACK] Seq=2851474562 Ack=3070257117 Win=32767 Len=0"
"19173","10390.526356","0.154.22.194","131.243.1.10","TCP","54","3322  >  21 [ACK] Seq=2852393934 Ack=994558401 Win=32767 Len=0"
"19220","10392.061209","0.154.22.194","131.243.1.10","TCP","54","3326  >  21 [ACK] Seq=2852966655 Ack=631143373 Win=32767 Len=0"
"19307","10395.307565","0.154.22.194","131.243.1.10","TCP","54","3331  >  21 [ACK] Seq=2853999800 Ack=120921087 Win=32767 Len=0"
"19391","10438.953223","222.186.198.110","131.243.2.12","TCP","54","2834  >  21 [ACK] Seq=1807288725 Ack=1240443685 Win=17520 Len=0"
"19795","10696.271550","10.48.254.166","131.243.1.10","TCP","54","43453  >  21 [ACK] Seq=2367183767 Ack=998070865 Win=1460 Len=0"
"19911","10734.764854","230.101.18.175","128.3.12.44","TCP","54","3747  >  21 [ACK] Seq=2335379495 Ack=102080001 Win=1460 Len=0"
"20098","10834.064125","222.186.198.110","131.243.2.12","TCP","54"," 2834  >  21 [ACK] Seq=1807294276 Ack=1240451188 Win=16118 Len=0"
"20102","11019.571226","133.183.60.94","131.243.1.10","TCP","54","22160  >  21 [ACK] Seq=743673838 Ack=3661388045 Win=64240 Len=0"
"20162","11067.945625","133.183.60.94","131.243.1.10","TCP","54","22211  >  21 [ACK] Seq=756979443 Ack=1240496343 Win=64240 Len=0"
"20222","11197.791183","13.199.22.210","131.243.1.10","TCP","54","1876  >  21 [ACK] Seq=3471135530 Ack=2010694468 Win=17520 Len=0"
"20415","11206.895621","13.199.22.210","131.243.1.10","TCP","54","1879  >  21 [ACK] Seq=3473585589 Ack=2350273087 Win=17520 Len=0"
"20481","11292.719660","173.112.82.221","131.243.1.10","TCP","54","3774  >  21 [ACK] Seq=2248263699 Ack=1815278532 Win=65535 Len=0"
"20784","11426.824162","147.74.11.41","131.243.1.10","TCP","54","2423  >  21 [ACK] Seq=7256668 Ack=2262443630 Win=8760 Len=0"
"20919","11474.162663","163.50.170.250","131.243.1.10","TCP","54","18479  >  21 [ACK] Seq=2086862218 Ack=4055995301 Win=17520 Len=0"
"21216","11590.672243","49.50.98.246","131.243.1.10","TCP","54","2510  >  21 [ACK] Seq=1206049037 Ack=2594455859 Win=17640 Len=0"
"21300","11606.575817","38.93.253.216","131.243.2.12","TCP","54","6124  >  21 [ACK] Seq=471362583 Ack=1395276333 Win=17520 Len=0"
"21324","11615.857967","22.129.74.56","131.243.1.10","TCP","54","2470  >  21 [ACK] Seq=3810780251 Ack=1207992288 Win=17520 Len=0"
"21572","11732.780434","110.112.122.22","131.243.2.12","TCP","54","3494  >  21 [ACK] Seq=3395152679 Ack=1412822539 Win=17520 Len=0"
"21584","11737.101946","58.255.243.65","131.243.1.10","TCP","54","1025  >  21 [ACK] Seq=2585479913 Ack=1477618285 Win=32767 Len=0"
"21666","11740.088668","58.255.243.65","131.243.1.10","TCP","54","3994  >  21 [ACK] Seq=3274828751 Ack=3589685767 Win=32767 Len=0"
"22030","11863.743455","20.105.218.163","131.243.2.12","TCP","54","1122  >  21 [ACK] Seq=4281042443 Ack=1430573518 Win=256960 Len=0"
"22289","11995.636647","38.5.158.54","131.243.2.12","TCP","54","4191  >  21 [ACK] Seq=1221788871 Ack=1447991942 Win=64240 Len=0"
"22467","12211.828292","8.24.194.121","128.3.180.73","TCP","54","64225  >  21 [ACK] Seq=1311938051 Ack=872437776 Win=5840 Len=0"
"22540","12331.670965","90.227.190.180","131.243.2.12","TCP","54","5478  >  21 [ACK] Seq=1967916284 Ack=1493921533 Win=17520 Len=0"
"22559","12351.226478","60.36.91.126","131.243.2.12","TCP","54","4563  >  21 [ACK] Seq=3274000622 Ack=1496577589 Win=17520 Len=0"
"22681","12372.182466","169.91.193.90","131.243.1.10","TCP","54","63563  >  21 [ACK] Seq=1256283513 Ack=150485332 Win=5840 Len=0"
"22682","12372.184327","19.249.82.185","131.243.1.10","TCP","54","2010  >  21 [ACK] Seq=3240033874 Ack=1088681220 Win=8760 Len=0"
"22840","12399.379835","8.24.194.121","128.3.180.73","TCP","54","64243  >  21 [ACK] Seq=1497594079 Ack=909732356 Win=5840 Len=0"
"23047","12429.274996","19.249.82.185","131.243.1.10","TCP","54","2014  >  21 [ACK] Seq=3254548206 Ack=842360572 Win=8760 Len=0"
"23423","12501.236241","8.24.194.121","128.3.180.73","TCP","54","64246  >  21 [ACK] Seq=1628591432 Ack=928786711 Win=5840 Len=0"
"23537","12519.104340","119.143.49.53","131.243.1.10","TCP","54","1091  >  21 [ACK] Seq=3612321008 Ack=2572726410 Win=17520 Len=0"
"24013","12644.978503","8.205.135.192","128.3.28.48","TCP","66","58296  >  21 [ACK] Seq=1066595027 Ack=3605995185 Win=5840 Len=0 TSval=5820752 TSecr=2269400442"
"24097","12669.906076","8.205.135.192","128.3.28.48","TCP","66","58294  >  21 [ACK] Seq=1087284505 Ack=3635298143 Win=5840 Len=0 TSval=5823245 TSecr=2269402935"
"24139","12675.451650","8.205.135.192","128.3.28.48","TCP","66","58292  >  21 [ACK] Seq=1105866919 Ack=3639007855 Win=5840 Len=0 TSval=5823799 TSecr=2269403489"
"24248","12709.372523","38.93.253.216","203.174.5.11","TCP","54","2095  >  21 [ACK] Seq=2838309653 Ack=657216001 Win=17520 Len=0"
"24273","12711.829264","8.205.135.192","128.3.28.48","TCP","66","58290  >  21 [ACK] Seq=1129418971 Ack=3679102065 Win=5840 Len=0 TSval=5827438 TSecr=2269407127"
"24419","12740.069620","8.205.135.192","128.3.28.48","TCP","66","58288  >  21 [ACK] Seq=1171069732 Ack=3705281649 Win=5840 Len=0 TSval=5830262 TSecr=2269409950"
"25080","12891.153211","8.205.135.192","128.3.28.48","TCP","66","58286  >  21 [ACK] Seq=1322394075 Ack=3869329997 Win=5840 Len=0 TSval=5845371 TSecr=2269425057"
"25212","12921.636217","38.93.253.216","131.243.2.12","TCP","54","3498  >  21 [ACK] Seq=1641971446 Ack=1573695384 Win=17520 Len=0"
"25831","13094.732722","73.231.82.55","131.243.1.10","TCP","54","59417  >  21 [ACK] Seq=1187471578 Ack=2010532593 Win=8760 Len=0"
"26096","13164.570645","84.68.192.198","131.243.1.10","TCP","54","1806  >  21 [ACK] Seq=1929970188 Ack=2683291318 Win=57960 Len=0"
"26340","13270.687945","165.128.231.76","131.243.1.10","TCP","54","5218  >  21 [ACK] Seq=4289213318 Ack=3179682965 Win=7300 Len=0"
"26428","13291.634881","49.103.49.196","131.243.1.10","TCP","54","49899  >  21 [ACK] Seq=2764464077 Ack=3743316422 Win=5840 Len=0"
"26491","13295.181766","49.103.49.196","131.243.1.10","TCP","54","49902  >  21 [ACK] Seq=2777185656 Ack=128283055 Win=5840 Len=0"
"26583","13393.538355","38.93.253.216","131.243.2.12","TCP","54","3421  >  21 [ACK] Seq=1762259999 Ack=1635970139 Win=17520 Len=0"
"26958","13633.968767","219.177.120.106","131.243.1.10","TCP","54","59281  >  21 [ACK] Seq=4046974365 Ack=2034321557 Win=8760 Len=0"
"27034","13643.671855","219.177.120.106","131.243.1.10","TCP","54","59338  >  21 [ACK] Seq=4056571678 Ack=2853522662 Win=8760 Len=0"
"27088","13646.483274","219.177.120.106","131.243.1.10","TCP","54","59369  >  21 [ACK] Seq=4060643500 Ack=4159521868 Win=8760 Len=0"
"27145","13647.743972","219.177.120.106","131.243.1.10","TCP","54","59400  >  21 [ACK] Seq=4064856993 Ack=1342626494 Win=8760 Len=0"
"27208","13649.211996","219.177.120.106","131.243.1.10","TCP","54","59436  >  21 [ACK] Seq=4070112219 Ack=3842028310 Win=8760 Len=0"
"27261","13649.980689","219.177.120.106","131.243.1.10","TCP","54","59449  >  21 [ACK] Seq=4071772248 Ack=1425034952 Win=8760 Len=0"
"27305","13650.459486","219.177.120.106","131.243.1.10","TCP","54","59453  >  21 [ACK] Seq=4072579910 Ack=2295046915 Win=8760 Len=0"
"27552","13765.769751","139.48.62.62","131.243.1.10","TCP","54","40900  >  21 [ACK] Seq=1979790988 Ack=1324041440 Win=17520 Len=0"
"27747","13831.380670","221.118.242.64","109.103.64.27","TCP","54","3292  >  21 [ACK] Seq=2404300688 Ack=1110947262 Win=17520 Len=0"
"27789","13836.568957","65.53.20.42","131.243.1.10","TCP","54","4331  >  21 [ACK] Seq=2653382000 Ack=1668477244 Win=17520 Len=0"
"27819","13836.691810","221.118.242.64","44.76.136.98","TCP","54","3356  >  21 [ACK] Seq=2408683239 Ack=1371397889 Win=17520 Len=0"
"27839","13837.910669","221.118.242.64","123.47.104.102","TCP","54","3399  >  21 [ACK] Seq=2410934664 Ack=634515390 Win=17520 Len=0"
"27840","13837.910671","221.118.242.64","189.246.241.212","TCP","54","3400  >  21 [ACK] Seq=2410973201 Ack=446700000 Win=17520 Len=0"
"27841","13837.911904","221.118.242.64","48.248.244.161","TCP","54","3401  >  21 [ACK] Seq=2411010188 Ack=2377866686 Win=17520 Len=0"
"27947","13880.722317","124.222.114.147","128.3.12.44","TCP","54","63268  >  21 [ACK] Seq=543767441 Ack=507904001 Win=17520 Len=0"
"28172","14057.067191","187.190.50.169","128.3.12.44","TCP","54","11745  >  21 [ACK] Seq=2219778699 Ack=531584001 Win=17520 Len=0"
"28203","14215.760846","160.71.218.255","131.243.1.10","TCP","54","3782  >  21 [ACK] Seq=3339833788 Ack=1688593750 Win=8760 Len=0"
"28271","14246.774806","160.71.218.255","131.243.1.10","TCP","54","3784  >  21 [ACK] Seq=3347682371 Ack=2417999475 Win=8760 Len=0"
"28339","14314.488372","82.143.24.12","131.243.2.12","TCP","54","1132  >  21 [ACK] Seq=2857284235 Ack=1758707174 Win=17520 Len=0"
"28356","14320.702643","82.143.24.12","131.243.2.12","TCP","54","2616  >  21 [ACK] Seq=2859440564 Ack=1759563822 Win=17520 Len=0"
"28387","14329.433228","160.71.218.255","131.243.1.10","TCP","54","3787  >  21 [ACK] Seq=3368297797 Ack=821739557 Win=8760 Len=0"
"28488","14352.190426","82.143.24.12","131.243.2.12","TCP","54","4476  >  21 [ACK] Seq=2869905289 Ack=1763858477 Win=17520 Len=0"
"28576","14373.489921","160.71.218.255","131.243.1.10","TCP","54","3789  >  21 [ACK] Seq=3379594948 Ack=1391758187 Win=8760 Len=0"
"28633","14378.713489","160.71.218.255","131.243.1.10","TCP","54","3790  >  21 [ACK] Seq=3380929782 Ack=2535525119 Win=8760 Len=0"
"28741","14398.122788","21.136.179.14","128.3.28.48","TCP","66","37832  >  21 [ACK] Seq=3612084911 Ack=1168280111 Win=5840 Len=0 TSval=12515824 TSecr=2269575744"
"28802","14404.242292","21.136.179.14","128.3.28.48","TCP","66","37834  >  21 [ACK] Seq=3611726283 Ack=1186919834 Win=5840 Len=0 TSval=12516436 TSecr=2269576356"
"28855","14406.985797","21.136.179.14","128.3.28.48","TCP","66","37837  >  21 [ACK] Seq=3618342542 Ack=1186046084 Win=5840 Len=0 TSval=12516711 TSecr=2269576630"
"28901","14411.251493","21.136.179.14","128.3.28.48","TCP","66","37839  >  21 [ACK] Seq=3614212228 Ack=1179592130 Win=5840 Len=0 TSval=12517137 TSecr=2269577057"
"28961","14418.068957","21.136.179.14","128.3.28.48","TCP","66","37847  >  21 [ACK] Seq=3624075153 Ack=1186918239 Win=5840 Len=0 TSval=12517819 TSecr=2269577739"
"29746","14510.636953","10.48.254.166","131.243.1.10","TCP","54","44725  >  21 [ACK] Seq=1377348602 Ack=853067606 Win=1460 Len=0"
"29891","14534.544654","213.24.52.183","128.3.12.44","TCP","54","33974  >  21 [ACK] Seq=3778172416 Ack=593984001 Win=5840 Len=0"
"29917","14544.670217","213.24.52.183","128.3.12.44","TCP","54","33976  >  21 [ACK] Seq=3801394004 Ack=595392001 Win=5840 Len=0"
"29976","14641.227172","187.190.50.169","128.3.12.44","TCP","54","11804  >  21 [ACK] Seq=863535041 Ack=608000001 Win=17520 Len=0"
"30014","14691.553182","10.48.254.166","131.243.1.10","TCP","54","44746  >  21 [ACK] Seq=1421977782 Ack=3412356592 Win=1460 Len=0"
"30105","14780.424908","16.87.232.184","131.243.1.10","TCP","54","1072  >  21 [ACK] Seq=266902862 Ack=2359748961 Win=17520 Len=0"
"30183","14787.641086","38.93.253.216","203.174.5.11","TCP","54","3445  >  21 [ACK] Seq=1272457162 Ack=678272001 Win=17520 Len=0"
"30482","14982.069593","16.87.232.184","131.243.1.10","TCP","54","1140  >  21 [ACK] Seq=319982344 Ack=2781453443 Win=17520 Len=0"
"30693","15073.391013","93.184.100.33","128.3.12.44","TCP","54","1310  >  21 [ACK] Seq=5670683 Ack=663936001 Win=8576 Len=0"
"30727","15077.638375","20.105.218.163","131.243.2.12","TCP","54","1537  >  21 [ACK] Seq=818589826 Ack=1862862931 Win=256960 Len=0"
"30747","15079.201000","117.105.159.60","131.243.1.10","TCP","54","32973  >  21 [ACK] Seq=34595324 Ack=846600243 Win=5840 Len=0"
"30854","15087.407726","217.148.52.180","131.243.2.12","TCP","54","1639  >  21 [ACK] Seq=82011469 Ack=1864162205 Win=8760 Len=0"
"31057","15128.296373","93.184.100.33","128.3.12.44","TCP","54","1312  >  21 [ACK] Seq=5725596 Ack=671104001 Win=8576 Len=0"
"31303","15175.241030","93.184.100.33","128.3.12.44","TCP","54","1314  >  21 [ACK] Seq=5772490 Ack=677312001 Win=8576 Len=0"
"32133","15390.169240","217.211.132.163","131.243.1.10","TCP","54","1079  >  21 [ACK] Seq=1578797294 Ack=905548664 Win=17520 Len=0"
"32725","15754.234947","83.1.240.233","131.243.2.12","TCP","54","2244  >  21 [ACK] Seq=2118006821 Ack=1952898369 Win=64240 Len=0"
"32764","15801.105494","83.1.240.233","131.243.2.12","TCP","54","4000  >  21 [ACK] Seq=2129056840 Ack=1959395183 Win=64240 Len=0"
"33157","16132.134384","131.201.66.31","203.174.5.11","TCP","54","2234  >  21 [ACK] Seq=2457824641 Ack=697856001 Win=17520 Len=0"
"33184","16139.361501","216.43.247.103","131.243.1.10","TCP","54","38924  >  21 [ACK] Seq=1148137962 Ack=878677390 Win=5840 Len=0"
"33564","16255.539854","16.87.232.184","131.243.1.10","TCP","54","1255  >  21 [ACK] Seq=643088994 Ack=3089544609 Win=17520 Len=0"
"33728","16288.300425","16.87.232.184","131.243.1.10","TCP","54","1273  >  21 [ACK] Seq=652171443 Ack=4013235341 Win=17520 Len=0"
"34064","16384.722192","98.7.14.113","131.243.1.10","TCP","54","50216  >  21 [ACK] Seq=2747081 Ack=2637598859 Win=8760 Len=0"
"34123","16386.641827","98.7.14.113","131.243.1.10","TCP","54","55183  >  21 [ACK] Seq=2749002 Ack=1793882313 Win=8760 Len=0"
"34376","16430.815839","197.113.3.99","128.3.20.245","TCP","54","1858  >  21 [ACK] Seq=1247178352 Ack=3850985812 Win=8760 Len=0"
"34425","16447.896307","197.113.3.99","128.3.20.245","TCP","54","1863  >  21 [ACK] Seq=1251606144 Ack=3855336412 Win=8760 Len=0"
"34484","16469.785502","206.175.122.94","128.3.12.44","TCP","54","3532  >  21 [ACK] Seq=3851954901 Ack=844672001 Win=9112 Len=0"
"34532","16486.339812","206.175.122.94","128.3.12.44","TCP","54","3537  >  21 [ACK] Seq=3856364823 Ack=847104001 Win=9112 Len=0"
"34596","16512.563413","16.87.232.184","131.243.1.10","TCP","54","1298  >  21 [ACK] Seq=709248528 Ack=1425679594 Win=17520 Len=0"
"34756","16559.198698","16.87.232.184","131.243.1.10","TCP","54","1306  >  21 [ACK] Seq=721268836 Ack=3868652242 Win=17520 Len=0"
"34859","16579.745127","131.201.66.31","203.174.5.11","TCP","54","3910  >  21 [ACK] Seq=2573534423 Ack=712512001 Win=17520 Len=0"
"34972","16613.739959","206.175.122.94","128.3.12.44","TCP","54","3542  >  21 [ACK] Seq=3887202664 Ack=862912001 Win=9112 Len=0"
"35103","16649.329176","197.113.3.99","128.3.20.245","TCP","54","1877  >  21 [ACK] Seq=1302175213 Ack=3905758901 Win=8760 Len=0"
"35347","16708.550003","167.132.136.3","128.3.12.44","TCP","54","39886  >  21 [ACK] Seq=1756583748 Ack=876352001 Win=5840 Len=0"
"35410","16716.837985","197.113.3.99","128.3.20.245","TCP","54","1880  >  21 [ACK] Seq=1319169443 Ack=3922718924 Win=8760 Len=0"
"35510","16740.980634","167.132.136.3","128.3.12.44","TCP","54","39890  >  21 [ACK] Seq=1791042334 Ack=880960001 Win=5840 Len=0"
"35809","16908.027247","206.175.122.94","128.3.12.44","TCP","54","3547  >  21 [ACK] Seq=3961765849 Ack=902144001 Win=9112 Len=0"
"35845","16922.279428","76.152.197.160","131.243.2.12","TCP","54","1360  >  21 [ACK] Seq=359800680 Ack=2117515654 Win=17520 Len=0"
"36322","17146.888739","224.163.220.10","131.243.1.10","TCP","54","51091  >  21 [ACK] Seq=2318685989 Ack=3354886305 Win=33580 Len=0"
"36616","17341.292113","80.96.243.218","131.243.1.10","TCP","54","33468  >  21 [ACK] Seq=2415504172 Ack=2489367197 Win=5840 Len=0"
"36674","17348.352714","80.96.243.218","131.243.1.10","TCP","54","33469  >  21 [ACK] Seq=2431058155 Ack=3373457372 Win=5840 Len=0"
"36798","17461.402788","196.227.5.254","131.243.1.10","TCP","54","53203  >  21 [ACK] Seq=2560254854 Ack=872558625 Win=5840 Len=0"
"36901","17518.219120","75.254.162.229","131.243.1.10","TCP","54","38378  >  21 [ACK] Seq=1829154340 Ack=2829728852 Win=5840 Len=0"
"36950","17523.179786","75.254.162.229","131.243.1.10","TCP","54","38379  >  21 [ACK] Seq=1826026012 Ack=1090270817 Win=5840 Len=0"
"36983","17523.801433","48.82.133.230","131.243.1.10","TCP","54","3056  >  21 [ACK] Seq=3364532506 Ack=3680843622 Win=8760 Len=0"
"37036","17526.354227","48.82.133.230","131.243.1.10","TCP","54","3060  >  21 [ACK] Seq=3365362563 Ack=1563228146 Win=8760 Len=0"
"37273","17550.060080","75.254.162.229","131.243.1.10","TCP","54","38384  >  21 [ACK] Seq=1858217989 Ack=1840363403 Win=5840 Len=0"
"37344","17554.891682","8.205.135.192","128.3.28.48","TCP","66","58284  >  21 [ACK] Seq=1970008018 Ack=206488406 Win=5840 Len=0 TSval=6311779 TSecr=2269891386"
"37398","17593.606540","62.40.240.133","131.243.1.10","TCP","54","48858  >  21 [ACK] Seq=2689043957 Ack=4146657127 Win=64240 Len=0"
"37477","17615.596054","109.82.249.52","131.243.1.10","TCP","54","32786  >  21 [ACK] Seq=2731010566 Ack=3849234553 Win=5840 Len=0"
"37554","17655.728632","165.114.58.48","131.243.1.10","TCP","54","4101  >  21 [ACK] Seq=1516141494 Ack=3400185431 Win=65535 Len=0"
"37629","17667.964167","196.227.5.254","131.243.1.10","TCP","54","53226  >  21 [ACK] Seq=2781128254 Ack=4161490658 Win=5840 Len=0"
