"3","0.666069","113.165.230.66","131.243.1.10","TCP","54","63267  >  21 [ACK] Seq=1678493484 Ack=2848448490 Win=64240 Len=0"
"58","91.750115","181.223.231.99","131.243.2.12","TCP","54","3362  >  21 [ACK] Seq=2469850255 Ack=2835865450 Win=17520 Len=0"
"121","126.814360","123.125.239.10","128.3.28.48","TCP","66","63004  >  21 [ACK] Seq=1171148532 Ack=2887783775 Win=5840 Len=0 TSval=314098226 TSecr=2233538616"
"155","130.455634","123.125.239.10","128.3.28.48","TCP","66","63011  >  21 [ACK] Seq=1179361230 Ack=2890522070 Win=5840 Len=0 TSval=314100056 TSecr=2233538970"
"193","135.261797","123.125.239.10","128.3.28.48","TCP","66","63016  >  21 [ACK] Seq=1184413744 Ack=2892800311 Win=5840 Len=0 TSval=314102552 TSecr=2233539461"
"313","194.827082","79.37.53.67","131.243.2.12","TCP","54","38255  >  21 [ACK] Seq=934586306 Ack=2850451776 Win=17520 Len=0"
"403","216.572157","79.37.53.67","203.174.5.11","TCP","54","39897  >  21 [ACK] Seq=950349523 Ack=863808001 Win=17520 Len=0"
"663","318.985332","182.125.36.184","131.243.1.10","TCP","54","46477  >  21 [ACK] Seq=2629967347 Ack=304250577 Win=8760 Len=0"
"724","333.549485","240.86.67.4","131.243.1.10","TCP","54","4036  >  21 [ACK] Seq=1950806315 Ack=2446010623 Win=17520 Len=0"
"934","427.968242","116.106.109.148","131.243.1.10","TCP","54","4931  >  21 [ACK] Seq=1274017980 Ack=4289573325 Win=64240 Len=0"
"1304","583.662028","72.192.229.59","128.3.12.44","TCP","54","2997  >  21 [ACK] Seq=1503100017 Ack=129664001 Win=32120 Len=0"
"1349","588.221285","79.37.53.67","131.243.2.12","TCP","54","37361  >  21 [ACK] Seq=1170577318 Ack=2908900216 Win=17520 Len=0"
"1395","596.218333","224.220.166.101","131.243.1.10","TCP","54","56537  >  21 [ACK] Seq=1130017750 Ack=4013430998 Win=32768 Len=0"
"1452","597.482135","246.94.203.142","203.174.5.11","TCP","54","2658  >  21 [ACK] Seq=4068834245 Ack=867392001 Win=17520 Len=0"
"1545","610.144750","72.192.229.59","128.3.12.44","TCP","54","3001  >  21 [ACK] Seq=1529309889 Ack=134528001 Win=32120 Len=0"
"1559","611.255763","79.37.53.67","203.174.5.11","TCP","54","40225  >  21 [ACK] Seq=1186864426 Ack=867904001 Win=17520 Len=0"
"1633","617.092986","72.192.229.59","128.3.12.44","TCP","54","3003  >  21 [ACK] Seq=1548218917 Ack=135808001 Win=32120 Len=0"
"1693","622.233253","72.192.229.59","128.3.12.44","TCP","54","3005  >  21 [ACK] Seq=1543681212 Ack=137088001 Win=32120 Len=0"
"1852","658.971272","27.172.198.213","131.243.1.10","TCP","54","1025  >  21 [ACK] Seq=1586062587 Ack=1469381379 Win=5840 Len=0"
"1986","684.644007","177.87.134.55","131.243.1.10","TCP","54","14462  >  21 [ACK] Seq=4203434426 Ack=2437754289 Win=17520 Len=0"
"2156","736.283354","72.192.229.59","128.3.12.44","TCP","54","3014  >  21 [ACK] Seq=1686578558 Ack=159872001 Win=32120 Len=0"
"2213","755.463009","195.55.62.39","131.243.1.10","TCP","54","52511  >  21 [ACK] Seq=3684174974 Ack=2516191694 Win=17520 Len=0"
"2325","784.804137","158.218.249.29","131.243.1.10","TCP","54","40517  >  21 [ACK] Seq=1919850844 Ack=485991314 Win=5608 Len=0"
"2391","787.002034","158.218.249.29","131.243.1.10","TCP","54","48676  >  21 [ACK] Seq=1925727703 Ack=4199815487 Win=5608 Len=0"
"2540","841.092943","65.240.185.205","131.243.2.12","TCP","54","1841  >  21 [ACK] Seq=3124187106 Ack=2950256609 Win=17520 Len=0"
"2581","850.217952","16.18.143.122","131.243.1.10","TCP","54","3601  >  21 [ACK] Seq=2699103330 Ack=3585163382 Win=17520 Len=0"
"2945","966.125813","230.101.18.175","128.3.12.44","TCP","54","1914  >  21 [ACK] Seq=2631955525 Ack=200320001 Win=1460 Len=0"
"3010","982.382581","79.37.53.67","131.243.2.12","TCP","54","37332  >  21 [ACK] Seq=1407814873 Ack=2971969387 Win=17520 Len=0"
"3104","1004.371952","79.37.53.67","203.174.5.11","TCP","54","38798  >  21 [ACK] Seq=1423931212 Ack=883072001 Win=17520 Len=0"
"3469","1193.967657","41.54.26.143","131.243.1.10","TCP","54","18676  >  21 [ACK] Seq=1109730946 Ack=688266488 Win=16800 Len=0"
"3571","1359.295350","181.223.231.99","131.243.2.12","TCP","54","2921  >  21 [ACK] Seq=212682239 Ack=3034323180 Win=17520 Len=0"
"3589","1362.022670","79.37.53.67","131.243.2.12","TCP","54","40373  >  21 [ACK] Seq=1641289143 Ack=3034693121 Win=17520 Len=0"
"3685","1385.567652","79.37.53.67","203.174.5.11","TCP","54","39096  >  21 [ACK] Seq=1657917498 Ack=890240001 Win=17520 Len=0"
"3795","1420.548053","89.124.219.32","131.243.2.12","TCP","54","1886  >  21 [ACK] Seq=1567835973 Ack=3042852715 Win=17520 Len=0"
"3845","1432.293585","123.125.239.10","128.3.28.48","TCP","66","63662  >  21 [ACK] Seq=2541902129 Ack=4270038258 Win=5840 Len=0 TSval=314766703 TSecr=2233669150"
"3891","1437.974329","123.125.239.10","128.3.28.48","TCP","66","63666  >  21 [ACK] Seq=2540436334 Ack=4287799985 Win=5840 Len=0 TSval=314769612 TSecr=2233669719"
"3945","1444.513919","1.126.179.169","131.243.1.10","TCP","54","12340  >  21 [ACK] Seq=725323912 Ack=997332840 Win=16060 Len=0"
"4071","1460.118814","69.88.8.56","131.243.1.10","TCP","54","2569  >  21 [ACK] Seq=3829444674 Ack=2352168366 Win=64240 Len=0"
"4278","1495.212946","104.205.27.72","128.3.28.48","TCP","66","42694  >  21 [ACK] Seq=2708560481 Ack=50011527 Win=5840 Len=0 TSval=335107581 TSecr=2233675459"
"4313","1496.754250","104.205.27.72","128.3.28.48","TCP","66","42696  >  21 [ACK] Seq=2721548108 Ack=44742901 Win=5840 Len=0 TSval=335108370 TSecr=2233675613"
"4348","1498.234219","104.205.27.72","128.3.28.48","TCP","66","42698  >  21 [ACK] Seq=2712879309 Ack=40119599 Win=5840 Len=0 TSval=335109128 TSecr=2233675761"
"4404","1505.933946","104.205.27.72","128.3.28.48","TCP","66","42700  >  21 [ACK] Seq=2727342160 Ack=56388187 Win=5840 Len=0 TSval=335113071 TSecr=2233676531"
"4472","1519.688636","30.146.52.247","131.243.1.10","TCP","54","2412  >  21 [ACK] Seq=775738885 Ack=2874677369 Win=8280 Len=0"
"4541","1523.565359","104.205.27.72","128.3.28.48","TCP","66","42702  >  21 [ACK] Seq=2754166693 Ack=69316093 Win=5840 Len=0 TSval=335122100 TSecr=2233678294"
"4587","1525.605007","104.205.27.72","128.3.28.48","TCP","66","42704  >  21 [ACK] Seq=2767961233 Ack=82478005 Win=5840 Len=0 TSval=335123145 TSecr=2233678498"
"4630","1527.974329","104.205.27.72","128.3.28.48","TCP","66","42706  >  21 [ACK] Seq=2758752493 Ack=85040695 Win=5840 Len=0 TSval=335124358 TSecr=2233678735"
"4705","1533.078585","136.108.93.122","203.174.5.11","TCP","54","29456  >  21 [ACK] Seq=2973765678 Ack=897216001 Win=32768 Len=0"
"4752","1536.988713","20.191.125.223","242.70.74.100","TCP","54","52099  >  21 [ACK] Seq=1131396770 Ack=26259050 Win=8760 Len=0"
"4767","1537.521921","30.146.52.247","131.243.1.10","TCP","54","2414  >  21 [ACK] Seq=1189977738 Ack=3887973564 Win=8280 Len=0"
"4928","1542.710310","30.146.52.247","131.243.1.10","TCP","54","2416  >  21 [ACK] Seq=129593227 Ack=3545720967 Win=8280 Len=0"
"5386","1648.403836","120.186.15.61","131.243.1.10","TCP","54","3333  >  21 [ACK] Seq=2580967876 Ack=1880614982 Win=16060 Len=0"
"5451","1651.472291","4.251.189.14","131.243.1.10","TCP","54","60211  >  21 [ACK] Seq=2626169398 Ack=2750398035 Win=5840 Len=0"
"5561","1662.634939","168.254.152.132","131.243.2.12","TCP","54","2135  >  21 [ACK] Seq=2745912266 Ack=3081988222 Win=17520 Len=0"
"5566","1663.265626","131.243.2.12","168.254.152.132","TCP","54","21  >  2135 [ACK] Seq=3081988305 Ack=2745912282 Win=64240 Len=0"
"5619","1672.426817","191.27.3.166","131.243.1.10","TCP","54","37624  >  21 [ACK] Seq=2232748995 Ack=1063806197 Win=64240 Len=0"
"5810","1704.415922","8.113.23.107","128.3.12.44","TCP","54","10514  >  21 [ACK] Seq=3051394549 Ack=315136001 Win=57344 Len=0"
"6015","1748.425432","249.44.109.25","128.3.28.48","TCP","66","4136  >  21 [ACK] Seq=2714954372 Ack=316150401 Win=5840 Len=0 TSval=160843426 TSecr=2233700777"
"6048","1749.752069","249.44.109.25","128.3.28.48","TCP","66","4140  >  21 [ACK] Seq=2725840121 Ack=313526975 Win=5840 Len=0 TSval=160843558 TSecr=2233700910"
"6084","1751.706145","249.44.109.25","128.3.28.48","TCP","66","4200  >  21 [ACK] Seq=2720602645 Ack=318982616 Win=5840 Len=0 TSval=160843754 TSecr=2233701105"
"6110","1753.486693","79.37.53.67","131.243.2.12","TCP","54","39753  >  21 [ACK] Seq=1877665773 Ack=3098118335 Win=17520 Len=0"
"6239","1769.731617","30.146.52.247","131.243.1.10","TCP","54","2439  >  21 [ACK] Seq=816570906 Ack=4081464133 Win=8280 Len=0"
"6301","1773.856210","30.146.52.247","131.243.1.10","TCP","54","2440  >  21 [ACK] Seq=590354121 Ack=362253333 Win=8280 Len=0"
"6352","1775.734646","79.37.53.67","203.174.5.11","TCP","54","38586  >  21 [ACK] Seq=1893612448 Ack=898304001 Win=17520 Len=0"
"6551","1801.999682","66.165.111.206","131.243.1.10","TCP","54","4559  >  21 [ACK] Seq=1923057540 Ack=912690080 Win=64800 Len=0"
"6795","1824.104723","6.57.196.120","131.243.1.10","TCP","54","2302  >  21 [ACK] Seq=2322712152 Ack=1655586282 Win=32120 Len=0"
"6893","1833.035269","6.57.196.120","131.243.1.10","TCP","54","2304  >  21 [ACK] Seq=2346003213 Ack=821506378 Win=32120 Len=0"
"7167","1885.077922","30.146.52.247","131.243.1.10","TCP","54","2450  >  21 [ACK] Seq=1083272610 Ack=1427113699 Win=8280 Len=0"
"7264","1891.941418","30.146.52.247","131.243.1.10","TCP","54","2454  >  21 [ACK] Seq=1293574388 Ack=3254159171 Win=8280 Len=0"
"7265","1891.942371","30.146.52.247","131.243.1.10","TCP","54","2455  >  21 [ACK] Seq=765647946 Ack=3344909972 Win=8280 Len=0"
"7266","1891.951607","30.146.52.247","131.243.1.10","TCP","54","2456  >  21 [ACK] Seq=1443972476 Ack=929105197 Win=8280 Len=0"
"7450","1899.932957","30.146.52.247","131.243.1.10","TCP","54","2461  >  21 [ACK] Seq=1643152423 Ack=3572146273 Win=8280 Len=0"
"7670","1938.749770","179.192.184.110","131.243.1.10","TCP","54","34259  >  21 [ACK] Seq=2240561739 Ack=646769492 Win=16824 Len=0"
"7955","2009.872133","40.159.39.117","131.243.2.12","TCP","54","1350  >  21 [ACK] Seq=3819789688 Ack=3146029597 Win=17520 Len=0"
"8240","2169.088942","79.37.53.67","203.174.5.11","TCP","54","38046  >  21 [ACK] Seq=2129590581 Ack=900544001 Win=17520 Len=0"
"8355","2207.855989","0.52.194.105","131.243.1.10","TCP","54","3131  >  21 [ACK] Seq=2086921673 Ack=105077799 Win=64240 Len=0"
"8548","2295.804161","0.52.194.105","131.243.1.10","TCP","54"," 3131  >  21 [ACK] Seq=2086921802 Ack=105079600 Win=0 Len=0"
"8611","2365.258695","86.220.148.131","131.243.2.12","TCP","54","1126  >  21 [ACK] Seq=1090313 Ack=3215425899 Win=8576 Len=0"
"8676","2385.095102","42.46.167.1","131.243.1.10","TCP","54","55522  >  21 [ACK] Seq=3419305694 Ack=2611021730 Win=16384 Len=0"
"8738","2390.662768","86.220.148.131","131.243.2.12","TCP","54","1131  >  21 [ACK] Seq=1115289 Ack=3219289537 Win=8576 Len=0"
"8783","2404.400695","86.220.148.131","131.243.2.12","TCP","54","1133  >  21 [ACK] Seq=1129015 Ack=3221370242 Win=8576 Len=0"
"8785","2404.599420","3.16.238.33","131.243.1.10","TCP","54","1999  >  21 [ACK] Seq=2862671310 Ack=2190431020 Win=65340 Len=0"
"8907","2413.772446","86.220.148.131","131.243.2.12","TCP","54","1135  >  21 [ACK] Seq=1138898 Ack=3222759904 Win=8576 Len=0"
"8958","2436.063183","86.220.148.131","131.243.2.12","TCP","54","1138  >  21 [ACK] Seq=1160519 Ack=3226131204 Win=8576 Len=0"
"8994","2441.881578","86.220.148.131","131.243.2.12","TCP","54","1142  >  21 [ACK] Seq=1166377 Ack=3227024673 Win=8576 Len=0"
"9030","2449.793585","86.220.148.131","131.243.2.12","TCP","54","1144  >  21 [ACK] Seq=1174150 Ack=3228461150 Win=8576 Len=0"
"9037","2450.431010","86.220.148.131","131.243.2.12","TCP","54","1145  >  21 [ACK] Seq=1175347 Ack=3228802980 Win=8576 Len=0"
"9042","2451.200174","86.220.148.131","131.243.2.12","TCP","54","1147  >  21 [ACK] Seq=1175972 Ack=3229175528 Win=8576 Len=0"
"9047","2451.540124","86.220.148.131","131.243.2.12","TCP","54","1146  >  21 [ACK] Seq=1175766 Ack=3229070744 Win=8576 Len=0"
"9167","2480.030564","189.30.8.121","131.243.1.10","TCP","54","42968  >  21 [ACK] Seq=4093048811 Ack=1337753614 Win=17520 Len=0"
"9219","2480.720216","216.17.33.81","131.243.1.10","TCP","54","3277  >  21 [ACK] Seq=3448048120 Ack=3065141179 Win=17520 Len=0"
"9279","2482.619398","216.17.33.81","131.243.1.10","TCP","54","3279  >  21 [ACK] Seq=3448566603 Ack=809155121 Win=17520 Len=0"
"9346","2484.664099","216.17.33.81","131.243.1.10","TCP","54","3281  >  21 [ACK] Seq=3449134338 Ack=1592777156 Win=17520 Len=0"
"9404","2486.563542","216.17.33.81","131.243.1.10","TCP","54","3283  >  21 [ACK] Seq=3449663540 Ack=1365882877 Win=17520 Len=0"
"9466","2491.164174","132.67.54.229","131.243.1.10","TCP","54","3856  >  21 [ACK] Seq=11120418 Ack=3705950051 Win=8760 Len=0"
"9568","2510.234171","3.16.238.33","131.243.1.10","TCP","54","2146  >  21 [ACK] Seq=1852895551 Ack=389900714 Win=17424 Len=0"
"9600","2510.491459","131.243.1.10","3.16.238.33","TCP","54","21  >  2146 [ACK] Seq=389902027 Ack=1852895567 Win=17408 Len=0"
"9649","2513.125943","3.16.238.33","131.243.1.10","TCP","54","2148  >  21 [ACK] Seq=1853717328 Ack=649111263 Win=17424 Len=0"
"9859","2549.239686","79.37.53.67","131.243.2.12","TCP","54","40638  >  21 [ACK] Seq=2351849353 Ack=3245194700 Win=17520 Len=0"
"9948","2579.506755","79.37.53.67","203.174.5.11","TCP","54","39776  >  21 [ACK] Seq=2369581460 Ack=904192001 Win=17520 Len=0"
"9970","2597.186786","160.231.206.89","131.243.1.10","TCP","54","1586  >  21 [ACK] Seq=9411982 Ack=22899297 Win=8760 Len=0"
"10026","2604.185961","159.216.169.116","128.3.12.44","TCP","54","32777  >  21 [ACK] Seq=3547649381 Ack=454016001 Win=5840 Len=0"
"10082","2670.771872","132.67.54.229","131.243.1.10","TCP","54","3877  >  21 [ACK] Seq=11299840 Ack=3313256180 Win=8760 Len=0"
"10131","2679.866356","132.67.54.229","131.243.1.10","TCP","54","4053  >  21 [ACK] Seq=11308791 Ack=146854300 Win=8760 Len=0"
"10180","2686.624591","132.67.54.229","131.243.1.10","TCP","54","4115  >  21 [ACK] Seq=11315487 Ack=4256104883 Win=8760 Len=0"
"10248","2706.508906","154.153.143.71","131.243.1.10","TCP","54","56303  >  21 [ACK] Seq=3424969351 Ack=3023218314 Win=5840 Len=0"
"10319","2737.197188","101.114.196.190","131.243.1.10","TCP","54","10063  >  21 [ACK] Seq=1119764054 Ack=1500521063 Win=8760 Len=0"
"10383","2783.232849","132.67.54.229","131.243.1.10","TCP","54","4139  >  21 [ACK] Seq=11412096 Ack=2447995551 Win=8760 Len=0"
"10446","2873.714617","42.46.167.1","128.3.12.44","TCP","54","55803  >  21 [ACK] Seq=3126035447 Ack=496512001 Win=16384 Len=0"
"10476","2962.872485","79.37.53.67","131.243.2.12","TCP","54","37691  >  21 [ACK] Seq=2593182139 Ack=3313733112 Win=17520 Len=0"
"10533","2989.685152","79.37.53.67","203.174.5.11","TCP","54","40283  >  21 [ACK] Seq=2610320182 Ack=904576001 Win=17520 Len=0"
"10656","3119.984325","101.114.196.190","131.243.1.10","TCP","54","10066  >  21 [ACK] Seq=1207434130 Ack=854254107 Win=8760 Len=0"
"10705","3125.239948","182.6.9.175","128.3.32.63","TCP","66","33006  >  21 [ACK] Seq=4176052119 Ack=4205066326 Win=5840 Len=0 TSval=3662879 TSecr=1299998860"
"10751","3164.139972","101.114.196.190","131.243.1.10","TCP","54","10068  >  21 [ACK] Seq=1217625084 Ack=3712431460 Win=8760 Len=0"
"10803","3179.154277","107.34.21.92","131.243.2.12","TCP","54","1099  >  21 [ACK] Seq=2345298683 Ack=3351252041 Win=256960 Len=0"
"10866","3210.055757","84.68.192.198","131.243.1.10","TCP","54","1658  >  21 [ACK] Seq=159375808 Ack=3521078662 Win=57960 Len=0"
"10960","3213.908984","101.114.196.190","131.243.1.10","TCP","54","10070  >  21 [ACK] Seq=1229070800 Ack=406936939 Win=8760 Len=0"
"11086","3249.058216","101.114.196.190","131.243.1.10","TCP","54","10072  >  21 [ACK] Seq=1237221348 Ack=3598129461 Win=8760 Len=0"
"11149","3254.995315","101.114.196.190","131.243.1.10","TCP","54","10074  >  21 [ACK] Seq=1238698634 Ack=4189316077 Win=8760 Len=0"
"11342","3334.517155","121.195.250.138","128.3.12.44","TCP","54","1368  >  21 [ACK] Seq=2973117410 Ack=586688001 Win=65535 Len=0"
"11368","3337.494820","121.195.250.138","128.3.12.44","TCP","54","1370  >  21 [ACK] Seq=2973971328 Ack=587264001 Win=65535 Len=0"
"11425","3352.868745","79.37.53.67","131.243.2.12","TCP","54","38908  >  21 [ACK] Seq=2829157154 Ack=3385733990 Win=17520 Len=0"
"11462","3357.659324","121.195.250.138","128.3.12.44","TCP","54","1372  >  21 [ACK] Seq=2979071714 Ack=589952001 Win=65535 Len=0"
"11561","3386.266028","35.73.33.202","131.243.1.10","TCP","54","1052  >  21 [ACK] Seq=304584140 Ack=3430874291 Win=5840 Len=0"
"11667","3406.740579","148.253.227.51","131.243.1.10","TCP","54","1059  >  21 [ACK] Seq=1472895 Ack=44675303 Win=8576 Len=0"
"11815","3433.542880","148.253.227.51","131.243.1.10","TCP","54","1061  >  21 [ACK] Seq=1499503 Ack=1769946976 Win=8576 Len=0"
"11905","3449.308749","47.125.91.135","131.243.2.12","TCP","54","2255  >  21 [ACK] Seq=4066784044 Ack=3404352925 Win=17520 Len=0"
"11916","3450.232037","24.190.46.234","131.243.1.10","TCP","54","64846  >  21 [ACK] Seq=3584156902 Ack=3767176381 Win=8760 Len=0"
"11988","3454.765990","35.73.33.202","131.243.1.10","TCP","54","1054  >  21 [ACK] Seq=373294934 Ack=3172048638 Win=5840 Len=0"
"12072","3461.962131","216.43.247.103","131.243.1.10","TCP","54","53830  >  21 [ACK] Seq=232787551 Ack=1990657184 Win=5840 Len=0"
"12114","3463.583702","26.250.204.76","131.243.1.10","TCP","54","3205  >  21 [ACK] Seq=2771092684 Ack=1185175050 Win=65535 Len=0"
"12182","3465.434158","26.250.204.76","131.243.1.10","TCP","54","3207  >  21 [ACK] Seq=2771615366 Ack=1848455389 Win=65535 Len=0"
"12348","3514.910296","98.192.203.106","131.243.1.10","TCP","54","29027  >  21 [ACK] Seq=2827168483 Ack=1759563811 Win=2048 Len=0"
"12408","3517.680758","82.143.24.12","131.243.2.12","TCP","54","2281  >  21 [ACK] Seq=1567752781 Ack=3417793499 Win=17520 Len=0"
"12432","3520.912645","141.62.47.110","128.3.12.44","TCP","54","54659  >  21 [ACK] Seq=3168085821 Ack=619840001 Win=16384 Len=0"
"12637","3575.122469","101.114.196.190","131.243.1.10","TCP","54","10076  >  21 [ACK] Seq=1311953052 Ack=2168457693 Win=8760 Len=0"
"12818","3618.068034","82.143.24.12","131.243.2.12","TCP","54","2290  >  21 [ACK] Seq=1603923255 Ack=3435639330 Win=17520 Len=0"
"13211","3748.485034","110.112.122.22","131.243.2.12","TCP","54","2211  >  21 [ACK] Seq=1501643336 Ack=3460173954 Win=17520 Len=0"
"13270","3763.607197","79.37.53.67","131.243.2.12","TCP","54","37675  >  21 [ACK] Seq=3068999938 Ack=3463056460 Win=17520 Len=0"
"13431","3846.407116","82.143.24.12","131.243.2.12","TCP","54","3016  >  21 [ACK] Seq=1699462400 Ack=3478555595 Win=17520 Len=0"
"13590","3911.100722","143.106.218.181","131.243.1.10","TCP","54","60305  >  21 [ACK] Seq=3834636 Ack=1481988998 Win=5840 Len=0"
"13694","3955.556183","43.8.145.97","131.243.1.10","TCP","54","40210  >  21 [ACK] Seq=1962597324 Ack=2594649979 Win=65044 Len=0"
"13744","3961.908686","0.131.191.60","131.243.1.10","TCP","54","1269  >  21 [ACK] Seq=373424 Ack=1319494492 Win=8532 Len=0"
"13954","3983.192020","0.131.191.60","131.243.1.10","TCP","54","1285  >  21 [ACK] Seq=394713 Ack=1002264979 Win=8532 Len=0"
"14058","4024.567851","40.12.141.141","242.70.74.100","TCP","54","2362  >  21 [ACK] Seq=98614442 Ack=348621905 Win=64240 Len=0"
"14100","4040.599602","82.143.24.12","131.243.2.12","TCP","54","4882  >  21 [ACK] Seq=1790567524 Ack=3519215005 Win=17520 Len=0"
"14310","4151.370282","79.37.53.67","131.243.2.12","TCP","54","36156  >  21 [ACK] Seq=3304410190 Ack=3537122382 Win=17520 Len=0"
"14387","4173.590213","79.37.53.67","203.174.5.11","TCP","54","39666  >  21 [ACK] Seq=3320450644 Ack=907328001 Win=17520 Len=0"
"14474","4212.861692","6.18.109.183","131.243.1.10","TCP","54","61341  >  21 [ACK] Seq=992702698 Ack=2030936465 Win=64860 Len=0"
"14577","4267.980166","6.18.109.183","131.243.1.10","TCP","54","61344  >  21 [ACK] Seq=875684326 Ack=1059786854 Win=64860 Len=0"
"14729","4279.640409","101.114.196.190","131.243.1.10","TCP","54","10089  >  21 [ACK] Seq=1473781609 Ack=3726816854 Win=8760 Len=0"
"14765","4282.851319","28.36.15.115","131.243.1.10","TCP","54","2089  >  21 [ACK] Seq=9351665 Ack=1920725693 Win=9324 Len=0"
"14979","4320.832282","217.148.52.180","131.243.2.12","TCP","54","1292  >  21 [ACK] Seq=2987523626 Ack=3561726023 Win=17520 Len=0"
"15054","4346.272098","107.34.21.92","131.243.2.12","TCP","54","2029  >  21 [ACK] Seq=2647434565 Ack=3565604836 Win=256960 Len=0"
"15203","4384.085586","210.90.252.151","131.243.1.10","TCP","54","41042  >  21 [ACK] Seq=1209697052 Ack=2256744649 Win=1460 Len=0"
"15324","4403.170196","101.114.196.190","131.243.1.10","TCP","54","10094  >  21 [ACK] Seq=1502116527 Ack=2606398540 Win=8760 Len=0"
"15459","4429.183053","11.61.231.160","131.243.1.10","TCP","54","41700  >  21 [ACK] Seq=1272449447 Ack=3143516608 Win=5840 Len=0"
"15523","4430.038265","101.114.196.190","131.243.1.10","TCP","54","10100  >  21 [ACK] Seq=1508312365 Ack=2577919164 Win=8760 Len=0"
"15787","4485.721555","154.30.244.212","131.243.1.10","TCP","54","5877  >  21 [ACK] Seq=1186610400 Ack=2710609630 Win=64240 Len=0"
"15855","4487.977039","154.30.244.212","131.243.1.10","TCP","54","5935  >  21 [ACK] Seq=796301331 Ack=302565888 Win=64240 Len=0"
"15936","4494.969238","11.61.231.160","131.243.1.10","TCP","54","42267  >  21 [ACK] Seq=1330021316 Ack=239500799 Win=5840 Len=0"
"16080","4515.592332","107.34.21.92","131.243.2.12","TCP","54","2462  >  21 [ACK] Seq=2692513108 Ack=3593136015 Win=256960 Len=0"
"16164","4529.616639","31.83.68.172","128.3.12.44","TCP","54","62242  >  21 [ACK] Seq=3403385378 Ack=773312001 Win=32768 Len=0"
"16266","4547.850628","79.37.53.67","131.243.2.12","TCP","54","38252  >  21 [ACK] Seq=3541176864 Ack=3599850249 Win=17520 Len=0"
"16474","4574.493186","11.61.231.160","131.243.1.10","TCP","54","42808  >  21 [ACK] Seq=1406365166 Ack=3513127019 Win=5840 Len=0"
"16649","4594.277310","31.83.68.172","128.3.12.44","TCP","54","62249  >  21 [ACK] Seq=3900442426 Ack=785280001 Win=32768 Len=0"
"16765","4611.541302","96.73.248.101","128.3.12.44","TCP","54","5715  >  21 [ACK] Seq=1013511708 Ack=787968001 Win=16384 Len=0"
"17069","4660.858211","101.114.196.190","131.243.1.10","TCP","54","10103  >  21 [ACK] Seq=1561203265 Ack=3860260923 Win=8760 Len=0"
"17323","4703.857704","228.99.213.82","128.3.12.44","TCP","54","2749  >  21 [ACK] Seq=2263277515 Ack=808192001 Win=16616 Len=0"
"17364","4707.256395","228.99.213.82","128.3.12.44","TCP","54","2752  >  21 [ACK] Seq=2264275988 Ack=809344001 Win=16616 Len=0"
"17377","4707.833048","91.7.201.120","128.3.12.44","TCP","54","42761  >  21 [ACK] Seq=3621401949 Ack=809536001 Win=9112 Len=0"
"17554","4732.284827","156.139.170.126","131.243.1.10","TCP","54","33435  >  21 [ACK] Seq=3115811752 Ack=1645679312 Win=24820 Len=0"
"17647","4735.828875","101.114.196.190","131.243.1.10","TCP","54","10105  >  21 [ACK] Seq=1578450109 Ack=2511135400 Win=8760 Len=0"
"17678","4736.005143","108.44.231.26","131.243.1.10","TCP","54","36574  >  21 [ACK] Seq=3774948540 Ack=3696791144 Win=64240 Len=0"
"17744","4738.532163","11.61.231.160","131.243.1.10","TCP","54","44400  >  21 [ACK] Seq=1598634830 Ack=3897979680 Win=5840 Len=0"
"17802","4739.149838","97.89.211.226","128.3.12.44","TCP","54","49239  >  21 [ACK] Seq=1370389873 Ack=814400001 Win=65535 Len=0"
"17868","4742.889242","233.135.80.34","131.243.1.10","TCP","54","41318  >  21 [ACK] Seq=3725668917 Ack=3969703358 Win=8760 Len=0"
"18098","4771.758235","107.34.21.92","131.243.2.12","TCP","54","1836  >  21 [ACK] Seq=2758897542 Ack=3644039413 Win=256960 Len=0"
"18238","4788.697836","101.114.196.190","131.243.1.10","TCP","54","10108  >  21 [ACK] Seq=1590609952 Ack=779568769 Win=8760 Len=0"
"18322","4793.678960","169.16.94.254","131.243.1.10","TCP","54","23639  >  21 [ACK] Seq=1833445474 Ack=3854426097 Win=33580 Len=0"
"18597","4824.684949","101.114.196.190","131.243.1.10","TCP","54","10110  >  21 [ACK] Seq=1598911297 Ack=1476135412 Win=8760 Len=0"
"18715","4834.436991","207.198.138.9","128.3.12.44","TCP","54","1321  >  21 [ACK] Seq=475656467 Ack=829568001 Win=9112 Len=0"
"18884","4857.131790","254.240.108.155","131.243.1.10","TCP","54","32962  >  21 [ACK] Seq=1708870422 Ack=1198127480 Win=5840 Len=0"
"18996","4863.523140","207.198.138.9","128.3.12.44","TCP","54","1323  >  21 [ACK] Seq=483047076 Ack=833600001 Win=9112 Len=0"
"19265","4905.794321","12.201.183.87","128.3.12.44","TCP","54","60497  >  21 [ACK] Seq=2912200303 Ack=839616001 Win=17520 Len=0"
"19328","4910.778198","133.59.122.75","128.3.12.44","TCP","54","59337  >  21 [ACK] Seq=998759442 Ack=840384001 Win=17520 Len=0"
"19390","4915.588448","12.201.183.87","128.3.12.44","TCP","54","60468  >  21 [ACK] Seq=3777775468 Ack=841152001 Win=17520 Len=0"
"19442","4919.556659","174.85.33.217","128.3.12.44","TCP","54","55791  >  21 [ACK] Seq=1437980431 Ack=841856001 Win=17520 Len=0"
"19496","4923.658514","133.59.122.75","128.3.12.44","TCP","54","59318  >  21 [ACK] Seq=1877501689 Ack=842560001 Win=17520 Len=0"
"19592","4936.640657","79.37.53.67","131.243.2.12","TCP","54","41140  >  21 [ACK] Seq=3777670707 Ack=3680676872 Win=17520 Len=0"
"19735","4957.789047","79.37.53.67","203.174.5.11","TCP","54","40555  >  21 [ACK] Seq=3793539462 Ack=908800001 Win=17520 Len=0"
"19969","5017.701676","109.101.191.162","131.243.1.10","TCP","54","4246  >  21 [ACK] Seq=1897641994 Ack=4095496734 Win=32120 Len=0"
"20264","5093.691328","72.113.103.140","131.243.1.10","TCP","54","55285  >  21 [ACK] Seq=2882720742 Ack=1948998361 Win=5840 Len=0"
"20449","5142.255224","86.165.2.124","131.243.1.10","TCP","54","50119  >  21 [ACK] Seq=4244676484 Ack=2245544401 Win=32768 Len=0"
"20553","5173.243799","79.36.161.226","131.243.1.10","TCP","54","32928  >  21 [ACK] Seq=509987998 Ack=115055483 Win=8760 Len=0"
"20638","5183.034480","175.18.23.51","131.243.1.10","TCP","54","45629  >  21 [ACK] Seq=2327580617 Ack=1040894703 Win=65535 Len=0"
"20791","5227.229952","116.177.87.124","131.243.1.10","TCP","54","4062  >  21 [ACK] Seq=2106195123 Ack=3378143988 Win=32120 Len=0"
"20900","5251.955441","79.88.120.7","131.243.1.10","TCP","54","35140  >  21 [ACK] Seq=2127513282 Ack=3792878207 Win=5840 Len=0"
"20994","5275.812566","97.171.4.194","131.243.1.10","TCP","54","3503  >  21 [ACK] Seq=2124977830 Ack=2737600568 Win=17520 Len=0"
"21159","5319.896669","176.173.163.126","131.243.1.10","TCP","54","2245  >  21 [ACK] Seq=468326828 Ack=3999873912 Win=64240 Len=0"
"21295","5365.666065","79.37.53.67","131.243.2.12","TCP","54","39708  >  21 [ACK] Seq=4022356343 Ack=3762524484 Win=17520 Len=0"
"21346","5377.938435","47.125.91.135","131.243.2.12","TCP","54","3967  >  21 [ACK] Seq=280772001 Ack=3765203044 Win=17520 Len=0"
"21378","5390.915723","79.37.53.67","203.174.5.11","TCP","54","38214  >  21 [ACK] Seq=4039240118 Ack=910336001 Win=17520 Len=0"
"21476","5435.932499","217.148.52.180","131.243.2.12","TCP","54","3241  >  21 [ACK] Seq=162047958 Ack=3777645583 Win=8760 Len=0"
"21670","5503.000748","139.140.18.135","131.243.1.10","TCP","54","11841  >  21 [ACK] Seq=2343661542 Ack=680179578 Win=5840 Len=0"
"21815","5533.894965","139.140.18.135","131.243.1.10","TCP","54","11843  >  21 [ACK] Seq=2370095738 Ack=3628999946 Win=5840 Len=0"
"21895","5541.432467","79.88.120.7","131.243.1.10","TCP","54","35296  >  21 [ACK] Seq=2439501568 Ack=1895832269 Win=5840 Len=0"
"22327","5661.984093","115.173.74.163","131.243.1.10","TCP","54","50184  >  21 [ACK] Seq=648196145 Ack=1018649154 Win=16384 Len=0"
"22413","5675.146359","115.173.74.163","131.243.1.10","TCP","54","50244  >  21 [ACK] Seq=3651553869 Ack=2053767482 Win=16384 Len=0"
"22524","5692.036403","130.37.36.181","128.3.12.44","TCP","54","1103  >  21 [ACK] Seq=1379126864 Ack=944576001 Win=57344 Len=0"
"22580","5702.444701","90.73.11.68","131.243.1.10","TCP","54","1117  >  21 [ACK] Seq=3175364829 Ack=1761553911 Win=5840 Len=0"
"22842","5775.363860","79.37.53.67","131.243.2.12","TCP","54","40604  >  21 [ACK] Seq=4261687872 Ack=3827412970 Win=17520 Len=0"
"22961","5797.039289","79.37.53.67","203.174.5.11","TCP","54","38062  >  21 [ACK] Seq=4277165357 Ack=911104001 Win=17520 Len=0"
"23145","5822.865392","107.34.21.92","131.243.2.12","TCP","54","1681  >  21 [ACK] Seq=3032572027 Ack=3835303402 Win=256960 Len=0"
"23408","5881.493946","161.202.108.234","131.243.1.10","TCP","54","44472  >  21 [ACK] Seq=3847257015 Ack=68871436 Win=8760 Len=0"
"23679","5931.132865","97.0.158.29","131.243.1.10","TCP","54","56289  >  21 [ACK] Seq=2843653004 Ack=3340438302 Win=5840 Len=0"
"23768","5938.608200","41.28.91.226","131.243.1.10","TCP","54","64476  >  21 [ACK] Seq=2864361824 Ack=3437075190 Win=5840 Len=0"
"23987","5974.354148","154.200.17.223","131.243.1.10","TCP","54","2095  >  21 [ACK] Seq=2710758916 Ack=3183284990 Win=17424 Len=0"
"24394","6035.504591","47.125.91.135","131.243.2.12","TCP","54","2770  >  21 [ACK] Seq=444148850 Ack=3879994525 Win=17520 Len=0"
"24636","6158.238860","79.37.53.67","131.243.2.12","TCP","54","38532  >  21 [ACK] Seq=200587313 Ack=3906208750 Win=17520 Len=0"
"24684","6167.768104","205.134.158.207","131.243.2.12","TCP","54","1434  >  21 [ACK] Seq=15227115 Ack=3908498251 Win=8760 Len=0"
"25304","6540.397410","79.37.53.67","131.243.2.12","TCP","54","31070  >  21 [ACK] Seq=434059680 Ack=3980087110 Win=17520 Len=0"
"25338","6563.975871","79.37.53.67","203.174.5.11","TCP","54","35185  >  21 [ACK] Seq=450228459 Ack=912256001 Win=17520 Len=0"
"25415","6651.521376","45.168.56.161","131.243.1.10","TCP","54","1768  >  21 [ACK] Seq=3602131255 Ack=2429800351 Win=32120 Len=0"
"25468","6725.008657","182.6.9.175","128.3.32.63","TCP","66","33008  >  21 [ACK] Seq=3700526677 Ack=3713502806 Win=5840 Len=0 TSval=4022824 TSecr=1301842138"
"25489","6833.599371","148.195.8.158","131.243.1.10","TCP","54","32901  >  21 [ACK] Seq=1642372612 Ack=561615959 Win=49640 Len=0"
"25536","6840.564741","80.254.140.105","131.243.193.93","TCP","54","51760  >  21 [ACK] Seq=1946902188 Ack=3806647145 Win=8760 Len=0"
"25565","6858.419793","114.253.163.95","131.243.1.10","TCP","54","3265  >  21 [ACK] Seq=388934677 Ack=3976753536 Win=8760 Len=0"
"25646","6871.220083","114.253.163.95","131.243.1.10","TCP","54","3267  >  21 [ACK] Seq=391766748 Ack=2920838921 Win=8760 Len=0"
"25723","6932.707914","79.37.53.67","131.243.2.12","TCP","54","38194  >  21 [ACK] Seq=670246117 Ack=4049799121 Win=17520 Len=0"
"25777","6960.004462","79.37.53.67","203.174.5.11","TCP","54","36607  >  21 [ACK] Seq=687408803 Ack=913088001 Win=17520 Len=0"
"25838","6982.910872","14.157.212.82","131.243.1.10","TCP","54","2107  >  21 [ACK] Seq=3305686215 Ack=3549485520 Win=1460 Len=0"
"25870","6983.169177","131.243.1.10","14.157.212.82","TCP","54","21  >  2107 [ACK] Seq=3549486835 Ack=3305686231 Win=17504 Len=0"
"25908","6987.770182","14.157.212.82","131.243.1.10","TCP","54","2158  >  21 [ACK] Seq=3303586277 Ack=3731045636 Win=1460 Len=0"
"25967","6996.843394","14.157.212.82","131.243.1.10","TCP","54","2206  >  21 [ACK] Seq=3307491454 Ack=1908238692 Win=1460 Len=0"
"26035","7016.318671","14.157.212.82","131.243.1.10","TCP","54","2367  >  21 [ACK] Seq=3339669007 Ack=1736164140 Win=1460 Len=0"
"26109","7076.917845","157.227.225.72","128.3.12.44","TCP","54","1144  >  21 [ACK] Seq=784436274 Ack=1131904001 Win=8576 Len=0"
"26150","7132.288347","157.227.225.72","128.3.12.44","TCP","54","1147  >  21 [ACK] Seq=1969192539 Ack=1139264001 Win=8576 Len=0"
"26176","7287.338945","17.36.154.9","131.243.1.10","TCP","54","62109  >  21 [ACK] Seq=1232874952 Ack=2766395042 Win=33580 Len=0"
"26251","7327.579123","79.37.53.67","131.243.2.12","TCP","54","40530  >  21 [ACK] Seq=907121211 Ack=4108034277 Win=17520 Len=0"
"26319","7349.567403","79.37.53.67","203.174.5.11","TCP","54","41339  >  21 [ACK] Seq=923228492 Ack=914368001 Win=17520 Len=0"
"26393","7402.802872","133.32.110.93","131.243.1.10","TCP","54","37871  >  21 [ACK] Seq=1207813220 Ack=2935742817 Win=17316 Len=0"
"26463","7405.525187","133.32.110.93","131.243.1.10","TCP","54","37885  >  21 [ACK] Seq=1208585717 Ack=789284077 Win=17316 Len=0"
"26560","7511.557756","131.209.49.253","131.243.1.10","TCP","54","2303  >  21 [ACK] Seq=418576356 Ack=1682069123 Win=5840 Len=0"
"26643","7555.028123","20.31.25.188","78.56.58.89","TCP","54","2280  >  21 [ACK] Seq=1958719436 Ack=689088001 Win=64320 Len=0"
"26687","7656.680331","217.148.52.180","203.174.5.11","TCP","54","1599  >  21 [ACK] Seq=3838313964 Ack=914688001 Win=17520 Len=0"
"26798","7719.646864","79.37.53.67","131.243.2.12","TCP","54","40135  >  21 [ACK] Seq=1144209099 Ack=4173973102 Win=17520 Len=0"
"26887","7735.712015","146.194.49.41","128.3.12.44","TCP","54","60329  >  21 [ACK] Seq=4118002240 Ack=1225088001 Win=5840 Len=0"
"26918","7742.052825","79.37.53.67","203.174.5.11","TCP","54","41255  >  21 [ACK] Seq=1160256284 Ack=917568001 Win=17520 Len=0"
"26955","7747.176129","146.194.49.41","128.3.12.44","TCP","54","60347  >  21 [ACK] Seq=4122269492 Ack=1226624001 Win=5840 Len=0"
"27028","7759.022606","107.34.21.92","131.243.2.12","TCP","54","2510  >  21 [ACK] Seq=3537478033 Ack=4181589410 Win=256960 Len=0"
"27073","7769.887174","84.68.192.198","131.243.1.10","TCP","54","1774  >  21 [ACK] Seq=1631180202 Ack=2826930215 Win=57960 Len=0"
"27155","7774.559155","187.67.89.67","128.3.180.73","TCP","54","48770  >  21 [ACK] Seq=509813581 Ack=648264760 Win=5840 Len=0"
"27819","7955.945537","82.143.24.12","131.243.2.12","TCP","54","3517  >  21 [ACK] Seq=2152458677 Ack=4218091546 Win=17520 Len=0"
"27870","7964.068123","252.13.27.74","131.243.1.10","TCP","54","1031  >  21 [ACK] Seq=1427575174 Ack=1365734169 Win=5840 Len=0"
"28609","8109.837338","79.37.53.67","131.243.2.12","TCP","54","41449  >  21 [ACK] Seq=1379883092 Ack=4245360426 Win=17520 Len=0"
"28760","8132.284225","79.37.53.67","203.174.5.11","TCP","54","35371  >  21 [ACK] Seq=1395752130 Ack=932608001 Win=17520 Len=0"
"28923","8157.125897","245.179.24.26","131.243.1.10","TCP","54","49476  >  21 [ACK] Seq=898752370 Ack=3933194567 Win=5840 Len=0"
"29099","8174.297429","76.17.253.13","131.243.1.10","TCP","54","54701  >  21 [ACK] Seq=2967692242 Ack=3852367303 Win=5840 Len=0"
"29497","8243.194445","76.17.253.13","131.243.1.10","TCP","54","54706  >  21 [ACK] Seq=3043005668 Ack=1862160244 Win=5840 Len=0"
"29713","8272.268862","76.17.253.13","131.243.1.10","TCP","54","54710  >  21 [ACK] Seq=3062018272 Ack=727815364 Win=5840 Len=0"
"29884","8301.899649","252.13.27.74","131.243.1.10","TCP","54","1033  >  21 [ACK] Seq=1776464392 Ack=2123328572 Win=5840 Len=0"
"30232","8445.634096","11.61.231.160","131.243.1.10","TCP","54","43870  >  21 [ACK] Seq=1206140923 Ack=1896699901 Win=5840 Len=0"
"30322","8470.310867","11.61.231.160","131.243.1.10","TCP","54","44075  >  21 [ACK] Seq=1239508779 Ack=1389200597 Win=5840 Len=0"
"30404","8482.235678","11.61.231.160","131.243.1.10","TCP","54","44147  >  21 [ACK] Seq=1246795504 Ack=997482590 Win=5840 Len=0"
"30491","8493.052754","11.61.231.160","131.243.1.10","TCP","54","44204  >  21 [ACK] Seq=1251610079 Ack=1383631749 Win=5840 Len=0"
"30536","8493.905296","79.37.53.67","131.243.2.12","TCP","54","40446  >  21 [ACK] Seq=1614275258 Ack=16216063 Win=17520 Len=0"
"30645","8523.588170","79.37.53.67","203.174.5.11","TCP","54","41617  >  21 [ACK] Seq=1632094715 Ack=937280001 Win=17520 Len=0"
"30754","8550.482674","76.17.253.13","131.243.1.10","TCP","54","54750  >  21 [ACK] Seq=3674042960 Ack=2350607690 Win=64240 Len=0"
"30811","8553.396791","76.17.253.13","131.243.1.10","TCP","54","54752  >  21 [ACK] Seq=3674883643 Ack=1339749236 Win=64240 Len=0"
"30989","8579.352395","72.7.161.198","131.243.1.10","TCP","54","1731  >  21 [ACK] Seq=333465713 Ack=4078956937 Win=17520 Len=0"
"31034","8589.115828","224.244.209.25","131.243.1.10","TCP","54","4751  >  21 [ACK] Seq=2177019438 Ack=3092671156 Win=8760 Len=0"
"31106","8768.227262","217.148.52.180","203.174.5.11","TCP","54","4036  >  21 [ACK] Seq=165377606 Ack=937600001 Win=8760 Len=0"
"31166","8797.442924","11.61.231.160","131.243.1.10","TCP","54","46371  >  21 [ACK] Seq=1568561146 Ack=2931822105 Win=5840 Len=0"
"31262","8813.285945","36.150.111.231","131.243.1.10","TCP","54","1024  >  21 [ACK] Seq=3049667833 Ack=117041198 Win=17520 Len=0"
"31316","8814.512724","36.150.111.231","131.243.1.10","TCP","54","1026  >  21 [ACK] Seq=3050075271 Ack=3905308635 Win=17520 Len=0"
"31530","8843.946788","36.150.111.231","131.243.1.10","TCP","54","1028  >  21 [ACK] Seq=3057535330 Ack=2301910603 Win=17520 Len=0"
"31608","8856.885253","36.150.111.231","131.243.1.10","TCP","54","1031  >  21 [ACK] Seq=3060910803 Ack=3927592960 Win=17520 Len=0"
"31750","8897.700399","79.37.53.67","131.243.2.12","TCP","54","40286  >  21 [ACK] Seq=1852785660 Ack=80980992 Win=17520 Len=0"
"31851","8916.154052","83.27.116.42","131.243.1.10","TCP","54","17213  >  21 [ACK] Seq=2948747955 Ack=3673352684 Win=64240 Len=0"
"31914","8920.616209","79.37.53.67","203.174.5.11","TCP","54","39309  >  21 [ACK] Seq=1868959251 Ack=943296001 Win=17520 Len=0"
"31964","8925.173741","83.27.116.42","131.243.1.10","TCP","54","17215  >  21 [ACK] Seq=2950884197 Ack=2567740989 Win=64240 Len=0"
"32109","8934.823015","83.27.116.42","131.243.1.10","TCP","54","17217  >  21 [ACK] Seq=2953208994 Ack=2174642590 Win=64240 Len=0"
"32164","8937.473747","165.78.71.101","128.3.28.48","TCP","66","37175  >  21 [ACK] Seq=1732486821 Ack=3599320147 Win=5840 Len=0 TSval=826522597 TSecr=2234419621"
"32192","8937.894193","165.78.71.101","128.3.28.48","TCP","66","37177  >  21 [ACK] Seq=1734612653 Ack=3593002288 Win=5840 Len=0 TSval=826522813 TSecr=2234419663"
"32219","8938.821215","165.78.71.101","128.3.28.48","TCP","66","37179  >  21 [ACK] Seq=1725466619 Ack=3588873220 Win=5840 Len=0 TSval=826523287 TSecr=2234419755"
"32295","8963.726859","108.97.140.165","131.243.1.10","TCP","54","36522  >  21 [ACK] Seq=1764800691 Ack=3057691010 Win=5840 Len=0"
"32407","8995.642998","78.51.239.141","131.243.1.10","TCP","54","63025  >  21 [ACK] Seq=3138289714 Ack=704935678 Win=64240 Len=0"
"32598","9070.238512","154.200.17.223","131.243.1.10","TCP","54","2150  >  21 [ACK] Seq=3422099746 Ack=2113565054 Win=17424 Len=0"
"32630","9070.578970","131.243.1.10","154.200.17.223","TCP","54","21  >  2150 [ACK] Seq=2113566370 Ack=3422099762 Win=17408 Len=0"
"32997","9250.799227","65.13.26.86","131.243.1.10","TCP","54","1288  >  21 [ACK] Seq=9188863 Ack=2860654213 Win=8760 Len=0"
"33075","9261.072097","65.13.26.86","131.243.1.10","TCP","54","1303  >  21 [ACK] Seq=9199138 Ack=3457234759 Win=8760 Len=0"
"33195","9294.396359","79.37.53.67","131.243.2.12","TCP","54","38536  >  21 [ACK] Seq=2089357772 Ack=150018831 Win=17520 Len=0"
"33211","9295.745587","233.56.123.131","131.243.193.93","TCP","66","12934  >  21 [ACK] Seq=1941457167 Ack=2109153197 Win=5840 Len=0 TSval=34219130 TSecr=911771508"
"33327","9321.979313","79.37.53.67","203.174.5.11","TCP","54","39412  >  21 [ACK] Seq=2106509095 Ack=959168001 Win=17520 Len=0"
"33432","9347.880337","92.209.69.32","131.243.2.12","TCP","66","6108  >  21 [ACK] Seq=3854240529 Ack=159008840 Win=17520 Len=0 TSval=367449 TSecr=280265777"
"33636","9435.068178","82.143.24.12","131.243.2.12","TCP","54","2185  >  21 [ACK] Seq=3777645041 Ack=173943677 Win=17520 Len=0"
"33639","9435.381159","131.243.2.12","82.143.24.12","TCP","54","21  >  2185 [ACK] Seq=173943760 Ack=3777645057 Win=64240 Len=0"
"33687","9452.185743","248.38.9.24","131.243.1.10","TCP","54","54082  >  21 [ACK] Seq=2262688449 Ack=2782640768 Win=5840 Len=0"
"33929","9536.826168","82.143.24.12","131.243.2.12","TCP","54","2944  >  21 [ACK] Seq=3813789897 Ack=191158222 Win=17520 Len=0"
"34042","9572.326242","82.143.24.12","131.243.2.12","TCP","54","2521  >  21 [ACK] Seq=3826068121 Ack=197339647 Win=17520 Len=0"
"34283","9630.464337","79.36.161.226","131.243.1.10","TCP","54","44536  >  21 [ACK] Seq=2586975825 Ack=1573620205 Win=8760 Len=0"
"34320","9631.018480","216.43.247.103","131.243.1.10","TCP","54","56477  >  21 [ACK] Seq=2453623736 Ack=3967122967 Win=5840 Len=0"
"34386","9633.015496","79.36.161.226","131.243.1.10","TCP","54","44660  >  21 [ACK] Seq=1686762715 Ack=2923070234 Win=8760 Len=0"
"34516","9646.253993","79.36.161.226","131.243.1.10","TCP","54","45127  >  21 [ACK] Seq=362122744 Ack=3849222960 Win=8760 Len=0"
"34607","9665.357808","79.36.161.226","131.243.1.10","TCP","54","45680  >  21 [ACK] Seq=2977427753 Ack=225569108 Win=8760 Len=0"
